,verdict,text,part
118,SH-22-01-45270-521,אבהיר מראש כי החלטתי לאמץ את בקשת הנאשם.,דיון
119,SH-22-01-45270-521,להלן נימוקיי:,דיון
120,SH-22-01-45270-521,"נכון הדבר ששיקולי שיקום אינם חזות הכל, ולעולם על בית המשפט ליתן דעתו לנסיבות ביצוע העבירות, לחומרתן, לשיקולי הלימה והרתעה, ולמסר המועבר לציבור כתוצאה מגזירת עונש מקל, שאיננו קרוב לעונש שהיה ראוי לגזור על הנאשם אלמלא היה נתון בתהליך שיקומי כה מוצלח.",דיון
121,SH-22-01-45270-521,"עוד נכון הדבר, שהשתתפותו של נאשם בטיפול, אין בה די כשלעצמה כדי לאמץ את המלצת שירות המבחן, ולחרוג לקולה מהמתחם.",דיון
122,SH-22-01-45270-521,רק מיעוט מן הנאשמים מבצעים הליך טיפולי משמעותי שיש בו כדי להביא לחריגה לקולה מהמתחם.,דיון
123,SH-22-01-45270-521,"רק מיעוט שבמיעוט עברו דרך כה משכנעת, עד כדי מהפך של ממש בחייהם.",דיון
124,SH-22-01-45270-521,כזה הוא עניינו של הנאשם שלפנַי.,דיון
125,SH-22-01-45270-521,"מעשי העבירה, כאמור, חמורים ומתוכננים, ונעשו בכוונת מכוון על מנת לאפשר לנאשם להפיק רווח כספי קל, תוך התעלמות מפוטנציאל הנזק הגבוה לפרט ולחברה.",דיון
126,SH-22-01-45270-521,"אילו דובר במי שבעברו עבירות דומות, או שעבר לאחרונה הליך טיפולי שכשל, ספק אם הייתי מוצא להקל בעונשו, לבטח לא בהיקף המבוקש על ידי ההגנה.",דיון
127,SH-22-01-45270-521,"עיון בגיליון הרישום הפלילי (עת/1) מגלה שני הליכים מבית המשפט לנוער, שהסתיימו ללא הרשעה, האחד בגין ניסיון לפציעה (משנת 2000) והאחר בגין החזקת סמים שלא צריכה עצמית (משנת 2002).",דיון
128,SH-22-01-45270-521,"בשנת 2003 נדון הנאשם למאסר בפועל בן 3 שנים ו-3 חודשים בגין עבירות אלימות (חבלה חמורה, פציעה, חבלה כשהעבריין מזוין, תקיפת עובד ציבור, תקיפה, איומים) והחזקת סמים לצריכה עצמית.",דיון
129,SH-22-01-45270-521,בשנת 2017 נדון למאסר על-תנאי בגין החזקת סכין.,דיון
130,SH-22-01-45270-521,"מכאן, מבלי להתעלם מהרשעותיו הקודמות ומעונש המאסר הממושך שריצה, עברו הפלילי המהותי רחוק בשנים, ועינינו הרואות כי לאחר שסיים לרצות את מאסרו, חלפו שנים רבות בטרם ביצע עבירה נוספת (בגינה נדון למאסר צופה פני עתיד).",דיון
131,SH-22-01-45270-521,"בצד זאת, וכעולה מדבריו של הנאשם בבית המשפט ובפני שירות המבחן, הלה התנהל במשך שנים ארוכות בשוליו של העולם העברייני, בהתמכרות ממושכת לסמים, אלכוהול והימורים.",דיון
132,SH-22-01-45270-521,"ההתמכרויות השפיעו במישרין על איכות חייו וחיי בני משפחתו, הוא שקע בחובות, ואלו היוו קטליזטור לביצוע מעשי העבירה עליהם הוא נותן עתה את הדין.",דיון
133,SH-22-01-45270-521,"כמו נאשמים רבים, תהליך השיקום בו השתתף הנאשם החל עוד בשלב המעצר.",דיון
134,SH-22-01-45270-521,"בשונה מאחרים – הנאשם תפס את ההזדמנות שניתנה לו בשתי ידיו (ובמילותיו – ""אחזתי בציפורניים""), ומינף אותה כדי לשנות את חייו מהקצה לקצה.",דיון
135,SH-22-01-45270-521,"הוא השתתף במשך מספר חודשים בקבוצת הכנה לטיפול; לאחר שסיים אותה בהצלחה, השתתף במשך שנה תמימה בקבוצה טיפולית, ארבעה ימים בשבוע; לאחר שהשלים את הטיפול וזכה להערכה רבה מהצוות הטיפולי, מתמיד הנאשם במפגשים שבועיים בקבוצת הבוגרים; במקביל הוא משתתף במהלך התקופה כולה במפגשים פרטניים; כמו כן, הנאשם מגיע באופן קבוע, מדי ערב, לפגישות בקבוצות למהמרים אנונימיים ולנרקומנים אנונימיים.",דיון
136,SH-22-01-45270-521,"במקביל לפעילות הטיפולית התכופה, הנאשם עושה חַיִל בעבודתו התובענית – הוא מתפקד כשף של שני בתי קפה ברשת מוכרת, מנהל 12 טבחים, ואחראי על מערך ההזמנות על כל הכרוך בכך.",דיון
137,SH-22-01-45270-521,"נוסף על אלו, הנאשם משקיע מזמנו בהורות לבתו, ולומד כיצד להפוך לאב טוב יותר.",דיון
138,SH-22-01-45270-521,"מזה למעלה משנה הוא מגיע מדי שבוע למפגשי הדרכת הורים, ושוהה עם בתו שלוש פעמים בשבוע.",דיון
139,SH-22-01-45270-521,"הצוות המטפל בנאשם ב""מרכז חוסן"", כמו גם קצינת המבחן, גמרו את ההלל על הנאשם, שהוכיח ומוכיח כל העת כי הוא ראוי לאמון שניתן בו.",דיון
140,SH-22-01-45270-521,"אף אני התרשמתי מדבריו של הנאשם לפניי: מכנותו, מחריצותו, מהכוחות העצומים שגילה לשינוי עצמי, מהצלחתו להתנתק באופן מוחלט מעולם הסמים, האלכוהול וההימורים שהיה מנת חלקו במשך שנים רבות ורעות, מיכולת ההשקעה וההתמדה שהוא מגלה, מהאופן בו השכיל לרתום את התהליך הטיפולי לשינוי בכל אורחות חייו, לרבות במסגרת המשפחתית, תוך ניסיון בלתי פוסק ללמוד ולהשתפר כהורה לבתו.",דיון
141,SH-22-01-45270-521,"אני מאמין כי יש בנאשם כוחות להמשיך בדרך הטובה, וכולי תקווה וציפייה שימשיך וישגשג, חרף מהמורות שלבטח צפויות בהמשך הדרך, שלעולם איננה מסתיימת.",דיון
142,SH-22-01-45270-521,"העבירות שביצע הנאשם מצדיקות, ככלל, גזירת קנס כספי מוחשי, ולעתים מזומנות אף פסילת רישיון הנהיגה.",דיון
143,SH-22-01-45270-521,"ברם, סבורני כי בנסיבותיו של הנאשם, עלולים עונשים אלו לפגוע בו באופן בלתי מידתי, ולפגום בסיכויי הצלחתו להתמיד בהליך הטיפולי ובעבודתו.",דיון
144,SH-22-01-45270-521,"משכך מצאתי כי אותם השיקולים המצדיקים לחרוג לקולה ממתחם העונש ההולם את מעשי העבירה, הם שמדריכים את בית המשפט אף בקביעת מרכיבי הענישה הנוספים, תוך הסתפקות בהתחייבות כספית צופה פני עתיד.",דיון
145,SH-22-01-45270-521,"סוף דבר, החלטתי לגזור על הנאשם את העונשים הבאים:",דיון
146,SH-22-01-45270-521,"הנאשם יבצע 450 שעות שירות לתועלת הציבור (של""צ) בהתאם לתוכנית שתוכן ע""י שירות המבחן, ותוגש לבית המשפט עד יום 6.2.24.",דיון
147,SH-22-01-45270-521,המזכירות תקבע תזכורת פנימית ביומני.,דיון
148,SH-22-01-45270-521,"על הנאשם להשלים את ביצוע השל""צ תוך 18 חודשים מהיום בו תאושר.",דיון
149,SH-22-01-45270-521,"הוסבר לנאשם כי אם לא תתקבל תוכנית של""צ, או ככל שתתקבל אך הנאשם לא ישלים ביצועהּ בתוך התקופה שנקצבה, עשוי בית המשפט לגזור את דינו מחדש.",דיון
150,SH-22-01-45270-521,צו מבחן למשך 18 חודשים.,דיון
151,SH-22-01-45270-521,הוסברה לנאשם משמעותו של צו המבחן ואפשרות הפקעתו והטלת עונש במקומו.,דיון
152,SH-22-01-45270-521,"הנאשם יצהיר על התחייבותו לפניי עוד היום, שאם לא כן, ירצה תקופת מאסר בת 5 ימים.",דיון
153,SH-22-01-45270-521,"חילוט כסף מזומן שנתפס מהנאשם בסך 1,290 ₪ (לא מצאתי להורות על חילוט מכשיר טלפון, בהיעדר אינדיקציה בכתב האישום לשימוש עברייני שנעשה בו).",דיון
154,SH-22-01-45270-521,54678313זכות ערעור לבית המשפט המחוזי תוך 45 ימים מהיום.,דיון
155,SH-22-01-45270-521,"ניתן היום,  כ""א טבת תשפ""ד, 02 ינואר 2024, במעמד הצדדים.",דיון
156,SH-22-01-45270-521,עותק מגזר הדין יישלח לשירות המבחן.,דיון
