,verdict,text,part
0,SH-22-01-45270-521,לפני:				כבוד השופט גיא אבנון,בית משפט השלום בנתניה
1,SH-22-01-45270-521,באמצעות תביעות משטרת ישראל,בית משפט השלום בנתניה
2,SH-22-01-45270-521,"פקודת הסמים המסוכנים [נוסח חדש], תשל""ג-1973: סע'  6, 7(א), ג, 9.א., 9.ד, 10","בשם הנאשם:			עו""ד ויקי שמואל"
3,SH-22-01-45270-521,"חוק העונשין, תשל""ז-1977: סע'  400","בשם הנאשם:			עו""ד ויקי שמואל"
4,SH-22-01-45270-521,"ביום 20.7.22 הורשע הנאשם בהתאם להודאתו בכתב אישום מתוקן בעבירות: החזקת חצרים, לפי סעיף 9(א) ו-(ד) לפקודת הסמים המסוכנים [נוסח חדש], תשל""ג-1973 (להלן: פקודת הסמים); גידול וייצור סמים, לפי סעיף 6 לפקודת הסמים; החזקת סמים שלא לצריכה עצמית, לפי סעיף 7(א) ו-(ג) רישא לפקודת הסמים; החזקת כלים להכנת סם לא לצריכה עצמית, לפי סעיף 10 רישא לפקודת הסמים; נטילת חשמל בגניבה, לפי סעיף 400 לחוק העונשין, תשל""ז-1977.","בשם הנאשם:			עו""ד ויקי שמואל"
5,SH-22-01-45270-521,מכתב האישום המתוקן עולה כי ביום 15.1.22 שהה הנאשם בדירה אותה שכר ברחוב ביאליק 11 בנתניה.,"בשם הנאשם:			עו""ד ויקי שמואל"
6,SH-22-01-45270-521,"הנאשם גידל בדירה 100 שתילי סם מסוג קנאביס במשקל נטו 3 ק""ג וכן 50 שתילים נוספים.","בשם הנאשם:			עו""ד ויקי שמואל"
7,SH-22-01-45270-521,"לצורך גידול הסמים השתמש הנאשם בציוד רב: אוהל, מאווררים, מנורות, שנאים, מזגנים, מפוחים וכיוצ""ב.","בשם הנאשם:			עו""ד ויקי שמואל"
8,SH-22-01-45270-521,"כן החזיק הנאשם במספר מקומות בדירה סם מסוכן מסוג קנאביס במשקל כולל נטו 3.08 ק""ג.","בשם הנאשם:			עו""ד ויקי שמואל"
9,SH-22-01-45270-521,"בהתאם להסדר הטיעון הופנה הנאשם לקבלת תסקיר מבחן, ללא הסכמות בין הצדדים באשר לעתירותיהם לעונש.","בשם הנאשם:			עו""ד ויקי שמואל"
10,SH-22-01-45270-521,"תסקיר מיום 28.3.23: הנאשם בן 38, גרוש ואב לילדה בת 8 המתגוררת עם אמהּ.",תסקירי מבחן 
11,SH-22-01-45270-521,בגיל 6 עלה ארצה עם משפחתו.,תסקירי מבחן 
12,SH-22-01-45270-521,"הוא תיאר חווית עלייה חיובית, בצד קשיי קליטה ופרנסה של הוריו.",תסקירי מבחן 
13,SH-22-01-45270-521,"הוא סיפר כי פרט לחינוך נוקשה, נאלץ לסבול אלימות פיזית ומילולית מאביו, אשר הפנה תוקפנותו גם כלפי אמו.",תסקירי מבחן 
14,SH-22-01-45270-521,"הוא נשר ממערכת החינוך בכיתה יא', על רקע קשיים התנהגותיים ואלימות.",תסקירי מבחן 
15,SH-22-01-45270-521,"בגיל 16 נעצר לראשונה, ובהמשך לא גויס לצה""ל בהינתן מעורבותו בפלילים.",תסקירי מבחן 
16,SH-22-01-45270-521,בגיל 19 (שנת 2003) ריצה עונש מאסר בן 3 שנים ו-3 חודשים בגין עבירות אלימות.,תסקירי מבחן 
17,SH-22-01-45270-521,במהלך מאסרו עבד במטבח בית הסוהר מבלי ששולב בהליך טיפולי.,תסקירי מבחן 
18,SH-22-01-45270-521,"לאחר שחרורו ממאסר עבר להתגורר בצפון הארץ, ועבד באופן מזדמן במסעדות ובבתי קפה.",תסקירי מבחן 
19,SH-22-01-45270-521,הנאשם נישא בשנת 2014 והתגרש בחלוף כשנתיים.,תסקירי מבחן 
20,SH-22-01-45270-521,בני הזוג מקיימים קשר תקין סביב הטיפול בְּבִתָּם המשותפת.,תסקירי מבחן 
21,SH-22-01-45270-521,הנאשם משלם דמי מזונות ונפגש עם בִּתּוֹ בקביעות.,תסקירי מבחן 
22,SH-22-01-45270-521,"אשר לשימוש בחומרים ממכרים – בהיותו כבן 13 החל הנאשם לעשות שימוש בלתי מבוקר באלכוהול ולצרוך קנאביס, כחלק מניסיונו למצוא השתייכות חברתית.",תסקירי מבחן 
23,SH-22-01-45270-521,"במהלך מאסרו חלה העמקה בדפוסיו ההתמכרותיים, כשהשתמש בסמים מסוג אקסטזי, טריפים והרואין.",תסקירי מבחן 
24,SH-22-01-45270-521,"לדבריו, לאחר שחרורו ממאסר היו תקופות בהן הצליח להימנע משימוש בחומרים ממכרים.",תסקירי מבחן 
25,SH-22-01-45270-521,"ברם, בתקופות משבר, לרבות במהלך גירושיו, שב לצריכת סמים מוגברת ותלותית, כשהסם היווה חלק מרכזי מאורח חייו.",תסקירי מבחן 
26,SH-22-01-45270-521,"עוד תיאר כיצד נהג להמר בתדירות גבוהה, הפסיד כספים רבים והסתבך עם גורמים עברייניים.",תסקירי מבחן 
27,SH-22-01-45270-521,"הנאשם קיבל אחריות מלאה על מעשי העבירה העומדים בבסיס כתב האישום, ושיתף בפתיחות ובכנות אודות התנהלותו העבריינית במהלך חייו, והתדרדרותו לסמים אשר העמיקה, בין השאר, על רקע התמכרותו להימורים.",תסקירי מבחן 
28,SH-22-01-45270-521,"הוא סיפר כי חיפש דרכים להפיק רווח כספי מהיר כדי לממן את השימוש בסמים, את ההימורים ואת אורח החיים הראוותני שניהל באותה עת.",תסקירי מבחן 
29,SH-22-01-45270-521,"לדבריו, היה מודע כל העת לפסול שבהתנהגותו, אך לא השקיע בכך מחשבה, לא נתן דעתו לפגיעה באחרים, והיה עסוק כל כולו בצרכיו ובמטרה להשיג כסף.",תסקירי מבחן 
30,SH-22-01-45270-521,הנאשם החל בהליך טיפולי בליווי שירות המבחן עוד בשלב המעצר.,תסקירי מבחן 
31,SH-22-01-45270-521,"ביום 3.5.22 השתלב ביחידה לטיפול בהתמכרויות ""בית חוסן"", ובמקביל בפגישות פרטניות עם שירות המבחן במסגרת צו פיקוח מעצרים.",תסקירי מבחן 
32,SH-22-01-45270-521,"במועד עריכת התסקיר היה הנאשם נתון בתנאי מעצר בית בשעות הלילה, השתתף בטיפולים ב""בית חוסן"" ארבעה ימים בשבוע, ובמקביל עבד מדי יום בתחום המסעדנות.",תסקירי מבחן 
33,SH-22-01-45270-521,"הוא העיד על עצמו כי חש הקלה בעקבות מעצרו, אשר גרם לעצירת תהליך ההתדרדרות בו היה נתון.",תסקירי מבחן 
34,SH-22-01-45270-521,"דווקא המעצר הוא שהביא להתבוננות פנימית, ולתובנה בדבר הצורך לשנות את אורחות חייו, באופן שיאפשר לו לגדל את בתו בדרך שונה ממנו, ולספק לה תחושות יציבות וביטחון.",תסקירי מבחן 
35,SH-22-01-45270-521,"הוא סיפר כי התקשה בתחילה להתמסר לטיפול, ותיאר תהליך שינוי הדרגתי, תוך הסתייעות בטיפול המשמש עבורו כמסגרת מיטיבה.",תסקירי מבחן 
36,SH-22-01-45270-521,"קצינת המבחן שוחחה עם המטפלים ב""בית חוסן"", אשר התייחסו אף הם לקשייו של הנאשם בראשית הדרך, וסיפרו כיצד למד להכיר בקשייו, לשתף, ולבקש עזרה.",תסקירי מבחן 
37,SH-22-01-45270-521,תסקיר מיום 11.7.23: הנאשם מתמיד בטיפול.,תסקירי מבחן 
38,SH-22-01-45270-521,"הוא סיפר כיצד החל בטיפול מתוך מוטיבציה חיצונית וספקנות באשר ליכולתו לקבל עזרה, אך כבר בשלב מוקדם חווה את המטפלים כמי שמבקשים באמת ובתמים לסייע לו, והחל להיווצר קשר המבוסס על יחסי כבוד ואמון הדדי.",תסקירי מבחן 
39,SH-22-01-45270-521,"הוא תיאר את האופנים בהם נחשף בטיפול להתנהגותו בסיטואציות שונות; רכש כלים לתקשורת מקרבת בחיי היומיום ובקשריו הבינאישיים; למד לזהות מצבי סיכון; והחל להתמודד עם בעיות בחייו תוך הימנעות מוחלטת מסמים ואלכוהול, ואימוץ דרכי תגובה נורמטיביות במצבי משבר.",תסקירי מבחן 
40,SH-22-01-45270-521,"לדבריו, נוסף על הטיפול ב""בית חוסן"", פנה באופן עצמאי לקבוצת מהמרים אנונימיים (ga).",תסקירי מבחן 
41,SH-22-01-45270-521,"כמו כן, השלים לימודי קורס בפסיכולוגיה במסגרת פרויקט ""אוניברסיטה לעם"", ותיאר תחושות הנאה וסיפוק מהלימודים.",תסקירי מבחן 
42,SH-22-01-45270-521,"עוד תיאר כיצד הצליח לשלב את הטיפולים השונים בהם הוא משתתף, עם עבודה מאומצת בתחום הבישול.",תסקירי מבחן 
43,SH-22-01-45270-521,"אשר למסגרת המשפחתית, הנאשם סיפר כי הוא ממשיך בחיזוק הקשר עם בתו, נפגש עמה מדי שבוע, ולוקח חלק בהדרכה הורית, על מנת לקבל כלים וסיוע לאחר שנים בהן לא תפקד כאב פעיל.",תסקירי מבחן 
44,SH-22-01-45270-521,"קצינת המבחן שוחחה עם המטפלים, אשר הביעו הערכתם החיובית (מאוד) לנאשם ולתהליך שהוא עובר בהצלחה.",תסקירי מבחן 
45,SH-22-01-45270-521,צוות הטיפול העריך כי המדובר במי שחווה שינוי אמיתי בחייו.,תסקירי מבחן 
46,SH-22-01-45270-521,"נמסר כי הוא עתיד להשלים את הטיפול במרכז יום בחודש אוקטובר 2023, וכי תגובש עבורו תוכנית להמשך.",תסקירי מבחן 
47,SH-22-01-45270-521,"קצינת המבחן סיימה את התסקיר בהמלצה להסתפק בעונש מאסר בדרך של עבודות שירות, כזה שיחסוך מהנאשם היחשפות לחברה עוברת חוק, יגדע את ההליך הטיפולי, ועלול להביא לנסיגה במצבו.",תסקירי מבחן 
48,SH-22-01-45270-521,כן המליצה לאפשר לו להשלים את הטיפול במרכז יום.,תסקירי מבחן 
49,SH-22-01-45270-521,"בדיון מיום 18.7.23 ביקשו הצדדים במשותף לקבל תסקיר משלים וסופי, וחוות דעת מאת הממונה על עבודות שירות (הנאשם נמצא מתאים).",תסקירי מבחן 
50,SH-22-01-45270-521,"תסקיר מיום 18.12.23: קצינת המבחן סקרה את ההליך הטיפולי יוצא הדופן בו השתתף הנאשם: בחודש מאי 2022 החל טיפול פרטני ב""בבית חוסן"", וחודש לאחר מכן השתלב בקבוצת הכנה לטיפול למשך כארבעה חודשים.",תסקירי מבחן 
51,SH-22-01-45270-521,"בחודש אוקטובר 2022 השתלב בטיפול אינטנסיבי במסגרת מרכז יום, ארבעה ימים בשבוע, אותו השלים בחלוף שנה, ביום 28.9.23.",תסקירי מבחן 
52,SH-22-01-45270-521,"משם המשיך לטיפול בקבוצת בוגרים ביחידה, בטיפול חד-שבועי.",תסקירי מבחן 
53,SH-22-01-45270-521,"כמו כן, לכל אורך התקופה משתתף בטיפול פרטני.",תסקירי מבחן 
54,SH-22-01-45270-521,"המטפלים שבו והביעו הערכתם הרבה להתמסרותו המוחלטת של הנאשם לטיפול, לשיתוף הפעולה המלא, ולאופן בו הוא נתרם מההליך ומיישמו בחייו.",תסקירי מבחן 
55,SH-22-01-45270-521,הנאשם מוסר כל העת בדיקות שתן נקיות מסמים.,תסקירי מבחן 
56,SH-22-01-45270-521,קצינת המבחן הביעה הערכתה הגבוהה לנאשם ולתהליך הטיפולי שהוא מבצע בהצלחה לאורך תקופה ממושכת.,תסקירי מבחן 
57,SH-22-01-45270-521,"הוא המשיך לקבל על עצמו אחריות מלאה לעבירות שביצע, מבלי לטשטש מחומרתן, והתייחס בפתיחות לדרכים השוליות אליהן נהג לפנות בעבר כפתרון למצבי מצוקה.",תסקירי מבחן 
58,SH-22-01-45270-521,"קצינת המבחן הצביעה על פרמטרים רבים המלמדים על פוטנציאל שיקום משמעותי: התהליך הטיפולי האינטנסיבי והממושך שעובר הנאשם, האופן בו הוא מיישמו בחייו, נטילת האחריות המוחלטת, ניקיון מתמשך מסמים, הפסקת ההימורים, ניתוק הקשר עם גורמים שוליים, הפנמה ומסוגלות לביקורת עצמית, מאמציו של הנאשם לקיים הורות חיובית ומשמעותית לבתו.",תסקירי מבחן 
59,SH-22-01-45270-521,"שירות המבחן שב והמליץ להעמיד את הנאשם בצו מבחן, במהלכו ימשיך בטיפול ב""בית חוסן"", וישתתף בפגישות מעקב עִתיות עם שירות המבחן.",תסקירי מבחן 
60,SH-22-01-45270-521,"בצד זאת, בשונה מהתסקיר הקודם, זו הפעם המליצה קצינת המבחן להסתפק בענישה מוחשית בדמות צו של""צ בהיקף 450 שעות, באופן שימזער את הפגיעה בסדר היום האינטנסיבי שמנהל הנאשם, בו רואה שירות המבחן כעוגן וכגורם מארגן בחייו.",תסקירי מבחן 
61,SH-22-01-45270-521,"ב""כ המאשימה עמדה על כמות השתילים, הסמים והכלים שהחזיק הנאשם בדירה שנועדה כל כולה לשמש כמעבדה לגידול סמים, והגישה תמונות של המקום (עת/2).",טיעוני הצדדים לעונש
62,SH-22-01-45270-521,במעשיו שימש הנאשם כחוליה מרכזית בשרשרת הפצת נגע הסמים.,טיעוני הצדדים לעונש
63,SH-22-01-45270-521,"היא הגישה אסופת פסקי דין להמחשת מדיניות הענישה, וביקשה לקבוע את מתחם העונש בין 28-12 חודשי מאסר בפועל.",טיעוני הצדדים לעונש
64,SH-22-01-45270-521,לצורך גזירת העונש בתוך המתחם הוגש גיליון הרישום הפלילי של הנאשם (עת/1).,טיעוני הצדדים לעונש
65,SH-22-01-45270-521,"ב""כ המאשימה ביקשה לזקוף לזכות הנאשם את הודייתו ונטילת האחריות, ואת התהליך הטיפולי המוצלח שעבר, ובלשונה: ""כברת הדרך הארוכה והנפלאה יש לומר שעבר הנאשם.",טיעוני הצדדים לעונש
66,SH-22-01-45270-521,המאשימה מברכת על כך.,טיעוני הצדדים לעונש
67,SH-22-01-45270-521,"הנאשם נטל אחריות מלאה, השתלב בטיפולים אינטנסיביים, שיתף פעולה, במיוחד תפס את עיניי משפט מעמוד 4 בתסקיר הראשון: 'יוסף מתמסר לטיפול וניכר כי היה צמא במשך שנים לקבל הכוונה'.",טיעוני הצדדים לעונש
68,SH-22-01-45270-521,"ב""כ המאשימה ביקשה לחרוג לקולה ממתחם העונש משיקולי שיקום, אלא שלשיטתה אין הצדקה לחרוג במידה שהומלצה על ידי שירות המבחן.",טיעוני הצדדים לעונש
69,SH-22-01-45270-521,"לפיכך עתרה לגזור על הנאשם 8 חודשי מאסר בפועל שניתן לרצותם בעבודות שירות, מאסר על-תנאי, קנס, פסילת רישיון הנהיגה בפועל ועל-תנאי, וחילוט של כסף וטלפון שנזכרו בסיפא לכתב האישום.",טיעוני הצדדים לעונש
70,SH-22-01-45270-521,"ב""כ הנאשם התמקד בשאלת העונש הראוי לנאשם: ""מדובר במי שביצע הליך שיקומי יוצא דופן ונפלא, שמתפרש על כשנתיים בהן לא הייתה ולוּ נסיגה אחת קטנה, אלא להיפך.",טיעוני הצדדים לעונש
71,SH-22-01-45270-521,"מתסקיר לתסקיר שירות המבחן רק מלמד על התפתחותו ,התפכחותו, שיתוף הפעולה שלו, ועל כך שמדובר על מי שלקח את ההזדמנות שניתנה לו לטפל בעצמו בשתי ידיים.",טיעוני הצדדים לעונש
72,SH-22-01-45270-521,"מדובר בסופו של יום על אדם בוגר, שעוד כחצי שנה ימלאו לו 40.",טיעוני הצדדים לעונש
73,SH-22-01-45270-521,מי שבעצמו אב לילדה בת 9.,טיעוני הצדדים לעונש
74,SH-22-01-45270-521,"להוציא את כל הערפל מתוך התסקירים ומתוך שיחות עימו, מדובר על מי שהרוויח, פשוטו כמשמעו, את חייו, את הורותו, ואת משפחתו מחדש, והיום מנהל אורח חיים תקין.",טיעוני הצדדים לעונש
75,SH-22-01-45270-521,"לא רק תקין אלא אף מיטיב שתורם לאחרים, שכן היום במסגרת שירות מבחן הוא עתיד וכבר עכשיו חונך אנשים שבעצמם זקוקים לטיפול.",טיעוני הצדדים לעונש
76,SH-22-01-45270-521,"הוגשו מכתבי הערכה מהצוות הטיפולי במרכז יום ב""בית חוסן"" וממטופל במקום, תעודה בדבר סיום התוכנית בהצלחה, ותעודת סיום בהצלחה של הקורס מבוא לפסיכולוגיה במסגרת תוכנית 'אוניברסיטה בעם', מיסודה של אוניברסיטת תל אביב (ענ/1).",טיעוני הצדדים לעונש
77,SH-22-01-45270-521,"ב""כ הנאשם ביקש לקבוע כי המלצתו האחרונה של שירות המבחן מעוגנת כהלכה בתסקירים המצביעים על ""...",טיעוני הצדדים לעונש
78,SH-22-01-45270-521,"אבני דרך יציבות שמלמדות על מי שמלכתחילה הציב לעצמו מטרה, (ו)עמד ביעדים שהציב לעצמו.",טיעוני הצדדים לעונש
79,SH-22-01-45270-521,"נוסף על הטיפול הכמעט יומיומי בו השתלב הנאשם תקופה ממושכת, הוא עובד באופן יציב במקצוע הדורש אחריות רבה, שף המנהל תחתיו מספר רב של עובדים (הוגשו תלושי שכר – ענ/2), וכן משמש כאב פעיל לבתו.",טיעוני הצדדים לעונש
80,SH-22-01-45270-521,"לדעת הסנגור, זהו מסוג המקרים המצדיקים שימוש בכלי שנתן בידינו המחוקק, להעדיף את דרכי השיקום על פני ענישה מוחשית.",טיעוני הצדדים לעונש
81,SH-22-01-45270-521,לתמיכה בעתירתו הפנה אף הוא לאסופת פסיקה.,טיעוני הצדדים לעונש
82,SH-22-01-45270-521,בדבריו של הנאשם ניכרה התרגשות רבה.,טיעוני הצדדים לעונש
83,SH-22-01-45270-521,"מפאת חשיבותם, החלטתי להביאם במלואם: ""זה נורא מרגש הלחץ הזה.",טיעוני הצדדים לעונש
84,SH-22-01-45270-521,"תודה לביהמ""ש על כל התהליך הזה.",טיעוני הצדדים לעונש
85,SH-22-01-45270-521,"אני רוצה להתחיל בלהודות לביהמ""ש ולסניגור, שנתן לי הזדמנות לחוות את הטיפול הזה, ולהכיר את עצמי מחדש, ולהיוולד מחדש.",טיעוני הצדדים לעונש
86,SH-22-01-45270-521,"הסנגור אמר שאחזתי בשתי ידיים, אבל אחזתי בציפורניים.",טיעוני הצדדים לעונש
87,SH-22-01-45270-521,"אני מבין ש-20 שנים חייתי בהתמכרות בלתי פוסקת לחומרים משני תודעה: סמים, אלכוהול, הימורים.",טיעוני הצדדים לעונש
88,SH-22-01-45270-521,"אני נקי בחסד אלוהים 12 יום, חודשיים ושנה שלמה רק להיום, וזה לא מובן מאליו בכלל.",טיעוני הצדדים לעונש
89,SH-22-01-45270-521,"הייתי בקשר עם הילדה כל השנים, אבל לא כאב נוכח.",טיעוני הצדדים לעונש
90,SH-22-01-45270-521,"אני רוצה להגיד שמרכז חוסן אצלנו עושה עבודה נפלאה, באמת.",טיעוני הצדדים לעונש
91,SH-22-01-45270-521,כל יום מחדש מודה על מה שחוויתי והכרתי.,טיעוני הצדדים לעונש
92,SH-22-01-45270-521,מה שלמדתי על עצמי.,טיעוני הצדדים לעונש
93,SH-22-01-45270-521,אני היום בן שנה וחודשיים.,טיעוני הצדדים לעונש
94,SH-22-01-45270-521,נולדתי מחדש.,טיעוני הצדדים לעונש
95,SH-22-01-45270-521,להבין שאתה פוסט טראומתי בלי להיות מאובחן.,טיעוני הצדדים לעונש
96,SH-22-01-45270-521,"כשהכל מתיישב, אתה מבין את כל התסמינים.",טיעוני הצדדים לעונש
97,SH-22-01-45270-521,"אני הולך לקבוצות: na, ga [נרקומנים אנונימיים, מהמרים אנונימיים – ג""א].",טיעוני הצדדים לעונש
98,SH-22-01-45270-521,לומר את 12 הצעדים וליישם אותם בחיים.,טיעוני הצדדים לעונש
99,SH-22-01-45270-521,"לגבי העבירה, אני מבקש להתייחס לזה.",טיעוני הצדדים לעונש
100,SH-22-01-45270-521,"כמה שזה ישמע לא אמיתי, אני שמח שנעצרתי.",טיעוני הצדדים לעונש
101,SH-22-01-45270-521,אני שמח שזה קרה.,טיעוני הצדדים לעונש
102,SH-22-01-45270-521,פשוטו כמשמעו.,טיעוני הצדדים לעונש
103,SH-22-01-45270-521,"כי אם לא, זה היה או מוות או מוסדות.",טיעוני הצדדים לעונש
104,SH-22-01-45270-521,"היום חוץ מהטיפול הפרטני וחוץ מזה שאני בוגר מרכז יום, קבוצות שציינתי זה כל יום בערב, יש לי עבודה מאד אינטנסיבית, לא פשוטה.",טיעוני הצדדים לעונש
105,SH-22-01-45270-521,המון עם אחריות.,טיעוני הצדדים לעונש
106,SH-22-01-45270-521,אני עובד כשף של קפה 'לנדוור' שני סניפים.,טיעוני הצדדים לעונש
107,SH-22-01-45270-521,"מחזיק 12 טבחים תחתיי, אחראי על כל מערך ההזמנות.",טיעוני הצדדים לעונש
108,SH-22-01-45270-521,אחראי להגיש דוחות.,טיעוני הצדדים לעונש
109,SH-22-01-45270-521,תוך כדי מוצא זמן לנסוע 3 פעמים בשבוע לפרדס חנה לילדה.,טיעוני הצדדים לעונש
110,SH-22-01-45270-521,"יש לי כל יום שלישי הדרכת הורים, זה קרוב למפגש 60 עם המטפלת.",טיעוני הצדדים לעונש
111,SH-22-01-45270-521,"זה 13 מפגשים, ואני ממשיך מאז תהליך קרוב לשנה נוספת, להבין כמה הורות פספסתי בשמונה שנים של אי שפיות שחייתי בה.",טיעוני הצדדים לעונש
112,SH-22-01-45270-521,אני נרגש לא מוצא עוד מילים.,טיעוני הצדדים לעונש
113,SH-22-01-45270-521,"דומה שאין מחלוקת בין הצדדים בדבר חומרתן של העבירות שביצע הנאשם, המצדיקות על דרך הכלל גזירת עונש מאסר ממש לריצוי מאחורי סורג ובריח.",דיון
114,SH-22-01-45270-521,"עבירות הסמים מכלות עוד ועוד חלקות טובות בחברה, פוגעות בבריאותו של הציבור, מסבות נזקים לכלכלה, ומהוות זרז לביצוע עבירות נוספות, בעיקר מסוג רכוש ואלימות.",דיון
115,SH-22-01-45270-521,"מתחם העונש שביקשה המאשימה לקבוע מקובל עליי, לְמִצְעַר בחלקו התחתון (שנת מאסר בפועל), ואינני רואה להרחיב בעניין זה.",דיון
116,SH-22-01-45270-521,"עוד הסכימו הצדדים כי הדרך הטיפולית בה פוסע הנאשם מזה תקופה ממושכת, ראויה להכרה ולהתחשבות, ומצדיקה לחרוג לקולה ממתחם העונש.",דיון
117,SH-22-01-45270-521,"המחלוקת ביניהם מתמקדת בהיקף החריגה – האם כדי המלצת שירות המבחן לסיום ההליך בצו של""צ בהיקף ניכר, כעתירת ההגנה, שמא בעבודות שירות, כעתירת המאשימה.",דיון
