text,CIR_PUNISHMENT,GENERAL_CIRCUM,CIRCUM_OFFENSE,reject,CIR_TYPE,CIR_AMOUNT,CIR_ROLE,CIR_EQ,REGRET,RESPO,CONFESSION
"חוק העונשין, תשל""ז-1977: סע'  25, 40 ב, 40 ג', 40 ט', 144, 144 (ב), 287(א), 340א(ב)(1), 402(ב), 40יג(ב)",0.00035875695,3.0016867e-05,4.6062385e-05,0.9999871,0.0009524145,0.002265029,0.001187578,0.03051922,0.05503566,0.00022861979,0.0057349214
"פקודת הסמים המסוכנים [נוסח חדש], תשל""ג-1973: סע'  7(א), 7(ג), 13, 19א', 37א'(א)",0.00014984226,2.8651786e-05,2.6651243e-05,9.255366e-06,0.00045456283,0.0011176757,0.0006221855,0.033350836,0.032323383,0.00014185933,0.0042196554
"פקודת סדר הדין הפלילי (מעצר וחיפוש) [נוסח חדש], תשכ""ט-1969: סע'  47(א)",8.72304e-05,2.9227886e-05,2.2388182e-05,0.9999881,0.0003956027,0.00082104624,0.00031214056,0.06546104,0.029450739,0.00011274555,0.0009340793
"הנאשם הורשע, על פי הודאתו בעובדות כתב האישום שתוקן (במ/1), במסגרת הסדר טיעון שלא כלל הסכמה לעניין העונש, בביצוע עבירה של ניסיון שוד בנסיבות מחמירות, עבירה לפי סעיף 402(ב) בצירוף סעיף 25 לחוק העונשין, התשל""ז- 1977 (להלן: חוק העונשין), בעבירה של נשיאת נשק ותחמושת, עבירה לפי סעיפים 144 (ב) רישא ו- 144(ב) סיפא לחוק העונשין, בעבירה של ירי מנשק חם באזור מגורים, עבירה לפי סעיף 340א(ב)(1) לחוק העונשין ובעבירה של הפרת הוראה חוקית, עבירה לפי סעיף 287(א) לחוק העונשין.",0.00021659526,3.351458e-05,0.00030985157,9.11299e-06,0.0011114442,0.002903126,0.002459666,0.0065169362,0.082632504,0.00020345121,0.9998648
"בעובדות כתב האישום המתוקן בתיק המצורף נטען, כי ביום 14.12.17 בשעה 21:40, לערך, התקשר הסוכן המשטרתי, השוטר שי אבו-חצירה (להלן: הסוכן) לנאשם, וביקש לרכוש ממנו סמים מסוכנים.",0.00014680903,3.101312e-05,0.9999572,0.9999883,0.35849383,0.9994307,0.13476129,0.0076088686,0.011653665,0.0001960639,0.014856033
השניים קבעו להיפגש לצורך כך.,0.00019765846,3.5677745e-05,3.4769335e-05,0.99998736,0.0005058125,0.0010119245,0.007188838,0.1313232,0.004150926,0.00018871756,0.00038556888
"בהמשך, בשעה 22:40, לערך, סחר הנאשם בסם מסוכן בכך שנתן לסוכן ""אצבע וחצי"" של סם מסוכן מסוג חשיש במשקל 6.7 גרם נטו תמורת 300 ₪.",0.00014687207,2.995353e-05,0.9999677,8.959104e-06,0.99970263,0.9998723,0.99986935,0.003752277,0.006620828,0.00017369032,0.002139388
"בסמוך לכך הודיעו שני שוטרים לנאשם על מעצרו כדין, ובעת שנעצר, השתמש הנאשם בכוח, השתולל והתנגד למעצרו ובכך ניסה למנוע או להכשיל מעצר חוקי.",0.00013599444,3.158298e-05,0.860171,0.9999877,0.00075937243,0.0010241424,0.3689822,0.036129396,0.015261014,0.00026711202,0.030522013
"עת שערכו שוטרים חיפוש על גופו של הנאשם, נמצא הנאשם מחזיק על גופו סם מסוכן מסוג חשיש במשקל 8.3 גרם נטו ו-400 ₪ במזומן.",0.00014294671,3.0082205e-05,0.99995875,8.940821e-06,0.99968624,0.99986494,0.99966526,0.0037244286,0.0059122564,0.00015231321,0.00056930364
"עוד בהמשך לכך, נתפסו בחזקת הנאשם, בדירתו באילת, סמים מסוכנים מסוג חשיש, כדלקמן: 23.7 גרם נטו בארון הבגדים; 31.9 גרם נטו בנרתיק חום ו- 4.8 גרם נטו בשידת מגירות.",0.00017467285,3.0347464e-05,0.99995923,8.8617235e-06,0.9996588,0.99987197,0.999273,0.038398597,0.008559677,0.00023268528,0.0042868443
כתב האישום המתוקן בתיק זה,0.00015561823,3.1684307e-05,1.8214665e-05,0.9999882,0.00031266798,0.00069737516,0.0007746067,0.0013919531,0.012458468,0.00010768894,0.00012574764
"ביום 22.2.18 במסגרת תיק עמ""ת 59424-02-18, בנוכחות הנאשם, הורה כבוד השופט אריאל חזק בבית המשפט המחוזי בבאר שבע, כי הנאשם ישהה במעצר בית מלא בביתו של מר בכר ג'ברין ברח' עין תניה באום אל פחם (להלן: ההוראה החוקית).",0.00024886947,3.1918556e-05,0.007124652,0.99998724,0.0010949398,0.0024200215,0.0009229168,0.06058432,0.007943952,0.00014275109,0.01743956
"ביום 3.9.18, סמוך לשעה 6:30, הפר הנאשם את ההוראה החוקית, והגיע למאפיית ""סובח ומסא"" באום אל פחם (להלן: המאפייה), ברכב מסוג פורד פוקוס (להלן: הרכב) כשאחר, שזהותו אינה ידועה  (להלן: האחר), נוהג ברכב.",0.00013997816,0.9999945,0.9999515,0.99998844,0.35727742,0.99677974,0.9340852,0.46870834,0.01272761,0.00026259685,0.3114543
"הנאשם ישב במושב הנוסע האחורי ברכב, כשהוא נושא עמו אקדח חצי אוטומטי FN מודל 35HP, קיבר 9 מ""מ פארבלום, מס' סידורי 58418C ובו מחסנית עם תחמושת תואמת (להלן: האקדח), בלא רשות על פי דין להחזקתם או לנשיאתם.",0.00032297708,3.080908e-05,0.99993944,1.526729e-05,0.99463403,0.9995819,0.98227316,0.34748086,0.0098756775,0.00023726127,0.03238758
האקדח הוא כלי שסוגל לירות כדור שבכוחו להמית אדם והמחסנית היא אביזר של נשק.,0.00018658886,3.4024753e-05,0.9998903,0.9999865,0.009083745,0.46510682,0.74269086,0.79869646,0.015473706,0.00027839487,0.0005056889
"בהגיעם סמוך למאפייה, עצר האחר את הרכב במרכז הכביש.",0.00015228504,3.2103428e-05,0.10137485,0.9999877,0.000627336,0.0024753932,0.31202817,0.38279146,0.0125806965,0.00019147784,0.0002876228
"הנאשם יצא מהרכב ונכנס לתוך המאפייה כשהוא רעול פנים, כפפות על ידיו והוא נושא עמו את האקדח, כל זאת בכוונה לשדוד את המאפייה, ובעוד האחר המתין ברכב מחוץ למאפייה.",0.00014748365,3.0309173e-05,0.9999441,0.99998784,0.2133669,0.8812995,0.9991611,0.13062651,0.020100757,0.00050318276,0.003170298
"באותה עת עבד במאפייה עבד אל רחמן, כקופאי (להלן: המתלונן), ושהו במאפיה מספר לקוחות.",0.00012986528,0.9999956,0.9998778,1.0248069e-05,0.00104119,0.001516039,0.85641843,0.6398109,0.0062910654,0.00020765173,0.0011964502
"הנאשם נכנס למאפייה, ירה ירייה אחת מהאקדח לעבר התקרה, ואז דרש מהמתלונן לפתוח את הקופה, תוך שהוא מאיים עליו באמצעות האקדח באומרו ""אני ארה בך"", כל זאת בכוונה ליטול את תכולת הקופה, ולשלול אותה שלילת קבע, ללא הסכמת הבעלים, ובלי תביעת זכות בתום לב.",0.0002850134,3.058384e-05,0.9999343,0.99998677,0.06477559,0.2531902,0.9942677,0.6597056,0.036359902,0.00033179414,0.019863572
"המתלונן נבהל, התחבא מאחורי דלפק סמוך ואמר לנאשם שיפתח את הקופה בעצמו.",0.00015236059,3.052324e-05,0.98415035,0.99998784,0.00050482556,0.0013891265,0.9535246,0.07072113,0.018295875,0.00025127112,0.0005144204
"הנאשם שב ודרש מהמתלונן לפתוח את הקופה, ומשזה לא הגיב, עזב הנאשם את המאפייה.",0.00014622674,3.192446e-05,0.001169029,0.9999877,0.00047522355,0.0010275989,0.12814313,0.29679072,0.021080425,0.00027980894,0.00066607643
הנאשם יצא מהמאפייה ועלה לרכב במטרה להימלט מהמקום.,0.00011255574,3.1633226e-05,0.98217463,0.9999881,0.00048112386,0.0012234376,0.9918107,0.02297613,0.010729269,0.00019675533,0.00037278782
"אז הגיע סעיד ג'ברין (להלן: סעיד) כשהוא נוהג ברכב סקודה וכאשר הבחין במתרחש, חסם את מסלול נסיעתו של הרכב על מנת למנוע את בריחת הנאשם והאחר.",0.0001346892,3.016091e-05,0.9998665,0.9999877,0.006275571,0.11213429,0.9750124,0.14726713,0.011332684,0.0002017224,0.0026184968
"בהמשך לאמור, החל האחר לנסוע לאחור, כאשר רכב הסקודה חוסם את אפשרותו לנסוע קדימה ונוסע מולו, כל זאת נגד כיוון הנסיעה.",0.00015497573,3.0377318e-05,0.053423874,0.9999876,0.0038397524,0.013187683,0.560362,0.2637645,0.010523528,0.00022924626,0.00032459485
"באותה עת, במהלך סיור שגרתי, נסעו השוטרים סילביה אברמוב וסאיד פאדל (להלן: השוטרים) בניידת משטרתית ברחוב אל מדינה באום אל פחם לכיוון המאפייה.",0.00012677329,3.0743184e-05,0.9998319,0.9999875,0.0026779477,0.06968458,0.043323427,0.407609,0.009283666,0.0001548608,0.0012291992
"השוטרים הבחינו ברכב ובסקודה שנסעו נגד כיוון הנסיעה, ועצרו לצד הרכב על מנת לברר את פשר נהיגתם.",0.00020510484,3.0805786e-05,0.9791235,0.99998784,0.0024285363,0.003888423,0.65306556,0.12861368,0.042255085,0.00023461985,0.00037829875
"משהבחין הנאשם  בניידת המשטרה, ירד מהרכב כשהוא רעול פנים ונושא עליו את האקדח.",0.00011909375,3.12009e-05,0.99886644,0.9999875,0.00073872175,0.00238713,0.8595934,0.046816915,0.052654784,0.00038007795,0.00060993823
"מיד לאחר מכן, עלה האחר עם הרכב על אי תנועה בכביש, עקף את הסקודה ונסע במהירות על מנת לברוח מהשוטרים.",0.00015753838,3.0659477e-05,0.9985519,0.99998784,0.0028460813,0.013858162,0.9581392,0.085108146,0.0158857,0.00025694742,0.0006115233
"סעיד, אשר הבחין בשוטרים נוסעים אחרי הרכב ממנו ירד הנאשם, החל בנסיעה אחרי הנאשם תוך כדי שהנאשם רץ במהירות ונושא בידו את האקדח.",0.00015700408,3.0878196e-05,0.99987483,0.9999877,0.008884102,0.18619034,0.99563295,0.08323487,0.019342965,0.00032577605,0.0013547931
"במהלך הבריחה, כיוון הנאשם את האקדח שלוש פעמים לכיוונו של סעיד.",0.0001614454,3.0889063e-05,0.9995334,0.99998724,0.0016280288,0.06526928,0.99499136,0.052714024,0.010675718,0.00016238703,0.00033036998
"עם הגעת הנאשם אל מול קניון עבד-אל-לטיף  באום אל פחם, הגיעה ניידת משטרה אחרת, אשר הוזעקה על ידי השוטרים, ואז הנאשם עצר.",0.00013621611,3.058008e-05,0.022900414,0.99998796,0.0011152915,0.0033311236,0.0072974837,0.39943442,0.007814247,0.00021822,0.0008892654
"תסקיר שירות המבחן שהוגש לתיק זה מלמד על צעיר כבן 24, תושב אום אל פחם.",0.00012482655,0.9999958,1.8568207e-05,9.139439e-06,0.00045459362,0.0009577208,0.00061230856,0.0090202885,0.0087452475,0.00014723747,0.0002948829
"טרם מעצרו בגין תיק זה, שהה הנאשם בתנאי מעצר בית בבית הוריו וזאת בגין התיק המצורף.",0.00016928077,3.101543e-05,1.8237228e-05,0.9999877,0.0004998602,0.00092522084,0.00076823414,0.004226295,0.0048513436,0.00011348787,0.0005506059
"הנאשם ציין בפני שרות המבחן כי בעבר נהג לעבוד בעבודות מזדמנות בת""א ובאילת.",0.00010294415,0.99999595,1.8750728e-05,8.999112e-06,0.00043476722,0.00074601156,0.0014483775,0.008796729,0.009620895,0.00011300419,0.00068359094
"הנאשם סיפר,  כי  בהיותו בן 18 החל לעשן חשיש ולשתות אלכוהול בתדירויות שונות.",0.00011302973,0.9999962,0.99993646,8.969141e-06,0.9788507,0.0018129426,0.98885626,0.0054397704,0.01018674,0.00013077716,0.00091608416
"עם זאת, שלל הנאשם קיומם של דפוסי תלות והתמכרות וטען לשליטה בעניין.",0.0001002338,0.99999523,4.8344995e-05,8.994135e-06,0.0005696388,0.00094585243,0.0062216227,0.0069952877,0.022746528,0.00013251435,0.00039812538
"אשר לעברו הפלילי של הנאשם, צוין בתסקיר כי לחובתו שתי הרשעות קודמות בעבירות שעניינן היזק לרכוש וסמים.",0.00014152333,0.99999607,1.9110832e-05,9.009285e-06,0.00052526855,0.0008643858,0.00086783915,0.0018459276,0.0179146,0.00014503086,0.0016177972
"בהתייחס לביצוע העבירה שבפנינו, לקח הנאשם אחריות פורמאלית לביצועה, תוך שציין כי היה נתון תחת השפעת אלכוהול, דבר שהקשה עליו לזכור את פרטי האירוע.",0.00011461315,3.0126184e-05,0.99506855,9.091496e-06,0.001055731,0.0009648476,0.99832267,0.004937294,0.42740703,0.9996025,0.99501294
"הנאשם אף ייחס את התנהלותו להשלכות החומרים הממכרים על תפקודו, מה שהקשה עליו, לטענתו, להפעיל שיקול דעת הולם להתנהלותו.",0.00014957432,3.161715e-05,3.9942614e-05,1.0359174e-05,0.0011494769,0.001092111,0.051956933,0.0273386,0.4362317,0.0852517,0.004210275
"הנאשם התייחס לעבירות הנשק באופן מקל, תוך שציין כי מדובר בתופעה רווחת באזור מגוריו.",0.00011571315,0.99999166,2.1144562e-05,0.9999865,0.00044815472,0.00085155957,0.0049530007,0.004715777,0.07613234,0.0004096901,0.0007071044
"אשר לתיק המצורף, הסביר הנאשם כי מעשיו נבעו מתוך התפתות לכסף קל.",0.0001114209,3.24163e-05,0.012413072,9.666792e-06,0.000583709,0.0010455217,0.9739404,0.0022004305,0.8777013,0.00016144617,0.0016888897
"בבואו להעריך את הסיכון להישנות התנהגות עוברת חוק לצד הסיכוי לשיקום, העריך שרות המבחן כי מדובר בצעיר הפועל מתוך רמת תפקוד ומסוגלות בינונית- נמוכה.",9.997054e-05,0.9999958,2.1587226e-05,4.0197945e-05,0.00056457706,0.00094886083,0.00041505,0.0064721117,0.011047237,0.00022337738,0.00034296306
"שירות המבחן התרשם מקיומם של קווים אנטי-סוציאליים אצל הנאשם שאימץ התנהגות פורצת חוק, המאופיינת בהסתבכות שלו עם החוק במקביל לקיומו של הליכים משפטיים נוספים ולהיותו נתון בתנאים מגבילים.",0.0001008047,0.99999154,2.169955e-05,0.999977,0.0005678036,0.0010980599,0.00077923835,0.004282336,0.013289799,0.00017965316,0.00046596598
"שירות המבחן סבור, כי הנאשם יתקשה לשתף פעולה עם גורמי טיפול, וכי הוא פועל מתוך מיקוד שליטה חיצוני תוך צמצום חלקו בהתנהגות עוברת החוק.",0.00011184127,0.99999595,1.9795916e-05,9.011855e-06,0.00058806146,0.0010237314,0.0009820065,0.00293803,0.022998285,0.0006076672,0.0016960027
"נוכח ריבוי גורמי הסיכון, בהיות הנאשם צעיר המצוי בתהליך של הידרדרות וחשיפה לגורמים שוליים ואינו מבטא הכרה בחומרת מצבו, וכן אינו מודע לצורך בשינוי דפוסי התנהלותו, לא בא שירות המבחן בהמלצה שתסייע בהפחתת הסיכון להישנות עבירות על-ידו בעתיד.",0.00012823127,0.9999963,2.13978e-05,0.9905662,0.0007229669,0.0010889942,0.0006176037,0.0060372553,0.29995424,0.00027601735,0.40828076
טיעוני הצדדים לעונש,0.00023445573,3.061019e-05,1.9157287e-05,0.99998724,0.0002738527,0.00077500765,0.0006992919,0.0061249323,0.1472914,0.00019333149,0.00018076108
באת כוח המאשימה הגישה את טיעוניה לעונש בכתב (ט/3) וכן הוסיפה וטענה בקצרה בעל-פה בדיון בפניי ביום 1.3.19.,0.00014147245,3.0483328e-05,1.959397e-05,0.9999876,0.00047404045,0.0010559165,0.00066852896,0.0052131996,0.014231662,0.00026919387,0.90182716
"הובהר מפי באת כוח המאשימה, כי לחובת הנאשם שתי הרשעות קודמות בעבירות של היזק לרכוש במזיד והחזקת סמים לצריכה עצמית (ט/1) ואף תלוי ועומד נגדו מאסר על תנאי בן 45 יום שיש להפעילו בהליך זה נוכח הרשעתו בתיק המצורף בעבירה של החזקת סמים (ראו ט/2).",0.00021256563,0.9999963,0.00035892238,9.004467e-06,0.001439093,0.0011875882,0.0024132414,0.0031688968,0.015987642,0.00014969675,0.99851054
"בטיעוניה לעונש הפנתה באת כוח המאשימה לאמור בתסקיר שירות המבחן שהוגש בעניינו של הנאשם, לרבות לכך שלא ניתנה המלצה טיפולית בעניינו, בהינתן  ריבוי גורמי הסיכון הנזכרים בתסקיר.",0.00012871504,3.1631836e-05,1.8761873e-05,0.9999875,0.00051198597,0.000954402,0.0005678401,0.0022989288,0.012309764,0.00022794046,0.006940218
באת כוח המאשימה ציינה את חומרת העבירות שבפנינו.,0.00012490788,3.1983673e-05,2.2003773e-05,0.9999876,0.0004057534,0.0008687861,0.0006686568,0.0034387358,0.9131232,0.00021301405,0.00056680926
"עוד ציינה באת כוח המאשימה, כי הערכים החברתיים שנפגעו כתוצאה מביצוע העבירות הם ביטחון הציבור ושלומו וכן בטחונו האישי של המתלונן, כבודו וזכות הקניין שלו.",0.00013746471,3.3091907e-05,3.0272631e-05,0.9999876,0.00057742075,0.00091019965,0.00078999856,0.15559603,0.44878873,0.00045235016,0.0005622025
"כן צוין כי לאירוע  ניסיון השוד קדמו הכנה ותכנון ע""י הנאשם והאחר שהצטיידו באקדח בכוונה להפחיד את המתלונן, וכן הצטיידו בכפפות ובד שהסתיר את פניו של הנאשם במטרה להקשות על זיהויו.",0.0001181096,3.047362e-05,0.99995005,0.9999877,0.970008,0.18980724,0.99947244,0.032547913,0.012664957,0.00041331782,0.008837393
"באת כוח המאשימה ביקשה מבית המשפט לתת דעתו לרגעי האימה שחווה המתלונן במהלך אירוע ניסיון השוד, ובד בבד ביקשה שלא לזקוף לזכותו של הנאשם את העובדה שפעל מפאת מצוקה כלכלית.",9.991564e-05,0.9999958,2.9747229e-05,9.059845e-06,0.0004567946,0.0008226117,0.0044217925,0.0072022523,0.596772,0.0038792624,0.18824391
"באת כוח המאשימה הפנתה בטיעוניה לעונש, במסגרת סקירת מדיניות ענישה נהוגה, לפסקי דין שניתנו בעבירות של נשיאת נשק, שוד וניסיון שוד (ראו ט/3 ו- ט/4).",0.00016032187,3.1655916e-05,2.3011271e-05,0.99998796,0.0007165595,0.0012270135,0.0013733021,0.003934987,0.02823034,0.00015449562,0.006045725
"בסיכומו של דבר, ותוך הדגשת התנהלותו של הנאשם שנכנס, כאמור, למאפייה בשעות הבוקר וירה בתוכה באמצעות האקדח, לעיני לקוחות, תוך שהוא מאיים ומסכן את המתלונן שעבד כקופאי, ביקשה באת כוח המאשימה לקבוע בתיק זה מתחם עונש הולם הנע בין 4.5 ל- 6.5 שנות מאסר בפועל, תוך שביקשה להשית על הנאשם מאסר בפועל ברף העליון של מתחם העונש ההולם הנ""ל.",0.00019313527,0.99992836,0.9937842,1.3894417e-05,0.06848302,0.0060660485,0.3472856,0.008156492,0.017001895,0.00017800006,0.96436965
"אשר לתיק המצורף, טענה באת כוח המאשימה כי מדובר באירוע נפרד בגינו ביקשה להשית על הנאשם עונש של שנת מאסר בפועל, תוך קביעה כי שני העונשים יצטברו האחד לשני ותוך הפעלת המאסר המותנה במצטבר לעונש המאסר בפועל.",0.00011303211,3.0601026e-05,2.3246504e-05,0.99998736,0.000640573,0.0010519666,0.0005653743,0.0010150776,0.00896724,0.00011486237,0.9975522
"בנוסף למאסר בפועל ביקשה המאשימה להשית על הנאשם מאסר מותנה ארוך ומרתיע, פיצוי כספי למתלונן ופסילה מלהחזיק רישיון נהיגה וכן לחלט סכום של 400 ₪ שנתפס ברשות הנאשם במסגרת התיק המצורף.",0.99995494,3.0283662e-05,0.00032052095,1.0473878e-05,0.0008991906,0.0060865036,0.021935634,0.0010471466,0.012439616,9.444848e-05,0.98993087
"ב""כ הנאשם ביקש, בטיעוניו לעונש בדיון הנ""ל בפניי, שלא למצות את הדין עם הנאשם, תוך שטען כי מדובר בנאשם שהיה אך בן 23 בעת ביצוע העבירות בתיק זה.",0.00012764848,0.9999963,2.2900433e-05,9.196663e-06,0.0005258364,0.00090823736,0.004660261,0.0019357069,0.10482935,0.00018558108,0.99904364
"ב""כ הנאשם הוסיף כי הנאשם הודה בהזדמנות הראשונה ולא הסכים להשתחרר ממעצר מתוך כוונה להודות בעבירות  ולשאת את עונשו.",9.749584e-05,3.079865e-05,2.141082e-05,9.171509e-06,0.00036520994,0.000786252,0.004473907,0.0011965962,0.9845064,0.988052,0.9998529
"נטען כי הנאשם לוקח אחריות מלאה על העבירות ויש לראות את הודאתו כהודאה כנה המביעה חרטה ובנוסף חוסכת זמן שיפוטי יקר ואת העדת עדי התביעה, לרבות המתלונן.",0.00010163633,3.1113694e-05,9.1958726e-05,8.9618225e-06,0.00056614785,0.0008956686,0.005791281,0.002957793,0.9986021,0.99968624,0.999869
"כאן אציין, כי ביום 8.4.19 הוגש מטעם ההגנה הסכם סולחה שנערך ביום 7.4.19, בין הנאשם ואביו ובין המתלונן ובעל הקיוסק (המאפייה) , ולפיו הסכסוך בין הצדדים בה לסיומו ואין למתלונן ולבעל הקיוסק כל דרישה ו/או טענה ו/או תביעה כלפי הנאשם ואביו.",0.00016956475,3.340517e-05,0.24109872,0.99998736,0.0014812618,0.0022056964,0.0054626493,0.21522437,0.024218652,0.00026360553,0.026560271
"עוד, לפי הסכם הסולחה, שילמו הנאשם ואביו פיצוי למתלונן ולבעל הקיוסק בסכום של 5,000 ₪.",0.9998553,3.1569427e-05,0.00041986138,1.025241e-05,0.00085199333,0.0008443237,0.54985726,0.043840252,0.016722068,0.00014130742,0.00046753077
"המאשימה טענה לעניין זה, כי המתלונן אומנם אישר כי חתם על הסכם הסולחה, אולם היא סבורה כי אין לתת להסכם זה משקל כלשהו במסגרת גזר הדין, וזאת בהינתן חומרת העבירות והעובדה שרק בדרך נס לא הסתיים האירוע בפגיעה בגוף או בחיי אדם.",0.00014352977,3.244723e-05,0.00033272544,0.0016037663,0.000988976,0.0011738663,0.0025368133,0.008130952,0.14276834,0.00028696816,0.61836034
"ב""כ הנאשם טען כי הנאשם הוא בן למשפחה המונה 6 נפשות וכי בשנה שעברה פקדה את המשפחה טרגדיה עת שנורו למוות, במסגרת סכסוך חמולות, דודו ובן דודו של הנאשם.",0.00013008279,0.9999962,0.009821069,9.0161875e-06,0.00072648685,0.0012203488,0.015755208,0.23999044,0.025303442,0.00018494549,0.002483153
"ב""כ הנאשם הדגיש את היות הנאשם נתון במעצר בתנאים קשים מזה כ-7 חודשים.",0.0001130749,3.0912906e-05,1.9195068e-05,9.693083e-06,0.0003823067,0.00089926436,0.0003338843,0.0062084487,0.023975667,0.0001716928,0.00038360542
"להמחשת עמדתה לעונש של ההגנה בתיק זה, הוגשה אסופת פסיקה (נ/1 ו- נ/3).",0.00018525931,3.1982814e-05,2.388986e-05,0.9999875,0.00060114136,0.0013318887,0.0011337391,0.009334635,0.017864646,0.00015399525,0.0005562226
"בהסתמך על אסופת הפסיקה הנ""ל, נטען כי בגין עבירות שוד הושתו עונשי מאסר בפועל הנעים מ-6 חודשי עבודות שירות עד ל-42 חודשי מאסר בפועל כשדובר בארבעה מקרי שוד של תחנות דלק.",0.00012021325,3.1163196e-05,9.7237265e-05,0.9999877,0.0014504374,0.0013425467,0.0022983742,0.002707672,0.008950288,0.0001303909,0.0004808277
"כמו כן, הוגשה אסופת פסיקה להמחשת עמדת ההגנה לעונש לעניין התיק המצורף.",0.00018536851,3.3271703e-05,2.2797194e-05,0.9999876,0.00048496164,0.0010417893,0.0008305993,0.0034960813,0.0126297055,9.410524e-05,0.00018036303
"לעניין תיק זה נטען כי בית משפט השלום באילת הפנה את הנאשם בתיק המצורף לקבלת חוות דעת הממונה על עבודות  שירות, אולם מפאת מעצרו בתיק זה וצירוף התיק הנ""ל, לא הושלם ההליך בבית משפט השלום באילת.",0.00013574194,3.0952546e-05,4.8865844e-05,0.9999875,0.00064416806,0.0010723149,0.0008375763,0.005418639,0.005404008,0.00011994235,0.0031003337
