text,PUNISHMENT,GENERAL_CIRCUM,CIRCUM_OFFENSE,CIR_STATUS_WEP,CIR_HELD_WAY_WEP,CIR_PURPOSE,CIR_AMMU_AMOUNT_WEP,CIR_OBTAIN_WAY_WEP,CIR_TYPE_WEP,CIR_USE,CIR_PLANNING,RESPO,REGRET,CONFESSION,PUNISHMENT_ACTUAL,PUNISHMENT_SUSPENDED,PUNISHMENT_FINE
"בעניינו של הנאשם הנדון יש אפוא, לשקול את השיקולים הבאים: ראשית, אמנם לחובת הנאשם שתי הרשעות קודמות, אך כפי שטען בא-כוחו בצדק, ההרשעה האחרונה בעבירה של הפרעה לשוטר במילוי תפקידו היא משנת 2010 (לפני כתשע שנים) בעניין עבירה שנעברה בשנת 2008 (לפני כאחת-עשרה שנים) ואילו ההרשעה שקדמה לה, בעבירת הצתה, היא משנת 2001, לפני כשמונה עשרה שנה, עת היה הנאשם קטין.",,"['1 : כן', '2 : לא', '3 : לא', '4 : לא', '5 : לא', '6 : לא', '7 : לא', '8 : כן', '9 : לא', '10 : כן', '11 : כן']",,,,,,,,,,,,,,,
"מאז כך נראה, מנהל הנאשם אורח חיים תקין ולכן נראה, כי עונש מאסר ממושך עשוי להשליך לרעה על עתידו ועל סיכוייו לשוב אל משפחתו ואל אורח חייו התקין, כאב למשפחה שהפעיל עסק לפרנסתה.",,"['1 : כן', '2 : כן', '3 : לא', '4 : לא', '5 : לא', '6 : לא', '7 : לא', '8 : לא', '9 : לא', '10 : כן', '11 : לא']",,,,,,,,,,,,,,,
"שנית, נשקל המשבר הכלכלי שנגרם למשפחת הנאשם בשל כך שבעקבות מעצרו, העסק שהפעיל קרס והוא נקלע לחובות כספיים; שלישית, לזכות הנאשם יש לזקוף את העובדה שהכיר באחריותו והודה ובכך חסך זמן שיפוטי ניכר.",,"['1 : לא', '2 : כן', '3 : לא', '4 : כן', '5 : כן', '6 : לא', '7 : כן', '8 : כן', '9 : לא', '10 : לא', '11 : לא']",,,,,,,,,,,,['כן'],,,
"הודאת הנאשם, כפי שטען בא-כוחו, הייתה כבר בשלב חקירתו במשטרה ואף לא מן הנמנע שכטענת בא-כוחו, אלמלא הודה, לא היו בידי המאשימה ראיות מספיקות להגשת כתב האישום; רביעית, הנאשם הביע צער כן על כך שעבר את העבירה שבה הורשע, הכיר בטעותו וביקש שיתאפשר לו לשוב אל חיק משפחתו ולשוב ולנהל אורח חיים תקין, כפי שעשה קודם לכן.",,"['1 : לא', '2 : כן', '3 : לא', '4 : כן', '5 : כן', '6 : לא', '7 : כן', '8 : לא', '9 : לא', '10 : כן', '11 : לא']",,,,,,,,,,,,['כן'],,,
"איזון כל השיקולים האמורים, לרבות עמדת המאשימה וטענותיו של בא-כוח הנאשם וכן הצורך להרתיע את הנאשם ואת כלל הציבור מפני עבירות נשק, ומנגד השיקול המצדיק לאפשר לנאשם לשוב למשפחתו ולהשתקם, מוביל לכך שיש להעמיד את עונש המאסר שיושת הנאשם ברף הנמוך של מתחם העונש ההולם.",,,,,,,,,,,,,,,,,
זאת לצד מאסר מותנה שישמש גורם מרתיע לנאשם מפני חזרה על עבירת נשק.,,,,,,,,,,,,,,,,,
"מאחר שבפועל לא היה היבט כלכלי לעבירה, נראה כי אין מקום להשתת קנס כספי.",,,,,,,,,,,,,,,,,
"לנוכח כל השיקולים שהובאו לעיל, על הנאשם נגזרים העונשים הבאים:",,,,,,,,,,,,,,,,,
"מאסר בפועל למשך תקופת מעצרו של הנאשם, מיום 14.9.2018 ועד היום.",,,,,,,,,,,,,,,"['הנאשם קיבל מאסר בפועל למשך תקופת מעצרו, שזה 1492018 עד היום']",[],[]
"בסך הכול, שמונה חודשי מאסר בפועל.",,,,,,,,,,,,,,,,,
מאסר מותנה למשך ארבעה חודשים.,,,,,,,,,,,,,,,,,
"הנאשם לא יישא עונש מאסר זה, אלא אם יעבור תוך שלוש שנים מיום שחרורו מן המאסר עבירת נשק שהיא פשע.",,,,,,,,,,,,,,,[],['הנאשם קיבל 36 חודשי מאסר על תנאי'],[]
מאסר מותנה למשך חודשיים.,,,,,,,,,,,,,,,,,
"הנאשם לא יישא עונש מאסר זה, אלא אם יעבור תוך שלוש שנים מיום שחרורו מן המאסר עבירת נשק שהיא עוון.",,,,,,,,,,,,,,,[],['הנאשם קיבל 36 חודשי מאסר על תנאי'],[]
זכות ערעור לבית המשפט העליון תוך ארבעים וחמישה יום.,,,,,,,,,,,,,,,,,
"54678313ניתן היום,  ח' באייר התשע""ט, 13 במאי 2019, במעמד הנאשם, בא-כוחו ובא-כוח המאשימה כאמור בפרוטוקול מהיום.",,,,,,,,,,,,,,,,,
תמר בר אשר 54678313,,,,,,,,,,,,,,,,,
