text,PUNISHMENT,GENERAL_CIRCUM,CIRCUM_OFFENSE,CIR_STATUS_WEP,CIR_HELD_WAY_WEP,CIR_PURPOSE,CIR_AMMU_AMOUNT_WEP,CIR_OBTAIN_WAY_WEP,CIR_TYPE_WEP,CIR_USE,CIR_PLANNING,RESPO,REGRET,CONFESSION,PUNISHMENT_ACTUAL,PUNISHMENT_SUSPENDED,PUNISHMENT_FINE
"תפ""ח 39587-07-21 מדינת ישראל נ' פלוני",,,,,,,,,,,,,,,,,
פלוני,,,,,,,,,,,,,,,,,
"ע""י ב""כ עו""ד אהוד בן יהודה",,,,,,,,,,,,,,,,,
"חוק העונשין, תשל""ז-1977: סע'  31, 144(א), 152, 275א, 329(א)(2), 448(א)",,,,,,,,,,,,,,,,,
"חוק המאבק בטרור, תשע""ו-2016: סע'  37",,,,,,,,,,,,,,,,,
"נגד הנאשמים ואחרים, הוגש כתב אישום חמור המייחס להם מעורבות בתכנית פיגוע וביצוע מעשי טרור נגד תושבים יהודים בעיר לוד, במהלך ימי מבצע ""שומר חומות"", בחודש מאי 2021.",,,,,,,,,,,,,,,,,
"נאשמים 1-3 הורשעו, בהתאם להודאתם, במסגרת הסדר טיעון, בעבירות הבאות:  נאשמים 1 ו-2 בעבירות של מעשה טרור של חבלה בכוונה מחמירה, לפי סעיף 329(א)(2) לחוק העונשין, תשל""ז-1977 (להלן: ""החוק"") יחד עם סעיף 37 לחוק המאבק בטרור, תשע""ו-2016 (להלן: ""חוק המאבק בטרור"") ; מעשה טרור של הצתה לפי סעיף 448(א) סיפא לחוק יחד עם סעיף 37 לחוק המאבק בטרור.",,,,,,,,,,,,,,['כן'],,,
"עוד הורשע נאשם 2 בעבירת החזקת נשק אביזר ותחמושת לפי סעיף 144(א) לחוק ונאשם 1 בסיוע להחזקת נשק, אביזר ותחמושת לפי סעיף 144(א) יחד עם סעיף 31 לחוק.",,,,,,,,,,,,,,,,,
"נאשם 3 הורשע בעבירות של סיוע למעשה טרור של חבלה בכוונה מחמירה לפי סעיף 329(א)(2) יחד עם סעיף 31 לחוק וסעיף 37 לחוק המאבק בטרור וסיוע למעשה טרור של הצתה לפי סעיף 448(א) סיפא יחד עם סעיף 31 לחוק וסעיף 37 לחוק המאבק בטרור, וכן בעבירות של הפרעה לשוטר בנסיבות מחמירות לפי סעיף 275א לחוק והתפרעות לפי סעיף 152 לחוק.",,,,,,,,,,,,,,,,,
"בד בבד החלו הפרות סדר רחבות בכל רחבי הארץ, לרבות בעיר לוד, בה התרחשו אירועים רבים של אלימות בין יהודים, ערבים וכוחות הביטחון על רקע לאומני וגזעני, בין היתר באמצעות התפרעויות, השלכת בקבוקי תבערה, ירי זיקוקים, חסימת כבישים וזריקות אבנים לעבר אזרחים וכוחות הביטחון.",,,,,,,,,"['בקבוק תבערה (בקת""ב)']",[],,,,,,,
"ביום 10.5.21, במסגרת המהומות, נורה למוות מוסא חסונה ז""ל (להלן: ""מות חסונה"").",,,,,,,,,,[],,,,,,,
"על פי עובדות האישום השני המיוחס לנאשמים 1-4 ו-6-8, הנאשמים 1-3 הם קרובי משפחה.",,,,,,,,,,,,,,,,,
"ביום 13.5.21, או סמוך לכך, נפגש נאשם 1 בביתו עם הנאשמים 6, 7 ו-8.",,,,,,,,,,,,,,,,,
"במהלך המפגש הציע נאשם 7 לנוכחים להשליך בקבוקי תבערה אל עבר בניין בו מתגוררים יהודים בשכונת חב""ד בעיר לוד, על רקע מהומות 'שומר חומות' ומות חסונה.",,,,,,,,,"['בקבוק תבערה (בקת""ב)']",[],,,,,,,
"הנאשמים 1, 6 ו-8 הסכימו להצעתו של הנאשם 7, והארבעה סיכמו שיבצעו את תכניתם בהמשך אותו הלילה.",,,,,,,,,,,,,,,,,
"בהמשך, בשעות הערב, נסע נאשם 1 עם נאשמים 6 ו-7 ברכבו של נאשם 6, וביצעו סיור הכנה בזירה בה תכננו לבצע את הפיגוע בהמשך הלילה.",,,,,,,,,,[],,,,,,,
"נאשמים 1, 6 ו-7 הגיעו לשכונת חב""ד בלוד, בחרו את הבניין שלעברו ישליכו את בקבוקי התבערה וחילקו ביניהם את התפקידים, כך שנאשמים 1 ו-7 ישליכו את בקבוקי התבערה לעבר הבניין ונאשם 6 יתצפת ויזהיר את שותפיו מפני הגעת כוחות משטרה לזירה.",,,,,,,,,"['בקבוק תבערה (בקת""ב)']",,,,,,,,
עוד תכננו הנאשמים את דרך הגעתם לזירה ואת דרך המילוט.,,,,,,,,,,,,,,,,,
"חרף התכנון, לא ביצעו את תוכניתם באותו הלילה.",,,,,,,,,,,,,,,,,
"ביום 16.5.21, נפגשו נאשמים 1-3, 4, 6-8 ושוחחו על רצונם לפגוע ביהודים בלוד.",,,,,,,,,,,,,,,,,
"בהמשך, קשרו נאשמים 1 ו-2 קשר לביצוע פיגוע נגד יהודים בלוד, במסגרתו ישליכו בקבוקי תבערה בשעת לילה מאוחרת לעבר בניין מגורים בשכונת חב""ד בלוד בו מתגוררים יהודים.",,,,,,,,,"['בקבוק תבערה (בקת""ב)']",[],,,,,,,
מספר ימים לאחר מכן פנו נאשמים 1 ו-2 לנאשם 3 והציעו לו לסייע להם ולשמש כתצפיתן במהלך הפיגוע.,,,,,,,,,,,,,,,,,
"נאשם 3 השיב בחיוב והשלושה סיכמו כי תפקידו יהיה להתמקם על גשר שנמצא בסמוך לשכונת חב""ד בלוד, ולהזהיר את הנאשמים 1 ו-2, באמצעות מכשירי קשר, בדבר הגעת כוחות משטרה לאזור.",,,,,,,,,,,,,,,,,
"לצורך קידום התכנית ביצעו הנאשמים 1-3 מספר סיורי שטח בזירת הפיגוע המתוכנן, בחנו לאיזה בניין מגורים ישליכו את בקבוקי התבערה וסיכמו על נתיבי הגעה ומילוט: בסיור הראשון השתתפו הנאשמים 1 ו-2, בסיור השני השתתפו הנאשמים 1, 2 ו-6, בסיור השלישי השתתפו הנאשמים 2 ו-3, בסיור הרביעי השתתפו הנאשמים 1 ו-2.",,,,,,,,,"['בקבוק תבערה (בקת""ב)']",,,,,,,,
"בימים הסמוכים נפגשו הנאשמים 1-2 עם הנאשמים 3,4,6-8 במספר מועדים ועדכנו אותם על תכנית הפיגוע.",,,,,,,,,,,,,,,,,
"במסגרת הקשר הצטיידו נאשמים 1-3 בכלי עזר וחפצים שונים: אופניים חשמליים שאותם רכש הנאשם 2 לקראת הפיגוע, הנאשמים 1 ו-6 הביאו את האופניים מהחנות בה נקנו על ידי הנאשם 2 והחנו אותם בביתו של נאשם 1; שישה בקבוקי תבערה שאותם קיבל הנאשם 1 לבקשתו מנאשם 4; שני מכשירי קשר שאותם קיבלו הנאשמים 1-2 מנאשם 8.",,,,,,,,[],['בקבוק תבערה'],,,,,,,,
"ביום 28.5.21 הוציאו נאשמים 1-3 בצוותא את תכנית הפיגוע אל הפועל: ביום 27.5.21 בשעת ערב מאוחרת, נפגשו נאשמים 1-2 בבית, הוסיפו בנזין לששת בקבוקי התבערה שהביא עמו הנאשם 1, וקשרו חמישה מהם יחדיו.",,,,,,,,[],"['בקבוק תבערה (בקת""ב)']",[],,,,,,,
"בשלב מסוים בערב הגיע הנאשם 3 למקום המפגש, נאשמים 1-2 ציידו אותו באחד ממכשירי הקשר לצורך תפקידו כתצפיתן.",,,,,,,,,,,,,,,,,
"הנאשמים עטפו את פנס האופניים, שעון האופניים וכתוביות שהיו מודפסות על האופניים, הכל לצורך הסוואה.",,,,,,,,,,,,,,,,,
"בהמשך, בסמוך לשעת חצות, הסיע נאשם 1 את נאשם 3 על האופניים לכיוון שכונת חב""ד, והאחרון התמקם על גשר סמוך.",,,,,,,,,,,,,,,,,
"נאשם 1 שב עם האופניים לבית, שם פגש את נאשם 2 שהמתין לו, השניים הצטיידו בששת בקבוקי התבערה, במכשיר חיתוך, מכשיר קשר, בכפפות לידיים ובמכשיר הדלקת אש, יחדיו רכבו לעבר שכונת חב""ד לביצוע הפיגוע.",,,,,[],,,['מאחר'],"['בקבוק תבערה (בקת""ב)']",[],,,,,,,
"נאשמים 1-2 הגיעו בסמוך לגדר הסמוכה לשכונה וחתכו פתח בגדר כדי להקל על מנוסתם, והמשיכו בדרכם עד לבניין מגורים ברחוב בעל התניא 6 בלוד, ווידאו עם נאשם 3 באמצעות מכשירי הקשר שאין כוחות שיטור באזור, ואז בשעה 00:30 הבעיר הנאשם 1 אש בששת בקבוקי התבערה.",,,,,,,,,"['בקבוק תבערה (בקת""ב)']",[],,,,,,,
"נאשם 1 זרק בקבוק תבערה אחד לעבר פתחי הדירות בבניין המגורים בהן שהו אותה עת אנשים, ונאשם 2 זרק את חמשת בקבוקי התבערה הנוספים שחוברו יחדיו, לעבר מרפסות וחלונות של דירות מגורים בהן שהו אותה עת אנשים.",,,,,,,,,['בקבוק תבערה (מולוטוב)'],[],,,,,,,
בקבוקי התבערה התנפצו על בניין המגורים והחלה שריפה בבניין.,,,,,,,,,['בקבוק תבערה (מולוטוב)'],[],,,,,,,
"הנאשמים 1-2 נמלטו מהמקום באמצעות האופניים, דרך הפתח בגדר, במהלך מנוסתם יצר קשר נאשם 2 עם נאשם 3 באמצעות מכשירי הקשר ושאל האם זיהה כוחות שיטור, אך האחרון לא השיב.",,,,,,,,,,,,,,,,,
כתוצאה מהשריפה נכנס עשן למספר דירות ונגרם נזק לרכוש.,,,,,,,,,,[],,,,,,,
דיירי הבניין נמלטו מדירותיהם וכיבו את השריפה בסיועו של עובר אורח שהגיע למקום באקראי.,,,,,,,,,,,,,,,,,
בגין מעשיהם אלו הורשעו הנאשמים 1 ו-2 בעבירות של מעשה טרור של חבלה בכוונה מחמירה ומעשה טרור של הצתה ונאשם 3 הורשע בסיוע למעשיהם.,,,,,,,,,,,,,,,,,
"על פי עובדות האישום השלישי (נאשמים 1-2 בלבד), ביום 6.7.21 החזיק נאשם 2 במקום מסתור בבית סבו, בסיועו של נאשם 1, אקדח חצי אוטומטי, מחסנית תואמת וארבעה עשר כדורי תחמושת מתאימים.",,,,"['נשק עם מחסנית בהכנס', 'נשק עם כדור בקנה']","['בבית', 'מוסלק - מוסתר']",,,['מאחר'],['אקדח'],,,,,,,,
בגין מעשיהם אלו הורשע נאשם 2 בעבירת החזקת נשק אביזר ותחמושת ונאשם 2 בכך שסייע בידו.,,,,,,,,,,,,,,,,,
"על פי עובדות האישום החמישי (נאשם 3 בלבד), ביום 11.5.21 בשעות הערב, נטל הנאשם 3 חלק בהתפרעות שהתקיימה בסמוך לתחנת המשטרה בעיר לוד, ויידה ארבע אבנים לעבר כוחות ותחנת המשטרה, ממרחק שאינו ידוע.",,,,,,,,,,[],,,,,,,
בגין מעשיו אלו הורשע בעבירות של הפרעה לשוטר בנסיבות מחמירות והתפרעות.,,,,,,,,,,,,,,,,,
"הצדדים הגיעו להסדר טיעון: אשר לנאשם 1, קטין, עתרו במשותף לגזור עליו מאסר בן 36 חודשי מאסר וענישה נלווית; אשר לנאשם 2, עתרו הצדדים לעונש מאסר מוסכם בן 4 שנות מאסר וענישה נלווית הכוללת פיצוי משמעותי וקנס; אשר לנאשם 3, המאשימה טענה לעונש ראוי בן 30 חודשי מאסר, כשההגנה חופשית בטיעוניה.",,,,,,,,,,,,,,,,,
"לצורך השלמת התמונה יצוין כי נאשם 4, שהורשע בעבירת ייצור נשק וקשירת קשר למעשה טרור מסוג פשע, נדון למאסר בן 20 חודשים; נאשם 5 הורשע בעבירת ייצור נשק, נדון למאסר בן 12 חודשים ונאשם 6 שהורשע בעבירות סיוע לייצור נשק והכנה לביצוע מעשה טרור, נדון למאסר בן 20 חודשים.",,,,,,,,,,,,,,,,,
נאשמים 7 ו-8 (קטין) ממתינים לגזר דין.,,,,,,,,,,,,,,,,,
נאשם 1 – [הושמט].,,,,,,,,,,,,,,,,,
נאשם 2 – [הושמט].,,,,,,,,,,,,,,,,,
נאשם 3 – [הושמט].,,,,,,,,,,,,,,,,,
"המאשימה, באמצעות עו""ד תומר שטיינברג, עמדה בטיעוניה בהרחבה על חומרת מעשי הנאשמים, מועד ביצועם במהלך מבצע ""שומר חומות"" ופגיעתם הקשה בשלומו, בטחונו ורכושו של הציבור והתושבים היהודים בעיר לוד, בשלטון החוק ובסדר הציבורי.",,,,,,,,,,,,,,,,,
"ב""כ המאשימה הדגיש בעיקר את חומרת האישום השני, השלכת מספר בקבוקי תבערה לעבר בניין מגורים, במטרה לפגוע בדייריו.",,,,,,,,,"['בקבוק תבערה (בקת""ב)']",[],,,,,,,
לדבריו המעשה בוצע לאחר שנרגעו המהומות ובמטרה להביא להסלמה נוספת.,,,,,,,,,,,,,,,,,
"עוד עמד על התכנון הקפדני והמקיף שביצעו הנאשמים עובר לפיגוע, שכלל סיורים מקדימים, והצטיידות בציוד הכולל מכשירי קשר, ועל הנזק שנגרם.",,,,,,,,,,,,,,,,,
"לדבריו, נאשמים 1 ו-2 הם הרוח החיה בהוצאת הפיגוע לפועל, המתכננים והמבצעים, וההבדלים ברמת הענישה ביניהם נובעים מכך שנאשם 1 קטין ובשל נסיבותיו האישיות המורכבות.",,"['1 : כן', '2 : לא', '3 : לא', '4 : לא', '5 : לא', '6 : לא', '7 : לא', '8 : כן', '9 : לא', '10 : לא', '11 : לא']",,,,,,,,,,,,,,,
נאשם 3 אמנם לא היה מעורב בשלבי תכנון והכנת תכנית הפיגוע אך ביצע פעולות כדי לאפשר את הוצאתה לפועל.,,,,,,,,,,,,,,,,,
עוד הפנה התובע למעורבות נאשם 3 במעשה התפרעות והשלכת אבנים לעבר שוטרים.,,,,,,,,,,,,,,,,,
"אשר לנאשם זה עתרה המאשימה  ביחס לאישום השני למתחם ענישה הנע בין 48-24 חודשי מאסר, ובגין האישום החמישי, בין 24-10 חודשים.",,,,,,,,,,,,,,,,,
"אשר למיקום הנאשם במתחם, הנאשם צעיר, ללא עבר פלילי, הודה בשלב החקירה וחסך זמן שיפוטי ניכר.",,"['1 : כן', '2 : לא', '3 : לא', '4 : לא', '5 : לא', '6 : לא', '7 : כן', '8 : לא', '9 : לא', '10 : לא', '11 : לא']",,,,,,,,,,,,['כן'],,,
נתוניו טובים אך התסקיר בעניינו אינו חיובי.,,,,,,,,,,,,,,,,,
בשל אופי העבירות ושיקולי ההרתעה עתרה לעונש ראוי בן  30 חודשי מאסר וענישה נלווית.,,,,,,,,,,,,,,,,,
המאשימה הגישה אסופת פסיקה לתמיכה בעתירתה העונשית.,,,,,,,,,,,,,,,,,
"ב""כ נאשמים 1 ו-3, עו""ד אהוד בן יהודה, ביקש לאמץ את הסדר הטיעון בנוגע לנאשם 1.",,,,,,,,,,,,,,,,,
אשר לנאשם 3 סבור שחלקו קטן משמעותית ומאפשר להסתפק בענישה בדרך של עבודות שירות.,,,,,,,,,,,,,,,,,
"לטענתו, הנאשם וחבריו לא ביצעו את המעשים מתוך אידיאולוגיה לאומנית אלא מדובר במעשה ללא שיקול דעת של חבורת צעירים ברקע המהומות והמתח ששרר בעיר לוד.",,"['1 : לא', '2 : לא', '3 : לא', '4 : לא', '5 : לא', '6 : לא', '7 : לא', '8 : לא', '9 : לא', '10 : לא', '11 : לא']",,,,[],,,,,,,,,,,
"לדבריו, מאז האירועים חלפו שנתיים, נאשם 3 לא הסתבך שוב, לא היה שותף בתכנון המעשים וחלקו שולי ומתמצה בהשתתפות באחד הסיורים המקדימים ובמהלך האירוע כששימש כתצפיתן.",,"['1 : לא', '2 : לא', '3 : לא', '4 : לא', '5 : לא', '6 : לא', '7 : כן', '8 : לא', '9 : לא', '10 : כן', '11 : לא']",,,,,,,,,,,,,,,
"עוד לטענתו, יש להתחשב בכך שהיה נתון במעצר כ-4 חודשים, והחזרתו לכלא תדרדר את מצבו.",,,,,,,,,,,,,,,,,
"הנאשם הודה במיוחס לו, צעיר, הפנים את חומרת מעשיו וראוי למקמו בתחתית מתחם הענישה.",,"['1 : כן', '2 : לא', '3 : לא', '4 : כן', '5 : לא', '6 : לא', '7 : כן', '8 : לא', '9 : לא', '10 : לא', '11 : לא']",,,,,,,,,,,,['כן'],,,
"ב""כ נאשם 2, עו""ד דרוויש נאשף, ביקש אף הוא לאמץ את הסדר הטיעון.",,,,,,,,,,,,,,,,,
"לדבריו, יש לתת משקל נכבד להודאתו במיוחס לו, למעצרו הממושך ולכך שמדובר במעידה שלא תחזור על עצמה.",,"['1 : לא', '2 : לא', '3 : לא', '4 : כן', '5 : לא', '6 : לא', '7 : לא', '8 : לא', '9 : לא', '10 : כן', '11 : לא']",,,,,,,,,,,,['כן'],,,
דומה שאין צורך להכביר מילים ביחס לחומרתם היתרה של מעשי הנאשמים.,,,,,,,,,,,,,,,,,
"מדובר בתיק חמור שעניינו ביצוע עבירות אלימות וטרור על רקע מבצע ""שומר חומות"", במוקד כתב האישום, תכנון פיגוע נגד יהודים בעיר לוד על רקע גזעני ולאומני.",,,,,,,,,,"['ירי', 'ניסיון לירי', 'זריקת רימון', 'הפעלת מטען']",,,,,,,
לחומרת העבירות כשלעצמה מתווספת הרשעתם בביצוע עבירות טרור בהתאם לחוק המאבק בטרור.,,,,,,,,,,,,,,,,,
"הנאשמים הורשעו בביצוע עבירות אלימות והצתה בנסיבות סעיף 37 לחוק המאבק בטרור, שעניינו החמרת הענישה על מעשים אלו עד כדי כפל העונש הקבוע לאותה עבירה.",,,,,,,,,,,,,,,,,
"כעולה מדברי הסבר לחוק ""בעבירות מסוג זה, יש מקום להדגשה מיוחדת הן של תכלית ההרתעה שבענישה, והן של עקרון הגמול.",,,,,,,,,,,,,,,,,
"זאת - בעיקר נוכח המניע האידיאולוגי שבבסיסן, ההישענות על שיתוף הפעולה האזרחי, וההשפעה והנזק שעבריינות זו גורמת לכלל האוכלוסייה בישראל"" (דברי הסבר להצעת החוק, התשע""ה-2015, ה""ח 949,967 בעמ' 1104).",,"['1 : לא', '2 : לא', '3 : לא', '4 : לא', '5 : לא', '6 : לא', '7 : לא', '8 : לא', '9 : לא', '10 : לא', '11 : לא']",,,,,,,,,,,,,,,
"מעשי הנאשמים פגעו פגיעה קשה ומוחשית בשלומו ובטחונו של הציבור בכלל, ושל ציבור האזרחים היהודים בעיר לוד בפרט, בשלטון החוק ובסדר הציבורי, ופגעו פגיעה אנושה במרקם החיים המשותפים בערים המעורבות, ובזכותו של כל אזרח במדינה לחיות חיים של שקט ובטחון על פי דרכו ואמונותיו.",,,,,,,,,,,,,,,,,
הנאשמים הורשעו כולם במעורבות במעשים מושא האישום השני.,,,,,,,,,,,,,,,,,
"נאשמים 1 ו-2 הורשעו גם בעבירה של החזקת נשק וסיוע לה, במועד מאוחר יותר (אישום שלישי), ונאשם 3 – הורשע גם בהשתתפות בהתפרעות במהלך ימי מבצע ""שומר חומות"" (אישום חמישי).",,,,,,,,,,,,,,,,,
מדובר ב'אירועים' נפרדים אך בהתחשב בהסדר הטיעון ייגזר בעניינם עונש אחד כולל.,,,,,,,,,,,,,,,,,
"בעניינם של נאשמים 1 ו-2 עותרים הצדדים לאמץ את הסדר הטיעון, ובעניינו של נאשם 3, הקשור אליהם בקשר הדוק, טענו הצדדים באופן חופשי.",,,,,,,,,,,,,,,,,
נסיבות מעשי הנאשמים כוללות פנים רבים של חומרה:,,,,,,,,,,,,,,,,,
"העבירות נעברו לאחר תכנון והכנה וכללו תכנית פעולה מאורגנת, ביצוע מספר סיורים מקדמיים בהרכבים שונים של נאשמים, הכנת פתח מילוט בגדר בסמוך למקום האירועים והצטיידות בבקבוקי תבערה, מכשירי קשר וציוד נוסף;",,,,,,,,[],['בקבוק תבערה'],[],,,,,,,
המעשים בוצעו בחבורה תוך חלוקת תפקידים בין הנאשמים השונים.,,,,,,,,,,,,,,,,,
"עם זאת, ובניגוד למקרים אחרים שנדונו בפסיקה, הנאשמים לא היו חברים פעילים בארגון טרור, אלא פעלו על רקע הנסיבות הקונקרטיות של אירועי מבצע ""שומר חומות"" (ראו עניין ראזם).",,,,,,,,,,,,,,,,,
"חלקם של נאשמים 1 ו-2 היה מרכזי, בעוד חלקו היחסי של נאשם 3 היה קטן יותר והתמצה בסיוע בכך שהשתתף בסיור מקדים ושימש במהלך האירוע כתצפיתן כשהוא מצוייד במכשיר קשר.",,,,,,,,,,,,,,,,,
אין מדובר בחלק שולי וזוטר כטענת בא כוחו אך חלקו קטן משמעותית מזה של שותפיו.,,,,,,,,,,,,,,,,,
הנאשם 3 אף לא נטל חלק בשלבי היגוי תכנית הפיגוע;,,,,,,,,,,,,,,,,,
עוד יודגש הסיכון הרב הגלום בהשלכת בקבוקי תבערה בוערים:,,,,,,,,,"['בקבוק תבערה (מוכר גם כבקת""ב או בקבוק תבערה)']",,,,,,,,
נאשמים 1 ו-2 הורשעו גם בעבירה של החזקת נשק.,,,,,,,,,,,,,,,,,
"ביום 6.7.2021  החזיק נאשם 2 במקום מסתור בבית סבו, אקדח חצי אוטומטי ותחמושת מתאימה, כשנאשם 1 סייע בידו.",,,,"['נשק עם מחסנית בהכנס', 'נשק עם כדור בקנה']",['מוסלק - מוסתר'],,,[],['אקדח'],,,,,,,,
"העבירה בוצעה בתקופה מאוחרת לאישום השני, לא נטען לאינדיקציה לשימוש בו לצורך ביצוע עבירה פלילית או ביטחונית.",,,,,,,,,,,,,,,,,
"נאשם 3 הורשע בכך שנטל חלק בהתפרעות בסמוך לתחנת המשטרה בעיר לוד, ויידוי ארבע אבנים לעבר כוחות ותחנת המשטרה, ממרחק שאינו ידוע.",,,,,,,,,,,,,,,,,
"הרקע למעשה דומה, המעשה בוצע ברקע ההתפרעויות שאירעו בחודש מאי 2021, הנאשם נטל חלק פעיל בהתפרעות ויידה אבנים במטרה לפגוע בכוחות הביטחון.",,,,,,,,,,[],,,,,,,
"עיון בפסיקה במקרים דומים, שבהם בוצעו עבירות אלימות במהלך ההתפרעויות בתקופת מבצע ""שומר חומות"" ובמקרים אחרים שבהם בוצעו המעשים על רקע לאומני, מעלה כי, על דרך הכלל, נגזרים על מבצעיהם עונשי מאסר ממושכים.",,,,,,,,,,,,,,,,,
"במקרים שבהם הורשעו נאשמים בביצוע המעשים בנסיבות סעיף 37 לחוק המאבק בטרור, הקובע כפל עונש בגין אותן עבירות, רף הענישה חמור יותר.",,,,,,,,,,,,,,,,,
נאשמים 1 ו-2 –הודו במסגרת הסדר טיעון סגור.,,,,,,,,,,,,,,['כן'],,,
"הנאשמים הם הרוח החיה והמוציאים לפועל של תכנית הפיגוע מושא האישום השני, מדובר במעשים שתוכננו בקפידה במטרה לפגוע בדרכי אלימות וטרור בתושבים יהודים המתגוררים בעיר לוד אך בשל מוצאם.",,,,,,[],,,,,,,,,,,
"הנאשמים צעירים, ללא עבר פלילי, עצורים כשנתיים, לראשונה בחייהם, הודו ונטלו אחריות על מעשיהם.",,"['1 : לא', '2 : לא', '3 : לא', '4 : כן', '5 : לא', '6 : לא', '7 : לא', '8 : לא', '9 : לא', '10 : כן', '11 : לא']",,,,,,,,,,,,['כן'],,,
"מתסקיריהם עולה כי אינם אוחזים בהשקפות גזעניות, ולדבריהם ביצעו את המעשים על רקע המתיחות ששררה באותה תקופה ומתוך תחושות כעס ונקם.",,"['1 : לא', '2 : לא', '3 : לא', '4 : לא', '5 : לא', '6 : לא', '7 : לא', '8 : כן', '9 : לא', '10 : לא', '11 : לא']",,,,,,,,,,,,,,,
"נאשם 1, קטין, ביצע את המעשים כשהוא בן 16.5, נסיבותיו המשפחתיות מורכבות, וטרם מעצרו תואר כתלמיד חיובי שהצליח בלימודים חרף המצוקות הכלכליות והמשפחתיות בהן נתון.",,"['1 : לא', '2 : כן', '3 : לא', '4 : לא', '5 : לא', '6 : לא', '7 : לא', '8 : כן', '9 : לא', '10 : לא', '11 : לא']",,,,,,,,,,,,,,,
"נאשם 2, על גבול הקטינות במועד ביצוע העבירות, נטל אחריות על מעשיו אך צמצם מחומרתם.",,,,,,,,,,,,,,,,,
"חלקם בביצוע העבירות דומה, וההבדל בענישה נובע מכך שנאשם 1 קטין ובשל נסיבותיו האישיות.",,"['1 : כן', '2 : לא', '3 : לא', '4 : לא', '5 : לא', '6 : לא', '7 : לא', '8 : כן', '9 : לא', '10 : לא', '11 : לא']",,,,,,,,,,,,,,,
