text,PUNISHMENT,GENERAL_CIRCUM,CIRCUM_OFFENSE,CIR_STATUS_WEP,CIR_HELD_WAY_WEP,CIR_PURPOSE,CIR_AMMU_AMOUNT_WEP,CIR_OBTAIN_WAY_WEP,CIR_TYPE_WEP,CIR_USE,CIR_PLANNING,RESPO,REGRET,CONFESSION,PUNISHMENT_ACTUAL,PUNISHMENT_SUSPENDED,PUNISHMENT_FINE
"העונשים שאליהם עותרים הצדדים, 3 שנות מאסר לנאשם 1 ו-4 שנות מאסר לנאשם 2 אינם חמורים כלל ואילו נדרשנו לגזור את דינם שלא במסגרת הסדר טיעון יכול שהיו מוטלים על הנאשמים עונשי מאסר חמורים יותר.",,,,,,,,,,,,,,,,,
"עם זאת, לאחר ששמענו את טיעוני הצדדים, ונתנו משקל לנתוני הנאשמים, מצאנו לכבד את הסדר הטיעון.",,,,,,,,,,,,,,,,,
"נאשם 3 - הורשע, במסגרת האישום השני, בסיוע לנאשמים 1-2.",,,,,,,,,,,,,,,,,
"לאחר שבחנו את נסיבות מעשיו, מדיניות הענישה הנוהגת ועונשיהם של נאשמים 1 ו-2, ראינו לקבוע בנוגע לאישום השני, מתחם ענישה שנע בין 16-36 חודשי מאסר.",,,,,,,,,,,,,,,,,
אשר לאישום החמישי – נקבע מתחם ענישה הנע בין 10-24 חודשי מאסר.,,,,,,,,,,,,,,,,,
"הנאשם צעיר, ללא עבר פלילי, הודה והביע חרטה על מעשיו.",,"['1 : לא', '2 : לא', '3 : לא', '4 : כן', '5 : לא', '6 : לא', '7 : כן', '8 : לא', '9 : לא', '10 : לא', '11 : לא']",,,,,,,,,,,,['כן'],,,
"בתסקירו צמצם מחומרת מעשיו, ומסוכנותו הוערכה כבינונית.",,,,,,,,,,,,,,,,,
הנאשם היה עצור בתיק זה כ-4 חודשים ותקופה ממושכת נוספת שהה בתנאים מגבילים.,,,,,,,,,,,,,,,,,
"לאחר ששקלנו את כלל השיקולים ונתנו דעתנו לחומרת מעשי הנאשם 3 ולשיקולי ההרתעה ומנגד לגילו הצעיר, חלקו כמסייע, הודאת הנאשם וחרטתו, ובעיקר ליחס בין עונשו לבין עונשיהם של הנאשמים 1-2, מצאנו להשית על הנאשם עונש מאסר כולל המצוי בתחתית מתחם הענישה, לצד ענישה נלווית.",,"['1 : כן', '2 : לא', '3 : לא', '4 : לא', '5 : לא', '6 : לא', '7 : לא', '8 : לא', '9 : לא', '10 : לא', '11 : לא']",,,,,,,,,,,,['כן'],,,
"אשר לרכיבים הנוספים - כתוצאה ממעשי הנאשמים נגרם נזק משמעותי לתריסים וחלונות דיירי הבניין (מכתבי דיירי הבניין עת/1, עת/2).",,,,,,,,,,,,,,,,,
"לפיכך, יושת על הנאשמים פיצוי לטובת דיירי הבניין עדי תביעה 1-5 והגב' חיה ברון (עת/1) וקנס מתון.",,,,,,,,,,,,,,,,,
מאסר בפועל בן 36 חודשים החל מיום מעצרו 30.6.21.,,,,,,,,,,,,,,,['הנאשם קיבל 36 חודשי מאסר בפועל'],[],[]
"מאסר על תנאי בן 12 חודשים לבל יעבור עבירת אלימות מסוג פשע, עבירת נשק מסוג פשע או כל עבירה על חוק המאבק בטרור במשך 3 שנים מיום שחרורו ממאסר.",,,,,,,,,,,,,,,[],['12 חודשי מאסר על תנאי'],[]
מאסר על תנאי בן 6 חודשים לבל יעבור עבירת אלימות מסוג עוון או עבירת נשק מסוג עוון במשך 3 שנים מיום שחרורו ממאסר.,,,,,,,,,,,,,,,[],['6 חודשים'],[]
"פיצוי בסך 6,000 ₪ שישולם ב-5 תשלומים שווים ורצופים החל מיום 1.7.23 ויועבר באופן שווה לעדי תביעה 1-5 והגב' חיה ברון, בהתאם לפרטים שתמסור המאשימה למזכירות.",,,,,,,,,,,,,,,,,
"קנס בסך 1,500 ₪ או 21 ימי מאסר שישולם עד ליום 1.11.23.",,,,,,,,,,,,,,,[],[],"['1,500 ש""ח']"
מאסר בפועל בן 4 שנים החל מיום מעצרו 30.6.21.,,,,,,,,,,,,,,,"['הנאשם קיבל 4 שנים מאסר בפועל, החל מיום מעצרו ב-30621']",[],[]
"מאסר על תנאי בן 12 חודשים לבל יעבור עבירת אלימות מסוג פשע, עבירת נשק מסוג פשע, או כל עבירה על חוק המאבק בטרור במשך 3 שנים מיום שחרורו ממאסר.",,,,,,,,,,,,,,,[],['12 חודשי מאסר על תנאי'],[]
מאסר בפועל בן 24 חודשים בניכוי ימי מעצרו 6.7.21-3.11.21.,,,,,,,,,,,,,,,"['הנאשם קיבל 24 חודשי מאסר בפועל, בניכוי ימי מעצרו מ-6721 עד 31121 אז, תקופת']",[],[]
"מאסר על תנאי בן 8 חודשים לבל יעבור עבירת אלימות מסוג פשע, עבירת התפרעות או כל עבירה על חוק המאבק בטרור במשך 3 שנים מיום שחרורו ממאסר.",,,,,,,,,,,,,,,[],['8 חודשים'],[]
מאסר על תנאי בן 5 חודשים לבל יעבור עבירת אלימות מסוג עוון או עבירה כנגד שוטרים במשך 3 שנים מיום שחרורו ממאסר.,,,,,,,,,,,,,,,[],['5 חודשים'],[]
"פיצוי בסך 2,500 ₪ שישולם ב-5 תשלומים שווים ורצופים החל מיום 1.7.23 ויועבר באופן שווה לעדי תביעה 1-5, בהתאם לפרטים שתמסור המאשימה למזכירות.",,,,,,,,,,,,,,,,,
"קנס בסך 1,000 ₪ או 14 ימי מאסר תמורתו.",,,,,,,,,,,,,,,[],[],"['1,000 ₪']"
הקנס ישולם עד ליום 1.11.23.,,,,,,,,,,,,,,,,,
להבטחת התייצבותו תעמודנה הערבויות בתיק המעצר.,,,,,,,,,,,,,,,,,
"לאחר התייצבותו למאסר, יוחזרו למפקיד בכפוף לכל הוראה חוקית.",,,,,,,,,,,,,,,,,
זכות ערעור לבית המשפט העליון תוך 45 ימים.,,,,,,,,,,,,,,,,,
"ניתן היום,  ד' אייר תשפ""ג, 25 אפריל 2023, בנוכחות הצדדים.",,,,,,,,,,,,,,,,,
5129371,,,,,,,,,,,,,,,,,
"עמי  קובו, שופט, אב""ד",,,,,,,,,,,,,,,,,
