,verdict,text,part
0,ME-13-09-13822-835,"חוק העונשין, תשל""ז-1977: סע'  144(ב), 186(א)., 329 (א)(1), (א)(2), 333, 335(א)(1), 384, 402(ב)","ע""י ב""כ עו""ד פולינה סורין "
1,ME-13-09-13822-835,"הנאשם, יליד 1962, הורשע על פי הודאתו בגין האישום הראשון בעבירה של גניבה לפי סעיף 384 לחוק העונשין התשל""ז-1977 (להלן: ""חוק העונשין""), ובגין האישום השני – עבירות שוד מזוין לפי סעיף 402(ב) לחוק העונשין; נשיאת נשק לפי סעיף 144(ב) לחוק העונשין; ונשיאת סכין לפי סעיף 186(א).",גזר דין
2,ME-13-09-13822-835,"בגין האישום השלישי הוא הורשע  בביצוע עבירות של שוד מזוין לפי סעיף 402(ב) לחוק העונשין, גרימת חבלה חמורה בנסיבות מחמירות לפי סעיפים 333 ו-335(א)(1) ונשיאת נשק לפי סעיף 144(ב) לחוק העונשין.",גזר דין
3,ME-13-09-13822-835,במסגרת האישום הראשון הודה הנאשם כי בתאריך 26.8.13 בסמוך לשעה 10:00 הוא פרץ לדירת מגורים וגנב מתוכה אקדח מסוג ARCTUS שהיה שייך לחברת אבטחה.,גזר דין
4,ME-13-09-13822-835,באישום השני  הודה הנאשם כי שדד בעל בית מלאכה לתכשיטים בתל-אביב עמו הייתה לו היכרות מוקדמת במסגרת עבודה במקום.,גזר דין
5,ME-13-09-13822-835,על פי עובדות כתב האישום הוא התקשר למתלונן וביקש ממנו סיוע כספי השניים קבעו להיפגש בבית המלאכה.,גזר דין
6,ME-13-09-13822-835,במועד המצוין לעיל בסמוך לשעה 18:30 הגיע הנאשם לבית המלאכה כשהוא מצויד באקדח ובסכין.,גזר דין
7,ME-13-09-13822-835,"הנאשם שוחח עם המתלונן, וחזר על בקשתו, ולאחר שזה סירב להיענות לדרישתו לתת לו 50 ₪, הוא שלף את האקדח ואיים על המתלונן בדרישה כי ימסור לו סכום הכסף המבוקש.",גזר דין
8,ME-13-09-13822-835,"הנאשם שהביא עימו אזיקונים הורה למתלונן לאזוק את עצמו בידיו וברגליו, אך המתלונן לא הצליח לעשות כן.",גזר דין
9,ME-13-09-13822-835,"והנאשם אזק אותו בעצמו, וקשר כבל נוסף סביב רגליו.",גזר דין
10,ME-13-09-13822-835,"המתלונן הצליח להשתחרר, ובין השניים התפתח מאבק במהלכו היכה הנאשם את המתלונן ""...",גזר דין
11,ME-13-09-13822-835,"בין היתר, באמצעות מקלדת, מגירה, וחצובת מצלמה"" כמפורט בסעיף 6ג' לאישום השני, תוך שהוא ממשיך לדרוש ממנו סכומי כסף וזהב.",גזר דין
12,ME-13-09-13822-835,"בהמשך, החל הנאשם לאסוף זהב לתוך שקית מהשולחן שבבית המלאכה, וכשהמתלונן ניסה לברוח מהמקום ירה לעברו שלוש יריות שפגעו בדלת ובחלון.",גזר דין
13,ME-13-09-13822-835,"הנאשם נמלט מהמקום כשברשותו זהב, תכשיטים, יהלומים ואבנים בשווי של כ-10,000$ ו-1,600 ₪ במזומן אותם נטל משולחן בית המלאכה.",גזר דין
14,ME-13-09-13822-835,"כתוצאה ממעשי הנאשם נגרמו למתלונן חבלות באיזור המצח, חתך בקרקפת ובלחיו, נפיחות מתחת לעינו הימנית, וחבלה ביד ימין, כתף שמאל ובגב.",גזר דין
15,ME-13-09-13822-835,האישום השלישי עניינו מעשה שוד דומה שביצע הנאשם בהמשכו של אותו יום בסמוך לשעה 12.00 ברמת-גן כלפי בעל עסק לתכשיטים ויהלומים אשר העסיק אותו בעבר.,גזר דין
16,ME-13-09-13822-835,"הנאשם הגיע לעסק ברמת גן לאחר האירוע המתואר באישום השני, ושוחח עם המתלונן במשרדו.",גזר דין
17,ME-13-09-13822-835,הוא איים על המתלונן ודרש ממנו למסור לו יהלומים ותכשיטים.,גזר דין
18,ME-13-09-13822-835,המתלונן החל לברוח והנאשם בא בעקבותיו.,גזר דין
19,ME-13-09-13822-835,כשהמתלונן ניסה לסגור את דלת המשרד ירה הנאשם קליע שחדר את הדלת ופגע בבטנו של המתלונן.,גזר דין
20,ME-13-09-13822-835,"בעוד המתלונן שרוע מדמם על רצפת המשרד דרש הנאשם באיומי אקדח מאשתו של המתלונן שנכחה במקום, שתמסור לידיו יהלומים, והיא נענתה לדרישתו.",גזר דין
21,ME-13-09-13822-835,"הנאשם נמלט מהמקום כשהוא מורה למתלוננת ללוותו לכיוון היציאה כשבידו יהלומים רבים בשווי של כ-40,000 ₪.",גזר דין
22,ME-13-09-13822-835,כתוצאה ממעשי הנאשם נגרם למתלונן קרע נרחב בדופן בטן ימנית.,גזר דין
23,ME-13-09-13822-835,"ב""כ המאשימה הגיעה להסדר טיעון עם הנאשם ובאת כוחו, ולפיו תוקן כתב האישום, באופן שאחת מהעבירות בהן הורשע - חבלה בכוונה מחמירה לפי סעיף 329 (א)(1) רישא ו- (א)(2) רישא שהעונש בצידה הוא 20 שנות מאסר הומרה לעבירה של חבלה חמורה בנסיבות מחמירות – עבירה לפי סעיף 333 יחד עם סעיף 335(א)(1) לחוק העונשין, שהעונש בצידה 7 שנות מאסר.",גזר דין
24,ME-13-09-13822-835,"ב""כ הצדדים לא הגיעו להסדר טיעון בעניין העונש.",גזר דין
25,ME-13-09-13822-835,ראיות הצדדים לעונש,גזר דין
26,ME-13-09-13822-835,לנאשם עבר פלילי הכולל גניבה והונאה בכרטיס חיוב.,גזר דין
27,ME-13-09-13822-835,"הוא אף הורשע בעבר עפ""י הודאתו בתקיפה חבלנית של בת זוגו וגרימת היזק בזדון בהיותו בגילופין, והוטלה עליו תקופת מאסר בת 9 חודשים.",גזר דין
28,ME-13-09-13822-835,נפגע העבירה באישום השני בתיק דנן פירט את הנזקים החומריים שנגרמו לו עקב פציעתו בראשו וחוסר יכולתו לעבוד במשך חודש ימים.,גזר דין
29,ME-13-09-13822-835,כמו כן תיאר המתלונן את המצוקה הנפשית בה הוא מצוי וכי הוא מקבל כיום טיפול תרופתי ומתקשה להירדם בלילות.,גזר דין
30,ME-13-09-13822-835,לוח הצילומים - ת/4 מתעד את פציעותיו של המתלונן.,גזר דין
31,ME-13-09-13822-835,מטעם ההגנה הוגש סיכום אשפוז מבית החולים וולפסון המלמד על ניסיון אובדני שביצע הנאשם כשבועיים עובר לאירוע נשוא כתב האישום.,גזר דין
32,ME-13-09-13822-835,"ממכתבה של קצינת העצירים בבית המעצר, כלאי רינה תורן עולה, כי הנאשם שובץ לטיפול גמילה בפרוייקט ""בראשית"" בתאריך 2.1.14 והוא מצוי בהליך טיפולי זה.",גזר דין
33,ME-13-09-13822-835,במהלך ההליך השיקומי הביע הנאשם מוטיבציה מילולית לשינוי אורחות חייו והוא אינו מעורב כיום בפעילות שלילית.,גזר דין
34,ME-13-09-13822-835,מטעם ההגנה אף העיד מר רפאל רפי שהינו בעל מפעל תכשיטים  אשר העסיק בעבר את הנאשם  במשך שנתיים ימים.,גזר דין
35,ME-13-09-13822-835,הלה העיד כי הוא מכיר את הנאשם כאדם טוב לב ובעל מקצוע יסודי בעבודתו.,גזר דין
36,ME-13-09-13822-835,העד הביע נכונות לסייע בשיקומו של הנאשם.,גזר דין
37,ME-13-09-13822-835,"טיעוני ב""כ הצדדים",גזר דין
38,ME-13-09-13822-835,"ב""כ המאשימה גורסת כי יש להעמיד את מתחם העונש הראוי למקרה השוד הראשון בין 5 עד 9 שנות מאסר ובמקרה השוד השני בין 6 ל-10 שנות מאסר, וזאת בצד מאסר על תנאי ותשלום פיצוי למתלוננים.",גזר דין
39,ME-13-09-13822-835,"בטיעוניה לעונש הדגישה התובעת את הסיכון שהיה במעשי הנאשם לחיי המתלוננים, את הפגיעות שספגו בגופם  והנזק הכלכלי שנגרם לרכושם.",גזר דין
40,ME-13-09-13822-835,"עוד הדגישה את התכנון שבמעשי הנאשם, אשר הצטייד באקדח ובאזיקונים, השימוש שנקט בכלי נשק חם שכלל ירי כלפי שני המתלוננים כשבמקרה האחד פגע למזלו של המתלונן באישום השני בדלת ובחלון בית המלאכה ובמקרה נשוא האישום השלישי – בבטנו של המתלונן.",גזר דין
41,ME-13-09-13822-835,"ב""כ המאשימה עתרה לענישה מצטברת לשני מעשי השוד, אך ציינה כי היא אינה מבקשת לקבוע מתחם ענישה נפרד לעבירה של גניבת האקדח.",גזר דין
42,ME-13-09-13822-835,"ב""כ הנאשם לעומתה טוענת, כי יש לראות בכל ההתרחשויות נשוא כתב האישום כאירוע אחד, ולקבוע ביחס אליו מתחם ענישה אחיד  אשר עומד לדעתה על תקופה שבין 3 ל-6 שנות מאסר.",גזר דין
43,ME-13-09-13822-835,"ב""כ הנאשם הסבירה שהנאשם עלה לישראל לפני כ-21 שנה, אך הוא הידרדר לחיים של דר רחוב.",גזר דין
44,ME-13-09-13822-835,"מצב זה, לצד מחלת אמו המתגוררת במוסקבה, שידו קצרה מלסייע לה, הביאו לכדי ייאוש, שמצא  ביטויו בניסיון התאבדות.",גזר דין
45,ME-13-09-13822-835,"לאחר שלא זכה להמשך טיפול, נגרר הנאשם לביצוע המעשים נשוא כתב האישום.",גזר דין
46,ME-13-09-13822-835,"עוד לדבריה, הנאשם אמנם אינו מוגדר פסיכוטי, אך מצבו הנפשי לא היה טוב.",גזר דין
47,ME-13-09-13822-835,"היא הדגישה כי הנאשם לא נמלט לאחר המעשים, אלא נמצא שותה בגינה ציבורית.",גזר דין
48,ME-13-09-13822-835,"מהאמור לעיל לדעתה יש להסיק, כי מידת התכנון במעשיו הייתה מוגבלת ביותר.",גזר דין
49,ME-13-09-13822-835,"בנוסף לכך, עם מעצרו ואף בתחילת משפטו הוא הודה במיוחס לו.",גזר דין
50,ME-13-09-13822-835,"ב""כ הנאשם ציינה כי הנאשם הינו צורף שעבד אצל המתלונן שבאישום השלישי הלה גרם לו עוול ופיטר אותו מעבודתו, ואז החלה הידרדרותו המקצועית והנפשית.",גזר דין
51,ME-13-09-13822-835,"לדבריה, הנאשם ידע שיש מצלמות אבטחה במקום והמתלוננים הכירו אותו והוא אף לא הסתיר את פניו.",גזר דין
52,ME-13-09-13822-835,"הנאשם אף לא התכוון לטענתה לפגוע בביטנו של המתלונן, שהרי ירה לכיוון הדלת.",גזר דין
53,ME-13-09-13822-835,התנהגותו לאחר המעשה מצביעים לדעתה על כך שלא פעל מרדיפת בצע.,גזר דין
54,ME-13-09-13822-835,"נוכח ההליך השיקומי שהוא עובר, גמילתו מסמים, והודאתו בביצוע העבירות עתרה ב""כ הנאשם להקלה בעונשו.",גזר דין
55,ME-13-09-13822-835,"הנאשם עצמו הביע את צערו על מעשיו והסביר, שלו היה זוכה לטיפול שנדרש לו לא היה מסתבך בביצועם.",גזר דין
56,ME-13-09-13822-835,"כיום הוא מצוי בפרויקט שיקום, הוא מונה לאחראי קבוצה, וצפוי לעבור לאגף טיפולי.",גזר דין
57,ME-13-09-13822-835,"עסקינן במי שפנה למעסיקיו הקודמים על מנת לקבל מהם תמיכה כספית, הוא הגיע לפגישה עימם  לאחר שהצטייד באקדח ואזיקונים.",גזר דין
58,ME-13-09-13822-835,"משנכזבה תוחלתו לקבל מהם כסף הוא השתמש בנשק, ופצע את המתלונן שבאישום השלישי בירי בבטנו, וחבל במתלונן שבאישום השני באמצעות חפצים שהיו בבית המלאכה.",גזר דין
59,ME-13-09-13822-835,"הנאשם השתמש בנשק גם כלפי המתלונן באישום השני, אך פגע בחלון בבית המלאכה.",גזר דין
60,ME-13-09-13822-835,"למרות שעלה בידי הנאשם לשדוד סכום בלתי מבוטל כבר במעשה השוד הראשון, הוא לא הסתפק בכך, אלא שב והשלים ביצועו של מעשה שוד נוסף.",גזר דין
61,ME-13-09-13822-835,אני מתקשה לקבל איפוא את טענת ההגנה כי הנאשם לא פעל מתוך בצע כסף.,גזר דין
62,ME-13-09-13822-835,הצדדים חלוקים בשאלה אם עסקינן באירוע פלילי אחד או מדובר במספר אירועים.,גזר דין
63,ME-13-09-13822-835,"ההלכה הפסוקה קובעת כי ""זיהוי והפרדה בין אירועים לצורך קביעת מתחם ענישה צריך להיות מוכרע בהתאם למספר קריטריונים: רציפות המעשים, משך הזמן שנמשכו יחדיו וכל אחד בפני עצמו,  הזיקה העניינית ומידת הדמיון שביניהם – כל זאת בהתאם לאופי העבירות והערך המוגן שנפגע"" (תפ""ח 49290-05-12 מדינת ישראל נ' ג'אבר, ניתן ב-26.6.13, פסקה 13).",גזר דין
64,ME-13-09-13822-835,"בענייננו, קיימת סמיכות בזמן בין האירועים, ודמיון בנסיבות האירועים ובסוג הערכים החברתיים שנפגעו.",גזר דין
65,ME-13-09-13822-835,"יחד עם זאת, קיימת הפרדה במקום ביצוע המעשים ובזהות הנפגעים, כאשר כל אחד מהם סבל פגיעה נפרדת.",גזר דין
66,ME-13-09-13822-835,"בנוסף לכך, נפגעה פגיעה נפשית גם אשת המתלונן באישום השלישי שנכחה במקום, כאשר בעת שבעלה דימם לנגד עיניה על הרצפה, היא נדרשה ע""י הנאשם לאסוף עבורו תכשיטים ויהלומים משולחן העבודה.",גזר דין
67,ME-13-09-13822-835,"הנאשם ביצע לאחר תכנון, שוד של בתי עסק בהם עבד, תוך שימוש באקדח, ופגע פיזית במי שהתנגד למעשיו.",גזר דין
68,ME-13-09-13822-835,"הוא נטל רכוש: תכשיטים ויהלומים בסכום בלתי מבוטל, ובאת-כח הנאשם הודתה שלא כל הרכוש הושב.",גזר דין
69,ME-13-09-13822-835,באישום השלישי נקט הנאשם כאמור באיומים כלפי אדם נוסף (אשת המתלונן).,גזר דין
70,ME-13-09-13822-835,במקרה דנן קיימים איפוא מאפיינים גם מחמירים לא רק עקב חומרת הפציעה מקליע האקדח.,גזר דין
71,ME-13-09-13822-835,"בהתאם לפסקי דין אלו, ולנסיבות העניין כפי שפורטו לעיל, אני סבורה שיש להעמיד את מתחם הענישה באישום השני בין 55 ל-70 חודשי מאסר, ואת מתחם הענישה באישום השלישי בין 65 ל-85 חודשי מאסר.",גזר דין
72,ME-13-09-13822-835,נוכח העובדה שהמאשימה ראתה בגניבת האקדח מעין חלק אנטגרלי של תוכנית השוד היא לא בקשה כי יקבע מתחם ענישה נפרד לגניבת האקדח שבאישום הראשון.,גזר דין
73,ME-13-09-13822-835,באשר לנסיבות שאינן קשורות בעבירה.,גזר דין
74,ME-13-09-13822-835,מהראיות עולה שהנאשם היה במצב נפשי וכלכלי רעוע בעת שביצע את המעשים נשוא כתב האישום.,גזר דין
75,ME-13-09-13822-835,"נוכח העובדה, כי הנאשם ירה באקדח כלפי כל אחד מהמתלוננים מספר יריות, ורק בדרך מקרה לא נגרם למי מהם נזק פיזי שיש בו משום סיכון חייו, לפיכך אני סבורה שאין ליתן לנסיבותיו האישיות משקל גבוה מידי.",גזר דין
76,ME-13-09-13822-835,"עם זאת, אין להתעלם מכך שהנאשם הודה, ובכך חסך מקורבנותיו טראומה נוספת של חקירה מעל דוכן העדים.",גזר דין
77,ME-13-09-13822-835,"בנוסף, הנאשם החל בתהליך שיקומי, הוא שובץ לפרוייקט ""בראשית"", והוא מאמין כי בכוחותיו להשלים את התהליך הטיפולי.",גזר דין
78,ME-13-09-13822-835,"אם כן ההקלה בעונשו של הנאשם נוכח הודאתו, והחסכון בהעדת המתלוננים והליך השיקום בו החל תבוא לידי ביטוי בחפיפה  של עונשי המאסר המוטלים על הנאשם.",גזר דין
79,ME-13-09-13822-835,"לאור כל המקובץ לעיל, ולאחר ששקלתי את טיעוני ב""כ הצדדים, אני מטילה על הנאשם את העונשים כדלקמן:",גזר דין
80,ME-13-09-13822-835,בגין גניבת האקדח ומעשה השוד השני אני מטילה על הנאשם עונש של 5.5 שנות מאסר.,גזר דין
81,ME-13-09-13822-835,"בגין העבירות נשוא האישום השלישי אני מטילה עליו עונש של 7 שנות מאסר; אני חופפת חלק מתקופת המאסר שהוטלה על הנאשם בגין האישומים הראשון והשני עם עונש המאסר שהוטל באישום השלישי באופן שהוא ירצה 8 שנות מאסר, החל מיום מעצרו בתאריך 27.8.2013.",גזר דין
82,ME-13-09-13822-835,"12 חודשי מאסר על תנאי, והתנאי הוא שלא יעבור תוך 3 שנים מיום שחרורו ממאסר עבירה מהעבירות בהן הורשע, או כל עבירת רכוש מסוג פשע.",גזר דין
83,ME-13-09-13822-835,"אינני מפעילה את המאסר על תנאי שלטענת התביעה תלוי ועומד נגד הנאשם מהסיבות שנטענו על ידי ב""כ הנאשם.",גזר דין
84,ME-13-09-13822-835,עקב מצבו הכלכלי של הנאשם ותקופת המאסר הממושכת שהוטלה עליו – לא אטיל עליו תשלום פיצוי למתלוננים .,גזר דין
85,ME-13-09-13822-835,הודע לנאשם על זכותו לערער תוך 45 ימים לבית המשפט העליון.,גזר דין
86,ME-13-09-13822-835,"ניתן היום,  ט' אלול תשע""ד, 04 ספטמבר 2014, בנוכחות הצדדים והמתורגמן לשפה הרוסית מר לב קפלונוב.",גזר דין
