,verdict,text,part
101,SH-23-03-1491-44,"את הסכום יש לשלם ישירות לחשבון המרכז לגביית קנסות, אגרות והוצאות ברשות האכיפה והגבייה באחת מהדרכים הבאות:",הארכת המאסרים המותנים 
102,SH-23-03-1491-44,"בכרטיס אשראי – באתר המקוון של רשות האכיפה והגבייה, www.eca.gov.il",הארכת המאסרים המותנים 
103,SH-23-03-1491-44,מוקד שירות טלפוני בשרות עצמי (מרכז גבייה)  – בטלפון 35592* או בטלפון 073-2055000,הארכת המאסרים המותנים 
104,SH-23-03-1491-44,במזומן בכל סניף של בנק הדואר – בהצגת תעודת זהות בלבד (אין צורך בשוברי תשלום).,הארכת המאסרים המותנים 
105,SH-23-03-1491-44,"כסף מזומן שנתפס בסך של 12,370 ₪ לטובת אוצר המדינה.",אני מורה על חילוט כמפורט להלן:
106,SH-23-03-1491-44,"בנסיבות תיק זה ולאור העובדה כי על פי תסקיר שירות המבחן הנאשם נקי מסמים ולאור העובדה כי הנאשם עובר בדיקות שתן שגרתיות לבדיקת שרידי סם, אני נמנעת מפסילה בפועל של רישיון הנהיגה ואולם אני מטילה עונש של פסילה על תנאי לתקופה של 4 חודשים למשך שלוש שנים, והתנאי הוא שהנאשם לא יעבור עבירת סמים ויורשע בה.",אני מורה על חילוט כמפורט להלן:
107,SH-23-03-1491-44,זכות ערעור בתוך 45 יום לבית המשפט המחוזי.,אני מורה על חילוט כמפורט להלן:
108,SH-23-03-1491-44,5129371המוצגים – סמים וכלים להשמיד בחלוף תקופת הערעור.,אני מורה על חילוט כמפורט להלן:
109,SH-23-03-1491-44,54678313המזכירות תשלח את גזר הדין לשירות המבחן ולמשרד הרישוי.,אני מורה על חילוט כמפורט להלן:
110,SH-23-03-1491-44,"ניתן היום,  ב' אב תשפ""ד, 06 אוגוסט 2024, בנוכחות הצדדים.",אני מורה על חילוט כמפורט להלן:
111,SH-23-03-1491-44,סימי פלג קימלוב 54678313,   					
