text,PUNISHMENT,GENERAL_CIRCUM,reject,CIR_TYPE,CIR_AMOUNT,CIR_ROLE,CIR_EQ
"בעניינם של האחרים בתיק צירוף 2 (במ/3) הרי שהנאשמים 2 ו – 3 הורשעו בשתי הזדמנויות למעורבות בעסקאות הסמים אך כאמור בגזר הדין ""נשלחו על ידי אדם נוסף (הנאשם כאן).",0.0024520212,3.092277e-06,0.9999695,9.300262e-06,0.00016048214,0.9640848,0.27858764
כמו כן נאשם 2 גם גידל סמים.,0.0021179686,3.001171e-06,0.99996877,9.689496e-06,0.00012749666,0.943187,0.45407256
נקבע מתחם ענישה שבין 8 חודשי אסר לבין 18 חודשי מאסר ומובן שעניינם שונה מאד מענייננו.,0.0034425159,3.0961428e-06,0.9999702,9.303952e-06,0.00015037112,0.04160348,0.46623775
כמו כן לא ניתן להתעלם מהעובדה שנאשם 2 עבר הליך שיקומי משמעותי.,0.0021787123,3.0447943e-06,0.99996984,9.478356e-06,0.00013364552,0.03797132,0.27633464
בשים לב למכלול העבירות שעבר הנאשם בתיק המוביל (במ/1) אני סבורה כי מתחם העונש ההולם נע בין עונש 12   חודשי מאסר בפועל ברף התחתון לבין עונש של 30 חודשי מאסר ברף העליון.,0.96185416,3.0795782e-06,0.99996877,8.734425e-06,0.00014030862,0.022434402,0.34006035
"באשר לשני תיקי הצירוף בשים לב לריבוי עבירות, המלמדים על סחר בסמים החזקתם, בהינתן כמויות הסם, סוגי הסם, שיטתיות המסחר, נמצא לקבוע מתחם עונש כולל, שנע בין 35   חודשי מאסר בפועל ועד ל -65 חודשי מאסר, לצד ענישה נלווית.",0.15352969,3.0268764e-06,0.99996746,1.7855726e-05,0.0001855135,0.5616433,0.50085723
לא מצאתי שיש לחרוג ממתחם העונש ההולם משיקולי שיקום.,0.002140898,3.0309118e-06,0.999969,9.125217e-06,0.00011723551,0.035500925,0.32920465
באשר לעונשו של הנאשם בתוך מתחם העונש ההולם הרי שלזכותו יש לשקול היעדר עבר פלילי וכן העובדה כי הודה וחסך את עדותם של העדים בכל התיקים בהם הורשע.,0.0015941558,0.99999464,0.9999697,9.628462e-06,0.00015512432,0.038022865,0.26265004
כמו כן נתתי דעתי לאמור בתסקיר שירות המבחן ביחס לנסיבותיו המשפחתיות של הנאשם.,0.0022221177,0.9999939,0.9999697,9.33506e-06,0.00013354488,0.040308073,0.23299642
לא נעלמו מעיני נסיבותיו המשפחתיות כעולה מדברי עדי האופי ולא נעלמה מעיני העובדה כי לנאשם בת קטינה  - נערה.,0.0025035203,0.9999945,6.8799754e-06,8.929045e-06,0.00014610842,0.04371657,0.32450736
כמו כן לזכותו של הנאשם יש לתת משקל  לעובדה שהנאשם היה עצור תקופה ממושכת.,0.0018688198,3.703497e-06,0.9999691,9.25549e-06,0.00014389484,0.049525563,0.38081002
"לחובתו של הנאשם יש לשקול שיקולי הרתעה בתוך מתחם העונש ההולם נוכח הסיכון המשמעותי להישנות עבירות, והעובדה שלמרות שהנאשם נעדר עבר פלילי הרי שצבר העבירות מלמד על כך שסחר בסמים הפך להיות חלק מחייו של הנאשם וחלק משמעותי משגרת יומו לפחות בתקופה בה עבר את העבירות מושא כתבי האישום.",0.0024258397,0.9999945,6.8608438e-06,1.09579705e-05,0.00016063754,0.3713234,0.43494377
לא ניתן להתעלם מהאמור בתסקיר שירות המבחן.,0.0032830734,2.9920604e-06,0.9999685,9.494169e-06,0.0001169208,0.056919113,0.25263312
הנאשם נטל אחריות פורמאלית בלבד והציג עצמו בעמדה קורבנית וכן העובדה שיש סיכון להישנות עבירות.,0.0017959652,3.1877232e-06,6.8266836e-06,9.527929e-06,0.00014273285,0.030029686,0.28745174
נוכח כל האמור במכלול השיקולים לקולא ולחומרא אני גוזרת על הנאשם את העונשים הבאים :,0.49751955,3.1081954e-06,0.9999697,8.7346925e-06,0.00012679663,0.03423851,0.32572797
בגין התיק המוביל לגביו קבעתי כי מדובר באירוע אחד  אני גוזרת על הנאשם עונש של 14 חודשי מאסר בפועל.,0.9976598,3.0948233e-06,6.9576367e-06,9.05854e-06,0.00013895932,0.040631842,0.40042764
בגין שני תיקי הצירוף לגביהם קבעתי כי מדובר באירוע אחד אני גוזרת 40 חודשי מאסר בפועל במצטבר לעונש שהוטל על הנאשם בגין התיק המוביל .,0.997718,3.095635e-06,6.9022217e-06,9.312643e-06,0.00015094837,0.04091095,0.4106519
סך הכל ירצה הנאשם עונש כולל של 54 חודשי מאסר בפועל בניכוי ימי מעצרו מיום 4.1.21 ועד ליום 12.4.21  וכן מיום 16.11.22  ועד מועד מתן גזר הדין.,0.9974082,3.0756628e-06,6.935887e-06,8.876323e-06,0.00014039066,0.03366953,0.36275417
8 חודשי מאסר על תנאי מיום שחרורו של הנאשם והתנאי הוא שלא יעבור כל עבירת סמים מסוג פשע ויורשע בה.,0.9976156,3.101341e-06,6.839e-06,8.989419e-06,0.00012632259,0.029907217,0.5526517
אני פוסלת את הנאשם מלהחזיק או לקבל רישיון נהיגה לתקופה של 12 חודשים וזאת מיום שחרורו.,0.99663514,3.1237548e-06,0.99997044,8.816288e-06,0.00013071569,0.028954407,0.3662873
אני מורה על חילוט הכספים שנתפסו בתיק זה כמפורט בכתב האישום המתוקן ביחס לתיק המוביל וזאת בהתאם לסעיף 36א ((א) אציין כי המאשימה למרות שהיה מתבקש לעשות כן לא ביקשה להכריז על הנאשם סוחר סמים בשום שלב מאז הכרעת הדין.,0.991059,3.0728338e-06,0.99996984,9.478139e-06,0.00016216682,0.07372603,0.47903237
באשר לרכב שנתפס ואשר שימש לביצוע העבירות המתייחסות לתיק מוביל אני מורה על חילוט הרכב התפוס מסוג רנו  כמפורט בתיק המוביל .,0.99306715,3.031785e-06,0.9999697,1.4160567e-05,0.00015681553,0.30694652,0.6410796
"אני מחייבת את הנאשם בקנס כספי בסכום של 8,000 ₪ או חודש מאסר תמורתו.",0.9977235,3.142978e-06,6.91e-06,8.71351e-06,0.000116373216,0.038317613,0.36329344
הקנס ישולם עד ליום 1.7.24.,0.0070407186,3.0209214e-06,0.9999691,9.085976e-06,0.0001267432,0.05239165,0.5054379
"את הסכום יש לשלם ישירות לחשבון המרכז לגביית קנסות, אגרות והוצאות ברשות האכיפה והגבייה באחת מהדרכים הבאות:",0.0024001584,3.0247613e-06,0.9999701,9.469683e-06,0.00015432952,0.059585296,0.48522237
54678313הסמים יושמדו בתום תקופת הערעור.,0.0015599056,3.069038e-06,0.9999696,9.325298e-06,0.00013698789,0.056267682,0.5215144
"ניתן היום,  כ""ד אדר ב' תשפ""ד, 03 אפריל 2024, בנוכחות הצדדים.",0.33823082,3.0023562e-06,0.99996996,9.566937e-06,0.00014293539,0.075221606,0.31510246
סימי פלג קימלוב 54678313,0.0009747577,2.9784687e-06,0.9999691,9.138088e-06,0.00020789202,0.117871635,0.6321747
