text,PUNISHMENT,GENERAL_CIRCUM,reject,CIR_TYPE,CIR_AMOUNT,CIR_ROLE,CIR_EQ
אלכסנדר בולייבסקי (עציר),0.00091451744,3.063897e-06,0.99996686,9.177511e-06,0.00014261939,0.0989243,0.40098563
"חוק העונשין, תשל""ז-1977: סע'  29, 31, 40ג, 287(א), 40יג",0.0027690148,3.2103542e-06,0.9999702,8.667281e-06,0.0001342334,0.048553433,0.537405
"פקודת הסמים המסוכנים [נוסח חדש], תשל""ג-1973: סע'  7(א), (ג), 7(ג), 13, 19א, 37א",0.002586436,3.1215868e-06,0.99996996,8.200889e-06,0.00013363748,0.09510881,0.51665145
"הנאשם הורשע על פי הודאתו בעובדות כתב האישום המתוקן בעבירות של הפרת הוראה חוקית – עבירה לפי סעיף 287(א) לחוק העונשין, תשל""ז – 1977 (להלן: ""חוק העונשין""), ועבירה של החזקת סמים שלא לצריכה עצמית – עבירה לפי סעיף 7(א) + 7(ג) רישא לפקודת הסמים המסוכנים (נוסח חדש) תשל""ג – 1973 (להלן: ""פקודת הסמים"").",0.03743409,3.090184e-06,0.9999684,1.0331321e-05,0.0001657294,0.8826097,0.507309
"על פי עובדות החלק הכללי של כתב האישום המתוקן ביום 20.10.22 במסגרת הליך מ""ת 40405-01-21 (שלום חיפה) שוחרר הנאשם ממעצר בפיקוח אלקטרוני בידי כבוד השופטת מריה בוגדנוב פיקוס והושתו עליו תנאים מגבילים של מעצר בית מלא בעמותת ""בית חם "" בקריית אתא תחת פיקוח אחד מעובדי המקום והותר לו לצאת ממקום הפיקוח מידי יום בין השעות 10:00-12:00 וכן בין השעות 16:00-18:00 (להלן: ""ההוראה החוקית"").",0.0036406314,3.0553533e-06,0.9999683,1.1579503e-05,0.00017834798,0.03779317,0.37473708
ביום 19.10.22 רכש הנאשם ממר לוקה צ'האידזה רכב תוצרת רנו.,0.0024666286,3.0969343e-06,0.99996734,0.755594,0.00015588557,0.70192444,0.44272986
"ביום 21.10.22 בסמוך לשעה 23:08 ברחוב שדרות הבנים 3 בקרית ביאליק נסע הנאשם ברכב ומשהבחין בניידת משטרה מסומנת, נסע קדימה ואחורה בניגוד לתנאי הדרך עד שנכנס לחניה במקום.",0.002433319,3.0667093e-06,0.99996984,1.0596572e-05,0.00018005323,0.806653,0.60186803
"לאור האמור ניגשה השוטרת מוריה סדון (להלן: ""השוטרת"") לנאשם ומשזיהתה את הנאשם, ביקשה ממנו להמתיק במקום, ניצל הנאשם את ההזדמנות ונמלט מהמקום.",0.0023210945,3.0184476e-06,0.99996984,9.784565e-06,0.00018195408,0.59290427,0.37476954
"באותן נסיבות, החזיק הנאשם ברכב בסמים מסוכנים כמפורט להלן:",0.0021535761,3.039561e-06,0.99996936,9.891728e-06,0.00014270675,0.9667804,0.429728
41 טבליות MDMA ;,0.0018162283,3.1004508e-06,6.895346e-06,0.99995863,0.99997723,0.12518641,0.52944887
3 אריזות פלסטיק המכילות MDMA במשקל כולל נטו של 2.5668 גרם;,0.0016873762,3.1458958e-06,6.813103e-06,0.99995995,0.9999807,0.07128677,0.657376
5 יחידות קוקאין במשקל כולל נטו 2.6544 גרם;,0.0017284557,3.1184684e-06,6.8297377e-06,0.99995995,0.99998057,0.054035023,0.58229595
2 יחידות של METHYLMETHCATHINONE  שהוא נגזרת מבנית של מתקאתינון הכלול בפקודת הסמים במשקל של 1.7509 גרם;,0.0014278385,3.1836644e-06,6.826332e-06,0.9999597,0.9999789,0.16199896,0.6393183
2 יחידות  Cocaine  - METHYLMETHCATHINONE במשקל כולל נטו של 1.6586 גרם;,0.0014798407,3.0906617e-06,6.8231298e-06,0.99995923,0.9999808,0.10016701,0.6003388
4 יחידות METHYLMETHCATHINONE שהוא נגזרת מבנית של מתקאתינון הכלול בפקודת הסמים במשקל כולל נטו של 3.3971 גרם;,0.0014043528,3.1874072e-06,6.8191875e-06,0.99995935,0.99997926,0.15580258,0.6283044
יחידה של קטמין במשקל נטו של 0.9801 גרם.,0.0018179062,3.1641712e-06,6.865792e-06,0.99995935,0.99998033,0.1025356,0.60878885
2 יחידות של קטמין ו – MDMA במשקל כולל נטו 1.8598 גרם;,0.0018185896,3.3029626e-06,6.8312816e-06,0.99996006,0.99998105,0.10712287,0.55868745
3 יחידות LSD ;,0.0021769868,3.1517907e-06,6.919219e-06,0.99995565,0.9999782,0.09351385,0.49025857
2 יחידות קנבוס במשקל כולל נטו של 15.70 גרם;,0.0021463314,3.185125e-06,6.8525464e-06,0.9999585,0.9999809,0.065578856,0.6035484
"כמו כן באותו מעמד החזיק הנאשם ברכב במוצגים הנחזים לתרופות מרשם, מסוגים שונים כגון : 8 חפיסות DOCTINEX  , 5 חפיסות NOLVADWX , 4 חפיסות CLOMID, 4 חפיסות ARIMIDEX, 3 חפיסות CARDARINE, 5 חפיסות IBYTAMOREN , 5 בקבוקי זכוכית GOLDEN SARMS,    2 בקבוקי זכוכית LAB PERFORMANCE , בקבוק זכוכית WINSTROL,   SUSTANUN , TREN – N,   BOLODENONE  , TRENBUL, TESTABOL , CLENBUTEROL, STROMBA STANOZOLO.",0.0027839788,2.9143105e-06,6.854416e-06,0.99995637,0.99997556,0.94943684,0.56418407
"זאת ועוד, החזיק הנאשם ברכב מזרק עם 2 מחטים נוספים, 9 ראשי מחטים, כסף מזומן בסך של 1,980, 4 שטרות דולר, משקל אלקטרוני, 86 אריזות קרטון לבקבוקונים, 1,200 בקבוקונים, בקבוקונים ריקים וחפצים אישיים.",0.0025441574,3.0516724e-06,6.856932e-06,0.99995625,0.99997723,0.9154669,0.72859913
"ביום9 15.11.22 בסמוך לשעה 11:00 נעצר הנאשם בידי השוטרים ניסים בן חיים, גל הראל, עידו טורמן  ושחר שלוש בחדר בבית מלון ""צוקי ים"" בנתניה.",0.003325399,3.0761469e-06,0.99996984,9.496867e-06,0.00017992502,0.32876745,0.43210953
"באותן נסיבות החזיק הנאשם על שולחן הטלוויזיה בחדר המלון, 2 יחידות סם מסוכן מסוג METHYLMETHCATHINONE , יחידה אחת במשקל נטו של 0.8271 גרם ויחידה השניב במשקל של 0.6653 גרם.",0.0022379626,3.1495942e-06,6.79885e-06,0.9999602,0.9999788,0.9605564,0.6173045
"במהלך חודש מאי 2022 במועד המדויק אינו בידיעת המאשימה, עזב הנאשם את מקום המעצר הבית ובכך הפר את ההוראה החוקית.",0.0022119686,3.105061e-06,0.99996996,1.01177675e-05,0.00015493331,0.30425468,0.5388378
הנאשם הופנה לקבלת תסקיר של שירות המבחן לאחר הרשעתו.,0.0020297254,3.0556505e-06,0.999969,9.831886e-06,0.000120854136,0.03982771,0.31339544
ביום 28.1.24 הנאשם הודה וצירף שני תיקים נוספים והוסכם כי הפרקליטות היא שתטען לעונש בתיק זה.,0.0022859417,3.0795047e-06,0.9999703,8.640047e-06,0.00014078157,0.041012604,0.28212658
הנאשם הורשע על פי הודעתו בכתב האישום המתוקן (הכולל את הנאשם (נאשם 1) ונאשם נוסף (נאשם 2)) כמפורט להלן:,0.0019817047,3.1172851e-06,7.2662842e-06,8.63807e-06,0.0001301122,0.072770156,0.2135388
"על פי עובדות החלק הכללי במהלך האירועים מושא כתב האישום שימש יבגני אדמובסקי כסוכן משטרתי סמוי לשם ביצוע עסקאות סמים עם הנאשם 1 ואחרים (להלן: ""הסוכן"").",0.0022026435,3.0235037e-06,0.9999691,1.2569803e-05,0.00016809053,0.9739377,0.29249114
במסגרת זו פעל הסוכן באופן חשאי לשם איסוף ראיות ומידע כנגד עבריינים.,0.0020551437,3.0192796e-06,0.99996924,9.190877e-06,0.00013779502,0.94367516,0.33303672
הנאשם 2 בכתב האישום הוא בעליו של רכב מסוג סקודה אוקטביה וקיימת היכרות בינו לבין הנאשם.,0.0022112075,3.065206e-06,0.9999689,1.4850103e-05,0.00015070071,0.74789923,0.2193351
"על פי עובדות האישום הראשון ביום 14.7.20 סמוך לשעה 17:10 סיכמו ביניהם הנאשם 1 והסוכן כי הנאשם 1 ימסור לסוכן 10 גרם קוקאין בתמורה ל – 5,000 ₪.",0.002824682,3.107656e-06,6.849469e-06,0.999961,0.9999778,0.08063456,0.43664998
בהמשך לסיכום זה הגיע באותו הערב הסוכן לביתו של נאשם 1 בכרמיאל שם ישב עמו בחצר הבית וכן התאמן בחדר הכושר הנמצא בביתו.,0.0025699167,2.9923058e-06,0.99996924,8.850372e-06,0.0001567245,0.65621865,0.56202155
"בהתאם לתיאום מוקדם בין הנאשם 1 לאדם שזהותו אינה ידועה למאשימה כי הנאשם 1 יסייע לאחר למכור לסוכן קוקאין, סמוך לשעה 20:20 הגיע האחר ברכב אל סמוך לבית כשברשותו סם מסוכן מסוג קוקאין במשקל של 9.15 גרם, המחולק ל – 11 מנות.",0.00260947,3.0709e-06,6.834631e-06,0.9999615,0.9999738,0.9405611,0.5174031
"בהגיעו של האחר למקום יצא הנאשם 1 מהבית, פגש באחר וזה מסר לו את הסמים.",0.0028579715,3.0938702e-06,0.99996984,9.2660175e-06,0.00015991862,0.9373788,0.60119826
"הנאשם 1 נכנס חזרה לבית כשהסמים ברשותו, מסר אותם לסוכן וקיבל ממנו תמורתם סך של 5,000 ₪.",0.002719283,3.1161971e-06,6.885358e-06,1.0226903e-05,0.0003169118,0.7050112,0.59386444
"מיד לאחר מכן, ניגש הסוכן לרכבו כשהסמים ברשותו ועזב את המקום, כשבמקביל ניגש הנאשם 1 לרכב בו המתין האחר ומסר לו סכום כסף שאינו7 ידוע במדויק למאשימה בתמורה לסמים שהעביר לו קודם לכן.",0.0025372053,3.0293572e-06,7.6013566e-06,3.791983e-05,0.00021423248,0.95715183,0.5821391
בגין אישום זה הורשע הנאשם בעבירה של סיוע לסחר בסם מסוכן – עבירה לפי סעיף 13 וסעיף 19א לפקודת הסמים המסוכנים + סעיף 31 לחוק העונשין.,0.9514705,3.1102652e-06,0.9999702,9.049422e-06,0.00014074022,0.88852775,0.5557279
"על פי עובדות האישום השני, ביום 21.7.20 סמוך לשעה 17:55 סיכמו ביניהם הנאשם 1 והסוכן כי הנאשם 1 ימסור לסוכן 16 גרם קוקאין וקופסא של תוסף תזונה מסוג קריאטין בתמורה  ל – 8,000 ₪.",0.0028194608,3.0867702e-06,6.8251084e-06,0.9999604,0.9999782,0.09722303,0.4483267
בתוך כך הסביר הנאשם 1 לסוכן כי יוכל לערבבם באופן שיגדיל את כמות הסם וכך יוכל הסוכן לקבל סכום כסף גדול יותר במכירתם.,0.0019783783,3.0561575e-06,0.99996996,1.1446695e-05,0.00017007727,0.5870306,0.4391143
"בהמשך לסיכום זה, הגיע באותו הערב הסוכן לביתו של נאשם 1 והתאמן בחדר הכושר.",0.0025419018,2.990132e-06,0.99996936,8.602359e-06,0.00014166899,0.42776355,0.26644903
"בהתאם לתיאום מוקדם בין הנאשמים, סמוך לשעה 20:30 הגיע הנאשם 2 ברכב אל סמוך לבית כשברשותו סם מסוג קוקאין במשקל של 14.01 גרם.",0.0023675403,3.0691142e-06,6.8378645e-06,0.9999603,0.9999752,0.95084697,0.5716052
"בהגיע נאשם 2 למקום יצא הנאשם 1 מהבית, פגש בנאשם 2 וזה מסר לו את הסמים.",0.002948061,3.0450763e-06,0.99996996,8.957873e-06,0.0001540631,0.85237986,0.44449475
"הנאשם 1 נכנס בחזרה לבית כשהסמים ברשותו, מסר אותם לסוכן וקיבל ממנו תמורתם סך של 8,000 ₪.",0.0026287169,3.1023912e-06,6.8846093e-06,1.0205196e-05,0.0003425724,0.74584305,0.5957156
מיד לאחר מכן ניגש הסוכן לרכבו כשהסמים ברשותו ועזב את המקום כשבמקביל ניגש הנאשם 1 לרכב בו המתין נאשם 2 ומסר לו סכום כסף שאינו ידוע למאשימה בתמורה לסמים שהעביר לו קודם לכן.,0.0022609346,3.0117797e-06,7.4793784e-06,1.2300239e-05,0.00019186037,0.94315964,0.5807963
בגין אישום זה הורשע הנאשם בעבירה של סחר בסם מסוכן – עבירה לפי סעיף 13 וסעיף 19א לפקודת הסמים המסוכנים + סעיף 29 לחוק העונשין.,0.9249201,3.106296e-06,0.9999702,8.957669e-06,0.00014143414,0.8526326,0.5814983
"על פי עובדות אישום זה ביום 11.8.20 סמוך לשעה 17:44 סיכמו ביניהם הנאשם 1 והסוכן כי הנאשם 1 ימסור לסוכן 45 גרם קוקאין בתמורה ל – 20,000 ₪.",0.0027669591,3.108649e-06,6.8561867e-06,0.99996114,0.9999783,0.085657835,0.44505075
"בהמשך לסיכום זה הגיע באותו ערב הסוכן לביתו של נאשם 1 ומסר לו 20,000 ₪ עבור הסמים והמתין במקום.",0.0025464105,3.024617e-06,6.9240637e-06,8.906619e-06,0.00016476307,0.8286811,0.49180534
בהתאם לתיאום מוקדם בין הנאשם 1 לבין אדם אחר סמוך לשעה 20:20 הגיע האחר אל מוסך לבית כשברשותו סם מסוג קוקאין במשקל של 45.98 גרם.,0.0021471444,3.1311338e-06,6.8334125e-06,0.99996054,0.9999753,0.95548666,0.6123464
"בהגיע האחר למקום, יצא הנאשם 1 מהבית פגש באחר אשר מסר לו את הסמים ובתמורה מסר לו הנאשם 1 סכום כסף שאינו במדויק למאשימה.",0.002814202,3.0999897e-06,6.9753746e-06,1.0070485e-05,0.00017873851,0.90767676,0.577757
הנאשם 1 נכנס בחזרה לבית ומסר לסוכן את הסמים.,0.0022480153,3.0482113e-06,7.107513e-06,8.955704e-06,0.00014449721,0.86691827,0.3970993
בגין אישום זה הורשע הנאשם בעבירה של סחר בסם מסוכן – עבירה לפי סעיף 13 וסעיף 19א לפקודת הסמים וכן עבירה של החזקת סמים שלא לצריכה עצמית – עבירה לפי סעיף 7(א) + (ג) רישא לפקודת הסמים.,0.9388994,3.1054076e-06,6.821777e-06,9.232887e-06,0.00015345526,0.9455138,0.5400194
"על פי עובדות אישום זה ביום 14.9.20 סמוך לאחר השעה 17:00 סיכמו ביניהם הנאשם 1 והסוכן כי הנאשם 1 ימסור לסוכן 20 גרם קוקאין בתמורה ל – 9,000 ₪.",0.0028274972,3.094891e-06,6.8623426e-06,0.9999609,0.99997747,0.11129418,0.47099003
"בהמשך לסיכום, הגיע באותו הערב הסוכן לביתו של הנאשם 1.",0.0026542787,3.0359338e-06,0.9999691,8.77589e-06,0.00013540867,0.106417544,0.278051
"בהתאם לתיאום מוקדם בין הנאשמים, סמוך לשעה 20:35 הגיע הנאשם 2 ברכב אל סמוך לבית כשברשותו סם מסוג קוקאין במשקל של 20.12 גרם.",0.0022588635,3.0753138e-06,6.835218e-06,0.99996006,0.9999753,0.95329237,0.59493023
"בהגיע נאשם 2 למקום, יצא הנאשם 1 מהבית פגש בנאשם 2 וזה מסר לו את הסמים.",0.0028302681,3.0628044e-06,0.99996996,8.9908945e-06,0.00015503705,0.84591824,0.45391175
"הנאשם 1 נכנס בחזרה לבית כשהסמים ברשותו, מסר את הסמים לסוכן וקיבל ממנו תמורתם סך של 9,000 ₪.",0.0025188003,3.0834663e-06,6.8897457e-06,9.95113e-06,0.00024321987,0.90820104,0.6644632
"מיד לאחר מכן, ניגש הסוכן8 לרכבו כשהסמים ברשותו ועזב את המקום, כשבמקביל ניגש הנאשם 1 לרכב בו המתין הנאשם 2 ומסר לו סכום כסף שאינו ידוע במדויק למאשימה בתמורה לסמים שהעביר לו קודם לכן.",0.0026088543,3.0244269e-06,8.48937e-06,1.7796092e-05,0.00019829231,0.95277375,0.52153265
בגין אישום זה הורשע הנאשם בעבירה של סחר בסם מסוכן – עבירה על פי סעיף 13 וסעיף 19א לפקודת הסמים + סעיף 29 לחוק העונשין.,0.6087206,3.1106124e-06,0.9999703,8.987961e-06,0.00014287938,0.7513503,0.5581516
על פי עובדות אישום זה ביום 19.10.20 סמוך לשעה 18:30 הגיע הסוכן לביתו של הנאשם 1.,0.0026536274,3.0926724e-06,0.99996996,8.581252e-06,0.00015064467,0.7221409,0.429041
"אותה העת סיכמו ביניהם הנאשם 1 והסוכן כי הנאשם 1 ימסור לסוכן קוקאין בתמורה ל – 15,000 ₪.",0.0025896735,3.0796605e-06,6.8652294e-06,0.9999609,0.00090389326,0.06970024,0.3336326
"בהמשך לסיכום זה, בחלוף כשעתיים מסר הסוכן לנאשם 1 15,000 ₪ עבור הסמים והנאשם 1 מסר לסוכן סם מסוכן מסוג קוקאין במשקל של 32.94 גרם בתמורה.",0.002048694,3.0640897e-06,6.8521476e-06,0.999961,0.9999765,0.38022685,0.45490825
בגין אישום זה הורשע הנאשם בעבירה של סחר בסם מסוכן – עבירה לפי סעיף 13 וסעיף 19א לפקודת הסמים וכן עבירה של החזקת סמים שלא לצריכה עצמית – עבירה לפי סעיף 7(א) + 7(ג) רישא לפקודת הסמים.,0.93097657,3.098252e-06,6.8255513e-06,9.201647e-06,0.00015241113,0.9464856,0.5440793
הנאשם הודה וצירף כתב אישום מתוקן נוסף והורשע על פיו כדלקמן:,0.0015296217,3.0946255e-06,0.9999696,8.91771e-06,0.00012539154,0.024834331,0.1453025
"על פי עובדות החלק הכללי היה יבגני אדומבסקי שוטר (להלן:"" הסוכן "") ובמועדים הרלוונטיים לכתב האישום פעל בשליחות משטרת ישראל ורכש בהוראתה, באישורה ובכספה כלי נשק, תחמושת וסמים.",0.002607242,3.0713422e-06,0.9999633,0.9973667,0.00019453601,0.97730017,0.37832722
בתקופה הרלוונטית התגורר הנאשם ברחוב הפרחים בכרמיאל ועבד כמאמן כושר בחדר הממוקם בביתו.,0.0020180629,0.99999464,6.870495e-06,9.249931e-06,0.00014245833,0.59324634,0.3375778
במסגרת פעילותו נהג הסוכן להתאמן בחדר ה כושר של נאשם 1.,0.0020264278,0.9999944,0.9999682,8.688476e-06,0.00014134584,0.92933553,0.22794752
בכתב האישום בתיק צירוף זה הנאשם הוא נאשם מספר 1 יחד עם נאשמים 2 ו – 3 .,0.0023161971,3.1512977e-06,0.9999702,8.594307e-06,0.00012927286,0.6536307,0.18758564
על פי עובדות אישום זה ביום 17.6.20 בשעה 12:00 או בסמוך לכך התאמן הסוכן בחדר הכושר.,0.006864665,3.0834572e-06,0.9999701,8.8771185e-06,0.00015039995,0.7023467,0.4846821
ביום 17.6.20 בשעה 12:00 או בסמוך לכך התאמן הסוכן בחדר הכושר.,0.002960963,3.0868027e-06,0.9999701,9.334811e-06,0.00014870385,0.0768726,0.41108832
"בסיום האימון במהלך שיחת חולין בין הנאשם 1 לסוכן, הציע נאשם 1 לסוכן לקנות קפסולות של סם מסוכן מסוג אמפטמין (להלן : קפסולות הסם"") אשר יסופק על ידי הנאשמים 2 ו – 3 בסיועו של הנאשם 1.",0.0022267383,2.9769808e-06,0.99996924,0.9999579,0.9998517,0.8975399,0.33337867
"נאשם 1 אמר לסוכן כי אפשר להרוויח כסף רב מקנייה של קפסולות סם במחיר הנע בין 20 ל – 30 ₪ לכל קפסולת סם, ומכירתה במחיר הנע בין 50 ל – 60 ₪ והציע כי את הרווח יחלקו ביניהם.",0.002433472,3.115603e-06,6.8209115e-06,0.9999248,0.99995816,0.62074465,0.50746703
בהמשך השיחה הציע נאשם 1 לסוכן לנסוע עוד באותו היום לקריות ולקבל דוגמא של קפסולות הסם מהנאשמים 2 ו – 3 והסוכן השיב כי קיימת היתכנות לכך וכי ישוחחו על הנושא.,0.002345673,2.9980301e-06,0.9999697,1.1164145e-05,0.9440996,0.18256493,0.4501326
"בהמשך בשעה 16:25 או בסמוך לכך שלח הנאשם 1 לסוכן באמצעות אפליקציית ווטסאפ הודעה : ""בקיצור החברה מחכים לך"" ולאחר מכן שלח לו את מספר הטלפון של נאשם 2.",0.0025083406,3.0481299e-06,0.9999697,1.0017514e-05,0.00018386694,0.7146379,0.38991088
הסוכן כתב לנאשם 1 כי יצא אליהם בשעה 18:00.,0.0024313221,3.0716558e-06,0.9999695,9.296245e-06,0.00014528041,0.049619798,0.25124192
"בשעה 17:52 או בסמוך לכך, שוחחו נאשם 2 והסוכן בטלפון ונאשם 2 אמר לסוכן להגיע לפיצוציית ""מיאמי"" בקרית ים על מנת לקבל את קפסולת הסם.",0.002426375,3.0312415e-06,0.99996984,1.1205832e-05,0.00021328556,0.81472635,0.46018583
"בשעה 18:45 או בסמוך לכך, הגיע הסוכן ברכבו לפיצוצייה.",0.0025978805,3.0780602e-06,0.99996996,1.0108817e-05,0.00015600481,0.59201473,0.5393305
הסוכן התקשר לנאשם 2 ואמר כי הגיע למקום.,0.0022240407,3.079587e-06,0.9999689,8.858226e-06,0.0001312589,0.119056664,0.24629246
נאשם 2 אמר לסוכן כי ידבר עם נאשם 3 ויבקש כי יגיע למקום.,0.0020228492,3.0424203e-06,0.9999697,8.858015e-06,0.00013642655,0.08175356,0.23319666
"בהתאם לאמור, התקשר נאשם 2 לנאשם 3 וביקש ממנו להגיע.",0.002432956,3.0454448e-06,0.9999695,8.54941e-06,0.0001273805,0.06318493,0.15580659
"כעבור מספר דקות בעת שהסוכן עמד בפתח הפיצוצייה, הגיע למקום נאשם 3.",0.0021760112,3.0724937e-06,0.99996996,9.069e-06,0.00014120263,0.939211,0.6187148
נאשם 3 לחץ את ידו של הסוכן ומסר לו שקית ניילון ובתוכה 4 קפסולות: 3 קפסולות סם וקפסולה אחת ריקה ואמר לסוכן כי צריך לשתות עם נטילתן הרבה מים.,0.0018678905,3.0806268e-06,0.9999702,0.99993634,0.99997675,0.5835926,0.60861963
נאשם 3 בירר עם הסוכן האם נאשם 1 דיבר איתו לגבי המחיר ועזב את המקום.,0.001955613,3.0152974e-06,0.9999697,9.004776e-06,0.00014269885,0.09521108,0.39997235
בגין אישום זה הורשע הנאשם בעבירה של סיוע להספקת סם מסוכן – עבירה לפי סעיף 13 וסעיף 19א לפקודת הסמים + סעיף 31 לחוק העונשין.,0.97039056,3.1267232e-06,0.9999702,9.275221e-06,0.00014396523,0.6122328,0.60120857
על פי אישום זה ביום 21.6.20 בשעה 21:25 או בסמוך לכך לאחר שהסוכן סיים אימון בחדר הכושר ישבו הנאשם 1 והסוכן בחצר הבית ושוחחו שיחת חולין.,0.006421239,3.0830868e-06,0.99996984,9.043901e-06,0.0001556006,0.78883463,0.512859
במהלך השיחה סיכמו הנאשם 1 והסוכן כי נאשם 1 ימכור לסוכן 50 קפסולות של סם מסוכן מסוג אמפטמין.,0.0020989866,2.9647695e-06,6.8899035e-06,0.999961,0.99997175,0.09455157,0.34942675
נאשם 1 אמר לסוכן כי מדובר בסם טוב יותר מקוקאין.,0.0017590675,3.0520334e-06,0.99996996,0.9999515,0.00016581223,0.41846094,0.39888296
"בהמשך, בשעה 23:05 או בסמוך לכך, התכתבו נאשם 1 והסוכן באמצעות אפליקציית ווטסאפ וסיכמו כי נאשם 1 ימכור לסוכן 50 קפסולות סם תמורת 2,000 ₪ אשר יסופקו על ידי נאשמים 2 ו – 3 כאשר נאשם 1 ירוויח 500 ₪ מהסך הכולל של העסקה.",0.002887061,3.0121876e-06,6.9111466e-06,0.9999223,0.9999676,0.7410795,0.40320668
"ביום 22.6.20 בשעה 13:00 או בסמוך לכך, הגיע הסוכן ברכבו אל סמוך לבית ופגש בנאשם 1 בחצר הבית.",0.003118607,3.0857373e-06,0.9999702,9.062671e-06,0.00015743596,0.8746289,0.58640873
"באותו מעמד בהתאם לסיכום במסגרת עסקת הסמים מסר הסוכן לנאשם 1 2,000 ₪ בעבור 50 קפסולות סם.",0.002302428,3.0829046e-06,6.878034e-06,0.0016626455,0.99997675,0.3163491,0.5017547
נאשם 1 אמר לסוכן כי נאשמים 2 ו – 3 יביאו לו בערב את קפסולות הסם והסוכן עזב את הבית.,0.002324278,3.015329e-06,0.9999696,9.277512e-06,0.00018377895,0.42651227,0.31950784
"בהמשך, בשעה 16:53 או בסמוך לכך שלח הנאשם 1 לסוכן הודעה קולית באמצעות אפליקציית הווטסאפ ואמר לו להגיע לקריית ים למקום בו בוצעה עסקת הסמים המפורטת באישום ראשון וזאת  לצורך קבלת קפסולות הסם.",0.0023351205,3.0464385e-06,6.9069956e-06,1.0239923e-05,0.00016730206,0.9329471,0.4934739
"בשעה 17:45 או בסמוך לכך הגיע הסוכן לפיצוציית ""מיאמי"" בקרית ים.",0.002601163,3.1192299e-06,0.99996984,1.2405237e-05,0.00021562004,0.4404754,0.4701385
הסוכן יצא מהרכב ופגש בנאשמים 2 ו – 3 אשר המתינו לו בסמוך לפיצוצייה.,0.0028547419,3.031652e-06,0.9999701,9.292618e-06,0.0001680176,0.77337396,0.38568392
נאשם 3 שאל את הסוכן8 מה אנשיו אמרו על הסמים שקיבל ממנו בפעם הקודמת ונאשם 2 אמר שנאשם 1 דיבר איתו על כמות קפסולות הסם שימסרו לסוכן.,0.0021861847,3.0379786e-06,0.99996996,2.2126596e-05,0.0005789241,0.3547084,0.3675739
