text,PUNISHMENT,GENERAL_CIRCUM,CIRCUM_OFFENSE,CIR_STATUS_WEP,CIR_HELD_WAY_WEP,CIR_PURPOSE,CIR_AMMU_AMOUNT_WEP,CIR_OBTAIN_WAY_WEP,CIR_TYPE_WEP,CIR_USE,CIR_PLANNING,RESPO,REGRET,CONFESSION
הקנס ישולם ב- 30 תשלומים חודשיים שווים ורצופים החל מיום 1.5.2014 ובכל 1 לחודש שלאחר מכן.,0.99998796,5.152539e-06,9.29269e-06,5.2025644e-05,4.567016e-06,7.3334145e-06,1.2598881e-05,3.5725276e-05,1.7380538e-05,1.4884443e-05,0.00059793144,9.635954e-05,0.00027087142,2.8300233e-06
"לא ישולם אחד התשלומים במועדו, תעמוד יתרת הקנס לפירעון מיידי.",0.080414124,5.2491896e-06,9.515017e-06,3.9218445e-05,4.243928e-06,1.0776959e-05,1.2253664e-05,4.0412495e-05,1.810872e-05,2.1899457e-05,0.00064527895,9.969389e-05,0.00027748808,3.2565686e-06
המזכירות תעביר העתק פרוטוקול זה לשירות המבחן למבוגרים ולממונה על עבודות השירות.,6.85278e-05,5.2347973e-06,9.415742e-06,4.9097947e-05,4.34271e-06,6.303714e-06,1.0768289e-05,2.4610677e-05,1.776662e-05,1.5561323e-05,0.000396318,5.977308e-05,0.00022212113,3.6363494e-06
"בסיום הדברים, אני מוצאת להביע הערכה לממונה על עבודות השירות על המאמץ שניכר שהושקע על-מנת לאתר מקום מתאים לנאשם 2 נוכח מוגבלותו הגופנית (אף כי בסופם של דברים, נמנעתי נוכח הסכמת הצדדים מהטלת עונש מסוג זה על הנאשם 2).",1.3693547e-05,0.99997854,9.305123e-06,5.4067255e-05,4.864687e-06,1.5459556e-05,1.0940386e-05,1.979161e-05,1.7769431e-05,1.6049024e-05,0.010554835,0.019857235,0.61132556,3.7730063e-06
"בהסכמת הצדדים, נרשם בזאת כי אין מניעה לכך שגזר-הדין יפורסם ברבים.",1.5547723e-05,5.2200908e-06,9.624027e-06,3.7936796e-05,4.043083e-06,1.0378624e-05,1.0054419e-05,1.905158e-05,1.8742843e-05,1.9294284e-05,0.00033767213,6.739241e-05,0.00029473956,3.1642496e-06
זכות ערעור לבית-המשפט המחוזי בתוך 45 ימים מהיום.,1.5057453e-05,5.313035e-06,9.342647e-06,4.780736e-05,4.735028e-06,1.012271e-05,8.750576e-06,1.8706738e-05,1.8839111e-05,2.0916987e-05,0.00052417704,5.5218134e-05,0.0001846685,2.7071985e-06
"5129371ניתנה והודעה היום י""ג ניסן תשע""ד, 13/04/2014 במעמד הנוכחים.",0.011676677,5.07924e-06,9.384249e-06,5.9631653e-05,4.54725e-06,6.5283853e-06,7.1891955e-06,2.1687943e-05,1.6664955e-05,1.3772454e-05,0.001168014,5.9162434e-05,0.0004759124,3.3351405e-06
הוקלד על ידי ברוריה כהן,1.4579251e-05,5.6302088e-06,9.593999e-06,5.310318e-05,4.9158e-06,3.4856366e-06,1.6612372e-05,8.9937275e-05,0.0018868706,2.6416928e-05,0.0002988552,4.6409208e-05,0.00031625715,2.6260502e-06
דנה כהן לקח 54678313,1.8359975e-05,5.513082e-06,9.484071e-06,0.00019074843,6.006862e-06,5.796152e-06,9.920816e-05,0.00026648777,4.2239077e-05,2.6184396e-05,0.0003227336,5.783899e-05,0.00041362786,2.5708212e-06
