,verdict,text,part
105,ME-21-11-59488-113,"בבואי לבחון את מדיניות הענישה הנוהגת בעבירות של סחר בנשק, החזקתו, נשיאתו והובלתו שלא כדין, אני רואה לציין קיומו של מנעד ענישה רחב, התלוי מטבע הדברים בנסיבות הייחודיות של כל מקרה, לרבות כמות הנשק, סוגו, נסיבות החזקתו ומאפייניו האישיים של המבצע, ובכלל זה עברו הפלילי וסיכויי שיקומו.",גזר דין
106,ME-21-11-59488-113,"על אף קיומו של מנעד ענישה רחב כאמור, ניכרת בפסיקה מגמת החמרה ברורה בכל הנוגע לעבירות בנשק.",גזר דין
107,ME-21-11-59488-113,"להלן מספר דוגמאות מהפסיקה העוסקת בעבירות של סחר, רכישה והחזקה של כלי נשק:",גזר דין
108,ME-21-11-59488-113,"לסיכום, בשים לב לנסיבות ביצוע העבירות בענייננו, לערכים המוגנים שנפגעו כתוצאה מביצוען ומידת הפגיעה בהם, ובהתחשב במדיניות הענישה הנוהגת במקרים דומים, אני קובע כי מתחם העונש ההולם נע בין 2.5 ל-5 שנות מאסר.",גזר דין
109,ME-21-11-59488-113,הנסיבות שאינן קשורות בביצוע העבירות,גזר דין
110,ME-21-11-59488-113,"בנסיבות שאינן קשורות בביצוע העבירות ראיתי להביא בחשבון את הודאתו של הנאשם, שניתנה בתחילתו של ההליך, עוד בטרם החלה שמיעת הראיות בתיק.",גזר דין
111,ME-21-11-59488-113,הודאה זו מגלמת בחובה נטילת אחריות מצדו על מעשיו.,גזר דין
112,ME-21-11-59488-113,"כמו כן, נתתי דעתי לגילו הצעיר של הנאשם, כבן 21 במועד ביצוע העבירות, ולנסיבותיו האישיות כפי שפורטו בתסקיר שירות המבחן.",גזר דין
113,ME-21-11-59488-113,"לצד האמור, הבאתי בחשבון כי חרף גילו הצעיר הספיק הנאשם לצבור לחובתו הרשעה קודמת מלפני זמן לא רב.",גזר דין
114,ME-21-11-59488-113,"אמנם לא מדובר בהרשעה בעבירה מתחום הנשק אלא מתחום הסמים, אך בגין אותה הרשעה ריצה הנאשם 7 חודשי מאסר בעבודות שירות.",גזר דין
115,ME-21-11-59488-113,"בחלוף זמן קצר מעת שסיים את ריצוי עבודות השירות, שב הנאשם והסתבך בעבירות מושא הדיון בענייננו.",גזר דין
116,ME-21-11-59488-113,"בנסיבות, אני סבור כי יש לגזור את עונשו סמוך לרף התחתון של המתחם שנקבע לגביו, אם כי לא בקצהו התחתון.",גזר דין
117,ME-21-11-59488-113,"על יסוד מקבץ האמור, אני גוזר על הנאשם את העונשים הבאים:",גזר דין
118,ME-21-11-59488-113,"א.	36 חודשי מאסר לריצוי בפועל, בניכוי ימי מעצרו החל מיום 9.11.2021.",גזר דין
119,ME-21-11-59488-113,ב.,גזר דין
120,ME-21-11-59488-113,12 חודשי מאסר על תנאי לבל יעבור משך שלוש שנים ממועד שחרורו כל עבירת נשק מסוג פשע ויורשע בגינה.,גזר דין
121,ME-21-11-59488-113,זכות ערעור לבית המשפט העליון תוך 45 ימים.,גזר דין
122,ME-21-11-59488-113,"54678313ניתן היום,  כ""ט תשרי תשפ""ג, 24 אוקטובר 2022, במעמד הנוכחים.",גזר דין
