feature_key,text,extraction
CIR_TYPE_WEP,הנאשם היכה את האח בראשו וגרם לו לחבלה; ובהמשך – בעת שהנאשם החל להימלט רגלית מהזירה – דלק אחד מבניו של המנוח אחר הנאשם והאחרון הניף וכיוון לעברו את האקדח ואז המשיך במנוסתו.,['אקדח']
CIR_TYPE_WEP,"בנסיבות המקרה, ובין היתר בשים לב לכך שהנאשם עשה שימוש באקדח שלא כדין, ולתוצאה הטראגית שנגרמה כתוצאה מביצוע העבירה – מות המנוח, לצד הפגיעה הגופנית במוחמד, מידת הפגיעה בערכים החברתיים גבוהה ביותר.",['אקדח']
CIR_TYPE_WEP,"בתגובה, הנאשם שלף את אקדחו וירה לעבר המנוח 7 כדורים שגרמו למותו.",['אקדח']
CIR_TYPE_WEP,"המנוחה ישבה בפינת האוכל בדירה, הנאשם הלך לחדר השינה, הוציא את אקדחו, חזר לכוון המנוחה, דרך את האקדח, כוונו וירה לעבר ראשה.",['אקדח']
CIR_TYPE_WEP,"נקבע מתחם בין 26 שנות מאסר ועד לעונש של מאסר עולם והעונש נקבע על 29 שנות מאסר (ניהל את ההליך בטענה כי לא כוון את האקדח לעבר אשתו וביקש רק להפחידה; נעדר עבר, הביע חרטה מיד לאחר המעשה).",['אקדח']
CIR_USE,"לאחר מכן, יצא הנאשם מביתו ונכנס לרכבו של כמאל כשהוא נושא עמו את האקדח שהיה טעון בכדורים והשניים נסעו להיפגש עם המנוח.",['ניסיון לירי']
CIR_USE,"בשלב זה, הנאשם יצא מהרכב כשהוא אוחז באקדח, התקרב לעבר החבורה, ובהיותו מרחק מטרים בודדים מהם כיוון את האקדח לעברו של המנוח וירה לעברו 5 יריות לפחות, בכוונה להמיתו.","['ירי', 'ניסיון לירי']"
CIR_USE,היריות שירה הנאשם פגעו במנוח והוא התמוטט במקום.,"['ירי', 'ניסיון לירי']"
CIR_USE,"הקטין א' דלק בעקבות הנאשם אך הנאשם הסתובב לעברו, הניף את האקדח וכיוונו לעבר הקטין א' בכוונה להפחידו ואז המשיך במנוסתו מהמקום.",['ניסיון לירי']
CIR_USE,"גם האופן הקונקרטי שבו הסלים הסכסוך – מעימות מילולי ועד ירי בכוונה להמית, פוגע באופן קשה בערך המוגן של קדושת החיים ומחייב כאמור ענישה של מאסר עולם.",['ירי']
CIR_USE,"אשר לתכנון שקדם לביצוע העבירה והמעשה עצמו, אמנם הנאשם לא תכנן את הרצח בעת יציאתו מהבית עם האקדח (שאז היה להרשיעו ברצח בנסיבות מחמירות), אך אין בעובדה שהכוונה להמית התגבשה באופן ספונטני כדי להמעיט מחומרת המעשים.","['ירי', 'ניסיון לירי']"
CIR_USE,"חלף זאת, הנאשם בחר לרדת מהרכב, ללכת לכיוון המנוח וילדיו וירה לעבר המנוח 5 יריות שגרמו למותו בזמן ששני ילדיו הקטינים היו לידו.","['ירי', 'ניסיון לירי']"
CIR_USE,"זאת ועוד, לאחר הגעת הצדדים למקום המפגש, כמאל - אחיו של הנאשם, הוא זה שיצא את הרכב והיה מעורב בסכסוך אלים עם המנוח ומשפחתו, ורק לאחר מספר דקות ועם הסלמת האירוע, יצא הנאשם מהרכב עם האקדח וירה לעבר המנוח.","['ירי', 'ניסיון לירי']"
CIR_USE,"לגבי נסיבות ביצוע העבירה - על רקע סכסוך קודם (בכתב האישום לא צויין מה הרקע לו, אך לא היה חולק כי לפחות בחלקו הוא על רקע בניה מצד המנוח, שהיה שכנו של הנאשם ואחיו), התפתח זמן קצר לפני האירוע הקטלני ויכוח מילולי בין אחיו של הנאשם (כמאל) לבין המנוח.",['ירי']
CIR_USE,צודקת המאשימה בהפנותה למספר נתונים המהווים נסיבות משמעותיות לחומרה (וכן הביאו להתגבשות עבירת הרצח בכוונה) – יציאת הנאשם מהרכב כשבידו האקדח; ההתקרבות למנוח ובני משפחתו עד כדי מטרים ספורים; הירי של לא פחות מ 5 כדורים לעבר המנוח; ולבסוף – הנתון המרכזי – כי הירי היה בכוונה להמית את המנוח.,"['ירי', 'ניסיון לירי']"
CIR_USE,להשלמת התמונה אפנה לכך כי כתב האישום המתוקן תיאר את ההתרחשות לאחר הירי ובמהלכה זינק אחיו של המנוח על הנאשם וניסה לחלץ ממנו את האקדח.,['ירי']
CIR_USE,הנאשם היכה את האח בראשו וגרם לו לחבלה; ובהמשך – בעת שהנאשם החל להימלט רגלית מהזירה – דלק אחד מבניו של המנוח אחר הנאשם והאחרון הניף וכיוון לעברו את האקדח ואז המשיך במנוסתו.,"['ירי', 'ניסיון לירי']"
CIR_USE,"בנסיבות המקרה, ובין היתר בשים לב לכך שהנאשם עשה שימוש באקדח שלא כדין, ולתוצאה הטראגית שנגרמה כתוצאה מביצוע העבירה – מות המנוח, לצד הפגיעה הגופנית במוחמד, מידת הפגיעה בערכים החברתיים גבוהה ביותר.","['ירי', 'ניסיון לירי']"
CIR_USE,"בתגובה, הנאשם שלף את אקדחו וירה לעבר המנוח 7 כדורים שגרמו למותו.","['ירי', 'ניסיון לירי']"
CIR_USE,"הנאשם, ששירת כשוטר ירה למוות ברעייתו בהמשך לויכוח ביניהם שכלל גם אלימות מצדו כלפיה (היכה אותה בגבה באמצעות מחבת וכן בעט בה).",['ירי']
CIR_USE,"המנוחה ישבה בפינת האוכל בדירה, הנאשם הלך לחדר השינה, הוציא את אקדחו, חזר לכוון המנוחה, דרך את האקדח, כוונו וירה לעבר ראשה.","['ירי', 'ניסיון לירי']"
CONFESSION,"הנאשם הורשע על פי הודייתו במסגרת הסדר טיעון בעבירות רצח, תקיפה חבלנית ועבירות בנשק.",['כן']
CONFESSION,"הנאשם, יליד 1978 ותושב באקה אל גרביה, הורשע על פי הודייתו במסגרת הסדר טיעון בעבירות רצח, לפי סעיף 300(א) לחוק העונשין, התשל""ז –1977 (להלן: החוק); תקיפה חבלנית, לפי סעיף 380 לחוק; ועבירות בנשק, לפי סעיף 144(ב) רישא לחוק.",['כן']
CONFESSION,"ביחס לנסיבות שאינן קשורות בביצוע העבירה, הפנה בא כוח הנאשם להודיית הנאשם בשלב מוקדם יחסית של ההליך - הודיה שמעבר לכך שחסכה בזמן שיפוטי יקר, מגלמת הבעת חרטה כנה על ביצוע המעשים.",['כן']
CONFESSION,"הודגש, כי הודיית הנאשם בעבירת הרצח הבסיסית איננה דבר של מה בכך, בשים לב לעונש המאסר הממושך לו הוא צפוי וכן משום מדובר בעבירה ""חדשה"", שטרם התגבשה לגביה מדיניות ענישה שניתן להעריכה, ולכן אי הודאות וה""סיכון"" מצד הנאשם היו גבוהים.",['לא']
CONFESSION,עוד יש ליתן משקל להודיית הנאשם בשלב מוקדם ולאחר שהתקיימו שתי ישיבות הוכחות.,['לא']
CONFESSION,הנאשם הודה ולקח אחריות על מעשיו.,['כן']
CONFESSION,"הודיית הנאשם אף חסכה זמן שיפוטי ניכר וצודק בא כוחו, כי בנסיבות העניין ובשים לב למהות העבירה בה הודה ואי הבהירות לגבי רמת הענישה, ההודיה אינה דבר של מה בכך.",['כן']
PUNISHMENT_ACTUAL,"* בית המשפט גזר את דינו של נאשם שהורשע בעבירות רצח, תקיפה חבלנית ועבירות בנשק והשית עליו 24 שנות מאסר, 12 חודשי מאסר על תנאי ופיצוי לאלמנת המנוח וילדיו בסכום של 258,000 ₪.",['הנאשם קיבל 24 שנות מאסר']
PUNISHMENT_ACTUAL,"בשקלול כל הנתונים והשיקולים, יש להשית על הנאשם 24 שנות מאסר לריצוי בפועל, 12 חודשי מאסר על תנאי ופיצוי לטובת אלמנת המנוח וילדיו בסכום כולל של 258,000 ₪.",['24 שנים']
PUNISHMENT_ACTUAL,"24 שנות מאסר לריצוי בפועל, החל מיום מעצרו – 22.5.19.",['24 שנות מאסר בפועל']
PUNISHMENT_SUSPENDED,"* בית המשפט גזר את דינו של נאשם שהורשע בעבירות רצח, תקיפה חבלנית ועבירות בנשק והשית עליו 24 שנות מאסר, 12 חודשי מאסר על תנאי ופיצוי לאלמנת המנוח וילדיו בסכום של 258,000 ₪.",['12 חודשי מאסר על תנאי']
PUNISHMENT_SUSPENDED,"בשקלול כל הנתונים והשיקולים, יש להשית על הנאשם 24 שנות מאסר לריצוי בפועל, 12 חודשי מאסר על תנאי ופיצוי לטובת אלמנת המנוח וילדיו בסכום כולל של 258,000 ₪.",['12 חודשי מאסר על תנאי']
PUNISHMENT_SUSPENDED,"מאסר לתקופה של 12 חודשים, על תנאי למשך שלוש שנים מיום שחרורו; והתנאי הוא כי הנאשם לא יעבור עבירת אלימות או עבירת נשק מסוג פשע.",['12 חודשי מאסר על תנאי']
