text,CIR_PUNISHMENT,GENERAL_CIRCUM,CIRCUM_OFFENSE,reject,CIR_TYPE,CIR_AMOUNT,CIR_ROLE,CIR_EQ,REGRET,RESPO,CONFESSION
אבו חג'ג' בעל 3 הרשעות קודמות רלבנטיות בתחום הסמים לרבות בגין ניסיון הדחת קטין לסמים.,0.00012872266,0.99999595,2.5552572e-05,9.033143e-06,0.0005307374,0.000862367,0.0016238358,0.004729305,0.008794807,0.0001375216,0.0003543394
"הלה הורשע בגין מעורבותו בביצוע 3 עסקאות סם מסוג קוקאין ובמשקל כולל כ- 50 גרם תמורת 22,500 ₪ ועמלת תיווך בסך 2,100 ₪, עבירות אותן ביצע הנאשם שעה שעמד ותלוי נגדו כתב אישום אף הוא בעבירות סמים.",0.0005287197,3.1525444e-05,0.99996424,8.894896e-06,0.9995962,0.99979216,0.99977833,0.0017946981,0.009453269,0.00017857227,0.9979074
"אבו חג'ג' אף היה עצור מאחורי סורג ובריח, עצור בפיקוח אלקטרוני וכן שהה בתנאים ומגבלות.",0.0003252773,2.8483886e-05,1.9330346e-05,0.9999875,0.0005358352,0.0011902767,0.00047154262,0.0064160326,0.008153676,0.00021344342,0.0025597163
"תסקירי המבחן היו חיוביים במהותם, תיארו השתלבות בקבוצות טיפוליות לעוברי חוק והתרשמות כי מצוי בעיצומו של הליך שהביא לשינוי ויציבות בכל תחומי חייו בדגש על משפחתו.",0.00012435442,0.9999963,2.0296202e-05,1.3694083e-05,0.0006118994,0.0009137339,0.0005356329,0.017699584,0.015477403,0.0017478782,0.00018250194
"מכך, המליץ שירות המבחן על ענישה שיקומית לא בדמות עבודות שירות כבענייננו, אלא בדמות צו מבחן וצו של""צ.",0.00013402544,3.125203e-05,1.77464e-05,0.9999875,0.00059889676,0.0009944272,0.00038820892,0.0016104149,0.0065418426,0.00011228216,0.0006409532
בית המשפט הביע ספקנות בהליך השיקומי הנטען אך הביאו במניין השיקולים באופן שהוביל למיקום העונש בתחתית המתחם.,0.00016604766,3.0586176e-05,1.731831e-05,0.99998724,0.00052016263,0.0009182659,0.0009745554,0.0022014084,0.064610735,0.000101563084,0.00013796252
"משמע, עניינו של אבו חג'ג' חמור מעניינו של הנאשם, במובנים רבים.",0.00019299076,3.472239e-05,2.5648958e-05,0.999987,0.00068838656,0.0012423393,0.0019065484,0.0023587842,0.020041443,0.00016278467,0.00046091495
"נדמה כי צריך להזכיר מושכלות יסוד: עיקרון אחידות הענישה, מורה להחיל שיקולי ענישה דומים על מי שביצעו עבירות דומות במהותן, בנסיבות דומות ובעלי נסיבות אישיות שונות, תוך שמירה על ייחס הולם בין הנאשמים.",0.00016007043,3.047275e-05,3.874027e-05,0.99998736,0.0009107196,0.0011549081,0.0012942977,0.0036674843,0.04551412,0.00017713994,0.0010644819
"קבלת עתירתה של המאשימה, שאינה מביאה בחשבון את חלוף הזמן המשמעותי ושיקולי השיקום, ועל אף שאינם מצדיקים סטייה ממתחם הענישה, עשויה לפגוע במראית פני הצדק ובהגינות ההליך המשפטי ומחייבת איזון עונשי ראוי.",0.00018561046,3.3568736e-05,2.1687592e-05,0.9999871,0.000753084,0.0010364195,0.0005868646,0.0025892302,0.4368333,0.00024763652,0.01106491
לנוכח האמור ובאיזון בין הנסיבות לזכותו של הנאשם לבין הנסיבות העומדות לחובתו אני גוזרת על הנאשם את העונשים הבאים:,0.00023384669,2.9591418e-05,1.9062267e-05,0.9999871,0.0004060817,0.0009539025,0.00036986684,0.0008471285,0.37424827,8.913684e-05,0.1065319
"18 חודשי מאסר בפועל בניכוי ימי מעצרו בהתאם לרישומי שב""ס.",0.9999459,3.0433543e-05,1.7076425e-05,9.082363e-06,0.0004286663,0.0010164852,0.00024950216,0.0017519272,0.0045121564,9.577253e-05,0.00028132103
"הנאשם יתייצב לריצוי עונש מאסר ביום 28.10.2024 עד השעה 10:00 במתקן הכליאה ""הדרים"" או על פי החלטת  שירות בתי הסוהר, כשברשותו תעודת זהות או דרכון ועותק מהחלטה זו.",0.0008571628,3.00736e-05,0.00013290398,0.0013796483,0.0007887796,0.0012882431,0.0004999759,0.017863123,0.00658419,0.00023643972,0.02780491
"על הנאשם לתאם את הכניסה למאסר, כולל אפשרות למיון מוקדם, עם ענף אבחון ומיון של שירות בתי הסוהר, בטלפונים: 08-9787377 או 08-9787336.",0.00018832154,3.0768908e-05,2.7847886e-05,0.99998784,0.000679215,0.0014744329,0.00037142527,0.06046324,0.01105314,0.00017763264,0.0011878042
8 חודשי מאסר אותם לא ירצה הנאשם אלא אם יעבור בתוך שלוש שנים כל עבירת פשע לפי פקודת הסמים המסוכנים.,0.99995756,3.0485102e-05,2.1828773e-05,8.991974e-06,0.0004694815,0.00093274354,0.00042003448,0.0015439757,0.010653289,0.00013361608,0.0027611742
3 חודשי מאסר אותם לא ירצה הנאשם אלא אם יעבור בתוך שלוש שנים כל עבירת עוון לפי פקודת הסמים המסוכנים.,0.9999579,3.042455e-05,2.2058128e-05,8.9908945e-06,0.0004781906,0.00092182704,0.0003907903,0.00164449,0.00975827,0.00013539045,0.0040063947
"קנס בסך 15,000 ₪ או 30 ימי מאסר תמורתו.",0.9999559,0.9999907,2.0375286e-05,9.044237e-06,0.00048531446,0.0009124499,0.0005673073,0.0031340688,0.006664075,0.00014201834,0.00030062435
"הקנס ישולם ב- 5 תשלומים חודשיים שווים ורצופים, החל מיום 1.1.2025.",0.0002643966,2.929667e-05,2.4331339e-05,9.02782e-06,0.00061495823,0.001154202,0.000789988,0.012299506,0.005824922,0.0002161824,0.00029173755
"לא ישולם איזה מהתשלומים במועדו, תעמוד יתרת הקנס לפירעון מידי.",0.999524,3.1212745e-05,3.2317155e-05,0.9999862,0.00061893696,0.0010865297,0.0014113514,0.033384617,0.012428912,0.0002684107,0.00038624438
"לבקשת הנאשם, הקנס ישולם מתוך ערבון שהופקד מטעם הנאשם בהליך המעצר, והיתרה תושב לנאשם בכפוף לכל דין.",0.9696397,3.0007392e-05,2.185869e-05,0.00068685843,0.00046604863,0.0008822352,0.0009969382,0.0023442542,0.0047394517,0.00012005219,0.0015517726
"מובהר, כי רכיב זה בגזר הדין כפוף לכל מניעה חוקית לרבות עיקול.",0.0002444427,3.1571264e-05,2.4795607e-05,0.9999871,0.0006369933,0.0011227123,0.0010949068,0.025941603,0.010376218,0.00013375095,0.00031638017
פסילה מותנית למשך 12 חודשים שלא יעבור עבירות נהיגה ללא רישיון נהיגה או עבירות סמים מסוג פשע למשך 3 שנים.,0.9999602,3.064276e-05,2.074586e-05,8.994899e-06,0.0004600107,0.00088099315,0.00034421042,0.0022352703,0.0060770614,0.000118896096,0.000403531
הפסילה תצטבר לכל עונש פסילה אחר.,0.99990606,3.2165943e-05,2.2606524e-05,0.99998665,0.0005714475,0.0011029404,0.00044362003,0.002957243,0.007874902,0.00015402376,0.00028525645
על הנאשם להפקיד את רישיון הנהיגה במזכירות בית המשפט.,0.010312732,3.1227868e-05,1.9041263e-05,0.9999764,0.00045364603,0.0009710667,0.00028169196,0.0038706884,0.007843455,9.639225e-05,0.0001682873
"אני מכריזה על הנאשם כסוחר סמים – לפי סעיף 36 א(ב) לפקודת הסמים ומורה על חילוט הטלפון הנייד ששימש לביצוע העבירות, לאוצר המדינה – קרן החילוט.",0.9998938,3.079445e-05,0.9997924,9.0528065e-06,0.0006818102,0.0014633065,0.02442349,0.011039513,0.015115913,0.00011093694,0.0011981347
צו כללי למוצגים.,0.96797365,3.3321936e-05,2.8625624e-05,0.9999875,0.0006083959,0.0014110873,0.000942815,0.25693157,0.00917468,0.00023796629,0.00031057736
"ניתן היום,  ז' אלול תשפ""ד, 10 ספטמבר 2024, במעמד הצדדים.",0.9996853,3.0847055e-05,2.5497655e-05,0.99998736,0.0005959095,0.0013500372,0.0009082352,0.11301148,0.01843567,0.00022923204,0.0038962546
"בעניין עריכה ושינויים במסמכי פסיקה, חקיקה ועוד באתר נבו – הקש כאן",0.0001968606,3.205026e-05,5.8557358e-05,0.9999876,0.0006799258,0.0013470659,0.00066393014,0.55357987,0.010769281,0.000116573574,0.0002890567
