feature_key,text,extraction
GENERAL_CIRCUM,"יצוין כי במהלך תקופת מעצר הבית, היה נתון הנאשם בצו פיקוח מעצרים, ומהתסקירים שהוגשו בעניינו עלה, כי הנאשם שיתף פעולה עם השירות ולא הפר תנאים במהלך התקופה.","['1 : לא', '2 : לא', '3 : לא', '4 : לא', '5 : לא', '6 : כן', '7 : כן', '8 : לא', '9 : כן', '10 : לא', '11 : לא']"
GENERAL_CIRCUM,"מהתסקירים עולה כי הנאשם כבן 24, נשוי ואב לשני פעוטות.","['1 : לא', '2 : לא', '3 : לא', '4 : לא', '5 : לא', '6 : לא', '7 : לא', '8 : כן', '9 : לא', '10 : לא', '11 : לא']"
GENERAL_CIRCUM,"אשתו אינה עובדת, וכיום הוא עובד כעצמאי בתחום השיפוצים, מקצוע שלמד מאביו העובד בתחום.","['1 : לא', '2 : לא', '3 : לא', '4 : לא', '5 : לא', '6 : לא', '7 : לא', '8 : כן', '9 : לא', '10 : לא', '11 : לא']"
GENERAL_CIRCUM,לנאשם שלושה אחים והוא השלישי בסדר הלידה.,"['1 : לא', '2 : לא', '3 : לא', '4 : לא', '5 : לא', '6 : לא', '7 : לא', '8 : לא', '9 : לא', '10 : לא', '11 : לא']"
GENERAL_CIRCUM,הנאשם גדל בבית דתי והתחנך במסגרות מתאימות.,"['1 : לא', '2 : לא', '3 : לא', '4 : לא', '5 : לא', '6 : לא', '7 : כן', '8 : לא', '9 : לא', '10 : לא', '11 : לא']"
GENERAL_CIRCUM,הוא לא שירת שירות צבאי ולבסוף הופטר ממנו על-רקע אי-התאמה ועבד עם אביו.,"['1 : לא', '2 : לא', '3 : לא', '4 : לא', '5 : לא', '6 : לא', '7 : לא', '8 : כן', '9 : לא', '10 : לא', '11 : לא']"
GENERAL_CIRCUM,"הנאשם קיבל אחריות למעשים, אם כי שירות המבחן סבר כי לנאשם עמדות מקלות בכל הנוגע לשימוש בסמים, וכי הוא מאופיין באישיות בלתי בשלה ונטיה שלא לחשוב על ההשלכות ארוכות הטווח של מעשיו.","['1 : לא', '2 : לא', '3 : לא', '4 : כן', '5 : לא', '6 : לא', '7 : לא', '8 : לא', '9 : לא', '10 : לא', '11 : לא']"
GENERAL_CIRCUM,"הנאשם מסר בדיקות שתן נקיות מסמים ולא אותרה אצלו בעיה של שימוש לרעה בסמים או באלכוהול, ולכן שירות המבחן לא בא בהמלצה טיפולית בהקשר זה.","['1 : לא', '2 : לא', '3 : לא', '4 : לא', '5 : לא', '6 : לא', '7 : לא', '8 : לא', '9 : לא', '10 : לא', '11 : לא']"
GENERAL_CIRCUM,"בתסקירו האחרון התרשם שירות המבחן כי הנאשם העמיק לקבל אחריות למעשים, הבין את הפסול שבהם והשתפר מבחינת יכולת התנהגותו והכלים שרכש להתנהלות תקינה גם בתחום הכלכלי.","['1 : לא', '2 : לא', '3 : לא', '4 : כן', '5 : כן', '6 : לא', '7 : כן', '8 : לא', '9 : לא', '10 : לא', '11 : לא']"
GENERAL_CIRCUM,הנאשם צעיר ללא עבר פלילי.,"['1 : לא', '2 : לא', '3 : לא', '4 : לא', '5 : לא', '6 : לא', '7 : לא', '8 : לא', '9 : לא', '10 : לא', '11 : לא']"
GENERAL_CIRCUM,"הנאשם נשוי ואב לשני ילדים קטנים, והוא מפרנס יחיד למשפחתו.","['1 : לא', '2 : כן', '3 : לא', '4 : לא', '5 : לא', '6 : לא', '7 : לא', '8 : כן', '9 : לא', '10 : לא', '11 : לא']"
GENERAL_CIRCUM,"מהתסקירים שהוגשו עולה תהליך שבו שיפר הנאשם את קבלת אחריותו, הוא שיתף פעולה עם שירות המבחן, עבר טיפול במספר רמות הנוגעות לקבלת כלים לתפקוד תקין בחיים ומתעתד להמשיך בטיפול.","['1 : לא', '2 : לא', '3 : לא', '4 : כן', '5 : כן', '6 : לא', '7 : כן', '8 : לא', '9 : לא', '10 : לא', '11 : לא']"
CIR_TYPE,"על-פי האישום הראשון, ביום 17.4.2021 הזמין לקוח בשם סאסי סמים באמצעות יישומון הטלגראם, ובתגובה התקשר אליו הנאשם תוך שחסם את מספר הטלפון שלו, ותיאם אתו הגעה למקום ביצוע הסחר – 5 גרם קנביס תמורת 500 ₪.",['קנביס']
CIR_TYPE,"בעת מעצרו נתפסו על הנאשם וברכבו 179.13 גרם קנביס וכן 3,200 ₪ במזומן.",['קנביס']
CIR_TYPE,"על-פי האישום השני, סחר הנאשם בסמים עם סאסי, שש פעמים במהלך החודשים פברואר עד אפריל 2021, כשניתן להבין שכל עסקה שתואמה בטלגראם כללה 5 גרם קנביס תמורת 500 ₪.",['קנביס']
CIR_TYPE,"על-פי האישום השלישי, סחר הנאשם בסם מסוג קנביס מול לקוחה בשם מיכל בהיקף של 10 גרם קנביס תמורת 800 ₪.",['קנביס']
CIR_TYPE,"על-פי האישום הרביעי, סחר הנאשם עם אדם בשם איתמר בקנביס במשקל 5 גרם תמורת 400 ₪ בארבע עסקאות נפרדות שבוצעו באותה שיטה, בין פברואר לאפריל 2021.",['קנביס']
CIR_AMOUNT,"בעת מעצרו נתפסו על הנאשם וברכבו 179.13 גרם קנביס וכן 3,200 ₪ במזומן.",['[179.13 - גרם]']
CIR_AMOUNT,"על-פי האישום השלישי, סחר הנאשם בסם מסוג קנביס מול לקוחה בשם מיכל בהיקף של 10 גרם קנביס תמורת 800 ₪.",['[10 - גרם]']
CIR_ROLE,"על-פי האישום השני, סחר הנאשם בסמים עם סאסי, שש פעמים במהלך החודשים פברואר עד אפריל 2021, כשניתן להבין שכל עסקה שתואמה בטלגראם כללה 5 גרם קנביס תמורת 500 ₪.","['על פי המידע שניתן, הנאשם סחר בסמים עם אדם אחר בשם סאסי, והעסקאות כללו 5 גרם קנביס תמורת 500 ש""ח. זה מצביע על כך שהנאשם היה בעל הסמים, מ']"
CIR_ROLE,"על-פי האישום השלישי, סחר הנאשם בסם מסוג קנביס מול לקוחה בשם מיכל בהיקף של 10 גרם קנביס תמורת 800 ₪.","['לא בעל המעבדה, בעל הסמים']"
CIR_ROLE,"על-פי האישום הרביעי, סחר הנאשם עם אדם בשם איתמר בקנביס במשקל 5 גרם תמורת 400 ₪ בארבע עסקאות נפרדות שבוצעו באותה שיטה, בין פברואר לאפריל 2021.","['הנאשם הואשם בסחר בקנאביס, לא בהפעלת מעבדה. הוא סחר עם אדם אחר בשם איתמר, והעסקאות בוצעו באופן נפרד, בין פברואר לאפריל 2021. הנאשם היה בע']"
RESPO,"הנאשם קיבל אחריות למעשים, אם כי שירות המבחן סבר כי לנאשם עמדות מקלות בכל הנוגע לשימוש בסמים, וכי הוא מאופיין באישיות בלתי בשלה ונטיה שלא לחשוב על ההשלכות ארוכות הטווח של מעשיו.",['כן']
RESPO,"בתסקירו האחרון התרשם שירות המבחן כי הנאשם העמיק לקבל אחריות למעשים, הבין את הפסול שבהם והשתפר מבחינת יכולת התנהגותו והכלים שרכש להתנהלות תקינה גם בתחום הכלכלי.",['כן']
CONFESSION,"הנאשם הורשע על-פי הודאתו בכתב אישום מתוקן בביצוע ניסיון לסחור בסמים מסוכנים, לפי סעיפים 13 ו-19א לפקודת הסמים המסוכנים (הפקודה) בצירוף סעיף  25 לחוק העונשין, התשל""ז-1977, וכן בעבירה של החזקת סם שלא לצריכה עצמית, לפי סעיפים 7(א)(ג) רישא לפקודה.",['כן']
PUNISHMENT_ACTUAL,"חודשיים מאסר שלא ירוצה, אלא אם יעבור הנאשם בתוך שלוש שנים מיום סיום עבודות השירות כל עבירת עוון לפי פקודת הסמים המסוכנים;","['הנאשם קיבל חודשיים מאסר שלא ירוצה, אלא אם יעבור כל עבירת עוון לפי פקודת הסמים המסוכנים בתוך שלוש שנים מיום סיום עבודות השירות']"
PUNISHMENT_ACTUAL,"7 חודשי מאסר שלא ירוצה, אלא אם יעבור הנאשם בתוך שלוש שנים מיום סיום עבודות השירות כל עבירת פשע לפי פקודת הסמים המסוכנים;",['7 חודשי מאסר']
PUNISHMENT_SUSPENDED,"7 חודשי מאסר שלא ירוצה, אלא אם יעבור הנאשם בתוך שלוש שנים מיום סיום עבודות השירות כל עבירת פשע לפי פקודת הסמים המסוכנים;",['7 חודשי מאסר על תנאי']
PUNISHMENT_SUSPENDED,"התחייבות בסך 10,000 ₪ שלא יבצע הנאשם בתוך שנתיים מסיום עבודות השירות כל עבירת פשע לפי פקודת הסמים המסוכנים;",['הנאשם קיבל 10 חודשי מאסר על תנאי']
PUNISHMENT_FINE,"קנס בסך 7,000 ₪ או 25 ימי מאסר תמורתו אם לא ישולם.","['7,000 ₪']"
OFFENCE_NUMBER,"פקודת הסמים המסוכנים [נוסח חדש], תשל""ג-1973: סע'  7(א)(ג), 12, 13, 19א","['סעיף 7א', 'סעיף 19א']"
OFFENCE_NUMBER,"הנאשם הורשע על-פי הודאתו בכתב אישום מתוקן בביצוע ניסיון לסחור בסמים מסוכנים, לפי סעיפים 13 ו-19א לפקודת הסמים המסוכנים (הפקודה) בצירוף סעיף  25 לחוק העונשין, התשל""ז-1977, וכן בעבירה של החזקת סם שלא לצריכה עצמית, לפי סעיפים 7(א)(ג) רישא לפקודה.","['סעיף 19א', 'סעיף 7א', 'סעיף 13']"
OFFENCE_NUMBER,"בנוסף , הורשע הנאשם בביצוע 11 עבירות של סחר בסמים לפי סעיפים 12 ו-19א לפקודה.",['סעיף 19א']
