text,CIR_PUNISHMENT,GENERAL_CIRCUM,CIRCUM_OFFENSE,reject,CIR_TYPE,CIR_AMOUNT,CIR_ROLE,CIR_EQ,REGRET,RESPO,CONFESSION
"הקנס ישולם ב- 4 תשלומים החל מיום 1.1.2021 ואם לא ישולם אחד התשלומים במועד תעמוד היתרה לפירעון מיידי ויתווספו תוספות פיגור כחוק, וזאת מעבר לזכותה של המדינה לבקש הפעלת המאסר חלף הקנס.",0.0010886249,2.9317549e-05,3.6193112e-05,1.0901935e-05,0.0007144157,0.0010583462,0.0006569949,0.009654689,0.0060249753,0.00022101586,0.001276531
הנאשם יתחייב שלא לעבור כל עבירת סמים.,0.002115037,3.332365e-05,2.3430677e-05,9.449006e-06,0.00054374506,0.0008701377,0.0013744902,0.0020680458,0.036356926,0.00015725654,0.0003631984
"ההתחייבות תהא לתקופה של שלוש שנים ממועד השחרור ממאסר ובסך של 1,500 ₪ ותוצהר לפרוטוקול.",0.9999262,3.0049232e-05,3.9411305e-05,9.036797e-06,0.0007042492,0.00093742047,0.0018859629,0.008640579,0.0056032995,0.00018096477,0.0005426348
פסילה מלהחזיק או לקבל רישיון נהיגה לתקופה של 3 חודשים ממועד שחרורו ממאסר ובמצטבר לכל פסילת רישיון אחרת אם ישנה.,0.9999596,3.0242361e-05,2.5276711e-05,8.9425275e-06,0.00059718994,0.001023585,0.0003593125,0.0041070785,0.007871863,0.00016331077,0.00086810015
הפסילה תהיה בתוקף ממועד השחרור אולם תיקצב רק לאחר הפקדת רישיון הנהיגה בפועל.,0.9980878,2.9989913e-05,1.9456238e-05,9.2346045e-06,0.00048605268,0.0010265431,0.00027674963,0.00656354,0.004602685,0.00015220926,0.00019610935
"בנוסף, יפסל הנאשם מלקבל או להחזיק רישיון נהיגה למשך 4 חודשים ועונש זה יהיה על תנאי והתנאי הוא שבמשך 3 שנים ממועד שחרורו של הנאשם ממאסר לא יעבור עבירת סמים כלשהי, או עבירה של נהיגה ללא רישיון או בזמן פסילה.",0.9999654,3.142222e-05,2.9355348e-05,8.952511e-06,0.00064369483,0.0009837197,0.00044214932,0.002930356,0.007947008,0.00014310381,0.05497218
"נוכח המוסכם, אני מצהיר על הנאשם כסוחר סמים ומורה על חילוט הסך של 1,500 ₪ שנתפס בתיק החקירה, לטובת קרן המאבק בסמים.",0.9999579,3.0134259e-05,0.9999186,8.944147e-06,0.0010645782,0.011241857,0.6209251,0.002376574,0.016357442,0.000106128784,0.076097116
על הנאשם לדאוג לקבלת שוברי תשלום במזכירות בית המשפט ולא תישמע טענה שלא קיבל אותם בדואר.,0.00044393388,3.1672014e-05,7.425744e-05,0.9999877,0.0005283263,0.0012031897,0.0025959215,0.11469206,0.010038711,0.00014735461,0.00013150345
זכות ערעור תוך 45 יום לבית המשפט המחוזי.,0.9998516,3.0523588e-05,2.219524e-05,0.9999875,0.00037928313,0.0012085509,0.00044028295,0.01180449,0.0044528376,0.00011055939,0.0003042267
"ניתן והודע היום כ""ז אלול תש""פ, 16/09/2020 במעמד הנוכחים.",0.9813022,3.0923522e-05,2.295783e-05,0.99998724,0.00049373816,0.0011737206,0.00068800786,0.2642088,0.020280445,0.00019691674,0.001821426
"הבנתי את גזר הדין, גם לאחר שבית המשפט עובר איתי שוב על רכיבי הענישה לרבות עונש המאסר המותנה והפסילה.",0.0002038279,3.027572e-05,2.2329694e-05,0.99998724,0.00054974534,0.0010328641,0.0003987586,0.0011346797,0.09269821,0.00020800326,0.0011907195
"אני מתחייב שלא לעבור עבירה נוספת של סמים ואני מבין שאם אעבור עבירה נוספת אני אצטרך לשלם סך של 1,500 ₪ גם מבלי לחתום על כל מסמך נוסף.",0.99988186,3.205087e-05,8.8858134e-05,9.216955e-06,0.0006486399,0.0014025029,0.0021382277,0.008765907,0.039517477,0.00019524363,0.0010874221
"5467831354678313ניתנה והודעה היום כ""ז אלול תש""פ, 16/09/2020 במעמד הנוכחים.",0.89812773,2.9501814e-05,2.4869752e-05,0.9999871,0.000602454,0.0011829045,0.0005987242,0.22014616,0.021727672,0.00020514183,0.0032661173
"בעניין עריכה ושינויים במסמכי פסיקה, חקיקה ועוד באתר נבו – הקש כאן",0.0001968606,3.205026e-05,5.855736e-05,0.9999876,0.00067992613,0.0013470658,0.00066392915,0.55358005,0.010769276,0.00011657335,0.00028905642
