text,reject,CIR_PUNISHMENT,CONFESSION,CIR_TYPE,CIR_ROLE,GENERAL_CIRCUM,CIR_AMOUNT,REGRET,RESPO,CIR_EQ
לשיטתו מדובר בפגיעה משמעותית נוכח כמות הסם.,1,0,0,0,0,0,0,0,0,0
"לשם כך התקין בה ציוד להפקה, הכנה וטיפול בקנבוס, כולל גופי תאורה ייעודיים, מערכות אוורור והשקיה, אדניות וחומרי דישון.",0,0,0,1,0,0,0,0,0,1
"לתקופה ניסה הנאשם לשמר תפקוד נורמטיבי, הוא נמנע משימוש בסמים והשתלב בעבודה.",0,0,0,0,0,1,0,0,0,0
"לתשומת לב שב""ס, לדברי הנאשם הוא היה שוטר לאורך שנים ויש להביא את הדבר בחשבון בכל הנוגע לשמירה מתאימה מפני פגיעה של כאלו שאולי זוכרים לו את תקופת פעילותו כשוטר.",0,0,0,0,0,1,0,0,0,0
"מאז המעצר, וכלל הנראה גם נוכח חזרתו בתשובה ובניית המשפחה, עבר הנאשם שינוי משמעותי בחייו.",0,0,0,0,0,1,0,0,0,0
"מאז התקשה הנאשם לשמר אורח חיים יציב ונורמטיבי, והתנהל על פי דפוסים עברייניים מושרשים.",0,0,0,0,0,1,0,0,0,0
"מאז ניהל הנאשם אורח חיים לא יציב, תוך התמכרות ממושכת לסמים קשים וקשירת קשר עם גורמים שוליים.",0,0,0,0,0,1,0,0,0,0
"מאחר והנאשם ביטא מוטיבציה ופועל לשינוי אורחות חייו, מכיר בנזקקותו בתמיכה והכוונה תוך רצון להתגייסות להליך טיפולי, העריך שירות המבחן כי שילוב הנאשם בקבוצה טיפולית יוכל לעזור בהפנמת עמדות ונורמות חברתיות תקינות, ויתרום לשינוי דפוסי מחשבה והתנהגות כושלים.",0,0,0,0,0,1,0,0,0,0
"מאחר והנאשם ללא עבר פלילי ובשים לב להמלצה השיקומית של שירות המבחן עתרה המאשימה להטיל על הנאשם מאסר ברף התחתון של המתחם לו עתרה, קרי 9 חודשי מאסר שירוצו בעבודות שירות.",0,0,0,0,0,1,0,0,0,0
"מאסר בפועל - מאסר למשך 15 חודשים בניכוי ימי מעצרו בהתאם לרישומי שב""ס.",0,1,0,0,0,0,0,0,0,0
מאסר בפועל למשך 9 חודשים.,0,1,0,0,0,0,0,0,0,0
"מאסר למשך 3 חודשים, וזאת על תנאי למשך 3 שנים מיום שחרורו מהמאסר, שלא יעבור על כל עבירת אלימות מסוג עוון, או עבירת סמים מסוג עוון מפקודת הסמים המסוכנים.",0,1,0,0,0,0,0,0,0,0
"מאסר למשך 9 חודשים, שירוצה בעבודות שירות, החל מיום 5.5.2024 (או במועד אחר שיקבע הממונה על עבודות השירות).",0,1,0,0,0,0,0,0,0,0
"מאסר מותנה - מאסר למשך 8 חודשים, ואולם הנאשם לא יישא בעונש זה אלא אם יעבור עבירה לפי פקודת הסמים המסוכנים, מסוג פשע, במשך 3 שנים מיום שחרורו.",0,1,0,0,0,0,0,0,0,0
"מאסר מותנה למשך 3 חודשים, והתנאי הוא כי הנאשם לא יעבור עבירה שכרוכה בפגיעה ברכוש או עבירה של החזקת סכין, למשך 3 שנים.",0,1,0,0,0,0,0,0,0,0
"מאסר מותנה למשך 3 חודשים, והתנאי הוא כי הנאשם לא יעבור עבירת סמים מסוג עוון, למשך 3 שנים מסיום ריצוי עבודות השירות.",0,1,0,0,0,0,0,0,0,0
"מאסר מותנה למשך 6 חודשים, והתנאי הוא כי הנאשם לא יעבור עבירה על פקודת הסמים מסוג פשע למשך 3 שנים.",0,1,0,0,0,0,0,0,0,0
"מאסר מותנה למשך 7 חודשים, והתנאי הוא כי הנאשם לא יעבור עבירה על פקודת הסמים מסוג פשע למשך 3 שנים.",0,1,0,0,0,0,0,0,0,0
"מאסר על תנאי בן 5 חודשים למשך 3 שנים, והתנאי הוא שהנאשם לא יעבור בתקופת התנאי עבירה מסוג פשע לפי פקודת הסמים המסוכנים, ויורשע בגינה.",0,1,0,0,0,0,0,0,0,0
"מבחינה תעסוקתית, עבד בעבודות שונות בארץ ובספרד בתחומי התיירות והפקת אירועים.",0,0,0,0,0,1,0,0,0,0
"מבחינה תעסוקתית, עבד לאורך השנים באופן לא מסודר בעבודות מזדמנות.",0,0,0,0,0,1,0,0,0,0
מבטא הכרה למחירים הנלווים להתנהלותו השולית ולפגיעה בעצמו ובמשפחתו.,0,0,0,0,0,1,0,0,0,0
"מבלי להצדיק את העבירות שביצע, אלו בוצעו בעקבות משבר כלכלי ואישי אליו נקלע, שהובילו לטעות בהתנהלותו.",0,0,0,0,0,1,0,0,0,0
מבקש שלא לקטוע את ההליך השיקומי ולא לגזור עליו מאסר בפועל.,1,0,0,0,0,0,0,0,0,0
"מדובר באדם שהיה מכור לסמים קשים, אשר מצא פרנסתו בין היתר בעבירות פליליות וניהל אורח חיים שולי.",0,0,0,0,0,1,0,0,0,0
"מדובר במי שנדרש לעשות כן בלחץ מסוים של מלווים בשוק האפור; נסיבותיו האישיות של הנאשם אינן קלות; לנאשם אמנם הרשעות קודמות, אך מדובר בעבירות שביצע בשנת 2005; הנאשם מעולם לא ריצה מאסר בפועל.",0,0,0,0,0,1,0,0,0,0
"מדובר במניעים שאין בהם להצדיק את העבירה אשר נסיבותיה אינן קלות נוכח טיבם המסוכן של הסמים, כמותם וסוגם המגוון.",0,0,0,0,0,0,0,0,0,0
"מדובר בנאשם בגיר, ללא כל לקות שכלית או קרבה לסייג לאחריות פלילית, הוא הבין את חומרת מעשיו ואת השלכותיהם, ויכל להימנע מביצועם.",0,0,0,0,0,1,0,0,0,0
"מדובר בסם מסוכן מסוג קוקאין שפגיעתו קשה, והעבירות בוצעו ממניע כלכלי.",0,0,0,1,0,0,0,0,0,0
"מדובר בעבירות שבוצעו בסמיכות זמנים,  ונפרשו על פני תקופה של כחודשיים.",1,0,0,0,0,0,0,0,0,0
"מדובר בשתי עסקאות של סמים אשר בוצעו באותה השיטה בדיוק, מול אותו סוכן משטרתי, ביחס לאותו סוג סם, אותה שיטת סחר, באותו אזור (קרית מוצקין), ולשם אותה המטרה.",0,0,0,0,0,0,0,0,0,0
מדיניות הענישה הנוהגת בה לידי ביטוי בגזרי דין רבים נוכח העובדה כי למעשה מדובר בעבירה נפוצה החוזרת על עצמה.,1,0,0,0,0,0,0,0,0,0
"מדיניות הענישה הנוהגת בעבירות של סחר בסם והחזקתו, משקללת את סוג הסם, הכמויות, התארגנות עסקית והמיקום בשרשרת הפצת הסמים.",1,0,0,0,0,0,0,0,0,0
מדיניות הענישה והפסיקה הנהוגה,1,0,0,0,0,0,0,0,0,0
"מהאישום הראשון עולה, כי ביום 27.2.2023 נתפס הנאשם במונית כשהוא מחזיק למעלה מ-700 גרם קנביס מחולק ל-124 שקיות, וכן למעלה מ-60 גרם חשיש אף הוא במספר אריות.",0,0,0,1,0,0,1,0,0,0
"מהאישום הראשון עולה, כי ביום 29.11.2022 בוצע צו חיפוש בחדר מלון בירושלים בו שהה הנאשם, ושם החזיק באריזות שונות כ-3.4 ק""ג סמים מסוג קנביס, ארבע פלטות חשיש במשקל כ-400 גרם ובשבע סיגריות אלקטרוניות שהכילו בתוכן קנבואיד סינתטי.",0,0,0,1,0,0,1,0,0,0
"מהאישום השישי עולה, כי הנאשם הכיר את ד' הכרות מוקדמת.",1,0,0,0,0,0,0,0,0,0
"מהאישום השלישי עולה, כי ביום 21.11.2022 ובאותו אופן, סייע הנאשם לבצע עסקת סמים עם הלקוחה ע' – 10 גרם קנביס תמורת 550 ₪;",0,0,0,1,1,0,1,0,0,0
"מהאישום השלישי עולה, כי הנאשם מכר בשתי הזדמנויות לנ""י קנביס במשקל מצטבר של 20 גרם תמורת סכום כולל של 1,000 ₪ וזאת בימים 7.2.2023 ו-20.2.2023.",0,0,0,1,1,0,1,0,0,0
"מהאמור עולה אם כן, כי אין המדובר בצופה מן הצד, אלא שפעולה זו הייתה מתוכננת ומתואמת בין השניים, כאשר תפקידו של הנאשם לנהוג את הרכב, בזמן שהאחר מכה את המתלונן במהלך כל זמן הנסיעה.",1,0,0,0,0,0,0,0,0,0
"מהתסקיר עולה, כי הנאשמת כבת 23, רווקה ומתגוררת עם משפחתה החרדית מרובת הילדים ביישוב חרדי.",0,0,0,0,0,1,0,0,0,0
מובן החשש לפגיעה בדימוי העצמי וביתר שאת כאשר הנאשם הצליח להימנע מהסתבכות עד כה אולם על בית המשפט לשקול גם שיקולי שוויון.,1,0,0,0,0,0,0,0,0,0
"מוצגים – כל המוצגים יושמדו/יחולטו/יושבו, לשיקול דעת המאשימה.",1,0,0,0,0,0,0,0,0,0
מוקד שירות טלפוני בשרות עצמי (מרכז גבייה)  – בטלפון 35592* או בטלפון 073-2055000,1,0,0,0,0,0,0,0,0,0
"מורה על השמדת הסמים ועל חילוט הטלפונים והמזומן בסך 5,810 ₪ שנתפסו בעת מעצרו של הנאשם.",0,1,0,0,0,0,0,0,0,0
מורה על חילוט הטלפון והכספים שנתפסו וכן מורה על השמדת הסמים.,0,1,0,0,0,0,0,0,0,0
"מורה על חילוט סך 17,000 ₪, כאמור בהחלטה מיום 3.6.2024.",0,1,0,0,0,0,0,0,0,0
מזה כשנה וחצי עובד הנאשם כעצמאי בהתקנת מצלמות אבטחה.,0,0,0,0,0,1,0,0,0,0
מזכירות בית המשפט תנפיק פקודת מאסר לאלתר וזאת כדי לאפשר לנאשם 2 להתייצב מחר לריצוי מאסרו.,1,0,0,0,0,0,0,0,0,0
"מחד גיסא, ב""כ המאשימה עתר לאמץ מתחמים נפרדים לכל אחד מהאישומים בהיעדר קשר הדוק ביניהם, ועתר לחרוג ממתחם העונש לו עתר ולהטיל על הנאשם 9 חודשי מאסר בעבודות שירות וענישה נלווית מתוך הכרה בתהליך הטיפולי שעבר.",1,0,0,0,0,0,0,0,0,0
"מחד גיסא, ב""כ המאשימה עתר להטיל על הנאשמת  עונש בתחתית מתחם שבין 8 ל-18 חודשי מאסר נוכח חומרת הנסיבות ותוך שקלול התסקיר החיובי בעניינה.",1,0,0,0,0,0,0,0,0,0
"מחוות הדעת עולה, כי הנאשם נמצא כשיר לבצע עבודות שירות ב""מפעל חיים"" בירושלים.",1,0,0,0,0,0,0,0,0,0
"מחוות הדעת עולה, כי הנאשם נמצא כשיר לבצע עבודות שירות בבית העלמין בבית שמש החל מיום 24.6.2024.",1,0,0,0,0,0,0,0,0,0
"מטיעוני ההגנה ומקריאת תסקיר שירות המבחן עולה כי הנאשם חווה על גופו ובנפשו את אירועי השביעי באוקטובר 2023, עת השתתף בפסטיבל הנובה; האירוע הקשה הותיר צלקות בנפשו של הנאשם והוא הוכר כפוסט טראומתי.",0,0,0,0,0,1,0,0,0,0
"מטעם ההגנה העידה לעונש אימו של הנאשם, ילנה טרבה (להלן: האם); כך העידה: ""בגלל שהמצב הרפואי שלו עכשיו מאוד מאוד קשה יש לו סיפור של פסוריאזיס הוא מקבל זריקה כל 3 חודשים הוא היה בטיפול ביולוגי, ויש מסמכים מהבית חולים הבאתי את כל מה שאפשר.",0,0,0,0,0,1,0,0,0,0
"מטעם המאשימה הוגש תדפיס המידע הפלילי של הנאשם, יליד שנת 1995 (בן 28 שנים כיום).",0,0,0,0,0,1,0,0,0,0
מטעם התביעה הוגש רישומו הפלילי של הנאשם (ת/1).,1,0,0,0,0,0,0,0,0,0
"מטעם זה נדחה הדיון, וביום 15.2.2024 הוצגה בפניי עמדת המאשימה גם ביחס לשותפו של הנאשם.",1,0,0,0,0,0,0,0,0,0
"מטעמים אלו הגעתי למסקנה, כי נכון לגזור את עונשו בחלק התחתון של מתחם העונש ההולם, כך שירצה עבודות שירות לתקופה המקסימלית.",1,0,0,0,0,0,0,0,0,0
"מי מחליט"" חכה חכה אתה לא יוצא מפה חי.",1,0,0,0,0,0,0,0,0,0
"מיד לאחר מכן נעצר הנאשם ובדירתו נמצאו, בתוך שלוש חבילות, 3,989.97 גרם נטו מהסם המסוכן וכן 1,097.21 גרם סם מסוכן מסוג קנבוס, שלא לשימוש עצמי.",0,0,0,1,0,0,1,0,0,0
"מידת הפגיעה בערכים המוגנים בענייננו היא משמעותית בשים לב למספר השתילים ומשקל הסם, ובשים לב לנזק הכלכלי שהסב לחברת החשמל באמצעות החשמל שנטל באופן פיראטי.",1,0,0,0,0,0,0,0,0,0
"מידת הפגיעה בערכים המוגנים- מדובר במעבדה שהוקמה למטרת גידול סם מסוג קנבוס, בה נמצאו 254 עציצים ובהם סם מסוג קנבוס במשקל כולל של 159.56 ק""ג נטו ושני שקים ובהם 3,066.57 גרם קנבוס.",0,0,0,1,0,0,1,0,0,1
"מידת הפגיעה בערכים המוגנים: בשים לב לסוג הסם ולעובדה כי לא מדובר באירוע אקראי מחד, ולכמות הקטנה שנמכרה מאידך, אני קובעת כי מידת הפגיעה בערכים המוגנים היא ממשית.",1,0,0,0,0,0,0,0,0,0
מידת הפגיעה של הנאשם בערכים המוגנים היא בינונית.,0,0,0,0,0,0,0,0,0,0
"מיקי דהן – בימ""ש קהילתי",1,0,0,0,0,0,0,0,0,0
"מכאן, שהמחוקק ראה לנגד עיניו שגם במקרים בהם עקרון ההלימה מחייב הטלת עונש מאסר משמעותי, בנסיבות מיוחדות ויוצאות דופן, שיקולי שיקום יכריעו את הכף, וזאת מבלי לגרוע מחומרת המעשה והעונש ההולם שראוי היה לגזור בגינו.",1,0,0,0,0,0,0,0,0,0
"מכאן, שלטעמי אין מקום להטיל על הנאשם את הפיצוי בהיקף שלו עתרה המאשימה, ואף לא בקירוב לכך.",1,0,0,0,0,0,0,0,0,0
"מכל מקום, ביום 09.05.2022 (עוד בעת שהנאשם היה מיוצג), הגיעו הצדדים להסדר טיעון ""סגור"" (דהיינו עם הסכמות מלאות לעניין הטיעונים לעונש), שבמסגרתו תוקן כתב האישום (בתיק העיקרי) וצורף כתב אישום מתוקן נוסף (בתיק המצורף) (בפרוטוקול, עמ' 14).",1,0,0,0,0,0,0,0,0,0
"ממידע שהתקבל מגורמי הטיפול בהוסטל עולה כי עמד בכללי התכנית הטיפולית, להתרשמותם הנאשם מצליח לזהות מוקדי סיכון במצבו כגון קשרים שוליים, דפוסי חשיבה עברייניים, חוסר יציבות תעסוקתית ומצוקות ומשברים שעובר.",0,0,0,0,0,1,0,0,0,0
"ממידע שהתקבל מגורמי הטיפול ביחידה להתמכרויות עלה כי משתף פעולה באופן חיובי, מתמיד ומתייצב בזמן ומוסר בדיקות שתן נקיות.",0,0,0,0,0,1,0,0,0,0
"מנגד סוג הסם, הכמות ומכירה אחת בודדת מציבים את הנאשם שלא בין המקרים החמורים.",1,0,0,0,0,0,0,0,0,0
"מנגד, ב""כ הנאשם ביקש מבית המשפט לאמץ את המלצות שירות המבחן.",1,0,0,0,0,0,0,0,0,0
"מנגד, נתתי דעתי גם להמלצות שירות המבחן אשר שב על המלצתו והתרשמותו מן הנאשם בשלושת תסקיריו ולעמדתו, לראשונה הנאשם מעוניין לעשות שינוי אמיתי בחייו, מסוגל להיתרם מטיפול בשירות המבחן וככל שיתמיד בטיפול זה, יקטן הסיכון להישנות העבירות.",0,0,0,0,0,0,0,0,0,0
מסביבי אין אף נרקומן.,1,0,0,0,0,0,0,0,0,0
"מסיבה זו, נסקרו לעיל גם פסקי דין שעסקו בייבוא סמים הזייתיים מסוגים אחרים.",1,0,0,0,0,0,0,0,0,0
"מעובדות כתב האישום עולה כי במועד שאינו ידוע במדויק ובמשך תקופה לא ידועה ועד ליום 30.11.2023 גידל הנאשם שתילים רבים של סם, בוילה ששכר מיום 1.7.2023 בקריית גת, לאחר שביצע בווילה פעולות שונות כדי להכשירה כמקום לגידול הסם.",0,0,0,0,1,0,0,0,0,0
מעולם לא התפרנסתי מסמים אני כל החיים שלי עובד.,0,0,0,0,0,1,0,0,0,0
"מעשיו, כפי שכבר נאמר, חמורים מאד נוכח סוג הסם - מחולל פשיעה מסוכן וכמותו העצומה.",1,0,0,0,0,0,0,0,0,0
"מקורותיו עולה כי חווה ילדות מורכבת בצלו של אב אלים, השלים 12 שנות לימוד במגמת אלקטרוניקה ותעודת בגרות מלאה, שירת שירות צבאי מלא ולאחר שחרורו עבד כשנתיים בארה""ב בתחום האלקטרוניקה.",0,0,0,0,0,1,0,0,0,0
"משום כך ובשל בעיותיו הרפואיות, הומלץ על המשך טיפול בנאשם בקהילת ""קריית שלמה"", במחלקה לטיפול בתחלואה כפולה.",0,0,0,0,0,1,0,0,0,0
"משך הליך הטיפול, הצלחתו, המוטיבציה הטיפולית הגבוהה שמגלה הנאשם ושינוי משמעותי שערך בכל מישורי חייו מעידים כי מצוי בהליך שיקום ממושך ויציב, עוד ניכר כי לראשונה בחייו הצליח לערוך התבוננות פנימית, להכיר בדפוסיו הבעייתיים ולרכוש כלים להתמודד עמם.",0,0,0,0,0,1,0,0,0,0
משכך ביקש שלא לזקוף לחובתו של הנאשם את העובדה שלא השתלב בטיפול.,0,0,0,0,0,1,0,0,0,0
"משכך, אין בנסיבות אלה כדי להצדיק סטייה ממתחם הענישה.",0,0,0,0,0,0,0,0,0,0
"משכך, סבר ב""כ הנאשם שיש לקבל את המלצת שירות המבחן במלואה, ולהטיל על הנאשם שירות לתועלת הציבור, בין אם ייקבע כי רכיב זה נכלל במתחם העונש ההולם ובין אם ייקבע מתחם עונש הולם שמתחיל ממאסר בפועל, שאז יש לחרוג לקולה מהמתחם משיקולי שיקום.",1,0,0,0,0,0,0,0,0,0
"משסירב בעל הדירה להזדהות הגיע הנאשם והחל לאיים על השוטרת, באומרו: ""אני אעשה לך כמו שעשינו לזקן פה למטה, נטפל בך היטב.",0,0,0,0,0,0,0,0,0,0
"משפחתו של הנאשם, על אף שהייתה מודעת למעורבותו בפלילים והביעה התנגדות לכך, המשיכה לתמוך בו ותומכת בו גם היום.",0,0,0,0,0,1,0,0,0,0
"משקל מסוים לקולה יינתן לעובדה שהיה זה הסוכן שיצר קשר עם הנאשם בשתי העסקאות,  אך יודגש כי לא מדובר במקרה של סוכן ""מדיח"",  ואף לא הועלתה  מצד ההגנה טענה בהקשר זה.",1,0,0,0,0,0,0,0,0,0
מששמע את השריקות הסיט הנאשם 1 את וילון החלון.,1,0,0,0,0,0,0,0,0,0
מתחם העונש ההולם צריך לנוע בין 28 ל-48 חודשי מאסר.,1,0,0,0,0,0,0,0,0,0
מתחם העונש ההולם –מדובר בעבירת סחר בודדת לצד החזקת סמים לצריכה עצמית בכמות ובנסיבות שמתיישבות עם הפצת סמים.,1,0,0,0,0,0,0,0,0,0
"מתחם הענישה צריך להתייחס לעקרון ההלימה, הנוגע ליחס לערך החברתי המוגן, מידת הפגיעה בו, נסיבות ביצוע העבירה ומידת אשמו של הנאשם, ומדיניות הענישה.",1,0,0,0,0,0,0,0,0,0
"מתחם הענישה – לפיכך, מתחם הענישה צריך לעמוד על בין 8 ל-20 חודשי מאסר.",1,0,0,0,0,0,0,0,0,0
"מתסקיר מיום 20.11.22 עלה שהנאשם יליד 1971, גרוש בשנית, כיום נמצא בזוגיות, אב לארבעה ילדים.",0,0,0,0,0,1,0,0,0,0
"מתסקיר משלים שהתקבל (10.6.24) בהמשך להחלטתי עולה כי במהלך תקופת הדחייה סיים הנאשם את הטיפול בהוסטל הקהילה וממשיך להתגורר בסמוך בדירת הבוגרים, לצד המשך עבודתו כמנהל הסעות.",0,0,0,0,0,1,0,0,0,0
"מתסקיר שירות המבחן מיום 10.7.23 עולה כי הנאשם בן 29, רווק, מתגורר בבית הוריו ועובד בעבודות מזדמנות בנגרות ושיפוצים וכן בעסק של הוריו.",0,0,0,0,0,1,0,0,0,0
"מתסקיר שירות המבחן מיום 19.5.24 עולה, כי הנאשם כיום בן 31 שנים, נשוי ובעל עסק למערכות קירור ומיזוג וחימום תת רצפתי.",0,0,0,0,0,1,0,0,0,0
"מתסקיר שירות המבחן שהתקבל בעניינו של הנאשם עלה כי זה כבן 27, רווק, בן להורים גרושים, עלה עם הוריו מאתיופיה בשנת 1997, סיים 12 שנות לימוד, סייע מגיל צעיר בפרנסת משפחתו, שוחרר משירות צבאי לאחר שירות של תקופה של שנתיים וארבעה חודשים, הוגדר כחייל בודד והתגורר בבית החייל, טרם מעצרו התגורר בגפו בדירה שכורה בקרית גת ועבד בעסק עצמאי לשליחויות.",0,0,0,0,0,1,0,0,0,0
מתסקירו עולה כי באותה תקופה הצליח במהלך מאסרו להגמל פיזית בכוחות עצמו אך עם שחרורו לא השתלב בהליכי טיפול.,0,0,0,0,0,1,0,0,0,0
"נאשם 1 (להלן – ""הנאשם""), הורשע על יסוד הודאתו בעובדות כתב אישום מתוקן, בעבירות שלהלן: יבוא סמים מסוכנים – עבירה לפי סעיפים 13 ו-19א לפקודת הסמים המסוכנים [נוסח חדש], תשל""ג-1973; אספקת סם – עבירה לפי סעיפים 13 ו-19א לפקודת הסמים המסוכנים; וניסיון לאספקת סם – עבירה לפי סעיפים 13 ו-19א לפקודת הסמים המסוכנים בצירוף עם סעיף 25 לחוק העונשין, התשל""ז-1977.",0,0,1,0,0,0,0,0,0,0
"נאשמים אלה נידונו לעבודות שירות ולשל""צ.",1,0,0,0,0,0,0,0,0,0
"נדמה, כי ריבוי סוגי הסמים מביא לעלייה בשימוש בסמים בכללותו.",1,0,0,0,0,0,0,0,0,0
"נוכח האמור, אני קובעת כי  מתחם הענישה נע בין מאסר על תנאי ועד 6 חודשי מאסר בפועל, בצד עונשים נלווים.",1,0,0,0,0,0,0,0,0,0
"נוכח האמור, ועל אף שבנסיבות אחרות מן הראוי היה להשית עונש של מאסר בפועל, אני סבורה כי בהתחשב בנסיבותיו החריגות מאד של הנאשם, האובדן הקשה שחווה, שזעזע את חייו, כמו גם חלוף הזמן המשמעותי ביותר מאז העבירות, העונש הראוי לו הוא במאסר לתקופה המקסימלית בעבודות שירות.",0,0,0,0,0,1,0,0,0,0
"נוכח השיקום המשמעותי שעבר הנאשם, עתר הסניגור לסטות ממתחם העונש ההולם, ולהפנות את הנאשם לקבל חוות דעת הממונה על עבודות השירות.",1,0,0,0,0,0,0,0,0,0
נוכח זאת היה מקום להטיל על הנאשם עונש בתחתית המתחם בדמות עבודות שירות.,1,0,0,0,0,0,0,0,0,0
"נוכח כל האמור, ימוקם עונשו של הנאשם בתחתית השליש האמצעי של מתחם העונש ההולם.",1,0,0,0,0,0,0,0,0,0
"נוכח קבלת האחריות ושיתוף הפעולה, והרקע ממנו מגיעה הנאשמת, המליץ שירות המבחן על הטלת של""ץ בהיקף 300 שעות וכן צו מבחן.",0,0,0,0,0,0,0,0,1,0
"נוכח שיקולים אלו ציין את עמדתו לפיה על מתחם הענישה במקרה זה לנוע בין 9 חודשי מאסר לריצוי בעבודות שירות לבין 30 חודשי מאסר בפועל, ויש למקם את הנאשם בחלקו התחתון של המתחם ולהשית עליו 12 – 13 חודשי מאסר בפועל.",1,0,0,0,0,0,0,0,0,0
"נוסף על כך, בענייננו מדובר במי שמנהל אורח חיים נורמטיבי, ומאז פרוץ מלחמת חרבות ברזל, אף שירת תקופה ממושכת במילואים ותרם להגנת המדינה בשעתה הקשה.",0,0,0,0,0,1,0,0,0,0
"נוסף על כך, שקלתי כי לעבירה קדם תכנון, כאשר אף לאחר שנודע לנאשם על שחרור החבילה שהזמין מקולומביה ונתפסה בנמל התעופה, הוא נקט פעולות שונות על מנת לוודא שהחבילה תגיע לידיו בבטחה.",1,0,0,0,0,0,0,0,0,0
