text,reject,CIR_PUNISHMENT,CONFESSION,CIR_TYPE,CIR_ROLE,GENERAL_CIRCUM,CIR_AMOUNT,REGRET,RESPO,CIR_EQ
הנאשם הביע התעניינות בתואר מתקדם ויש לברך על כך אולם מדובר בתכנית כללית שעדיין לא התגבשה לכלל מציאות והעולם האקדמי מלא ופתוח למקצועות רבים כך שהקשר בינם לבין הרשעה מרוחק בשלב זה.,0,0,0,0,0,1,0,0,0,0
הנאשם הביע צער וביקש את סליחתו של הציבור ובית המשפט.,0,0,0,0,0,0,0,1,0,0
"הנאשם הביע רצון ומוטיבציה להשתלב בטיפול בתחום התמכרויות, נמצא מתאים להשתתף בתוכנית הכנה לטיפול והחל להשתתף בה.",0,0,0,0,0,1,0,0,0,0
"הנאשם הגיע לישראל בשעות אחר הצהריים של אותו היום, ואילו המזוודה הגיעה לישראל רק בטיסה מאוחרת יותר באותו ערב.",1,0,0,0,0,0,0,0,0,0
"הנאשם הגיע למרבית המפגשים הקבוצתיים של ההליך הטיפולי, לחלקם באיחור, על רקע לחצים בעבודה וקשיים אישיים.",0,0,0,0,0,1,0,0,0,0
הנאשם הדגיש כי הוא רוצה לחזור לשגרת חייו ולבנות לעצמו חיים נורמטיביים.,0,0,0,0,0,1,0,0,0,0
"הנאשם הוא אדם נעדר הרשעות קודמות, איש משפחה, אשר עורך מאמצים רבים להשיב חובות ולחזור ולפרנס את משפחתו בדרכים לגיטימיות.",0,0,0,0,0,1,0,0,0,0
"הנאשם הובא לדין בשתי הזדמנויות קודמות, והורשע בין היתר בביצוע עבירות שעניינן החזקת סמים לצריכה עצמית.",0,0,0,0,0,1,0,0,0,0
"הנאשם הודה אפוא בעובדות כתבי האישום המתוקנים (בתיק העיקרי ובתיק המצורף) והורשע, על יסוד הודאה זו, בעבירות שבהן הואשם כאמור.",0,0,1,0,1,0,0,0,0,0
"הנאשם הודה בעבירות המיוחסות לו בכתב האישום המתוקן בהזדמנות הראשונה, לקח אחריות על מעשיו וחסך זמן שיפוטי יקר.",0,0,1,0,0,0,0,0,1,0
"הנאשם הודה בעבירות ונטל עליהן אחריות, לא חזר לבצע עבירות וניכר כי ההליך הפלילי כמו גם מעצרו הקצר ושהייתו בתנאים מגבילים הרתיעו אותו.",0,0,1,0,0,0,0,0,1,0
הנאשם הודה בעובדות כתב האישום המתוקן במסגרת הסדר טיעון והורשע בעבירות 	שמופרטות בו.,1,0,0,0,0,0,0,0,0,0
"הנאשם הודה כי מדובר בהליך שיקום ארוך שלא יסתיים גם לאחר שיעזוב את ההוסטל, בכוונתו להשתלב בקבוצות ובטיפול פרטני.",0,0,0,0,0,1,0,0,0,0
"הנאשם הודה, כי בתקופה שקדמה לביצוע העבירות צבר חובות שאותם שילם באמצעות הלוואות שנטל מהשוק האפור.",0,0,0,0,0,1,0,0,0,0
"הנאשם הוזהר כי אי ביצוע צו המבחן וצו השל""ץ עלול להוביל להפקעתם ולהטלת כל עונש חלופי לרבות מאסר.",1,0,0,0,0,0,0,0,0,0
"הנאשם הוסיף, כי במהלך תקופה זו התמודד עם לחץ רגשי סביב יחסיו העכורים עם בני משפחתו, וכן היה נתון בקשיים כלכליים.",0,0,0,0,0,1,0,0,0,0
"הנאשם הוסיף, כי הוא מצוי כעת בהליכי טיפול ושיקום, ומשמש כתומך לאסירים וכמורה לעברית לכאלו שאינם יודעים קרוא וכתוב.",0,0,0,0,0,1,0,0,0,0
"הנאשם הורשע בשתי עבירות סחר והספקת סמים בצוותא, לפי סעיפים 13 ו-19א לפקודת הסמים המסוכנים [נוסח חדש], התשל""ג-1973 (להלן: ""פקודת הסמים"") ו-29(א) לחוק העונשין, התשל""ז-1977 (להלן: ""חוק העונשין""), ובעבירה של החזקת סם לצריכה עצמית, לפי סעיף 7(א) ו-(ג) סיפא לפקודת הסמים, כמפורט להלן:",0,0,0,0,0,1,0,0,0,0
"הנאשם הורשע לאחר ניהול הוכחות, בעבירות הבאות: ייצור, הכנה והפקת סמים מסוכנים, לפי סעיף 6 לפקודת הסמים המסוכנים [נוסח חדש], התשל""ג-1973 (להלן: ""הפקודה""); החזקת סם שלא לצריכה עצמית, לפי סעיף 7(א) ו-(ג) רישא לפקודה;  החזקת כלים המשמשים להכנת סם מסוכן או לצריכתו, לפי סעיף 10 רישא לפקודה.",1,0,0,0,0,0,0,0,0,0
"הנאשם הורשע על פי הודאתו בביצוע 7 עבירות סחר בסמים לפי סעיפים 13 ו-19א לפקודת הסמים המסוכנים; סיוע לסחר בסמים, לפי סעיפים 13 ו-19א לפקודה ו-31 לחוק העונשין, התשל""ז-1977, והחזקת סם שלא לצריכה עצמית, לפי סעיפים 7(א)(ג) רישא לפקודה.",0,0,1,0,0,0,0,0,0,0
"הנאשם הורשע על פי הודאתו, בעבירות המיוחסות לו בכתב אישום מתוקן (במסגרת הליך גישור שנוהל בפני סגנית הנשיאה דאז כב' השופטת ארגמן), בעבירות של הספקת סם מסוכן (ריבוי עבירות) – לפי סעיפים 13 + 19א לפקודת הסמים המסוכנים, (נוסח חדש) תשל""ג – 1973, נהיגה בזמן פסילה – לפי סעיף 67 לפקודת התעבורה (נוסח חדש) תשכ""א – 1961, נהיגה ברכב ללא ביטוח – לפי סעיף 2א לפקודת ביטוח רכב מנועי (נוסח חדש) תש""ל – 1970 ונהיגה ללא רישיון נהיגה (פקיעה מעל שנתיים) – לפי סעיף 10(א) לפקודת התעבורה (נוסח חדש) תשכ""א - 1961.",0,0,1,0,0,0,0,0,0,0
"הנאשם הורשע, על סמך הודאתו, בשתי עבירות של סחר בסם מסוכן בניגוד לסעיף 13 + 19א לפקודת הסמים המסוכנים [נוסח חדש], תשל""ג – 1973 (להלן: ""פקודת הסמים המסוכנים"").",0,0,1,0,0,0,0,0,0,0
הנאשם החל לצרוך סמים ואלכוהול בגיל העשרה כדרך להתמודד עם קשייו.,0,0,0,0,0,1,0,0,0,0
"הנאשם היה אמון על הקשר עם הצרכנים וכן מסר את הסם בעצמו במקומות שונים; הוכיח נגישות לסם ויכולת לספק אותו תוך זמן קצר ללקוחות וכן החזיק ברשותו כמות שאיננה קטנה של קנאביס לצד משקל אלקטרוני, כשהוא מחולק וזמין למכירה, באופן המלמד על מעורבותו העמוקה בסחר.",0,0,0,0,1,0,0,0,0,0
הנאשם היה בן 18 שנים בלבד בעת ביצוע 		העבירות וקיבל אחריות מלאה על מעשיו.,0,0,0,0,0,1,0,0,0,0
הנאשם היה שותף מלא בתכנון ובהוצאה לפועל של העסקה ומעורבותו הייתה מרכזית.,1,0,0,0,0,0,0,0,0,0
"הנאשם העדיף את הטיפול הפרטי בקהילת ""מכורים לחיים"", אך פעם אחר פעם חזר לשימוש בסמים, לרבות חודשים ספורים לפני הדיון.",0,0,0,0,0,1,0,0,0,0
הנאשם הצטער על מעשיו.,0,0,0,0,0,0,0,1,0,0
"הנאשם השיב לשיחה: ""וואלה בסדר אחי עוד שעה אני בבית אני אחייג אליך פחות אפילו.",1,0,0,0,0,0,0,0,0,0
הנאשם השתלב בשוק העבודה מגיל צעיר בשל קשיים כלכליים במשפחתו.,0,0,0,0,0,1,0,0,0,0
"הנאשם התקשה להביע אמפטיה כלפי המתלונן, וכן ביחס לחלקים אלימים בהתנהלותו.",0,0,0,0,0,0,0,0,0,0
"הנאשם ודוד קבעו להיפגש בתלפיות על יד סניף רמי לוי בירושלים, שם נפגשו.",1,0,0,0,0,0,0,0,0,0
הנאשם ויונתן קבעו כי הנאשם ימכור לנחמן סם במשקל 2 גרם תמורת 300 ₪.,0,0,0,1,1,0,1,0,0,0
"הנאשם ומאיר קבעו, כי הנאשם ימכור לו סם במשקל 5 גרם תמורת 450 ש""ח, וכי שליח יפגוש במאיר ברחוב הרב שך 30 בביתר עילית.",0,0,0,1,1,0,1,0,0,0
"הנאשם יליד 6.10.92, בן 32 כיום ובן מעט פחות מ-30 בעת ביצוע העבירה.",0,0,0,0,0,1,0,0,0,0
"הנאשם יצהיר על התחייבות בסך 10,000 ₪ להימנע, בתוך שלוש שנים מיום שחרורו ממאסר, מכל עבירה המפעילה את אחד המאסרים המותנים בתיק זה.",0,1,0,0,0,0,0,0,0,0
הנאשם יתייצב ביום 20.8.24 בשעה 08:00 בבית כלא ניצן עם תעודת זהות לתחילת ריצוי העונש.,0,0,0,0,0,0,0,0,0,0
"הנאשם כבן 32, נשוי ואב לשלושה פעוטות.",0,0,0,0,0,1,0,0,0,0
"הנאשם לא 'רק' קנה סם לענות על צרכיו אלא סחר בסם, באמצעות טלגרם כלומר לא ברגע של היסח הדעת אלא מתוך תכנון.",0,0,0,0,1,0,0,0,0,0
הנאשם לא גויס בשל מעורבותו בפלילים.,0,0,0,0,0,1,0,0,0,0
הנאשם לא נענה לקריאות השוטרים ואלו דפקו שנית על דלת הכניסה עם פטיש.,1,0,0,0,0,0,0,0,0,0
"הנאשם לא פנה להמשך טיפול ביחידה לטיפול בהתמכרויות, וסמוך להגשת התסקיר הראשון פנה על דעת עצמו לקהילת ""מכורים לחיים"" והשתלב שם שוב בטיפול, אך עזב את המקום לאחר שהות קצרה.",0,0,0,0,0,1,0,0,0,0
"הנאשם לא שמר על יציבות במערכות החינוך, ככל הנראה בשל התמודדות עם הפרעות קשב וריכוז, וסיים לימודי תיכון במסגרת חיצונית.",0,0,0,0,0,1,0,0,0,0
הנאשם לקח אחריות מלאה על התנהלותו.,0,0,0,0,0,0,0,0,1,0
"הנאשם מגיע לקבוצה באופן סדיר, אמנם החמיץ מספר מפגשים אך על רקע סיבות מוצדקות.",0,0,0,0,0,1,0,0,0,0
"הנאשם מגיע מרקע נורמטיבי, סיים 12 שנות לימוד ושירת שירות צבאי מלא.",0,0,0,0,0,1,0,0,0,0
"הנאשם מוזהר בחובת שיתוף פעולה וכי אם לא יעשה כן, ניתן יהיה לבטל את הצו ולגזור עליו עונש אחר תחתיו.",0,0,0,0,0,0,0,0,0,0
הנאשם מוזהר כי אם לא ימלא אחר צו המבחן עונשו ייגזר מחדש.,1,0,0,0,0,0,0,0,0,0
הנאשם מוזהר כי אם לא ימלא אחר תנאי עבודות השירות הוא עלול לרצות עונש זה במאסר ממש.,0,0,0,0,0,0,0,0,0,0
הנאשם מוזהר כי עליו לעמוד בתנאי ההעסקה ובדרישות הממונה וכי כל חריגה מהכללים עלולה להביא להפסקת עבודות השירות וריצוי יתרת עונש המאסר מאחורי סורג ובריח.,1,0,0,0,0,0,0,0,0,0
הנאשם מוכר על ידי הביטוח הלאומי כנכה בשיעור של 68% והוא מקבל קצבת נכות.,0,0,0,0,0,1,0,0,0,0
הנאשם מפרנס עתה את אשתו ושלושת ילדיו הפעוטים שתלויים בו כלכלית.,0,0,0,0,0,1,0,0,0,0
הנאשם מצוי במעצר כ- 7 חודשים בגין העבירות נשוא תיק דנא.,1,0,0,0,0,0,0,0,0,0
"הנאשם מתמודד עם קושי כלכלי שנגרם על רקע בעיות רפואיות שונות, שבעטיין התקשה לתפקד ולא עבד – בשל תאונה וגניבת סחורה שרכש לעסקו, על רקע חובות להוצאה לפועל, לספקים ועוד.",0,0,0,0,0,1,0,0,0,0
"הנאשם מתקשה להציב לעצמו גבול פנימי ולהיענות לגבולות חיצוניים, מאופיין בדימוי עצמי נמוך ובתחושת נחיתות ונעדר כלים להתמודדות אדפטיבית עם מצבי דחק ומשבר.",0,0,0,0,0,1,0,0,0,0
הנאשם נולד בירושלים למשפחה המנהלת אורח חיים חרדי.,0,0,0,0,0,1,0,0,0,0
הנאשם נוצל בצורה צינית על ידי הגורמים ששלחו אותו לבצע את הבלדרות.,0,0,0,0,1,0,0,0,0,0
הנאשם נותן היום את הדין בגין עבירות שביצע לפני כשש שנים.,0,0,0,0,0,0,0,0,0,0
"הנאשם נלחם לשמור על הקן המשפחתי, למד מקצוע, מוצא זמן לשיעורי תורה, עובד על מנת לשלם חובותיו ומשקם עצמו.",0,0,0,0,0,1,0,0,0,0
"הנאשם סבל בשנות לימודיו בבית הספר מבעיות קוגניטיביות, משמעת והתנהגות, ואובחן כסובל מהפרעת קשב וריכוז.",0,0,0,0,0,1,0,0,0,0
"הנאשם סחר וסיפק סם מסוכן מסוג קוקאין במשקלים לא מבוטלים, בשתי הזדמנויות, לסוכן משטרתי לאחר שהאחרון פנה אליו.",0,0,0,1,1,0,0,0,0,0
הנאשם סיים 12 שנות לימוד.,0,0,0,0,0,1,0,0,0,0
"הנאשם סיים את הליכי הגמילה בהצלחה, כיום מתגורר בדירת בוגרים, מטופל ביחידה העירונית להתמכרויות ועובד בחברת הסעות.",0,0,0,0,0,1,0,0,0,0
"הנאשם סיפק וסחר בסם מסוכן מסוג קוקאין בשני אירועים לסוכן משטרתי וכן החזיק בסמים מסוכנים מסוגים שונים, הכוללים בין היתר קוקאין,  לצריכתו העצמית.",0,0,0,1,1,0,0,0,0,0
הנאשם סיפר כי הוא נוטל כדורים רבים מידי יום וברי כי נוכח מצבו הנפשי השהות במעצר קשה ומכבידה אף יותר.,0,0,0,0,0,1,0,0,0,0
"הנאשם סיפר שזו פעם ראשונה שהוא עובר הליך גמילה מסודר, בעבר הצליח להגמל בכוחות עצמו.",0,0,0,0,0,1,0,0,0,0
"הנאשם סירב להשתלב בקהילה טיפולית, אך הסכים להשתלב במרכז יום.",0,0,0,0,0,1,0,0,0,0
הנאשם עורך בדיקה פנימית ובעל יכולת להפיק תועלת מקשר טיפולי.,0,0,0,0,0,1,0,0,0,0
"הנאשם עצור מחודש מאי 2024, כחמישה חודשים, ובשל מצבו הבריאותי כאמור, התנאים אף קשים עבורו יותר.",0,0,0,0,0,1,0,0,0,0
"הנאשם ערך שימוש ביישומון טלגרם, שמשמש כפלטפורמה מוצפנת המאפשרת תקשורת אנונימית, וכן ווידא את זהותם של הקונים באופן המקטין את הסיכויים להיתפס על ידי מערכת אכיפת החוק.",1,0,0,0,0,0,0,0,0,0
הנאשם ציין שהוא הוציא רישיון חדש והוא זקוק לו לשם עבודתו.,0,0,0,0,0,1,0,0,0,0
"הנאשם קיבל אחריות מלאה למעשים, והביע נכונות לטיפול ששירות המבחן סבר שצריך להתמקד בשיפור יכולותיו של הנאשם להתמודד עם משברים וכן ביחס להתנהלות כלכלית מיטיבה.",0,0,0,0,0,1,0,0,1,0
הנאשם רווק בן 23 שנים.,0,0,0,0,0,1,0,0,0,0
"הנאשם שהה שם לסירוגין עד ספטמבר 2022, אז עזב לבית הוריו.",1,0,0,0,0,0,0,0,0,0
"הנאשם שולב בהליך טיפולי אינטנסיבי אשר כלל טיפול בהתמכרותו לסמים, הקניית הרגלי תעסוקה יציבים, מתן כלים להתנהלות כלכלית נכונה וזיהוי מצבי סיכון והימנעות מהם.",0,0,0,0,0,1,0,0,0,0
הנאשם שיתף את שרות מבחן אודות מצבו המשפחתי וכן היות בנו הצעיר בשלבי אבחון לגבי מוגבלותו בשל בעיות התפתחות.,0,0,0,0,0,1,0,0,0,0
"הנאשם שיתף כי הוא בחובות על סך של 200,000 ₪ לבנקים ולחברת אשראי.",0,0,0,0,0,1,0,0,0,0
הנאשם שיתף פעולה בטיפול והחל לגלות אחריות רבה יותר לחייו.,0,0,0,0,0,1,0,0,0,0
הנאשם שיתף שעזב את ערערה מאחר והסביבה החברתית משפיעה עליו ופוגעת בהליך שיקומו.,0,0,0,0,0,1,0,0,0,0
"הנאשם תיאר, כי החשיפה לטראומה גרמה לערעור יציבותו הרגשית ולמצוקה ורצון לגלות עוד פרטים באמצעי זה.",0,0,0,0,0,1,0,0,0,0
"הנאשם, בן 47, רווק, שוהה בהוסטל טיפולי של קהילת ""הדרך"" לטיפול והימנעות מהתמכרות.",0,0,0,0,0,1,0,0,0,0
"הנאשם, יליד 1994, הורשע על בסיס הודאתו ובמסגרת הסכמה דיונית, בעבירת יצוא, יבוא, מסחר, הספקה סמים מסוכנים – עבירה לפי סעיף 13 + 19א לפקודת הסמים המסוכנים (נוסח חדש) התשל""ג-1973, ועבירה של החזקה/ שימוש בסמים שלא לצריכה עצמית – עבירה לפי סעיף 7(א)+7(ג).",0,0,1,0,0,1,0,0,0,0
"הנאשם, כבן 29, נסיבות חייו האישיות והמשפחתיות אינן קלות, ולקשייו מילדות זיקה מלאה למעורבותו בעבריינות.",0,0,0,0,0,1,0,0,0,0
"הנאשם, סטניסלב טרבה (להלן: הנאשם), הורשע על פי הודאתו, בעובדות כתב אישום מתוקן המייחס לו עבירות של הספקת סמים מסוכנים – עבירה לפי סעיף 13 ו- 19א לפקודת הסמים המסוכנים (נוסח חדש) תשל""ג-1973 (להלן: פקודת הסמים) ; יצוא, יבוא, מסחר, הספקה של סמים מסוכנים – עבירה לפי סעיפים 13 ו- 19א לפקודת הסמים; החזקה/שימוש בסמים לצריכה עצמית – עבירה לפי סעיף 7 (א) ו- 7 (ג) סיפא לפקודת הסמים.",0,0,1,0,0,0,0,0,0,0
"הנאשם, צעיר בן 29 שנים, ולחובתו שתי הרשעות קודמות בעבירת רכוש (משנת 2013) ועבירה של החזקת סם מסוכן לצריכה עצמית (משנת 2018).",0,0,0,0,0,1,0,0,0,0
הנאשמת הודתה בכתב האישום המקורי ללא הסכמה עונשית ונשלחה לשירות המבחן.,0,0,1,0,0,0,0,0,0,0
"הנאשמת הוזהרה כי אי ביצוע צו המבחן וצו השל""ץ עלול להוביל להפקעתם ולהטלת כל עונש חלופי לרבות מאסר.",1,0,0,0,0,0,0,0,0,0
הנאשמת הייתה עצורה במסגרת חקירה מיום 2.2.2023 ועד ליום 12.2.2023 עת שוחררה בתנאים שנמשכו לאחר שהוגשו כתב האישום יחד עם בקשה להותרת התנאים המגבילים על כנם עד לתום ההליכים.,1,0,0,0,0,0,0,0,0,0
"הנאשמת נתפסה בכף כשברכבה נמצאו 17 יחידות סם MDMA מחולק לשקיות, MDMA במצב נוזלי במשקל 6.9 גרם, קוקאין במשקל 14.85 גרם וקטמין במשקל 2.8 גרם.",0,0,0,1,0,0,1,0,0,0
"הנאשמת סיפרה לי, טרם מתן גזר הדין, כי בזכות ההליך ובזכות מעורבות שירות המבחן, למדה, לראשונה בחייה, לבקש עזרה.",1,0,0,0,0,0,0,0,0,0
"הנזק שנגרם בפועל כתוצאה מביצוע העבירה איננו מאוד חמור, מאחר שבשל פעולתה היעילה של המשטרה הסמים נתפסו לפני שהופצו בפועל ברחבי מדינת ישראל, על כל הנזק הכרוך בכך.",1,0,0,0,0,0,0,0,0,0
"הנזק שנגרם מביצוע העבירות ופוטנציאל הנזק: אמנם לא נגרם נזק בפועל מביצוע העבירות על ידי הנאשם, בשים לב לעובדה כי הסם נמכר לסוכן משטרתי, אך ברור כי קיים פוטנציאל גבוה לגרימת נזק לציבור בכללותו לו הסם היה מגיע לציבור המשתמשים בסם.",1,0,0,0,0,0,0,0,0,0
הסדר הטעון מתייחס לתיקון כתב האישום ואינו כולל הסכמות לעניין העונש שיוטל על הנאשם.,1,0,0,0,0,0,0,0,0,0
"הסוכן המשטרתי פנה לנאשם 1 שעמד בפתח תחנת הסמים, ביקש לקנות סם מסוכן מסוג קוקאין בסכום של 100 ₪ והנאשם בתגובה ביקש ממנו להמתין, ירד לתחנת הסמים ונכנס פנימה.",0,0,0,1,0,0,1,0,0,0
הסוכן פעל תחת פיקוח ובהנחיית משטרת ישראל לצורך איסוף ראיות נגד סוחרי סמים באילת.,0,0,0,0,0,0,0,0,0,0
"הסכמה בדבר חילוט הרכב - ב""כ הצדדים הגיעו להסכמה, לה ניתנה ביום 3.6.24 תוקף של החלטה, לפיה היקף חילוט הרכב יעמוד על סך 17,000 ₪ וישולם באופן הבא: 15,000 ₪ מתוך כספים שהופקדו בקופת בית המשפט ו- 2,000 ₪ נוספים ינוכו מתשלום תגמולי ביטוח על סך 48,608 ₪, שקיבל הנאשם עבור רכב שנגנב.",0,1,0,0,0,0,0,0,0,0
הסם והתיק יושמדו  כשפסק  הדין יהיה חלוט.,0,1,0,0,0,0,0,0,0,0
"הסם נשלח בתוך חבילה בדואר (להלן: ""החבילה""), לכתובתו הפרטית של הנאשם כפי שמסר אותה לאיירו, רחוב בבא סאלי 21 דירה 8 בביתר עילית, וזאת באמצעות חברת השילוח UPS (להלן: ""החברה"").",1,0,0,0,0,0,0,0,0,0
"הסנגור ביקש להימנע מהרשעה ולחילופין לגזור על מרשו 500 שעות של""צ.",1,0,0,0,0,0,0,0,0,0
"הסנגור הדגיש, כי מעורבות הנאשם בהתרחשות האלימה המתוארת באישום הראשון, הינה מכוח ביצוע בצוותא, ולא משום שנקט במעשה אלים, פיזי או מילולי כלפי המתלונן, כך בהתאם לכתב האישום המתוקן, כאשר חלקו של הנאשם מתמצה בנהיגת כלי- הרכב, ולא מעבר לכך.",1,0,0,0,0,0,0,0,0,0
"הסנגור המלומד הדגיש את נסיבותיו האישיות של הנאשם, ואת הקשיים האישיים עמם הוא מתמודד.",0,0,0,0,0,1,0,0,0,0
הסנגור הציג פסיקה של מאסר בעבודות שירות למשך 9 חודשים ואולם לאחר עיון בפסיקה זו.,1,0,0,0,0,0,0,0,0,0
"הסנגור סבור כי בשים לב לסוג הסם ולנסיבות ביצוע העבירות, תחתיתו של מתחם העונש ההולם יא במאסר שניתן לרצות בעבודות שירות.",1,0,0,0,0,0,0,0,0,0
"הסנגור סקר בטיעוניו את ההליך השיקומי, השתלבות הנאשם ביחידה להתמכרויות, ובדיקות השתן הנקיות משרידי סם שמסר.",0,0,0,0,0,1,0,0,0,0
"הסנגור ער לכך שהתסקיר אינו מצביע על דרך שיקומית מרשימה, אולם מנגד ביקש לזקוף לזכותו של הנאשם את עדויות בני משפחתו שסיפרו על השינוי שחל בו בתקופה האחרונה בה שומר על ניקיון מסמים ואת העובדה שחזר לכשירות גם מבחינת ניהול העסק, כפי שמלמדות הזמנות של גופים גדולים איתם הוא עובד.",0,0,0,0,0,1,0,0,0,0
"הסנגורית הפנתה לפסיקה, ועתרה לקביעת מתחם עונש הולם כולל הנע בין חודשיים ועד 8 חודשי מאסר בפועל.",1,0,0,0,0,0,0,0,0,0
"הסניגור ביקש להסתפק במקרה דנא בענישה של 6-7 חודשי מאסר, או לכל היותר להשית על הנאשם ענישה ברף התחתון של מתחם העונש ההולם, קרי, 8 חודשי מאסר בפועל.",1,0,0,0,0,0,0,0,0,0
הסניגור הוסיף וציין כי מצבה הבריאותי של אמו של הנאשם אף הוא לא שפיר.,0,0,0,0,0,1,0,0,0,0
"העבירה הייתה חריגה לאורח חייו הנורמטיבי, והנאשם הסביר כי פעל מתוך רצון לרפא את עצמו מהפגיעה שעבר, ועסק ברצון לפתרונות מהירים וניסיון ריפוי עצמי ללא הבנה מספקת של חומרת העבירה, השלכותיה ומשמעויותיה.",0,0,0,0,0,1,0,0,0,0
"העבירות בוצעו אמנם ממניע כלכלי אך תרמו לכך שימוש בסם ומעורבות בחברה שולית, מכאן, שהפסקת השימוש בסם תרמה לשיקומו; הנאשם גילה מוטיבציה טיפולית גבוהה והשתלב באופן מוצלח בהליכים טיפוליים מגוונים; עוד הביע חרטה כנה ונטל אחריות מלאה על מעשיו.",0,0,0,0,0,1,0,1,1,0
"העבירות שבפני בוצעו שעה שתלויים ועומדים נגד הנאשם עונשי מאסר ופסילה מותנים, וגם בכך יש כדי להוות נסיבה לחומרה.",0,0,0,0,0,1,0,0,0,0
העונש המתאים לנאשם,1,0,0,0,0,0,0,0,0,0
העונש המתאים לנאשם – לא מצאתי לסטות ממתחם הענישה משיקולי צדק,1,0,0,0,0,0,0,0,0,0
