text,reject,CIR_PUNISHMENT,CONFESSION,CIR_TYPE,CIR_ROLE,GENERAL_CIRCUM,CIR_AMOUNT,REGRET,RESPO,CIR_EQ
ביקש להתחשב בתקופה הארוכה בה הנאשם נתון במעצר עד תום ההליכים  והדגיש את העובדה שתנאי מעצר קשים מתנאי מאסר כן הפנה לקשיים אותם עבר עת אמו קיבלה אירוע מוחי בזמן שהותו במעצר  והעובדה שלא נכח בחתונת אחותו.,0,0,0,0,0,1,0,0,0,0
"ביקש לקבוע מתחם עונש הולם אחד החל מ- 8 ועד 20 חודשי מאסר בפועל, ולמקם את עונשו של הנאשם במרכז של המתחם בניכוי ימי מעצרו.",1,0,0,0,0,0,0,0,0,0
"ביקשה להתחשב בנאשם, ולהחזירו לחיק משפחתו, לילדיו ולאורח חיים נורמטיבי.",1,0,0,0,0,0,0,0,0,0
בית המשפט המחוזי גזר את עונשו של הנאשם כדלקמן:,1,0,0,0,0,0,0,0,0,0
"בית המשפט המחוזי קבע מתחם עונש הולם אשר נע בין 30 - 48 חודשי מאסר בפועל והשית על הנאשמים עונשי מאסר בני  34 חודשים ו- 30 חודשים, וקנס של 50,000 ₪.",0,1,0,0,0,0,0,0,0,0
"בית המשפט העליון דחה את בקשת רשות הערעור ואמר בין היתר את הדברים הבאים: ""במקרה דנן, מצאו הערכאות הקודמות להתחשב בשיקולי השיקום בעניינו של המבקש, כמו גם בנסיבותיו האישיות המיוחדות, אך לא סברו, בצדק, כי החריגה ממתחם הענישה שנקבע בעניינו, מובילה לפטור מלא מעונש של מאסר לריצוי בפועל.",1,0,0,0,0,0,0,0,0,0
בית המשפט העליון מצא להפחית מעונשם 6 חודשי מאסר מטעמי שיקום;,0,0,0,0,0,0,0,0,0,0
בית המשפט חרג מן המתחם מטעמי שיקום והסתפק בענישה צופה פני עתיד לצד רכיבים נלווים.,1,0,0,0,0,0,0,0,0,0
בית המשפט מוצא להפעיל פסילת רישיון הנהיגה על תנאי בת 12 חודשים מגזר הדין ת/4 .,0,1,0,0,0,0,0,0,0,0
בית המשפט רשאי לחרוג ממתחם העונש ההולם בשל שיקולי שיקום או הגנה על שלום הציבור לפי סעיפים 40ד' ו40 ה' לחוק.,1,0,0,0,0,0,0,0,0,0
בכך הורשע הנאשם בהספקת סם מסוכן בצוותא עם אחר.,1,0,0,0,0,0,0,0,0,0
בכך הורשע הנאשם בסחר בסם מסוכן בצוותא עם אחר.,1,0,0,0,0,0,0,0,0,0
בכך לימד על חרטה והביא לחסכון בזמן שיפוטי יקר.,0,0,0,0,0,0,0,1,0,0
"בכך, יצר הנאשם פוטנציאל לפגיעה ממשית בשלום הציבור, במרקם החיים התקין בחברה ובפריון בעבודה, שכן אין צורך להכביר מילים בדבר השפעת שימוש בסמים מסוכנים על תפקודם של צרכני הסם.",1,0,0,0,0,0,0,0,0,0
"בכל הקשור לנוכחותה של הקטינה, טען כי אין בדבר כדי להוות נסיבה מחמירה מהטעם, שלא ניתן ללמוד מכתב האישום על טיב הקשר עם הקטינה, על מעורבותה או חשיפתה לעסקה, ואין להניח דבר לחובתו של הנאשם בהקשר זה.",1,0,0,0,0,0,0,0,0,0
"בכל הקשור לנסיבות הקשורות בביצוע העבירות נתתי דעתי למשקל הסם הגבוה שגודל (180 ק""ג); לכך שהנאשם גם החזיק סם שלא לצריכה עצמית בוילה במשקל של 7.48 ק""ג וזאת לצד ציוד רב ששימש לגידול הסם; להיערכות, להתארגנות ולתכנון שקדם לביצוע העבירות (שכירת וילה, הצטיידות בציוד מתאים, רכישת ידע, התחברות פיראטית לחשמל); לנזק הכספי המשמעותי שנגרם לחברת החשמל כתוצאה מגניבת החשמל; לנזק שעלול היה להיגרם לו הסם שגודל היה מופץ בשווקים; לנזק שעלול היה להיגרם כתוצאה מחיבור פיראטי לחשמל; לסיבה שהביאה את הנאשם לביצוע העבירה (רווח כספי מהיר בשל מצוקה כלכלית אליה נקלע) ולחלקו הבלעדי של הנאשם בביצוע העבירות.",0,0,0,0,1,1,1,0,0,1
בכרטיס אשראי באתר www.eca.gov.il,1,0,0,0,0,0,0,0,0,0
"במהלך חיפוש שביצעו השוטרים בוילה נמצאו בששה חדרים כ-700 שתילי סם מסוג קנבוס במשקל כולל של 180 ק""ג נטו אותם גידל הנאשם.",0,0,0,1,1,0,1,0,0,0
"במהלך שיחת תיאום בין הנאשם לחברה בעניין מסירת החבילה, ובעקבות חשדו של הנאשם, כי תוכנו האמיתי של המשלוח התגלה לרשויות, ביקש הנאשם מהחברה לשנות את שיטת מסירת המשלוח ממסירה ידנית בכתובתו לעיל, לאיסוף במכולת בעיר מגוריו.",1,0,0,0,0,0,0,0,0,0
במועד הרלוונטי לכתב האישום החזיק הנאשם טלפון נייד שמספרו 050-9064476 (להלן: הטלפון הנייד).,1,0,0,0,0,0,0,0,0,0
"במועד שמיעת פרשת העונש, הודיעו הצדדים על הגשת כתב האישום מתוקן נוסף (ת/2 – נושא גזר דין זה), במסגרתו תוקנו טעויות שנפלו בעובדות כתב האישום המתוקן ת/1, אך ללא שינוי בהוראות החיקוק בהן הורשע הנאשם.",1,0,0,0,0,0,0,0,0,0
"במועדים הרלבנטיים לכתב האישום החזיק הנאשם במספר טלפון: 055-9257367, וכן באפליקציית טלגרם ב-3 יוזרים שונים לממכר סמים.",1,0,0,0,0,0,0,0,0,0
"במועדים הרלוונטיים לעובדות כתב האישום, השתמש הסוכן בטלפון סלולרי שמספרו 054-6454608 ודים דנילוב (להלן: ""ודים"") השתמש בטלפון סלולרי שמספרו 055-3955795.",1,0,0,0,0,0,0,0,0,0
"במכלול הנסיבות כמפורט לעיל, אני סבור שנכון לגזור על הנאשם עונש מאסר בפועל לתקופה המצויה בין מרכז המתחם לחלקו התחתון.",1,0,0,0,0,0,0,0,0,0
"במכלול נסיבות אלה, ובשים לב לסוגי הסמים, לכמות הסם ולשילוב שבין עבירות הייבוא וההחזקה, ראוי לקבוע  מתחם עונש הולם הנע בין 27 ל-54 חודשי מאסר בפועל.",1,0,0,0,0,0,0,0,0,0
במכתב גם המלצה לשלבו בקורס בתחום התקנת מצלמות אבטחה.,1,0,0,0,0,0,0,0,0,0
"במסגרת ההליך דנן לא הופנה הנאשם לקבלת תסקיר, ולא הוצגו כל מסמך או חוו""ד שבכוחם להצביע על שינוי באורחותיו או על הפחתת הסיכון הנשקף לציבור מצדו.",0,0,0,0,0,1,0,0,0,0
"במסגרת החובות שנקלע אליהם, נטל הנאשם הלוואות בשוק האפור אותן התקשה לפרוע.",0,0,0,0,0,1,0,0,0,0
"במסגרת המאבק החברה בהתפשטות נגע הסמים – על מערכת המשפט להוקיע עבירות מסוג זה – תוך הטלת עונשים מחמירים, על אלו הבוחרים לעסוק בסמים.",1,0,0,0,0,0,0,0,0,0
"במסגרת הנסיבות שאינן קשורות לביצוע העבירה יש אף ליתן משקל למצבם הבריאותי של הורי הנאשם, כפי שפורטו בפני וזאת נוכח הפגיעה של העונש במשפחתו של הנאשם.",0,0,0,0,0,1,0,0,0,0
"במסגרת העסקאות מכר הנאשם סך הכול 100 גרם סם מסוכן מסוג קנאביס במחיר של 100 ₪ לגרם ו- 350 ₪ ל- 5 גרם, וזאת במספר הזדמנויות שאינו ידוע במדויק.",0,0,0,1,0,0,1,0,0,0
"במסגרת התסקיר הקהילתי, עמד שירות מבחן על חיוניות שילוב הנאשם בטיפול בהתמכרות כמוקד התערבות מרכזי.",1,0,0,0,0,0,0,0,0,0
"במסגרת התסקיר עומד שרות המבחן על כך שהנאשם מגיל צעיר חווה חסכים רגשיים רבים, ונחשף לחברה שולית ומעורבות פלילית של אחרים בסביבתו.",0,0,0,0,0,1,0,0,0,0
"במסגרת פיקוח המעצרים שולב הנאשם ביחידה לטיפול בהתמכרויות בבני ברק (בתקופה שבין 3/22 – 6/23), שם התמיד ושיתף פעולה.",0,0,0,0,0,1,0,0,0,0
"במעמד הכרעת הדין ביקש הסניגור לשלוח את הנאשם לשירות המבחן להכנת תסקיר, וביקש לבחון את שאלת ביטול הרשעת הנאשם, שהוא נהג מונית.",0,0,0,0,0,1,0,0,0,0
במעמד זה הנאשם העביר לו סם מסוג קנבוס במשקל גרם אחד תמורת 100 ₪.,0,0,0,1,1,0,1,0,0,0
"במעשיו המתוארים לעיל החזיק, גידל, ייצר, הפיק והכין הנאשם סם מסוכן מסוג קנבוס, שלא לצריכתו העצמית וללא רישיון מאת המנהל, החזיק ברשותו כלים להכנת סמים מסוכנים שלא בהיתר, ונטל הנאשם חשמל שלא כדין.",0,0,0,1,0,0,0,0,0,0
במקביל לטיפול עבד באופן רציף בסופרמרקט.,0,0,0,0,0,1,0,0,0,0
"במקביל לשליחת ההודעה למאור, בשעה 16:37 התקשר הנאשם לבצלאל, והשניים שוחחו במשך מספר דקות וקבעו להיפגש בביתו של בצלאל בערב למפגש, במסגרתו ישתמשו, בין היתר, בסם האיוואסקה, לצד חומרים אחרים שטיבם אינו ידוע למאשימה.",0,0,0,1,0,0,0,0,0,0
"במקרה דנן, מדובר בנאשם שאין זו הסתבכותו הראשונה בעבירות סמים, ואף ריצה עונש מאסר בגין הסתבכות קודמת.",0,0,0,0,0,1,0,0,0,0
"במקרה זה כאמור, סטה בית המשפט ממתחם הענישה שקבע, הנע בין 18 חודשי מאסר ועד 30 חודשי מאסר, והשית על הנאשם 12 חודשי מאסר בפועל וכן ענישה נלווית.",1,0,0,0,0,0,0,0,0,0
"במקרה זה נאשם 1, בסיוע נאשם 2 ששכר עבורו יחידת גג גדולה, הקים ""מעבדה"" לגידול קנבוס.",0,0,0,1,0,0,0,0,0,1
"במקרים רבים דווחו על התפרצויות של התנהגויות היסטריות ופסיכוטיות או התקפי חרדה, דיכאון ופאניקה.",1,0,0,0,0,0,0,0,0,0
במשך שמונה חודשים שיתף הנאשם פעולה עם גורמי הטיפול.,0,0,0,0,0,1,0,0,0,0
"בנוגע לאישום השני טענה ב""כ המאשימה כי מדובר בקטין, אולם נסיבה זו נעדרת מעובדות כתב האישום, אשר אמנם התייחס לקונה בראשי תיבות, כמקובל בנוגע לקטינים, אך ללא ציון תאריך הלידה המדויק אלא שנתון בלבד (2000).",1,0,0,0,0,0,0,0,0,0
"בנוסף הוסכם על חילוט סכום הכסף שנתפס בסך 1,740 ₪.",1,0,0,0,0,0,0,0,0,0
בנוסף התרשמו מהיעדר מיומנויות לניהול אורח חיים מאורגן  ויכולת לתפקוד במסגרות מקובלות.,0,0,0,0,0,1,0,0,0,0
"בנוסף לאמור, נתפס בוילה ציוד רב ששימש לגידול הסם.",0,0,0,0,0,0,0,0,0,1
"בנוסף עתרה המאשימה להטיל על הנאשם פיצוי בסך של 99,000 ₪  לחברת חשמל.",1,0,0,0,0,0,0,0,0,0
"בנוסף שקלתי שחלקו של הנאשם בביצוע העבירות הוא בלעדי, שכן הנאשם הזמין את הסמים המסוכנים לישראל, קיבל אותם לידיו באופן אישי, וניסה לספק אותם לחבריו ובהמשך לשבש את החקירה.",0,0,0,0,1,0,0,0,0,0
"בנוסף, ביקשה להטיל עליו עונשי מאסר על תנאי ארוכים ומשמעותיים, קנס כספי גבוה, פסילת רישיון נהיגה בפועל ופסילה מותנית.",1,0,0,0,0,0,0,0,0,0
"בנוסף, בתאריך 07.04.21 אותר הנאשם כשהוא נוהג במכונית וזאת על אף שרישיון נהיגתו פקע בשנת 2014 ובהיותו פסול לנהיגה מתאריך 11.07.18 מתוקף גזר דין שניתן בעניינו בתיק 11816-01-17.",0,0,0,0,0,1,0,0,0,0
"בנוסף, בתיק המצורף מדובר באיומים חמורים כלפי שוטרים.",1,0,0,0,0,0,0,0,0,0
"בנוסף, הנאשם בן 29, התארס לאחרונה, לקח אחריות באופן מיידי כבר בישיבה הראשונה.",0,0,0,0,0,1,0,0,1,0
"בנוסף, טען כי הנאשם עצמאי ומפרנס עיקרי, והטלת ענישה, ולו בדרך של עבודות שירות, תפגע בו ובמשפחתו המתהווה.",0,0,0,0,0,1,0,0,0,0
"בנוסף, יש ליתן גם משקל לחלוף הזמן הרב מאז ביצוע העבירות, בעיקר בהיבט זה שהנאשם לא שב לסורו ובכך ישנה אינדיקציה כי אמנם הוא מבקש לשנות את נתיב חייו.",0,0,0,0,0,1,0,0,0,0
"בנוסף, לחובתו		 26 הרשעות תעבורה קודמות (ת/2).",0,0,0,0,0,1,0,0,0,0
"בנוסף, סבל מלחץ דם גבוה, מאי ספיקת כליות, ואף עבר שבץ מוחי.",0,0,0,0,0,1,0,0,0,0
"בנוסף, סיפרה אשתו של הנאשם ואם ילדיו גב' דדון, על קשיי המשפחה הן בהיבט הכלכלי והן בהיבט המשפחתי.",0,0,0,0,0,1,0,0,0,0
"בנסיבות אלה הוא הוכיח שהשתקם ולמצער כי קיים סיכוי של ממש שישתקם, כדרישת המחוקק.",0,0,0,0,0,1,0,0,0,0
"בנסיבות אלה יש למקם את עונשו מעט מתחת לאמצע מתחם העונש ההולם שנקבע, לצד מאסר על תנאי וקנס כספי, אשר ייקח בחשבון את עונש המאסר הממושך ואת היכולות הכלכליות הדלות.",0,0,0,0,0,0,0,0,0,0
"בנסיבות אלה, בשתי ההזדמנויות, הגיע הנאשם למקום בו קבע עם הקטינה, ברמלה, כשהוא 	רכוב על אופניו, מסר לה שקית ובה סם מסוג קנבוס, במשקל שאינו ידוע למאשימה במדויק, 	תמורת 100 ₪ בכל פעם.",0,0,0,1,1,0,0,0,0,0
"בנסיבות אלה, לאורך תקופה של שלושה חודשים ,בשבע הזדמנויות שונות, מכרו הנאשם 	והאח לבנימין, לסירוגין ביחד ולחוד, סם מסוכן מסוג קנבוס, במשקל שנע בין 1 גרם ל-3 	גרם בכל פעם, בתמורה כספית.",0,0,0,1,0,0,1,0,0,0
"בנסיבות אלו, ונוכח חלקו של הנאשם באירוע האלים, ביקש הסנגור לקבוע מתחם עונש הולם החל ממאסר על תנאי ועד מאסר למשך מספר חודשים אשר ניתן לבצעו בדרך של עבודות שירות.",0,0,0,0,0,0,0,0,0,0
"בנסיבות אלו, תוך מתן משקל לשיקולי הרתעת הרבים, אין בידי לקבל את עתירת ההגנה והמלצת שירות המבחן להסתפק בענישה שאינה כוללת מאסר ממש.",0,0,0,0,0,0,0,0,0,0
"בנסיבות האמורות בהתחשב בהליך טיפולי שנראה על פניו כהליך מדשדש ומתקדם באיטיות נוכח העובדה כי מוצע ע""י שירות המבחן צו מבחן של שנה, שלא ברור לאור התנהלות הנאשם כי יש בו די.",1,0,0,0,0,0,0,0,0,0
"בנסיבות, מאז יוני 2023 אין מידע עדכני אודות הנאשם.",1,0,0,0,0,0,0,0,0,0
"בסופו של יום, לאחר שנלקחו בחשבון חומרת העבירות, עברו הפלילי של הנאשם, התמכרותו לסמים, העדר מוטיבציה לטיפול אינטנסיבי בקהילה, ואת העובדה כי עומד תלוי כנגדו מאסר מותנה, המליץ שירות המבחן על הטלת ענישה מוחשית בדמות מאסר בפועל קצוב, וכן הומלץ לשלבו בהליך טיפולי בתחום ההתמכרויות בין כתלי הכלא, אם ירצה בכך.",0,0,0,0,0,1,0,0,0,0
בסמוך למועד הגשת התסקיר מסר הנאשם בשיחה טלפונית שנגמל בכוחות עצמו אך לא הגיע לבדיקה לאיתור ממצאי סמים שנקבעה עבורו.,0,0,0,0,0,1,0,0,0,0
"בסמוך לשעה 19:28 הגיע הסוכן למקום שציין הנאשם, הנאשם הגיע למקום מסר לסוכן 4.6621 גרם קוקאין וקיבל מהסוכן 2,300 ₪ בתמורה.",0,0,0,1,1,0,1,0,0,0
"בסעיף 20 להכרעת הדין, דנתי בטענת הנאשם כי הכסף המזומן שנתפס בביתו מקורו בהחזר הלוואה שנתן אביה של אשתו.",1,0,0,0,0,0,0,0,0,0
בעבירות סמים נסוגים השיקולים האישיים של העבריין מפני שיקולי הנזק הקשה שהשימוש בסם מביא על המשתמשים בו...,1,0,0,0,0,0,0,0,0,0
"בעבר טופל הנאשם במשך חצי שנה, שולב בהוסטל אך לא נמצאה לו עבודה מתאימה, ולאחר כ-3 חודשים הוריו קנו לו רכב והוא השתמש בו כדי לצאת ולהתחבר עם גורמים שוליים וחזר לשימוש בסמים, ולכן סולק מהמסגרת.",0,0,0,0,0,1,0,0,0,0
"בעניין זנזורי דחה בית המשפט העליון את ערעור המאשימה ואת הערעור שכנגד של נאשם 1 שהורשע בעבירות של קשירת קשר, שיבוש מהלכי משפט וייצור והפקה הכנה של סמים מסוכנים, והותיר על כנו עונש של 26 חודשי מאסר.",0,0,0,0,0,0,0,0,0,0
"בעניין עריכה ושינויים במסמכי פסיקה, חקיקה ועוד באתר נבו – הקש כאן",1,0,0,0,0,0,0,0,0,0
בעניינה של הנאשמת הוגש תסקיר אחד לעונש.,1,0,0,0,0,0,0,0,0,0
"בעניינו של הנאשם הוגש תסקיר מבחן, אביא מתוכנו בתמצית: הנאשם התקשה לקחת אחריות על ביצוע העבירות, ונקט בצמצום וטשטוש.",0,0,0,0,0,0,0,0,1,0
בעניינו של הנאשם הוגשו שני תסקירים (פברואר ומאי 2024).,0,0,0,0,0,0,0,0,0,0
בעניינו של הנאשם התקבל תסקיר שרות מבחן למבוגרים מיום 1.5.24 לפיו במהלך תקופת הדחיה הנאשם שמר על קשר רציף עם שרות המבחן והמשיך בטיפול.,0,0,0,0,0,1,0,0,0,0
"בעניינו של הנאשם התקבל תסקיר שרות מבחן למבוגרים מיום 27.11.23 לפיו עולה כי הנאשם השתלב בקבוצה ייעודית, דווח כי הנאשם נמצא בשלב ראשוני אך הביע מוטיבציה.",0,0,0,0,0,1,0,0,0,0
בעניינו של הנאשם מתקיימות מספר בלתי מבוטל של נסיבות לחומרה.,1,0,0,0,0,0,0,0,0,0
"בעקבות הפסקת השימוש בקוקאין חלים שינויים ברורים בהתנהגות המשתמש כגון תחושת נמנמת, חוסר שקט, חרדה, דיכאון, וירידה בפעילות הגופנית.",0,0,0,0,0,0,0,0,0,0
"בעקבות זאת, שלח איירו ביום 21.10.20 לנאשם בקבוק (להלן: ""הבקבוק"") המכיל 1,300 מ""ל סם האיוואסקה, המכיל סמים מסוכנים מסוג די.אם.טי והארמין (להלן: ""הסם"").",0,0,0,1,0,0,1,0,0,0
"בעקבות כך הסתיים הקשר הזוגי, דבר שהעמיק את דפוסי השימוש של הנאשם בסמים.",0,0,0,0,0,1,0,0,0,0
"בעקבות כך, ובמסגרת מעקבו של הנאשם אחר מיקומה, פנה הנאשם ביום 2.11.20 לחברת UPS בצ'אט באתר האינטרנט של החברה, ונמסר לו כי המשלוח נמצא בבדיקה במכס.",0,0,0,0,0,0,0,0,0,0
בעת מאסרו השני הבין את ההשפעה השלילית של סביבתו וניתק את הקשר עם גורמים שוליים אך עקב הקושי להשתלב בשוק העבודה והמצוקה הכלכלית חיפש דרך להשגת רווחים מהירים.,0,0,0,0,0,1,0,0,0,0
"בעת קביעת העונש המתאים בתוך מתחם העונש ההולם לקחתי בחשבון לקולא את 	הנתונים הבאים: הודאתו של הנאשם וחסכון בזמן שיפוטי; חלוף הזמן מיום ביצוע העבירות; 	הבעת חרטה וקבלת אחריות; גילו הצעיר של הנאשם בעת ביצוע העבירות, בן 18 שנים 	בלבד.",0,0,1,0,0,1,0,1,1,0
"בעת שהאחר היכה את המתלונן, הוא ביקש מהמתלונן שיסתכל עליו באומרו ""אתה זונה של מי?",1,0,0,0,0,0,0,0,0,0
"בפסיקת בית המשפט העליון נקבע, כי לנוכח החומרה הנודעת לעבירות הסמים בכלל, ולעבירות הקשורות בהפצת סמים בפרט, מן הראוי להחמיר בענישתם של עברייני סמים:",1,0,0,0,0,0,0,0,0,0
"בפתח דבריה ציינה ב""כ המאשימה כי על אף שבתיקים דומים טוענת היא למספר מתחמים, כשמדובר בקליינטים שונים ומועדים שונים, הרי שבשל חלוף הזמן ונסיבותיו של הנאשם, תטען היא למתחם אחד.",1,0,0,0,0,0,0,0,0,0
"בצד האמור, הצליח הנאשם להימנע מביצוע עבירות וחרף קשייו והשימוש שעשה בסמים, לרבות כאלה שנחשבים ""קשים"" כגון קוקאין והרואין, הוא לא הורשע בתיקים נוספים, כך שנראה שהורתע מההליך המשפטי.",0,0,0,0,0,0,0,0,0,0
בצד זאת נראה שלא עיבד תחושות ורגשות כואבים ומצא מענה במסגרת שולית.,1,0,0,0,0,0,0,0,0,0
בצד זאת ציין לקולה את הודאתו ונטילת האחריות.,0,0,1,0,0,0,0,0,1,0
"בצד עונש המאסר, יושתו עונשים נוספים בדמות מאסר על תנאי, פסילת רישיון נהיגה בפועל ועל תנאי, קנס משמעותי, וחילוט הכסף שנתפס על הנאשם.",1,0,0,0,0,0,0,0,0,0
"בקביעת מתחם העונש ההולם, על בית המשפט להתחשב בערך החברתי שנפגע, במידת הפגיעה בו, במדיניות הענישה הנהוגה ובנסיבות הקשורות לביצוע העבירה.",1,0,0,0,0,0,0,0,0,0
בקשר עם שירות המבחן הנאשם שולב בהליך טיפולי במסגרת שירות המבחן רק בחודש מרץ 2024 בשל קושי להשתלב בקבוצה אחרת והוא נמצא כעת בשלב ראשוני והתחלתי של ההליך.,1,0,0,0,0,0,0,0,0,0
"ברם, אין להתעלם מכך שבפסיקה אליה המאשימה הפנתה נדון עניינו של נאשם שבנוסף לכמות גדולה של קטמין, ייבא גם כמות גדולה מאוד של קוקאין.",0,0,0,1,1,0,0,0,0,0
"ברם, מתוך תקווה כי הודאתו המוקדמת מבטאת צעד ראשוני לקראת השתלבות חוזרת בטיפול במסגרת מאסרו, ועל מנת לעודד אותו להוציא לפועל את רצונו להשתלב בטיפול, גם אם מאחורי סורג ובריח, ולממש את כוונתו להשלים בהצלחה הליך של גמילה מהימורים, החלטתי שלא לעשות כן.",0,0,1,0,0,1,0,0,0,0
בשיחתו עם שירות המבחן ציין הנאשם כי הוא ביצע את העבירות לאחר שקיבל הצעה מגורם עברייני להעביר את המזוודה לישראל בתמורה למחיקת חוב כספי.,1,0,0,0,0,0,0,0,0,0
"בשים לב לאופי המעבדה, למיקום בו הוקמה והיקף הגידול- מידת הפגיעה בערכים המוגנים בינונית.",0,0,0,0,0,0,0,0,0,1
"בשים לב לאלה, ובנסיבות העניין, נמצא לגזור על הנאשם 36 חודשי מאסר בפועל, מאסרים על תנאי וקנס בסך 8,000 ₪.",0,1,0,0,0,0,0,0,0,0
"בשים לב לכל שנאמר בדיון בפניי, בהתחשב בהודאה שחסכה זמן שיפוטי רב ובהתחשב במכלול הנסיבות וכדי לא לגזור עונש נוסף שבעיקר ייפגע באשתו ובילדיו, החלטתי להסתפק ברכיבי ענישה אלו ולא גזרתי עליו עונש כספי.",0,0,1,0,0,1,0,0,0,0
"בשים לב למכלול הנסיבות, ומבלי להתעלם מהעבר המכביד והרלוונטי של הנאשם, אני סבור כי יש לגזור את העונש במקרה זה בחלק הנמוך של המתחמים, אך לא בתחתיתם.",0,0,0,0,0,1,0,0,0,0
בשים לב לנסיבות ביצוע העבירה ומדיניות הענישה הנוהגת אני קובעת כי מתחם העונש ההולם נע בין 10 חודשים לבין 26 חודשי מאסר בפועל.,1,0,0,0,0,0,0,0,0,0
