,verdict,text,part
116,ME-23-03-50998-340,ואמנם ניכרת בשנים האחרונות מגמת החמרה בענישה לשם מיגור עבירות אלו.,הערכים המוגנים ומתחם העונש ההולם
117,ME-23-03-50998-340,..,הערכים המוגנים ומתחם העונש ההולם
118,ME-23-03-50998-340,"להלן פסיקה שקדמה לתיקון 140 לחוק העונשין, אשר יש לאבחנה בהתאם לנסיבות כל מקרה, ובהתאם להיעדר עונש מזערי אותה עת.",הערכים המוגנים ומתחם העונש ההולם
119,ME-23-03-50998-340,בעניינו של הנאשם חל תיקון 140 לחוק העונשין.,הערכים המוגנים ומתחם העונש ההולם
120,ME-23-03-50998-340,כאמור לעיל יש בתיקון זה כדי לבטא את הצורך בהחמרת הענישה.,הערכים המוגנים ומתחם העונש ההולם
121,ME-23-03-50998-340,"בקיומו של עונש מזערי לצד עבירה יש כדי להוות אינדיקציה למידת הפגיעה בערך המוגן, ולרף התחתון של מתחם העונש ההולם אשר יש לקבוע.",הערכים המוגנים ומתחם העונש ההולם
122,ME-23-03-50998-340,"כאמור קביעת המתחם קשורה בנסיבות ביצוע עבירה, אך לצד זאת גם בהוראה בדבר קיומו של עונש מזערי.",הערכים המוגנים ומתחם העונש ההולם
123,ME-23-03-50998-340,בשורת פסקי דין נקבע כי בעונש מינימום שנקבע בחוק יש כדי להשפיע על מתחם העונש ההולם.,הערכים המוגנים ומתחם העונש ההולם
124,ME-23-03-50998-340,"הדברים האמורים לעיל נפסקו ביחס לקיומו של עונש מזערי בסוג אחר של עבירות, אלם העיקרון זהה, שכן גם לפי סעיף 140(ז) לא יפחת העונש מרבע העונש המירבי שנקבע, אלא אם יש טעמים מיוחדים שירשמו.",הערכים המוגנים ומתחם העונש ההולם
125,ME-23-03-50998-340,"לאור האמור לעיל, ככלל קביעת מתחם עונש הולם אשר הרף התחתון בו נמוך מהעונש המזערי אשר נקבע בחוק, צריכה לטעמים מיוחדים המצדיקים זאת, ובהיעדרם, אין מקום לכך.",הערכים המוגנים ומתחם העונש ההולם
126,ME-23-03-50998-340,"לקביעת המחוקק בדבר קיומו של עונש מזערי השפעה על המתחמים שיש לקבוע, אשר הינם כאמור גם בכפוף ובהתאם לנסיבות ביצוע העבירה, וכן יש לכך השפעה על הענישה, שכן תיקון זה מבטא את הצורך בהחמרה, בשל החשיבות של ההגנה על הערכים המוגנים דלעיל, והצורך במענה עונשי הולם בפגיעה בהם.",הערכים המוגנים ומתחם העונש ההולם
127,ME-23-03-50998-340,"נסיבות ביצוע העבירה ע""י הנאשם אינן מקימות את הטעמים המיוחדים הנדרשים לקביעת מתחם ברף תחתון נמוך יותר.",הערכים המוגנים ומתחם העונש ההולם
128,ME-23-03-50998-340,"בחינת הנסיבות בכתב האישום המתוקן מביאה למסקנה כי הנאשם הינו גורם מרכזי בעסקה שבוצעה באקדח הזנקה שהוסב, ואשר מסוגל לירות תחמושת קליעית, יחד עם מחסנית תואמת ו – 8 כדורים, אשר לא תאמו את האקדח.",הערכים המוגנים ומתחם העונש ההולם
129,ME-23-03-50998-340,"הנאשם לא רק שמוסר את הנשק והתחמושת במסגרת העסקה, ומקבל את הסכום שהינו התשלום עבור האקדח והתחמושת, אלא שאף מסביר לסוכן כיצד הנשק עובד.",הערכים המוגנים ומתחם העונש ההולם
130,ME-23-03-50998-340,"כאמור, העבירה מבוצעת בביתו של הנאשם, והנאשם פונה אל הסוכן כמה פעמים קודם לכן.",הערכים המוגנים ומתחם העונש ההולם
131,ME-23-03-50998-340,"אינני מוצא כי בעובדה שמדובר בתיק שהנאשם קיבל מאחר, כדי להוות נסיבה אשר יש בה כדי להוות טעם מיוחד.",הערכים המוגנים ומתחם העונש ההולם
132,ME-23-03-50998-340,"הנאשם, לכל אורך העובדות המפורטות בכתב האישום המתוקן, הינו גורם מרכזי ביותר, לקיומה של העיסקה.",הערכים המוגנים ומתחם העונש ההולם
133,ME-23-03-50998-340,משכך הרף התחתון של המתחם אינו צריך להיות מתחת לעונש המזערי של 45 חודשי מאסר אשר נקבע בחוק.,הערכים המוגנים ומתחם העונש ההולם
134,ME-23-03-50998-340,"ואולם, כאמור לעיל, ב""כ המאשימה עתרו לקביעת מתחם עונש הולם שתחילתו ב – 42 חודשי מאסר, דהיינו מעט פחות מעונש המינימום.",הערכים המוגנים ומתחם העונש ההולם
135,ME-23-03-50998-340,"הגם שלא מצאתי הנמקה לירידה זו מתחת לעונש המזערי הקבוע בחוק, והגם שקביעת מתחם העונש ההולם הינה קביעה נורמטיבית של בית המשפט, לא מצאתי להחמיר מעבר לעתירת המאשימה, והרף התחתון יקבע כעתירתה, בשל כך שאינו נמוך משמעותית מהעונש המזערי, וכן לאור כך שמדובר למעשה בהחמרת המתחם אל מול מתחמים שנקבעו טרם כניסתו לתוקף של תיקון 140 לחוק העונשין, ויש בכך מידה מסויימת של הדרגתיות בהחמרה.",הערכים המוגנים ומתחם העונש ההולם
136,ME-23-03-50998-340,אשר על כן אני מוצא כי מתחם העונש ההולם לעבירה אשר ביצע הנאשם בנסיבות ביצועה כולל מאסר בפועל הנע בין 42 ל – 66 חודשים.,הערכים המוגנים ומתחם העונש ההולם
137,ME-23-03-50998-340,"מדובר בעבירה אשר יסוד כלכלי עומד בבסיסה, בנסיבות ביצועה.",הערכים המוגנים ומתחם העונש ההולם
138,ME-23-03-50998-340,בפסיקה דלעיל ניתן לראות כי לצד הענישה של מאסרים בפועל מוטלים גם קנסות.,הערכים המוגנים ומתחם העונש ההולם
139,ME-23-03-50998-340,"אין בפניי אינדיקציות של ממש למצבו הכלכלי של הנאשם, אשר רלוונטי לקביעת מתחם הקנס, ואולם לאור המאסר המוטל, מובן כי תהיה לכך השפעה כלכלית.",הערכים המוגנים ומתחם העונש ההולם
140,ME-23-03-50998-340,"לאור זאת, ולאור נסיבות ביצוע העבירה אשר במסגרתה שולם סך 27,000 ₪ עבור האקדח והתחמושת, אני קובע כי מתחם הקנס נע בין 25 ל – 50 אלף ₪.",הערכים המוגנים ומתחם העונש ההולם
141,ME-23-03-50998-340,"הנאשם יליד 1986 והוא נעדר עבר בעבירות נשק, ולחובתו כאמור עבירת החזקת סכין.",הענישה
142,ME-23-03-50998-340,"תסקיר שירות המבחן מציין היעדר הבעת נזקקות למענה טיפולי מצד הנאשם, ומתאר חוסר בהירות ברקע לביצוע העבירה, לצד השלכת מצבו על גורמים חיצוניים.",הענישה
143,ME-23-03-50998-340,"הנאשם נשוי ואב לשניים, קיבל אחריות על מעשיו, ובכך, לצד העובדה שמדובר בעבירת הנשק הראשונה שהוא מבצע, יש כדי שיקולים לקולא במסגרת המתחם.",הענישה
144,ME-23-03-50998-340,"אין בפני נימוקים אשר יכול ויהיה בהם להביא לירידה אל מתחת למתחם, בהיעדר הליך שיקומי, ובשים לב לעולה מהתסקיר.",הענישה
145,ME-23-03-50998-340,"לצד זאת, מדובר בעבירה אשר בענישה במסגרתה יש מקום לשיקולי הרתעת היחיד והרתעת הרבים.",הענישה
146,ME-23-03-50998-340,"מכל האמור אני מוצא כי על הענישה להיות מעל הרף התחתון של המתחם, אולם מתחת לאמצעו.",הענישה
147,ME-23-03-50998-340,"כך גם ביחס לקנס המוטל – עליו להיות מעל הרף התחתון, אך מתחת לאמצעו.",הענישה
148,ME-23-03-50998-340,"לאור כל האמור, אני גוזר על הנאשם את העונשים הבאים:",הענישה
149,ME-23-03-50998-340,"מאסר - מאסר בפועל לתקופה של 48 חודשים, בניכוי ימי מעצרו על פי רישומי שב""ס.",הענישה
150,ME-23-03-50998-340,מאסר על תנאי - מאסר על תנאי לתקופה של 18 חודשים.,הענישה
151,ME-23-03-50998-340,הנאשם יישא בעונש זה אם בתקופה של שלוש שנים מיום שחרורו יעבור על עבירת נשק מסוג פשע.,הענישה
152,ME-23-03-50998-340,מאסר על תנאי - מאסר על תנאי לתקופה של 9 חודשים.,הענישה
153,ME-23-03-50998-340,הנאשם יישא בעונש זה אם בתקופה של שלוש שנים מיום שחרורו יעבור על עבירת נשק מסוג עוון.,הענישה
154,ME-23-03-50998-340,"5129371קנס - קנס בסך  30 אלף ש""ח או מאסר למשך 120 יום תחתיו; הקנס ישולם ב- 30  תשלומים חודשיים שווים ורצופים.",הענישה
155,ME-23-03-50998-340,התשלום הראשון ישולם בתוך 120 יום מהיום ויתר התשלומים מידי 30 יום לאחר מכן.,הענישה
156,ME-23-03-50998-340,54678313זכות ערעור בתוך 45 יום מהיום.,הענישה
157,ME-23-03-50998-340,"ניתן היום,  כ' אדר א' תשפ""ד, 29 פברואר 2024, במעמד הצדדים.",הענישה
