text,CIR_PUNISHMENT,GENERAL_CIRCUM,CIRCUM_OFFENSE,reject,CIR_TYPE,CIR_AMOUNT,CIR_ROLE,CIR_EQ,REGRET,RESPO,CONFESSION
"הובהר לנאשם שמשמעות ההתחייבות היא, כי אם יעבור את העבירה בתוך התקופה שצוינה, בית המשפט שיגזור את הדין יהא חייב לחלט את ההתחייבות כקנס.",0.0015778707,3.0976702e-05,0.0004878897,0.9999869,0.0007208373,0.0009089702,0.002344225,0.014786005,0.014749401,0.00015439121,0.00062343647
מורה על השמדת הסמים והכלים שנתפסו.,0.9999347,3.379284e-05,0.99987197,9.1615e-06,0.0005666915,0.0012732828,0.009633207,0.45258754,0.016036186,0.00015540398,0.00022137522
"לבקשת המאשימה / הסניגור, מעכב את ביצוע העונש עד ליום .",0.24029453,3.199621e-05,1.9618463e-05,0.99998736,0.00052774826,0.0011078297,0.00047529562,0.0048631597,0.013837051,0.0001311343,0.00070630264
ערעור יוגש עד ליום     לבית המשפט המחוזי בירושלים.,0.009277817,3.1010222e-05,2.3062195e-05,0.99998724,0.0005304858,0.0012406542,0.0007363998,0.008098904,0.007038079,0.00010175706,0.00027830547
"לא יוגש ערעור במועד, יבוטל עיכוב הביצוע.",0.99991083,3.2631116e-05,2.4195722e-05,0.99998724,0.0005509324,0.0010143414,0.00053901627,0.021636711,0.007540758,0.00021515014,0.0004984313
"היה ויוגש ערעור כאמור, עיכוב הביצוע יעמוד בתוקף עד להכרעה בערעור.",0.003288883,3.0972627e-05,2.5129428e-05,0.99998724,0.00050636777,0.0011269164,0.0005693148,0.035420403,0.0047677816,0.0001641939,0.00033625355
יש לשלוח לשירות המבחן ולממונה על עבודות שירות.,0.87704,3.0531945e-05,1.7967164e-05,0.9999881,0.0005101475,0.0010895266,0.0004106948,0.003837513,0.0073426217,0.00013207032,0.00022464478
זכות ערעור כחוק לבית המשפט המחוזי בירושלים בתוך 45 יום מהיום.,0.9998791,3.06534e-05,2.3068505e-05,0.99998736,0.00039660966,0.0011630888,0.0004823304,0.016197722,0.006025638,0.00011142048,0.00039157827
"54678313ניתן היום,  י""ג ניסן התשע""ט, 16 יוני 2019, במעמד הנוכחים.",0.9976941,3.0228117e-05,3.6285877e-05,0.99998736,0.0006886251,0.0015023864,0.00066075695,0.14616431,0.019930124,0.00024977204,0.014380924
דוד שאול גבאי ריכטר 54678313,0.00020895041,3.240106e-05,2.2890083e-05,0.9999875,0.00047520638,0.0010531492,0.00095643743,0.3576151,0.00673718,9.725257e-05,0.0002766053
