feature_key,text,extraction
GENERAL_CIRCUM,"אחות הנאשם מאורסת לאדם בשם מוחמד, שהיה בן כיתתו של נאהד אבו מוך ז""ל (להלן - ""המנוח"").","['1 : לא', '2 : לא', '3 : לא', '4 : לא', '5 : לא', '6 : לא', '7 : לא', '8 : לא', '9 : לא', '10 : לא', '11 : לא']"
GENERAL_CIRCUM,"לנאשם רישום פלילי (ט/2), לפיו נדון ביום 30.5.2010 בבית משפט לנוער בחדרה, ללא הרשעה, בגין עבירה של תגרה במקום ציבורי מיום 6.2.2008 (עת היה כבן 17.5 שנים).","['1 : כן', '2 : לא', '3 : לא', '4 : לא', '5 : לא', '6 : לא', '7 : לא', '8 : לא', '9 : לא', '10 : כן', '11 : כן']"
GENERAL_CIRCUM,"המאשימה העידה לעניין העונש את אבי המנוח, מר פתחי אבו מוך, ואת אחי האב, מר וג'יה אבו מוך.","['1 : לא', '2 : כן', '3 : לא', '4 : לא', '5 : לא', '6 : לא', '7 : לא', '8 : לא', '9 : לא', '10 : לא', '11 : לא']"
GENERAL_CIRCUM,המנוח היה הבן השני מתוך שלושה בנים ובת.,"['1 : לא', '2 : לא', '3 : לא', '4 : לא', '5 : לא', '6 : לא', '7 : לא', '8 : לא', '9 : לא', '10 : לא', '11 : לא']"
GENERAL_CIRCUM,"האב העיד שכשנה לפני שנהרג נשא המנוח אישה, וכי אשתו, שהייתה בהריון, עזבה את הבית והפילה את עוברה.","['1 : לא', '2 : לא', '3 : לא', '4 : לא', '5 : לא', '6 : לא', '7 : לא', '8 : כן', '9 : לא', '10 : לא', '11 : לא']"
GENERAL_CIRCUM,בית המנוח סגור והמשפחה מתקשה להיכנס לבית.,"['1 : לא', '2 : לא', '3 : לא', '4 : לא', '5 : לא', '6 : לא', '7 : לא', '8 : לא', '9 : לא', '10 : לא', '11 : לא']"
GENERAL_CIRCUM,"משנתבקש לספר  על השפעת הטרגדיה על המשפחה סיפר האב כי ""אני לא חי"", לא עובד, עבר שני ניתוחי לב פתוח וחושב על המנוח.","['1 : לא', '2 : לא', '3 : לא', '4 : לא', '5 : לא', '6 : לא', '7 : לא', '8 : כן', '9 : לא', '10 : לא', '11 : לא']"
GENERAL_CIRCUM,"אמו של המנוח אינה מצליחה לישון בלילות, צועקת כי היא רוצה את בנה ונזקקת לטיפול פסיכולוגי.","['1 : לא', '2 : לא', '3 : לא', '4 : לא', '5 : לא', '6 : לא', '7 : לא', '8 : כן', '9 : לא', '10 : לא', '11 : לא']"
GENERAL_CIRCUM,"אחיו של המנוח, שהיה עד לאירוע, נמצא בטראומה.","['1 : לא', '2 : לא', '3 : לא', '4 : לא', '5 : לא', '6 : לא', '7 : לא', '8 : לא', '9 : לא', '10 : לא', '11 : לא']"
GENERAL_CIRCUM,"הדוד הוסיף ותאר כיצד נהרסה המשפחה ונפגע תפקודו של אחיו, אבי המנוח.","['1 : לא', '2 : לא', '3 : לא', '4 : לא', '5 : לא', '6 : לא', '7 : לא', '8 : כן', '9 : לא', '10 : לא', '11 : לא']"
GENERAL_CIRCUM,"שירות המבחן התרשם שקיים פער בין מהלך חייו הנורמטיבי של הנאשם עד האירוע, בהיותו ללא רקע פלילי חמור, נעדר דפוסי חשיבה עבריינים, תוקפניים ואלימים, לבין חומרת העבירה שביצע.","['1 : לא', '2 : לא', '3 : לא', '4 : לא', '5 : לא', '6 : לא', '7 : כן', '8 : לא', '9 : לא', '10 : לא', '11 : לא']"
GENERAL_CIRCUM,חלף זמן לא קצר מרגע הפגישה הראשונה ועד לשלב בו המית הנאשם את המנוח.,"['1 : לא', '2 : לא', '3 : לא', '4 : לא', '5 : לא', '6 : לא', '7 : לא', '8 : לא', '9 : לא', '10 : כן', '11 : לא']"
GENERAL_CIRCUM,במעשיו גרם הנאשם נזק בלתי הפיך למנוח ולבני משפחתו.,"['1 : לא', '2 : לא', '3 : לא', '4 : לא', '5 : לא', '6 : לא', '7 : לא', '8 : לא', '9 : לא', '10 : לא', '11 : לא']"
GENERAL_CIRCUM,"הנאשם אדם נורמטיבי לחלוטין, סיים 12 שנות לימוד עם בגרות מלאה, הקים משפחה ועסק ועבד כשנתיים עד למעצרו.","['1 : לא', '2 : לא', '3 : לא', '4 : לא', '5 : לא', '6 : לא', '7 : כן', '8 : לא', '9 : לא', '10 : לא', '11 : לא']"
GENERAL_CIRCUM,"בתום הטיעונים לעונש שב הנאשם והודה ""במעשה החמור שעשיתי"", הביע צער וחרטה, ביקש סליחה ממשפחת המנוח והביע תקווה שלא תדע יותר צער.","['1 : לא', '2 : לא', '3 : לא', '4 : כן', '5 : כן', '6 : לא', '7 : לא', '8 : לא', '9 : לא', '10 : לא', '11 : לא']"
GENERAL_CIRCUM,"בנסיבותיו של תיק זה, כעסו של הנאשם על המנוח בשל נהיגתו הפראית תוך השמעת מוסיקה בקול רם, הביא לטרגדיה איומה שהסתיימה במות המנוח.","['1 : לא', '2 : לא', '3 : לא', '4 : לא', '5 : לא', '6 : לא', '7 : לא', '8 : לא', '9 : לא', '10 : לא', '11 : לא']"
GENERAL_CIRCUM,המוות פגע קשות במשפחתו הגרעינית והמורחבת של המנוח.,"['1 : לא', '2 : לא', '3 : לא', '4 : לא', '5 : לא', '6 : לא', '7 : לא', '8 : לא', '9 : לא', '10 : לא', '11 : לא']"
GENERAL_CIRCUM,"אלמנתו הצעירה של המנוח עזבה את הבית והפילה את עוברה, והורי המנוח ואחיו טרם התאוששו מהטרגדיה הקשה שפקדה אותם.","['1 : לא', '2 : לא', '3 : לא', '4 : לא', '5 : לא', '6 : לא', '7 : לא', '8 : כן', '9 : לא', '10 : לא', '11 : לא']"
GENERAL_CIRCUM,הנאשם הוא צעיר כבן 23.,"['1 : לא', '2 : לא', '3 : לא', '4 : לא', '5 : לא', '6 : לא', '7 : לא', '8 : לא', '9 : לא', '10 : לא', '11 : לא']"
GENERAL_CIRCUM,"נטל אחריות על מעשיו, הביע צער וחרטה גם כלפי משפחת המנוח.","['1 : לא', '2 : לא', '3 : לא', '4 : לא', '5 : כן', '6 : לא', '7 : כן', '8 : לא', '9 : לא', '10 : לא', '11 : לא']"
GENERAL_CIRCUM,"עד לאירועי כתב האישום, חי הנאשם חיים נורמטיביים, סיים לימודי תיכון עם בגרות מלאה, הקים עסק ועבד בו במשך שנתיים עד מעצרו.","['1 : לא', '2 : לא', '3 : לא', '4 : לא', '5 : לא', '6 : לא', '7 : כן', '8 : לא', '9 : לא', '10 : לא', '11 : לא']"
GENERAL_CIRCUM,"הסתבכותו היחידה בעבר היתה בשל קטטה בה נטל חלק בעת שהיה תלמיד כיתה יב', בגינה נשפט בבית משפט לנוער, ללא הרשעה.","['1 : לא', '2 : לא', '3 : לא', '4 : לא', '5 : לא', '6 : לא', '7 : לא', '8 : לא', '9 : לא', '10 : כן', '11 : לא']"
CIR_STATUS_WEP,"כאן המקום לציין כי בפני שירות המבחן, הנאשם הודה במיוחס לו אך הוסיף כי משהבחין בקטטה ניגש אל המנוח על מנת להרחיקו כשאקדח טעון בידו וכי תוך כדי כך נפלט כדור מהאקדח ופגע בראשו של המנוח.","['נשק עם מחסנית בהכנס', 'נשק עם כדור בקנה']"
CIR_HELD_WAY_WEP,"עובר ליציאתם למקום המפגש החליט הנאשם לפגוע במנוח ולשם כך הצטייד באקדח ובתחמושת מתאימה (להלן - ""הנשק""), כל זאת ללא ידיעת מוחמד.",['על גופו']
CIR_HELD_WAY_WEP,"כאן המקום לציין כי בפני שירות המבחן, הנאשם הודה במיוחס לו אך הוסיף כי משהבחין בקטטה ניגש אל המנוח על מנת להרחיקו כשאקדח טעון בידו וכי תוך כדי כך נפלט כדור מהאקדח ופגע בראשו של המנוח.",['על גופו']
CIR_OBTAIN_WAY_WEP,"עובר ליציאתם למקום המפגש החליט הנאשם לפגוע במנוח ולשם כך הצטייד באקדח ובתחמושת מתאימה (להלן - ""הנשק""), כל זאת ללא ידיעת מוחמד.",['מאחר']
CIR_OBTAIN_WAY_WEP,בשלב זה הוציא הנאשם את הנשק והחל לירות לעבר עמאד בכוונה לגרום לו חבלה חמורה.,['מאחר']
CIR_OBTAIN_WAY_WEP,"במעשיו גרם הנאשם למות המנוח במעשה אסור, ניסה שלא כדין לפגוע באדם בקליע בכוונה לגרום לו לחבלה חמורה וכן נשא והוביל נשק אשר סוגל לירות כדור שבכוחו להמית אדם, בלא רשות על פי דין להחזקתו ונשיאתו.",['מאחר']
CIR_TYPE_WEP,"עובר ליציאתם למקום המפגש החליט הנאשם לפגוע במנוח ולשם כך הצטייד באקדח ובתחמושת מתאימה (להלן - ""הנשק""), כל זאת ללא ידיעת מוחמד.",['אקדח']
CIR_TYPE_WEP,"הנאשם הצטרף לקטטה ובמהלכה  ירה קליע אחד, שחדר לראש המנוח וגרם למותו.",['אקדח']
CIR_TYPE_WEP,"כאן המקום לציין כי בפני שירות המבחן, הנאשם הודה במיוחס לו אך הוסיף כי משהבחין בקטטה ניגש אל המנוח על מנת להרחיקו כשאקדח טעון בידו וכי תוך כדי כך נפלט כדור מהאקדח ופגע בראשו של המנוח.",['אקדח']
CIR_TYPE_WEP,"הסניגור ציין כי בדברי הנאשם לקצין המבחן בדבר פליטת כדור, הסביר כי לא כיוון את האקדח אל המנוח  וירה, אלא כי ההדק נלחץ תוך כדי המעורבות בקטטה.",['אקדח']
CIR_USE,"עובר ליציאתם למקום המפגש החליט הנאשם לפגוע במנוח ולשם כך הצטייד באקדח ובתחמושת מתאימה (להלן - ""הנשק""), כל זאת ללא ידיעת מוחמד.","['ירי', 'ניסיון לירי']"
CIR_USE,בשלב זה הוציא הנאשם את הנשק והחל לירות לעבר עמאד בכוונה לגרום לו חבלה חמורה.,"['ירי', 'ניסיון לירי']"
CIR_USE,"הנאשם הצטרף לקטטה ובמהלכה  ירה קליע אחד, שחדר לראש המנוח וגרם למותו.",['ירי']
CIR_USE,"במעשיו גרם הנאשם למות המנוח במעשה אסור, ניסה שלא כדין לפגוע באדם בקליע בכוונה לגרום לו לחבלה חמורה וכן נשא והוביל נשק אשר סוגל לירות כדור שבכוחו להמית אדם, בלא רשות על פי דין להחזקתו ונשיאתו.","['ירי', 'ניסיון לירי']"
CIR_USE,"כאן המקום לציין כי בפני שירות המבחן, הנאשם הודה במיוחס לו אך הוסיף כי משהבחין בקטטה ניגש אל המנוח על מנת להרחיקו כשאקדח טעון בידו וכי תוך כדי כך נפלט כדור מהאקדח ופגע בראשו של המנוח.","['ירי', 'ניסיון לירי']"
CIR_USE,"הסניגור ציין כי בדברי הנאשם לקצין המבחן בדבר פליטת כדור, הסביר כי לא כיוון את האקדח אל המנוח  וירה, אלא כי ההדק נלחץ תוך כדי המעורבות בקטטה.",['ירי']
CONFESSION,"במהלך שמיעת הראיות, הגיעו הצדדים להסדר טיעון בעקבותיו הודה הנאשם בעובדות כתב אישום מתוקן ובהתאם לכך הורשע בעבירות לפי סעיפים 298, 329 (א)(2) ו- 144(ב) לחוק העונשין התשל""ז – 1977 (להלן: חוק העונשין), קרי, הריגה, חבלה בכוונה מחמירה ועבירות בנשק.",['כן']
CONFESSION,"כאן המקום לציין כי בפני שירות המבחן, הנאשם הודה במיוחס לו אך הוסיף כי משהבחין בקטטה ניגש אל המנוח על מנת להרחיקו כשאקדח טעון בידו וכי תוך כדי כך נפלט כדור מהאקדח ופגע בראשו של המנוח.",['כן']
CONFESSION,בפתח הדיון הפנינו את תשומת לב הסניגור לך שלכאורה הדבר סותר את הודיית הנאשם בעובדות כתב האישום המתוקן.,['לא']
CONFESSION,"בתום הטיעונים לעונש שב הנאשם והודה ""במעשה החמור שעשיתי"", הביע צער וחרטה, ביקש סליחה ממשפחת המנוח והביע תקווה שלא תדע יותר צער.",['כן']
PUNISHMENT_ACTUAL,"הוא נדון ל-20 שנות מאסר בפועל, ובהתחשב גם במצבו הנפשי, הפחית בית המשפט העליון את  העונש ל-18 שנה בגין ההריגה, אליהם התווספו במצטבר 6 חודשי מאסר בגין הפציעה ובסה""כ 18.5 שנות מאסר.",['185 שנים']
PUNISHMENT_SUSPENDED,"שנתיים מאסר על תנאי למשך 3 שנים והתנאי הוא שהנאשם לא יעבור בתקופה זו עבירת אלימות מסוג פשע, או עבירות בנשק, ויורשע עליה.",['הנאשם קיבל 24 חודשי מאסר על תנאי']
