text,PUNISHMENT,GENERAL_CIRCUM,CIRCUM_OFFENSE,CIR_STATUS_WEP,CIR_HELD_WAY_WEP,CIR_PURPOSE,CIR_AMMU_AMOUNT_WEP,CIR_OBTAIN_WAY_WEP,CIR_TYPE_WEP,CIR_USE,CIR_PLANNING,RESPO,REGRET,CONFESSION,PUNISHMENT_ACTUAL,PUNISHMENT_SUSPENDED,PUNISHMENT_FINE
"חוק העונשין, תשל""ז-1977: סע'  40ד, 144 (א), 144 (ב2), (ג)(1), 340א",,,,,,,,,,,,,,,,,
"בכתב האישום שהוגש בתיק זה הואשם הנאשם בכך, שבמהלך חודש אוגוסט 2008, בעת שעבד כרתך במפעל אם.",,"['1 : לא', '2 : לא', '3 : לא', '4 : לא', '5 : לא', '6 : לא', '7 : לא', '8 : לא', '9 : לא', '10 : כן', '11 : לא']",,,,,,,,,,,,,,,
סי.,,,,,,,,,,,,,,,,,
"במעלות, הוא יצר כלי שסוגל לירות קליע שבכוחו להמית אדם (להלן: ""הנשק"") וזאת - בלא רשות על פי דין.",,,,,,,,,['תת מקלע מאולתר'],['ירי'],,,,,,,
"הנאשם החזיק את הנשק בביתו, ללא רשות על פי דין, עד ליום 15/8/11, שאז נתפס הנשק בחיפוש שערכה משטרת ישראל בביתו.",,,,,['בבית'],,,,,,,,,,,,
"כן מואשם הנאשם בכך, שבתאריך 11/8/11, במהלך חתונה בכפר פסוטה, הוא ירה מנשק חם, אותו החזיק ללא רשות על פי דין וזאת  - באזור מגורים וללא הסבר סביר.",,,,,,,,[],,['ירי'],,,,,,,
"בגין האמור לעיל הואשם הנאשם הוראות החיקוק כדלקמן"":",,,,,,,,,,,,,,,,,
"א.	עבירות בנשק (ייצור) - עבירה לפי סעיף 144 (ב2) + (ג)(1) לחוק העונשין, התשל""ז 	- 1977 (להלן: ""חוק העונשין"").",,,,,,,,,,,,,,,,,
ב.,,,,,,,,,,,,,,,,,
עבירות בנשק (החזקה) - עבירה לפי סעיף 144 (א) + (ג)(1) לחוק.,,,,,,,,,,,,,,,,,
ג.	יריות באזור מגורים - עבירה לפי סעיף 340א לחוק.,,,,,,,,,,,,,,,,,
"לאחר שמיעת ראיות התביעה וכן שמיעת עדותו של הנאשם ולאחר שהנאשם חזר בו מכוונתו להביא מומחה מטעמו, הודה הנאשם במיוחס לו בכתב האישום ובביצוע העבירות בהן הואשם, והורשע על פי הודאתו.",,,,,,,,,,,,,,['כן'],,,
"מתסקיר שירות המבחן, לענין העונש עולה, כי הנאשם הינו בן 38, רווק, ללא עבר פלילי, אדם חיובי, אשר עובד וחי חיים נורמטיביים.",,"['1 : לא', '2 : לא', '3 : לא', '4 : לא', '5 : לא', '6 : לא', '7 : כן', '8 : לא', '9 : לא', '10 : לא', '11 : לא']",,,,,,,,,,,,,,,
הוא אף נטל אחריות לביצוע העבירה והביע חרטה.,,,,,,,,,,,,,,,,,
"בגיל 18 כבר קיבל הנאשם רישיון לנשק, אולם בשנת 2011, עקב מחלת אביו, שנפטר בשנה זו ממחלת הסרטן, שכח לחדש את הרישיון.",,"['1 : לא', '2 : לא', '3 : לא', '4 : לא', '5 : לא', '6 : לא', '7 : לא', '8 : כן', '9 : לא', '10 : כן', '11 : לא']",,,,,,,,,,,,,,,
"שירות המבחן התרשם, כי מעצרו וההליך הפלילי מהווים עבורו גורם מזעזע ומרתיע.",,"['1 : כן', '2 : לא', '3 : לא', '4 : לא', '5 : לא', '6 : לא', '7 : לא', '8 : כן', '9 : לא', '10 : לא', '11 : לא']",,,,,,,,,,,,,,,
"לדעת שירות המבחן, הנאשם מסוגל להפיק לקחים מההליך, על משמעויותיו, ולתפקד באורח נורמטיבי בכוחות עצמו ואין הוא זקוק להליך טיפולי.",,"['1 : לא', '2 : לא', '3 : לא', '4 : לא', '5 : לא', '6 : לא', '7 : כן', '8 : לא', '9 : לא', '10 : לא', '11 : לא']",,,,,,,,,,,,,,,
"לפיכך, המליץ שירות המבחן להטיל על הנאשם עבודות של""צ בהיקף של 300 שעות וכן התחייבות כספית גבוהה ומאסר על תנאי משמעותי, לתקופה ארוכה.",,,,,,,,,,,,,,,,,
"הוגשו טיעונים בכתב וב""כ המאשימה השלים טיעונים בעל-פה.",,,,,,,,,,,,,,,,,
"ב""כ המאשימה מדגיש את המסוכנות אשר בייצור נשק ובהחזקתו ללא היתר וכן את המסוכנות אשר בירי במקום מגורים וטוען, כי ירי בחתונות מהווה מנהג פסול, המסכן חפים מפשע.",,,,,,,,,,[],,,,,,,
"כן הפנה ב""כ המאשימה לפסיקה, בה נגזרו עונשי מאסר של שנתיים ימים, על עבירות של אחזקת נשק וירי.",,,,,,,,,,,,,,,,,
"לטענתו, מתחם העונש ההולם, בנסיבות דנן, לגבי כל העבירות גם יחד, הוא בין 12 ל- 36 חודשי מאסר בפועל.",,,,,,,,,,,,,,,,,
"עוד טוען ב""כ המדינה, כי את נסיבותיו האישיות של הנאשם יש להביא בחשבון בתוך מתחם העונד ההולם והוא מבקש כי אדחה את המלצת שירות המבחן ואגזור על הנאשם מאסר בפועל, מאסר על תנאי וקנס מרתיע.",,,,,,,,,,,,,,,,,
"הסנגור טוען, כי לא הייתה לנאשם כל כוונה להשתמש בנשק למטרה פלילית או זדונית כלשהי וכי, למעשה, הוא טרם עשה שימוש בנשק.",,,,,,[],,,,[],,,,,,,
"לדבריו, השימוש הראשון שנעשה בנשק, נעשה במעבדת הנשק במטה הארצי של המשטרה ועובדה היא, כפי שעולה מחוות דעת המומחה שהוגשה מטעם התביעה, כי לאחר הירי הראשון שבוצע נשברה ידית הדריכה ולא ניתן היה עוד לירות בנשק.",,,,,,,,,,['ירי'],,,,,,,
"עוד טוען הסנגור המלומד, כי במדרגי החומרה של אחזקת נשק, נמצא המקרה דנן בדרגה הנמוכה ביותר, הוא מדגיש את העובדה שהנאשם קיבל היתר לשאת נשק עוד בהיותו כבן 18 שנים.",,"['1 : כן', '2 : לא', '3 : לא', '4 : לא', '5 : לא', '6 : לא', '7 : לא', '8 : לא', '9 : לא', '10 : כן', '11 : לא']",,,,,,,,,,,,,,,
"כן מציין הוא, כי הענישה הינה אינדיבידואלית וכי המלצת שירות המבחן תשרת טוב יותר את מטרות הענישה.",,,,,,,,,,,,,,,,,
"לדבריו, הנאשם, שאין לו כל עבר פלילי ואין הוא בעל דפוסי חיים עברייניים, לקח אחריות מלאה, מיד לאחר שנתפס ונחקר, הנאשם הביע תחושת חרטה אמיתית ומעצרו במשך 5 ימים, כמו גם ההליך המשפטי מהווים גורם מזעזע ומרתיע עבורו.",,"['1 : כן', '2 : לא', '3 : לא', '4 : כן', '5 : כן', '6 : לא', '7 : כן', '8 : לא', '9 : לא', '10 : לא', '11 : לא']",,,,,,,,,,,,,,,
"הוגש מכתב מכומר הכפר, המשבח את הנאשם ואת עזרתו לאחרים (ענ/1).",,,,,,,,,,,,,,,,,
"לפיכך, מבקש הסנגור שלא למצות את הדין עם הנאשם ולאמץ את המלצת שירות המבחן.",,,,,,,,,,,,,,,,,
הנאשם הביע התנצלות וחרטה וביקש את רחמי בית המשפט.,,,,,,,,,,,,,,,,,
מתחמי הענישה -,,,,,,,,,,,,,,,,,
אין חולק באשר לחומרה שבהחזקת כלי נשק ובירי באזור מגורים.,,,,,,,,,,,,,,,,,
שתי עבירות אלה באות להגן על שלום הציבור ומביאות לידי ביטוי את הערך החברתי של שלום האדם ובטחונו.,,,,,,,,,,,,,,,,,
"מתחם העונש ההולם, בנסיבות הספציפיות של המקרה דנן, לעבירה של ייצור הנשק ואחזקתו, הוא בין  6 חודשי מאסר, שאפשר שיבוצעו בעבודות שירות ובין עונש מאסר בן 12 חודשים.",,,,,,,,,,,,,,,[],[],[]
"החומרה שבהחזקת נשק שלא כדין, נגזרת מסוג הנשק וממטרת ההחזקה.",,,,,,,,,,,,,,,,,
"בב""ש 625/82 מחמוד נ' מדינת ישראל  (16.8.1982), נקבע מדרג של חומרה בהתייחס לעבירה של החזקת נשק, כאשר החזקתו לשם ביצוע מעשים, המיועדים לפגוע בביטחון המדינה או בביטחון הציבור, נמצאת בדרגת החומרה הגבוהה ביותר, החזקתו לצורך ספורט, ציד או שעשוע, במקום השישי, החזקה לשם אוסף, במקום השביעי ובמקום השמיני והאחרון מצויה החזקת נשק שפג תוקף רישיונו והנאשם נמנע מלחדש את הרישיון בעתו.",,,,,,,,,,,,,,,,,
"בהחלטה הנ""ל נקבע עוד, כי המקרים המנויים במקומות 5-8, אינם, בדרך כלל, בדרגת חומרה, המצדיקה מעצר עד תום ההליכים.",,,,,,,,,,,,,,,,,
"במקרה שבפניי אין מדובר בייצור נשק על מנת לעשות בו שימוש נגד אדם כלשהו, אלא לשם צייד וזאת - על ידי אדם אשר במשך כשני עשורים החזיק בנשק על פי היתר כדין, אשר את רישיונו שכח לחדש עקב מחלה קשה בה לקה אביו ועקב פטירת האב ממחלתו.",,"['1 : לא', '2 : לא', '3 : לא', '4 : לא', '5 : כן', '6 : לא', '7 : כן', '8 : כן', '9 : לא', '10 : כן', '11 : לא']",,,,,,"['מאחר', 'מצא']",,,,,,,,,
"זאת ועוד - מחוות דעת המומחה, שהוגשה מטעם התביעה (ת/1) עולה, כי ידית הדריכה של הנשק נשברה לאחר ירי של כדור אחד.",,,,,,,,,,[],,,,,,,
"אמנם, די בעצם העובדה שניתן היה לירות כדור אחד, כדי לכלול את הכלי בהגדרת ""נשק"", אולם, בהצטרף עובדה זו לכך שהנאשם לא יצר את הנשק לשם פגיעה בבני אדם, יש לכך משמעות לעניין המסוכנות ולעניין הנזק שהיה צפוי מביצוע העבירה ולכן גם לעניין מתחם העונש ההולם.",,,,,,,,,,,,,,,,,
"מתחם העונש ההולם לעבירה של ירי במקום מגורים, בנסיבות המקרה דנן, בהן הנאשם, בשמחת החתונה, ירה מספר יריות באוויר בנשק שנמסר לידיו ובו אחז לזמן קצר בלבד, הוא בין מספר חודשי מאסר לביצוע בעבודות שירות לבין מספר חודשי מאסר בפועל.",,,,,,,,,,['ירי'],,,,,,,
"פסקי הדין אליהם הפנה ב""כ המדינה ובהם נגזרו שנתיים מאסר בפועל, דנים במקרים חמורים בהרבה, בנסיבותיהם, הן לעניין ריבוי העבירות והן לעניין זהות הנאשמים ואין הם הולמים את נסיבות העבירות שבפניי.",,,,,,,,,,,,,,,,,
"לפיכך, לא ניתן לגזור מהם גזירה שווה לעניין מתחם העונש ההולם את נסיבות המקרה דנן, שהן נסיבות מיוחדות וחריגות.",,,,,,,,,,,,,,,,,
"גזירת העונש במתחמי הענישה, או בחריגה מהם  -",,,,,,,,,,,,,,,,,
"כאמור, הנאשם הינו אדם נורמטיבי, ללא עבר פלילי, העובד למחייתו ותורם לסביבתו.",,"['1 : לא', '2 : לא', '3 : לא', '4 : לא', '5 : לא', '6 : לא', '7 : כן', '8 : לא', '9 : לא', '10 : לא', '11 : לא']",,,,,,,,,,,,,,,
"הנאשם אמנם מעד, בעבירות לא קלות, אולם הוא לקח אחריות על מעשיו והביע חרטה, שלהתרשמותי הינה חרטה כנה.",,"['1 : לא', '2 : לא', '3 : לא', '4 : כן', '5 : כן', '6 : לא', '7 : כן', '8 : לא', '9 : לא', '10 : לא', '11 : לא']",,,,,,,,,,,,,,,
"בנסיבות אלה סבורה אני כי אין זה המקרה המתאים למשלוח מסר לציבור, באמצעות ענישה מחמירה, כפי שביקש ב""כ המאשימה.",,,,,,,,,,,,,,,,,
בשקילת העונש הראוי יש להביא בחשבון גם את העובדה שהנאשם היה עצור במשך 5 ימים ואת ההשפעה המרתיעה של ההליך המשפטי עליו.,,,,,,,,,,,,,,,,,
"לאור כך ולאור התרשמותו החיובית של שירות המבחן מהנאשם ודעתו, ההולמת גם את דעתי, לפיה שיקומו של הנאשם ייעשה בצורה הטובה ביותר, באמצעות עונש חינוכי של של""צ, בהיקף משמעותי ועונשים נלווים, כמפורט בתסקיר, סבורה אני, כי, יש להעדיף את שיקולי השיקום, לחרוג, במקרה זה, לקולא, ממתחם העונש ההולם (כפי שמתיר סעיף 40ד' לחוק העונשין) ולהסתפק בענישה המומלצת על ידי שירות המבחן.",,,,,,,,,,,,,,,,,
אשר על כן אני גוזרת עונשו של הנאשם כדלקמן:,,,,,,,,,,,,,,,,,
א.,,,,,,,,,,,,,,,,,
"אני מחייבת את הנאשם בביצוע עבודות של""צ בהיקף של 300 שעות, על פי תכנית שתיערך על ידי שירות המבחן.",,,,,,,,,,,,,,,,,
"אני משיתה על הנאשם מאסר על תנאי לתקופה של 7 חודשים והתנאי הוא, שבמשך 3 שנים מהיום לא יעבור עבירה מהעבירות בהן הורשע.",,,,,,,,,,,,,,,[],['7 חודשים'],[]
ג.,,,,,,,,,,,,,,,,,
"הנאשם יחתום על התחייבות על סך 10,000 ₪, שבמשך 3 שנים מהיום לא יעבור עבירה מהעבירות בהן הורשע.",,,,,,,,,,,,,,,,,
"שירות המבחן יגיש לביהמ""ש תכנית מלאה בנושא עבודות השל""צ, לא יאוחר מיום 5.11.13.",,,,,,,,,,,,,,,,,
מזכירות: לשלוח את גזר הדין לשירות המבחן ולקבוע תזכורת מעקב ליום 5.11.13.,,,,,,,,,,,,,,,,,
זכות ערעור לבית המשפט העליון בתוך 45 ימים מהיום.,,,,,,,,,,,,,,,,,
"54678313ניתן היום,  כ""ו תשרי תשע""ד, 30 ספטמבר 2013, בהעדר הצדדים.",,,,,,,,,,,,,,,,,
תמר שרון נתנאל 54678313,,,,,,,,,,,,,,,,,
