,verdict,text,part
75,ME-17-05-55639-212,"מרכזיותו ומעורבותו של המנוח בחייהם של כל אחד מבני המשפחה עומדת במרכזן של תחושות חוסר ואובדן, אשר הביאו לטלטלה בחיי המשפחה ובדינמיקה ביניהם.",תסקירי נפגע עבירה 
76,ME-17-05-55639-212,"צוין, כי ניכר שהם מתמודדים עם חווית החמצה משמעותית, על כל שיכול היה לקרות בקשר עם המנוח, אך לא יתגשם.",תסקירי נפגע עבירה 
77,ME-17-05-55639-212,"כמו כן תוארה הפגיעה באשת המנוח, הן במישור הנפשי, הן במישור המשפחתי-זוגי ובמישור הבריאותי.",תסקירי נפגע עבירה 
78,ME-17-05-55639-212,"תוארה הפגיעה בבניו של המנוח, עקב חסרונו של אביהם המורגש בחייהם והדאגה לאמם.",תסקירי נפגע עבירה 
79,ME-17-05-55639-212,"צוין עוד כי לאור האובדן, השבר והכאב שבני המשפחה חווים, ועל מנת להשיב להם חוויה ולו חלקית של שמירה ומוגנות והכרה בתוצאות הקשות של מעשי הנאשם, ההמלצה היא כי יוטל על הנאשם בין היתר פיצוי משמעותי למשפחת המנוח.",תסקירי נפגע עבירה 
80,ME-17-05-55639-212,"כפי שתואר לעיל ברקע להליך, מגזר הדין עולה כי הנאשם הורשע בכך שחטף את בנותיו הקטינות אשר היו במשמורת אימן ואף הוציא את בנותיו ממדינת ישראל לתאילנד, ורק בעקבות מבצע של משטרת ישראל בשיתוף עם גורמים בינלאומיים אותר מקומו של הנאשם, ושתי בנותיו הושבו לחזקתה של אמן.",רישום פלילי 
81,ME-17-05-55639-212,"לאחר שחזר לארץ, בסופו של דבר נעצר, נשפט ונדון במסגרת הסדר טיעון לעונש מאסר לתקופה של 17 חודשים, וכן למאסר על תנאי של 9 חודשים, אשר הוברר כי הוא אינו בר הפעלה בתיק זה.",רישום פלילי 
82,ME-17-05-55639-212,"ב""כ המאשימה טענה כי במסגרת קביעת מתחם העונש ההולם על בית המשפט להתחשב בערכים החברתיים אשר נפגעו בצורה קשה מביצוע העבירות על ידי הנאשם.",טיעוני המאשימה לעונש 
83,ME-17-05-55639-212,"באשר לעבירת ההמתה באחריות מופחתת, הרי שהנאשם במעשיו פגע בערכי היסוד של שלמות הגוף וקדושת החיים לאחר שנטל את חייו של קורבן חף מפשע בכוונה, ועל כן התוצאה המתבקשת והמתחייבת היא שלילת חירותו של מבצע העבירה לתקופה ממושכת.",טיעוני המאשימה לעונש 
84,ME-17-05-55639-212,באשר לאישום השני  הנוגע ל-ל' הודגש כי הנאשם פגע בצורה קשה בערך המקודש של חיי אדם וכן בערכים של כבוד האדם ושלמותו הגופנית והנפשית.,טיעוני המאשימה לעונש 
85,ME-17-05-55639-212,הפגיעה הינה קשה מאחר ול' הייתה כפסע ממוות וכן בשל החבלות שנגרמו לה וילוו אותה כל חייה כמו הצלקות בגוף ובנפש.,טיעוני המאשימה לעונש 
86,ME-17-05-55639-212,"אשר לפגיעה בבנותיו הקטינות של הנאשם, אשר היה אחראי עליהן, בכך שתקף את אמן בצורה אכזרית לעיניהן, נטען כי במעשיו פגע הנאשם בערכים של שלמות הגוף והנפש של הקטינות והזכות לחיות בשלווה מבלי להיפגע על ידי אחר.",טיעוני המאשימה לעונש 
87,ME-17-05-55639-212,"אשר להצתת ביתה של גרושתו של הנאשם בעוד בנותיה הקטינות בבית צוין, כי הערכים שנפגעו בעבירה זו הינם פגיעה באוטונומיה, שלמות הגוף, ביטחון הציבור ותחושת הביטחון האישית.",טיעוני המאשימה לעונש 
88,ME-17-05-55639-212,"צוין כי מעשי הצתה הינם מעשים מסוכנים הגורמים נזק לרכוש ולא פעם מסכנים חיי אדם, בשל אופייה הבלתי נשלט של האש.",טיעוני המאשימה לעונש 
89,ME-17-05-55639-212,"שורשיו של האיסור הפלילי להצתה נטועים בשורה של ערכים מוגנים, אשר המרכזיים שבהם: שמירה על חיי אדם ושלמותו הגופנית וכן שמירה על רכוש הזולת מפני פגיעה בלתי הפיכה בדמות שריפתו והשמדתו.",טיעוני המאשימה לעונש 
90,ME-17-05-55639-212,"אשר לערכים החברתיים העומדים בבסיס עבירות הנשק, הרי שהנאשם פגע בערך של הגנה על שלום הציבור ובטחונו וכן שמירה על גופו וחייו של אדם, וזאת בשל הסיכון הרב הטמון בשימוש בנשק.",טיעוני המאשימה לעונש 
91,ME-17-05-55639-212,"אשר לנסיבות הקשורות בביצוע העבירות עמדה ב""כ המאשימה על התכנון שקדם לביצוע העבירות, אותו ניתן ללמוד מן המסמכים אותם ערך הנאשם בכתב ידו, תוך שהפנתה לת/7 – מסמכים שכתב הנאשם, בהם סקר דרכי פעולה אפשריות ותכנן את מעשיו.",טיעוני המאשימה לעונש 
92,ME-17-05-55639-212,"בין היתר ציין הנאשם באותם מסמכים בכתב ידו את אפשרות חטיפת האקדח מן המנוח, גם אם זו תדרוש את חיסולו של המנוח.",טיעוני המאשימה לעונש 
93,ME-17-05-55639-212,כאשר בסופו של דבר הנאשם הוציא לפועל את מה שתכנן ואכן לקח מהמנוח את האקדח; וכי למעשה הנאשם הזמין את המנוח למשחק קלפים על מנת לרצוח אותו ולגנוב ממנו את האקדח.,טיעוני המאשימה לעונש 
94,ME-17-05-55639-212,"לאחר שקטל את המנוח, הצטייד הנאשם באקדח, בבקבוק שהכיל בנזין, ובאזיקונים ונסע לבית גרושתו.",טיעוני המאשימה לעונש 
95,ME-17-05-55639-212,"הנאשם איים עליה באקדח שלקח מן המנוח, ולאחר שלא הצליח להכניס את המחסנית לתוך הנשק עבר לתוכנית ב', הוציא את בקבוק הבנזין ושפך חלק מתכולתו על גרושתו בעודה מנסה לברוח ממנו.",טיעוני המאשימה לעונש 
96,ME-17-05-55639-212,"לאחר שגרושתו הצליחה לברוח מן הבית ובעוד בנותיו בבית איתו, שפך הנאשם חומר דליק בין הספות בסלון ושילח אש במזיד.",טיעוני המאשימה לעונש 
97,ME-17-05-55639-212,"הנאשם ברח מן הדירה בעוד האש מתלקחת, כשהוא מותיר את הבנות בתוך הבית.",טיעוני המאשימה לעונש 
98,ME-17-05-55639-212,"לעמדת ב""כ המאשימה, מן הרישומים עולה כי הנאשם ביצע את המעשים כפי שתכנן, כדי לחקור את גרושתו, כאשר כל האמצעים כשרים, וכאשר הוא מתאר בפרטי פרטים גם את אופן הפגיעה ואת השלכות הפגיעה בה תוך איומים על חייה.",טיעוני המאשימה לעונש 
99,ME-17-05-55639-212,אף ביחס לאישום השלישי צוין כי הנאשם תכנן את מעשיו כאשר העלה שני סרטונים ליוטיוב שם הסביר מה כוונותיו ומדוע הוא מבצע את מעשיו.,טיעוני המאשימה לעונש 
100,ME-17-05-55639-212,"הודגש, כי הנאשם הינו המבצע היחיד, אשר באמצעים שונים ובנחישות ניסה להוציא לפועל את מטרתו.",טיעוני המאשימה לעונש 
101,ME-17-05-55639-212,במסגרת טיעוניה ביקשה המאשימה ליתן דגש לנזק אשר נגרם מביצוע העבירות.,טיעוני המאשימה לעונש 
102,ME-17-05-55639-212,"באשר לאישום הראשון הודגש, כי אין נזק חמור יותר מאשר מותו של אדם חף מפשע.",טיעוני המאשימה לעונש 
103,ME-17-05-55639-212,"המאשימה הפנתה גם לאמור בהכרעת הדין, בחוות הדעת של נתיחת גופו של המנוח, לפיה הנאשם הוא זה שגרם למותו של המנוח באמצעות חץ מברזל ויתר הפגיעות המפורטות שם.",טיעוני המאשימה לעונש 
104,ME-17-05-55639-212,"עוד הפנתה המאשימה לנזק העולה מתסקירי נפגע העבירה של בני משפחתו של המנוח, המפרטים את השלכות האירוע על המשפחה ואת הנזק שנגרם להם כמערכת משפחתית כתוצאה ממעשיו של הנאשם.",טיעוני המאשימה לעונש 
105,ME-17-05-55639-212,"צוין כי בתסקיר מפורטת תמונת נזק קשה, כאשר גם בחלוף 6 שנים ממותו מתקשה המשפחה להתאושש מההלם ומהטלטלה ממותו של המנוח ומהגילוי כי מותו נגרם על ידי מי שהיה מכר של המנוח, לו הוא ניסה לסייע.",טיעוני המאשימה לעונש 
106,ME-17-05-55639-212,"אף שכלל בני המשפחה מצליחים לגייס כוחות לתפקוד תקין, הדבר אינו משקף את חווית המצוקה, הכאב והגעגוע המאפיינת את חייהם.",טיעוני המאשימה לעונש 
107,ME-17-05-55639-212,"עוד צוינה המלצת עורכת התסקיר להטלת פיצוי כספי משמעותי למשפחת המנוח, ונטען כי הנזק שנגרם למשפחת המנוח הינו עצום ומצוי ברף העליון.",טיעוני המאשימה לעונש 
108,ME-17-05-55639-212,"אשר לאישום השני, אף שנפגעת העבירה סירבה כי יוכן תסקיר קורבן בעניינה ובעניין בנותיה הקטינות, נטען כי סירובה נובע מכך שלא רצתה לחזור ולחוות שוב את הטראומה.",טיעוני המאשימה לעונש 
109,ME-17-05-55639-212,"על כן עדיין, לעמדת המאשימה, אין לפסוח על הנזק שנגרם לה ולבנותיה, נזק שייתן אותותיו לעוד שנים רבות.",טיעוני המאשימה לעונש 
110,ME-17-05-55639-212,"אשר לנסיבות נוספות הקשורות לביצוע העבירה אשר יכולות בהתאם לסעיף 40ט לחוק במקרים מסוימים להפחית את חומרת המעשה ואשמו של הנאשם, הרי בענייננו לא מתקיימת כל נסיבה כזו המפחיתה ממידת החומרה של המעשים שביצע הנאשם או את מידת אשמו.",טיעוני המאשימה לעונש 
111,ME-17-05-55639-212,"הודגש, כי במקרה זה האכזריות, האלימות וההתעללות של הנאשם בנפגעי העבירה או ניצולם (סעיף 40ט(א)(10)) וכן הנסיבה בסעיף 40ט(א)(11) לחוק העונשין הנוגעת ל""ניצול לרעה של כוחו או מעמדו של הנאשם או יחסיו עם נפגע העבירה"", הינן בעלות משקל מכריע בקביעת מתחם העונש ההולם ומגבירות את חומרת העבירה ואת אשמו של הנאשם.",טיעוני המאשימה לעונש 
112,ME-17-05-55639-212,כן טענה המאשימה כי מעשה הרצח של אבי אלתר הינו מעשה שנעשה באכזריות וברוטאליות.,טיעוני המאשימה לעונש 
113,ME-17-05-55639-212,"לאחר שהנאשם הצטייד בכלי רצח בביתו, דקר את המנוח, היכה אותו באלה ושפך על גופו חומצה במקומות שונים, ואף הותיר את המנוח חי בביתו ויצא מן הבית כאשר המנוח מתבוסס בדמו.",טיעוני המאשימה לעונש 
114,ME-17-05-55639-212,"אשר למדיניות הענישה ביחס לאישום הראשון, ציינה  ב""כ המאשימה כי נמצאה מעט פסיקה ביחס לעבירה של המתה באחריות מופחתת, וטרם התגבשה תמונה ברורה לעניין עבירה זו.",טיעוני המאשימה לעונש 
115,ME-17-05-55639-212,ובכל מקרה היה קשה למצוא מקרה בעל מסכת עובדתית דומה וכל כך קשה אשר כללה תכנון מפורט.,טיעוני המאשימה לעונש 
116,ME-17-05-55639-212,"באשר למדיניות הענישה בנוגע לאישום השני - עבירת ניסיון הרצח והעבירות הנוספות, צוין כי בתי המשפט עמדו לא אחת על החומרה היתרה בעבירות אלימות, בפרט כשהן מבוצעות לנגד עיניהם של בני משפחה.",טיעוני המאשימה לעונש 
117,ME-17-05-55639-212,"עבירת ניסיון רצח המבוצעת בתוך המשפחה הינה חמורה יותר, הן בשל הפגיעה בתא המשפחתי ובתחושת הביטחון, והן בשל המקום בו הוא התרחש בתוככי הבית, שאמור להיות מגן ומבצר למתגוררים בו.",טיעוני המאשימה לעונש 
118,ME-17-05-55639-212,"עוד צוין כי בעניין אחר נקבע כי ביצוע מעשה אלימות אל מול קטין מהווה עבירה של התעללות בקטין; אמנם במקרה זה לא הואשם הנאשם בעבירה זו אך יש לראות בכך כנסיבה לחומרה (ב""כ המאשימה הציגה פסיקה הנוגעת למדיניות הענישה אשר תסקר בהמשך).",טיעוני המאשימה לעונש 
119,ME-17-05-55639-212,"באשר לשאלה האם מדובר באירוע אחד שבגינו יש לקבוע מתחם אחד או שמדובר במספר אירועים טענה המאשימה, כי במקרה זה יש לקבוע מתחם עונש הולם לכל אישום בנפרד.",טיעוני המאשימה לעונש 
120,ME-17-05-55639-212,"זאת מאחר וכל אחד מהם מהווה מעשה נפרד, ולמעשה מדובר במעשים שונים באותו אירוע ומן הראוי שיינתן לכל אחד מהם משקל עצמאי ונפרד, כך שהאירוע מושא כתב האישום כולל לפחות שלושה מעשים.",טיעוני המאשימה לעונש 
121,ME-17-05-55639-212,באשר לעונש עצמו ביקשה המאשימה כי יוטל עונש כולל על ידי צבירת העונש בגין כל אחד מהאישומים.,טיעוני המאשימה לעונש 
122,ME-17-05-55639-212,מכאן עתרה המאשימה למתחמי ענישה כדלקמן: ביחס לאישום הראשון עותרת המאשימה למתחם שבין 18-20 שנות מאסר בפועל; בגין האישום השני עותרת המאשימה למתחם ענישה שבין 18-20 שנות מאסר בפועל וביחס לאישום השלישי עותרת המאשימה למתחם עונש הולם בין 2-4 שנות מאסר בפועל.,טיעוני המאשימה לעונש 
123,ME-17-05-55639-212,"בקביעת העונש בתוך מתחם העונש ההולם ביקשה המאשימה ליתן משקל להרתעת הרבים, וכן להרתעת הנאשם עצמו אשר לא בחל באמצעים להוציא לפועל את תוכניתו ויש ליתן לכך משקל משמעותי.",טיעוני המאשימה לעונש 
124,ME-17-05-55639-212,נטען כי מעשיו של הנאשם מלמדים על מסוכנותו הגבוהה כלפי גרושתו ובנותיהם וכלפי הציבור בכלל.,טיעוני המאשימה לעונש 
125,ME-17-05-55639-212,"צוין כי מעשיו של הנאשם בוצעו לאחר שהורשע בעבירות שבוצעו כלפי בנותיו, כאשר עוד בהיותו בתוככי הכלא החל לתכנן את נקמתו ואף זה שיקול לחריגה לחומרה ממתחם העונש ההולם לשם הגנה על שלום הציבור בהתאם לסעיף  40ה לחוק העונשין.",טיעוני המאשימה לעונש 
126,ME-17-05-55639-212,"בכל אלו יש לבסס חשש כבד ביחס למסוכנות הרבה של הנאשם, אשר בית המשפט מתבקש לאיינה בדרך של מיקום הנאשם ברף הגבוה של מתחמי הענישה.",טיעוני המאשימה לעונש 
127,ME-17-05-55639-212,"ביחס לעבירה של המתה באחריות מופחתת נטען כי במקרה זה יש להשית על הנאשם את העונש המקסימלי הקבוע בצידה של עבירה זו, נוכח קביעת בית המשפט בהכרעת הדין כי רצח המנוח על ידי הנאשם, בוצע בנסיבות הנושקות לאחריות מלאה, ונמצא ממש בצמוד לפליליות מלאה של המעשה, וכי יש מקום שהעונש ייתן ביטוי הולם וראוי ללקיחת חיי אדם.",טיעוני המאשימה לעונש 
128,ME-17-05-55639-212,"אשר לעבירות כלפי גרושתו של הנאשם, מבקשת המאשימה ליתן מקום לשיקולי הרתעה, בשל הגידול במספר הנשים החוות אלימות מצד בני זוגן.",טיעוני המאשימה לעונש 
129,ME-17-05-55639-212,עוד צוין כי המאשימה כבר לקחה בחשבון את מצבו הנפשי של הנאשם בעתירתה ביחס למתחמי הענישה.,טיעוני המאשימה לעונש 
130,ME-17-05-55639-212,"אשר לנסיבות שאינן קשורות בביצוע העבירה המנויות בסעיף 40יא לחוק העונשין, הרי שהנאשם לא הודה באף אחת מן העבירות אשר יוחסו לו בכתב האישום, למעט בעבירה של הצתת הרכב באישום השלישי, וכן הודה בביצוע של עבירות אלימות מינוריות יותר במתלוננת, אך הכחיש כל כוונה לגרום למותה והכחיש גם כוונה לגרום למותו של המנוח.",טיעוני המאשימה לעונש 
131,ME-17-05-55639-212,"כמו כן, הנאשם לא סיפק הסבר מניח את הדעת למעשיו כלפי המנוח והמתלוננת.",טיעוני המאשימה לעונש 
132,ME-17-05-55639-212,"ויותר מכך הנאשם לא לקח אחריות על מעשיו , ניסה להטיל את האחריות על המנוח וגרושתו, ניהל את ההליך עד תום ולא חסך מגרושתו וממשפחת המנוח את ההתמודדות עם ניהול ההליך.",טיעוני המאשימה לעונש 
133,ME-17-05-55639-212,"הנאשם אף לא שיתף פעולה על הרשויות, כאשר שמר על זכות השתיקה בחקירת המשטרה.",טיעוני המאשימה לעונש 
134,ME-17-05-55639-212,הנאשם לא עשה כל מאמץ לתיקון תוצאות העבירות ולפיצוי על הנזק שגרם.,טיעוני המאשימה לעונש 
135,ME-17-05-55639-212,"כמו כן יש לנאשם רישום פלילי, ומכל הטעמים הללו, סבורה המאשימה כי אין בנסיבותיו האישיות של הנאשם כדי להוות שיקול להקלה בעונשו.",טיעוני המאשימה לעונש 
136,ME-17-05-55639-212,"באשר לעונש ביקשה המאשימה למקם את עונשו של הנאשם ברף הגבוה של כל המתחמים, ומכאן עתרה להשית על הנאשם באישום הראשון 20 שנות מאסר וכך גם באישום השני, ובאישום השלישי עתרה לעונש של 4 שנות מאסר, תוך שעתרה להטיל את העונשים במצטבר, וכן להטיל על הנאשם מאסרים מותנים מרתיעים וממושכים ופיצוי גבוה ומשמעותי הן למשפחת המנוח והן לגרושתו של הנאשם ובנותיהם.",טיעוני המאשימה לעונש 
137,ME-17-05-55639-212,"בפתח דבריו ציין סנגורו של הנאשם כי מדובר בתיק שהוא טרגדיה למתלוננת, וגם למנוח ומשפחתו, אך גם לנאשם, בדגש על האישום השלישי, כאשר הנאשם בעצמו הוא אחד הקורבנות בתיק הזה בגלל מעשיו שלו ומצבו הנפשי.",טיעוני ההגנה לעונש 
138,ME-17-05-55639-212,"ביחס לאישום הראשון צוין, כי בלעדי ולולא ההפרעה הנפשית ממנה סובל הנאשם, הוא לא היה מבצע את העבירות באישום זה, והדבר עולה אף מחוות הדעת הפסיכיאטרית של פאנל המומחים, כאשר עיקר המחלוקת לא נגעה על עצם המעשה אלא לגבי מצבו הנפשי של הנאשם.",טיעוני ההגנה לעונש 
139,ME-17-05-55639-212,"עוד נטען כי מדיניות הענישה שהציגה המאשימה אינה מתייחסת למצבו הנפשי של הנאשם כבענייננו, ומעבר לכך המאשימה לא הפנתה לפסיקה הנוגעת להמתה באחריות מופחתת.",טיעוני ההגנה לעונש 
140,ME-17-05-55639-212,"כאשר מדובר במקרה בו העבירה בוצעה במצב נפשי בו ישנה בעיה ביכולת להימנע מהמעשה כמו בענייננו, הרי מידת האשמה פוחתת בצורה ניכרת.",טיעוני ההגנה לעונש 
141,ME-17-05-55639-212,"לכן לטענת הסנגור, מתחמי הענישה צריכים להיות שונים לגמרי מאלו להם טוענת המאשימה (בעניין זה הפנה לספר של פרופ' קרמניצר ופרופ' חאלד בעמ' 342).",טיעוני ההגנה לעונש 
142,ME-17-05-55639-212,"לדידו לאחר שהנאשם הורשע בהמתה באחריות מופחתת, על בית המשפט בשלב גזירת הדין להחליט עד כמה הפגם הנפשי משליך על העונש שצריך להיות מוטל על הנאשם.",טיעוני ההגנה לעונש 
143,ME-17-05-55639-212,אף ביחס לאישום השני צוין כי לא הייתה ממש מחלוקת עובדתית.,טיעוני ההגנה לעונש 
144,ME-17-05-55639-212,"העבירה העיקרית באישום זה היא עבירת ניסיון הרצח, ויתר העבירות כלולות בתוך המעשה עצמו.",טיעוני ההגנה לעונש 
145,ME-17-05-55639-212,"הגם שאין אחריות מופחתת בעבירה של ניסיון רצח, עדיין יש ליתן את הדעת למצבו הנפשי של הנאשם בעת גזירת דינו.",טיעוני ההגנה לעונש 
146,ME-17-05-55639-212,עוד נטען כי יש במקרה זה לחפוף את עונשו של הנאשם בגין עבירת ניסיון הרצח לעבירה בעניין הרצח.,טיעוני ההגנה לעונש 
147,ME-17-05-55639-212,ולכן המצב במקרה זה שונה מהפסיקה אליה הפנתה המאשימה ואף העונש צריך לשקף את אותו שוני.,טיעוני ההגנה לעונש 
148,ME-17-05-55639-212,"במסגרת טיעוניו הפנה ב""כ הנאשם לפסיקה בנוגע למדיניות הענישה אשר תסקר בהמשך.",טיעוני ההגנה לעונש 
149,ME-17-05-55639-212,"בהתייחס לנסיבות שאינן קשורות בביצוע העבירות ביקש ב""כ הנאשם כי בית המשפט יתן משקל לכך שלנאשם לקות נפשית שתלווה אותו גם בהמשך.",טיעוני ההגנה לעונש 
150,ME-17-05-55639-212,"עוד הוטעם כי בהתאם לפסיקה שהוגשה, אף שבית המשפט קבע את סוג העבירה בהתאם למצב הנפשי, משמע הרשיע את הנאשם בעבירה של רצח באחריות מופחתת, הרי מצבו הנפשי צריך להשליך גם על העונש הקונקרטי.",טיעוני ההגנה לעונש 
151,ME-17-05-55639-212,"עוד ביקש ב""כ הנאשם כי בית המשפט יתחשב במצבו הפיזי של הנאשם וכן בעובדה שהנאשם נמצא זמן רב במעצר, ושקודם האירועים ניהל הנאשם אורח חיים יצרני.",טיעוני ההגנה לעונש 
152,ME-17-05-55639-212,"מכל האמור טען ב""כ הנאשם כי המתחם הכולל בגין כלל האישומים צריך להיות בין 12 ל-22 שנות מאסר, כאשר יש לגזור על הנאשם עונש של  18 שנים, בהתחשב במצבו הנפשי והפיזי וביתר הנסיבות שאינן קשורות לביצוע העבירות.",טיעוני ההגנה לעונש 
153,ME-17-05-55639-212,בראשית דבריו ביקש הנאשם לפנות אל בנותיו וציין כי חשוב לו לומר שלא התכוון לפגוע באמן.,דברי הנאשם
