,verdict,text,part
240,ME-17-05-55639-212,"בתסקיר מפורטת הפגיעה בבני משפחתו של המנוח אשר ניכרת במישורים רבים בחייהם, הן במישור האישי, כאשר כל אחד מבני המשפחה ספג וחווה באופן אחר את הפגיעה הקשה ואת חסרונו הפתאומי של המנוח, והן במישור המשפחתי הכללי יותר.",אירוע אחד או כמה אירועים
241,ME-17-05-55639-212,"מעבר לאובדן אב המשפחה בפתאומיות, הרי הידיעה כי מי שנטל את חייו של אהובם, היה מכר של המשפחה לאורך שנים, מעצימה במובנים מסוימים את הפגיעה.",אירוע אחד או כמה אירועים
242,ME-17-05-55639-212,"מעבר לכך, אף הימשכותו של ההליך בעיקר בשל התנהלותו של הנאשם כפי שציינו בהרחבה בהכרעת הדין (ראו עמ' 8-12 ועמ'  32-34), העובדה שמשפחת המנוח מודעת לאופן בו הומת המנוח על ידי הנאשם באכזריות רבה, הסבו למשפחה כאב רב.",אירוע אחד או כמה אירועים
243,ME-17-05-55639-212,"אלו מתווספים לקושי הברור והמובן של משפחת המנוח לשמוע לאורך כל ההליך המשפטי הארוך אותו ליוו בדבקות את טענות הנאשם באשר למניעיו, האשמות שונות של הסנגורים השונים, בקשות לחילופי סנגורים אשר כל פעם מחדש משמעותן הייתה ביטול דיונים ועיכוב נוסף של ההליך המשפטי כדי לאפשר לסנגורים השונים להיכנס כל פעם מחדש לתיק.",אירוע אחד או כמה אירועים
244,ME-17-05-55639-212,"והכל כשהם מעוניינים באופן טבעי בהתקדמות ההליך המשפטי ובבירור הדברים ומיצוי ההליך והדין עם הנאשם, אשר מואשם ברצח המנוח אהובם.",אירוע אחד או כמה אירועים
245,ME-17-05-55639-212,"נסכם אפוא, כי הנזק שנגרם ממעשיו של הנאשם הינו קשה ורחב היקף, שכן הוא כולל פגיעה קשה בתחומים רבים בחיי כל בני המשפחה, ואובדן בלתי נתפס שקשה מאוד לקבל או להכיל של אב המשפחה.",אירוע אחד או כמה אירועים
246,ME-17-05-55639-212,"באשר לטענת ההגנה, כי יש להתחשב בגזירת העונש במצבו הנפשי של הנאשם, ובכך שהוא הורשע בעבירה של המתה באחריות מופחתת, תחת העבירה של רצח בנסיבות מחמירות שיוחסה לו בכתב האישום, אף בעת קביעת המתחם הרי אכן בין הנסיבות שצוינו בסעיף 40ט שעל בית המשפט להביא בחשבון מנויות שאלת מידת יכולתו של הנאשם להימנע מהמעשה ומידת השליטה על מעשיו ובחינת הקרבה לסייג לאחריות הפלילית, במקרים המתאימים.",אירוע אחד או כמה אירועים
247,ME-17-05-55639-212,"מהחומר שהובא בפנינו נראה כי לא הייתה כל פגיעה ביכולתו של הנאשם להבין את מעשיו או את הפסול שבהם; כך שנותר לבחון את השאלה של השפעת הקרבה לסייג של אחריות פלילית, והפגיעה ביכולתו להימנע מהמעשה או מידת שליטתו על מעשיו כתוצאה ממחלתו.",אירוע אחד או כמה אירועים
248,ME-17-05-55639-212,"ואולם, בשלב גזירת הדין, ניתן לשקול את מיקומו של הנאשם באזור הביניים האמור, כלומר, את עוצמת הגבלת יכולתו להבין את אשר הוא עושה או את הפסול שבמעשהו או להימנע מעשיית המעשה, או את מידת קרבתו לרף של פטור מאחריות פלילית.",אירוע אחד או כמה אירועים
249,ME-17-05-55639-212,"זאת, על-בסיס ההנחה כי סעיף 301ב(ב)(2) לחוק חל על קבוצת מקרים, שניתן למקמם על ציר שבין נשיאה באחריות פלילית מלאה והרשעה בעבירת הרצח, לבין קבלת פטור מאחריות פלילית, כאשר חלקם מצויים קרוב לקצהו הראשון של ציר זה, וחלקם מצויים קרוב לקצהו השני.",אירוע אחד או כמה אירועים
251,ME-17-05-55639-212,למיקומו של הנאשם על גבי מנעד זה בוודאי יש נפקות לשאלת העונש ההולם את מעשהו.,אירוע אחד או כמה אירועים
252,ME-17-05-55639-212,...,אירוע אחד או כמה אירועים
253,ME-17-05-55639-212,"ככל שמצבו הנפשי הפחית במידה רבה יותר את יכולתו של המערער להבין את אשר הוא עושה או את הפסול שבמעשהו [סעיף 300א(א)(1) לחוק] או להימנע מעשיית המעשה [סעיף 300א(א)(2) לחוק], כך תתקיים הצדקה להקלה משמעותית יותר בעונשו.״.",אירוע אחד או כמה אירועים
254,ME-17-05-55639-212,"בית המשפט העליון קבע אפוא, כי אין מניעה להתחשב בעניין הנפשי גם בשלב גזירת העונש, אך הדבר אינו מחויב ולבית המשפט שיקול דעת בעניין זה, והדבר ייקבע בהתאם למיקומו של הנאשם על המנעד שבין נשיאה באחריות פלילית מלאה לעבירת רצח, לבין קבלת הפטור.",אירוע אחד או כמה אירועים
255,ME-17-05-55639-212,"בעניינו של הנאשם קבענו בהכרעת הדין כי הגם שהנאשם סובל מהפרעה דלוזיונלית בשלה היו לו מחשבות שווא, הרי בוחן המציאות של הנאשם לא נפגע באופן רחב מחוץ ""לתחומי הדלוזיה""; ומכאן מדובר במצב פסיכוטי ממוקד הקשור לאותן מחשבות וכי: ""...",אירוע אחד או כמה אירועים
256,ME-17-05-55639-212,"קיים קושי לא מבוטל לדבר על אחריות מופחתת, כשהנאשם תכנן את מעשיו זמן רב, ועשה פעולות הכנה כה רבות, מחושבות ומכוונות מטרה.",אירוע אחד או כמה אירועים
258,ME-17-05-55639-212,אנו סבורים.,אירוע אחד או כמה אירועים
260,ME-17-05-55639-212,כי הנאשם תכנן את המעשים וביצע אותם כשהוא מבין את הפסול במעשיו ויכול היה להימנע מהם...,אירוע אחד או כמה אירועים
261,ME-17-05-55639-212,(ראו עמ' 88-89 להכרעת הדין).,אירוע אחד או כמה אירועים
262,ME-17-05-55639-212,"נוכח הקביעות הברורות בהכרעת הדין, לפיהן בענייננו מעשיו של הנאשם נמצאים ממש בצמוד לפליליות מלאה של המעשה; נוכח התכנון הרב של המעשים והעובדה שבוחן המציאות של הנאשם לא נפגע בכללותו; ומאחר שהנאשם לא סבר כי המנוח היה חלק מאותו מארג עברייני שהוא האמין בקיומו, אלא עשה את המעשה מתוך רצון לנקום ואף בשל רצונו להשיג את אקדחו של המנוח כדי לממש את תוכניותיו לפגיעה באחרים; וכשהוא  מודע היטב למעשיו ולפליליותם,  מצאנו כי כבר ניתן משקל מירבי למצבו הנפשי בעצם הרשעתו בעבירה של המתה באחריות מופחתת תחת עבירה של רצח בנסיבות מחמירות, כאשר הספק בעניין זה פעל לטובת הנאשם.",אירוע אחד או כמה אירועים
263,ME-17-05-55639-212,"על כן אנו סבורים, כי בשלב גזירת הדין יש ליתן לעניין זה משקל מועט מאוד, אם בכלל, זאת כאמור נוכח מיקומו של הנאשם על אותו מנעד - מיקום הקרוב ואפילו נושק לאחריות פלילית מלאה.",אירוע אחד או כמה אירועים
264,ME-17-05-55639-212,"אשר למדיניות הענישה הנהוגה - הרי המדובר במעשה המתה בנסיבות קשות וייחודיות – מחד נוכח האכזריות בה ביצע הנאשם את מעשה ההמתה כלפי המנוח חברו על לא עוול בכפו; העובדה שהמעשה נעשה באופן כה מחושב ומתוכנן, בקור רוח וכשהנאשם מראש מדבר על אפשרות של חיסול המנוח חברו כדי לקחת את אקדחו לשם המשך פגיעה באחרים.",אירוע אחד או כמה אירועים
265,ME-17-05-55639-212,"ומאידך נוכח מצבו הנפשי המורכב של הנאשם, והקביעות בהכרעת הדין ביחס לאותו סט של מחשבות שבו אחז הנאשם במסגרת אותה הפרעה דלוזיונלית.",אירוע אחד או כמה אירועים
266,ME-17-05-55639-212,"זאת ועוד, העבירה בה הורשע הנאשם בסופו של דבר של המתה באחריות מופחתת - הינה חלק מהרפורמה בעבירות ההמתה והתיקון לעבירות ההמתה אשר נחקק לאחרונה, ועל כן טרם התגבשה פסיקה רבה בנוגע לסעיף העבירה של המתה באחריות מופחתת, ולא מצאנו מקרה אשר ממנו ניתן ללמוד על מדיניות הענישה בעבירה זו ובנסיבות דומות לאלו שבפנינו.",אירוע אחד או כמה אירועים
267,ME-17-05-55639-212,"יוער כי אף המאשימה לא הפנתה לפסיקה ביחס לעבירה זו, כאשר צוין כי נוכח נסיבותיו הייחודיות של אישום זה קשה לאתר מקרים מתאימים.",אירוע אחד או כמה אירועים
268,ME-17-05-55639-212,ההגנה הפנתה מצדה לפסיקה להלן:,אירוע אחד או כמה אירועים
269,ME-17-05-55639-212,"נוכח האמור, לאחר ששקלנו את נסיבות המקרה שבפנינו, בהתחשב בערכים החברתיים שנפגעו כתוצאה מביצוע המעשים, במידת הפגיעה ועוצמתה הרבה, בנסיבות הקשות של ביצוע העבירה, במידת אשמו של הנאשם, ובמדיניות הענישה הנהוגה, מצאנו כי מתחם הענישה ההולם עומד על מנעד שבין 18-20 שנות מאסר בפועל.",אירוע אחד או כמה אירועים
270,ME-17-05-55639-212,מתחם העונש ההולם בגין האישום השני – ל' ובנותיה,אירוע אחד או כמה אירועים
271,ME-17-05-55639-212,"באישום זה הורשע הנאשם בעבירה של ניסיון רצח של גרושתו ל', בעבירה נוספת של תקיפה הגורמת חבלה ממשית בנסיבות מחמירות שאף היא נוגעת לאלימות שהפעיל כלפי ל', וכן בעבירת הצתה ועבירת נשק (החזקה, נשיאה והובלה).",אירוע אחד או כמה אירועים
272,ME-17-05-55639-212,"אשר לערכים החברתיים שנפגעו מביצוע העבירות, הנאשם במעשיו פגע בערך הבסיסי של קדושת החיים ובזכותה של המתלוננת לאוטונומיה ולשלמות גופה.",אירוע אחד או כמה אירועים
273,ME-17-05-55639-212,הנאשם ניסה לרצוח את ל' אשר הייתה בעבר בת זוגתו ואף תקף אותה באלימות כשהוא מטיח את ראשה בקיר וגורר אותה לכיוון הדלת.,אירוע אחד או כמה אירועים
274,ME-17-05-55639-212,"בתי המשפט עמדו רבות על החומרה הרבה המיוחסת למעשי אלימות כלפי נשים, בייחוד כאשר אותם מעשי אלימות נעשים בתוך התא המשפחתי.",אירוע אחד או כמה אירועים
275,ME-17-05-55639-212,עבירת ניסיון הרצח הינה עבירה חמורה ביותר אשר תוצאותיה יכול והיו קשות ביותר ויש בה פוטנציאל לנזק ופגיעה קשה ביותר בערך של קדושת החיים.,אירוע אחד או כמה אירועים
276,ME-17-05-55639-212,בית המשפט העליון עמד על חומרתן של עבירות רצח ועבירות ניסיון רצח המבוצעות כפי נשים על ידי בני זוגם או בני זוגם לשעבר:,אירוע אחד או כמה אירועים
277,ME-17-05-55639-212,הנה לנו אירוניה אכזרית.,אירוע אחד או כמה אירועים
278,ME-17-05-55639-212,"לצד התקדמות מסוימת בתחומים שונים לקראת שוויון מגדרי, יש כישלון מהדהד ומטריד בתחומים אחרים.",אירוע אחד או כמה אירועים
279,ME-17-05-55639-212,"המסקנה היא כי אין להניח הנחות נוחות ויש להיאבק נגד תופעות קשות בהקשר המגדרי בכל תחומי החיים גם, ובעיקר, אם הן מפתיעות בעוצמתן ובהיקפן.",אירוע אחד או כמה אירועים
280,ME-17-05-55639-212,המציאות היומיומית של אלימות נגד נשים ורצח נשים אינה גזירת גורל; ואין להשלים עימה.,אירוע אחד או כמה אירועים
282,ME-17-05-55639-212,"במעשיו פגע הנאשם אף בזכותן של ל' ובנותיהם לביטחון, בכך שהעבירה בוצעה בביתן שאמור להיות המקום הבטוח והמוגן עבורן, ותחת זאת הפך לפתע לזירה אלימה ומסויטת.",אירוע אחד או כמה אירועים
283,ME-17-05-55639-212,"החדירה למתחם הבטוח של ל' והבנות מומחשת בכך שבפעם הראשונה בה הנאשם ניסה להיכנס לביתן, ל' הורתה לבנותיה לא לפתוח את הדלת, ובכך שהוא נזקק לתחבולות על מנת להיכנס לבית, והגיע למקום מחופש לאדם דתי.",אירוע אחד או כמה אירועים
284,ME-17-05-55639-212,"הפגיעה מתעצמת בכך שעבירות האלימות וניסיון הרצח נעשו אל מול עיני בנותיהם הקטינות, כאשר בכך יש פגיעה נוספת בתחושת הביטחון הן של ל' והן של הבנות ובתא המשפחתי.",אירוע אחד או כמה אירועים
285,ME-17-05-55639-212,"אשר לעבירת ההצתה הרי מדובר בעבירה שבוצעה אף היא בנסיבות חמורות, תוך פגיעה ממשית בערכים המוגנים של קדושת החיים, בטחון אישי, והגנה על שלום הגוף והנפש וכן בזכות הקניין נוכח הפגיעה ברכוש.",אירוע אחד או כמה אירועים
286,ME-17-05-55639-212,"עבירה שבצידה עונש מאסר של 15 שנים, דבר המעיד על חומרתה.",אירוע אחד או כמה אירועים
287,ME-17-05-55639-212,"אף ביחס לעבירות הנשק, המדובר בנסיבות שיש בהן פגיעה נוספת בערכים חברתיים רבים, שכן מדובר במקרה בו הנשק נלקח מהמנוח אשר הנאשם קטל וגדע את עץ חייו בעודו באיבו, ולא רק שהחזיק ונשא את הנשק אלא אף עשה בו שימוש מאיים במעשה נוסף של נסיון לרצוח את גרושתו.",אירוע אחד או כמה אירועים
288,ME-17-05-55639-212,"במעשים אלו פגע הנאשם בעוצמה גבוהה בערכים החברתיים של שמירה על חיי אדם ותחושת הביטחון האישית, כאשר המתלוננת תיארה את הפחד והמורא שהיא חשה ואת הסכנה הרבה לחייה, וכן פגע בחשיבותם של סדרי חיים תקינים:",אירוע אחד או כמה אירועים
289,ME-17-05-55639-212,"אשר לנסיבות ביצוע העבירות, אף באישום זה הנאשם הוא המבצע היחיד של העבירות.",אירוע אחד או כמה אירועים
290,ME-17-05-55639-212,"אשר לתכנון שקדם לעבירות (סעיף 40ט(א)(1) לחוק העונשין) –מראיות שהובאו בפנינו עלה כפי שקבענו בהכרעת הדין, כי לעבירות קדם תכנון: הנאשם הגיע אל ביתה של ל' כשהוא מחופש וכשהוא נושא את נשקו של המנוח אותו המית לשם כך, וכשברשותו מחסנית ובקבוק עם חומר דליק.",אירוע אחד או כמה אירועים
291,ME-17-05-55639-212,"זאת לאחר שהגיע אל ביתה של ל' מוקדם יותר באותו היום, אך לא הצליח להיכנס אליו.",אירוע אחד או כמה אירועים
292,ME-17-05-55639-212,"אף מרישומיו של הנאשם אשר נמצאו בכיסו ניתן ללמוד על כוונתו ותכנונו לפגוע בל', כשכל האמצעים כשרים בעיניו, וכך הוא מתאר את אופן הפגיעה בל':",אירוע אחד או כמה אירועים
293,ME-17-05-55639-212,אני לא יכול להרשות לעצמי שתתלונני שאיימתי עלייך באקדח וכדי להיות בטוח שלא תתלונני את צריכה לספר לי את כל האמת על הפשעים שלך.,אירוע אחד או כמה אירועים
294,ME-17-05-55639-212,זה תעודת הביטוח שלך ושלי.,אירוע אחד או כמה אירועים
295,ME-17-05-55639-212,אם תתחכמי ותשקרי אז אשפוך עלייך חומצה.,אירוע אחד או כמה אירועים
296,ME-17-05-55639-212,אל תנסי אותי.,אירוע אחד או כמה אירועים
297,ME-17-05-55639-212,מה שתאמרי לי ישאר רק ביננו וככה אוכל לדעת שלא תתעללי בי יותר ואני אוכל לראות את הבנות בלי הפרעה.,אירוע אחד או כמה אירועים
298,ME-17-05-55639-212,אני יודע שהדימוי העצמי מאוד חשוב לך אבל את צריכה לחשוב.,אירוע אחד או כמה אירועים
299,ME-17-05-55639-212,לבחור בין חומצה על כל הפנים והראש לבין הדימוי.,אירוע אחד או כמה אירועים
300,ME-17-05-55639-212,"אני מבטיח שזה נשאר רק ביננו כי אחרת המשטרה תעצור אותי"" (מתוך רישומיו של הנאשם שנמצאו בכיסו, ת/7 סומן במקור א.ס. 700, עמ' 47 להכרעת הדין).",אירוע אחד או כמה אירועים
301,ME-17-05-55639-212,נסיבה נוספת לחומרה הינה האכזריות והאלימות שנהג הנאשם כאשר הוא מנסה בדרכים שונות לגרום למותה של ל' ולפגוע בה (סעיף 40ט(א)(10) לחוק העונשין).,אירוע אחד או כמה אירועים
302,ME-17-05-55639-212,"הנאשם הגיע לביתה של ל' ותחילה הצמיד אקדח לראשה, ולאחר שכשל בניסיונו להכניס את המחסנית, חנק אותה והטיח את ראשה בקיר ולבסוף אף שפך על גופה חומר דליק, אך זממו לא הושלם, שכן היא הצליחה לברוח מהזירה.",אירוע אחד או כמה אירועים
303,ME-17-05-55639-212,"התכנון המדוקדק, ההצטיידות בכלי משחית, והנסיון לרצוח את המתלוננת במספר דרכים, לרבות באמצעים אכזריים במיוחד, כמו שפיכת חומר דליק על גופה, עומדים ברף גבוה מאד של חומרה.",אירוע אחד או כמה אירועים
304,ME-17-05-55639-212,"לאחר כל אלו, הנאשם לא חדל ממעשיו, וגם לאחר שהמתלוננת ברחה מהבית, וכאשר הוא נותר לבדו עם הבנות, בנותיו שלו, הוא הוסיף ושפך חומר דליק ברחבי הבית והצית את ביתה של ל', וברח מהמקום כשהוא מותיר מאחוריו את בנותיו בתוך הבית.",אירוע אחד או כמה אירועים
305,ME-17-05-55639-212,אשר לנזק שנגרם מביצוע העבירות הרי שמן הראיות עולה כי לל' נגרמו חבלות גופניות (ראו ת/1).,אירוע אחד או כמה אירועים
306,ME-17-05-55639-212,"העובדה שלא הוגש תסקיר בעניינן של ל' ובנותיה אין בה כדי ללמד שלא נגרם נזק ממעשיו של הנאשם, וברי כי נגרם להן נזק נפשי ממשי.",אירוע אחד או כמה אירועים
307,ME-17-05-55639-212,"לגבי ל', ניתן רק לשער את הפחד והאימה שאחזו בה, עת הנאשם נכנס בעורמה לביתה, הצמיד אקדח לראשה וניסה לטעון אותו, ולאחר מכן שפך על גופה חומר דליק.",אירוע אחד או כמה אירועים
308,ME-17-05-55639-212,"ולגבי הבנות, נזכור כי בעבר הנאשם חטף את בנותיו אל מחוץ למדינת ישראל, וכעת הצית את ביתן וניסה לרצוח את אימן לנגד עיניהן.",אירוע אחד או כמה אירועים
309,ME-17-05-55639-212,המדובר בנזק שהשלכותיו מטבע הדברים יבואו לידי ביטוי גם בעתיד ואותו יום טראומטי ילווה אותן למשך כל חייהן.,אירוע אחד או כמה אירועים
310,ME-17-05-55639-212,"יש ליתן את הדעת גם לנזק אשר נגרם לרכוש, לדירתה של ל' ולדירות הסמוכות כפי שציינו  בהכרעת הדין בעניין זה: ""לא מצאנו ממש בגרסתו של הנאשם בהקשר זה, כי נוצרה אש קטנה שכובתה מיד, או כי הנזקים נגרמו בשל התעכבותם של כוחות הכיבוי.",אירוע אחד או כמה אירועים
311,ME-17-05-55639-212,כאמור בחוות הדעת.,אירוע אחד או כמה אירועים
312,ME-17-05-55639-212,(ראו עמ' 94 וכן סקירת חוות דעת דליקה בעמ' 47-48 להכרעת הדין).,אירוע אחד או כמה אירועים
313,ME-17-05-55639-212,"מעבר לכך יש לשקול את פוטנציאל הנזק – ובמקרה זה ברור שהייתה אפשרות שייגרם אף נזק חמור יותר לרכוש ולגוף, הן בעבירה של נסיון הרצח, שהנזק הפוטנציאלי הטמון בה הוא החמור ביותר; והן בעבירת ההצתה הטומנת בחובה פוטנציאל נזק ממשי לגוף ולרכוש, זאת לאור טיבה של האש, המסוגלת להתפשט בקלות ובמהירות, הרבה מעבר למוקד ההצתה.",אירוע אחד או כמה אירועים
314,ME-17-05-55639-212,"אשר לטענה כי בקביעת המתחם יש ליתן משקל לקולא להפרעה הדלוזיונלית ממנה סבל הנאשם, אשר בשלה נפגעה יכולתו של הנאשם להימנע מן המעשה ומידת השליטה שלו על מעשיו (סעיף 40ט(א)(7) לחוק העונשין), הרי שכפי שצוין ביחס לאישום הראשון, אף במסגרת אישום זה יש ליתן משקל מועט לטענה זו.",אירוע אחד או כמה אירועים
315,ME-17-05-55639-212,"שכן אף שמחשבות השווא של הנאשם נגעו להאשמות שונות כלפי ל' ביחס לעיסוקה, ביחס להתנהלותה ולקשר שלה עם אנשים שונים, וביחס לפגיעה לכאורה בבנותיו על ידי אחרים כאשר ל' לטענתו מודעת אליה, וכן העובדה שגרושתו ל' לא מאפשרת לו לראות את בנותיו, הרי כפי שציינו בהכרעת הדין, בשלב בו הנאשם ביצע את המעשים הוא לא סבר כי בנותיו עדיין עוברות את אותן פגיעות שמחשבות השווא נגעו אליהן.",אירוע אחד או כמה אירועים
316,ME-17-05-55639-212,"מכאן שמעשיו של הנאשם נעשו מתוך רצון לנקום במתלוננת שלא הסכימה לבקשותיו לראות את בנותיו ללא גורם מפקח, ולהוציא את האמת (לגישתו) לאור ביחס להתנהגותה של ל', לעיסוקה ומעשיה, לקשרים שונים שלה וכיוצא באלו.",אירוע אחד או כמה אירועים
317,ME-17-05-55639-212,"עוד ציינו בעניין זה בהכרעת הדין: ""מסקנת חברי הפאנל ביחס לשאלה זו הייתה כי: ""הנבדק היה מסוגל להימנע מביצוע המעשים, הוא לא הרגיש שנשקפת סכנה לבנותיו בעת ביצוע מעשיו, לא התכוון להציל אותן, אלא רצה לממש את משאלת ליבו – להוציא לאור את ה'אמת' בה האמין וממשיך להאמין, ולהעניש אנשים שלשיטתו אשמים...",אירוע אחד או כמה אירועים
