,verdict,text,part
154,ME-17-05-55639-212,הוא חולק על עמדת בית המשפט וקביעותיו ומקווה שבנותיו יאמינו לו.,דברי הנאשם
155,ME-17-05-55639-212,"עוד ציין כי אף שנאמר לו למן ההתחלה כי יש חוות דעת נפשית בעניינו, וכי העונש יהיה מקל יותר באם הוא יטען לעניין נפשי, הרי בשל התנהלות הרשויות הוא החליט ללכת עד הסוף ולא רצה לטעון בעניין זה.",דברי הנאשם
156,ME-17-05-55639-212,"עוד ציין הנאשם, כי יש למשפט הזה חשיבות מבחינת האינטרס הציבורי, וכי אין מחלוקת על העובדות אלא טענתו היא שהמשטרה לא בדקה את התלונות שלו על הפגיעה המתמשכת בבנותיו.",דברי הנאשם
157,ME-17-05-55639-212,"הנאשם דיבר ארוכות על העוול שנעשה לו, ועל כך שקביעותיו של בית המשפט לא היו נכונות ובית המשפט אמר לו שלא בצדק שהדברים לא רלוונטיים.",דברי הנאשם
158,ME-17-05-55639-212,"לאחר שהתבקש מספר פעמים להימנע מלהמשיך ולטעון באשר להשגותיו על הקביעות בהכרעת הדין גופה שכן בית המשפט קם מכיסאו וטיעונים אלו מתאימים יותר לערעור ושם יוכל להעלותם, אלא להתייחס לעניין העונש, הוסיף כי: ""אני כתבתי לכם הרבה פעמים אני אמרתי לכם שככה אני הרגשתי, יש לכם כוח בלתי מוגבל ללא שום אחריות ובגלל זה הפגיעה הזאת שהיתה בי מצד הפרקליטות אמרתי, לא נעים להגיד את זה בפנים, אבל אני כתבתי את זה לכם שאתם עריצות שיש למדינה.",דברי הנאשם
159,ME-17-05-55639-212,"ותעשו מה שתרצו, כב' השופטת.",דברי הנאשם
160,ME-17-05-55639-212,"אני עומד מאחורי המילים שלי, תנו את המקסימום.",דברי הנאשם
161,ME-17-05-55639-212,"מה שעשיתם מ - 2013 המערכת המשפטית זה היה פשע, פשע.",דברי הנאשם
162,ME-17-05-55639-212,להפקיר את בנותיי ולומר לי עכשיו בוא תלך לעונש.,דברי הנאשם
163,ME-17-05-55639-212,על העונש שלך.,דברי הנאשם
164,ME-17-05-55639-212,הפקירו אותם בחוק ואני יושב אבא חסר אונים.,דברי הנאשם
165,ME-17-05-55639-212,את יודעת מה היה המצב הנפשי שלי כב' השופטת?,דברי הנאשם
166,ME-17-05-55639-212,אתם הפכתם את ההודעה של הפרקליטות כלא רלוונטית ומצד שני מאשימים אותי בזה זה לא יאומן.,דברי הנאשם
167,ME-17-05-55639-212,"זה לא יאומן אני בהלם, זה לא משנה מה תנו לי עונש, אתם יכולים לתת את המקסימום גם 100 שנה.",דברי הנאשם
168,ME-17-05-55639-212,אבל אני אשתוק על זה?,דברי הנאשם
169,ME-17-05-55639-212,"אני אשתוק אחרי שמ - 2013 זה 4 שנים כמה עשיתי רק כדי שהבנות שלי יהיה להם בטחון, אני הייתי מוכן למסור את נפשי על זה .",דברי הנאשם
170,ME-17-05-55639-212,.,דברי הנאשם
171,ME-17-05-55639-212,"תנו את המקסימום, אני לא מוטרד מזה.",דברי הנאשם
172,ME-17-05-55639-212,"הבנות שלי שנתתי להם את החיים שלי להגיד שאני ניסיתי לפגוע באמא שלהן, זה כואב כי אם אני פוגע באמא שלהם אני פוגע בהם.",דברי הנאשם
173,ME-17-05-55639-212,"אבל אתם בית המשפט, מי יאמין לי?",דברי הנאשם
174,ME-17-05-55639-212,אני נאשם ברצח.,דברי הנאשם
175,ME-17-05-55639-212,מי יאמין לי?,דברי הנאשם
176,ME-17-05-55639-212,"אני רוצח, מי יאמין לי שהמערכת המשפטית היא הפושעת, היא העריצות שיש למדינה שעושה ככל העולה על רוחה.",דברי הנאשם
177,ME-17-05-55639-212,"ועכשיו תנו את המקסימום אני לא דואג מכם, אני אלך לקבר אני אנוח מהצרות ואני מתפלל שאלוהים יעשה משפטו אתכם.",דברי הנאשם
179,ME-17-05-55639-212,"ביום בהיר ואביבי בתחילת חודש אפריל, פתח הנאשם במסע קטל ונקמה אשר נפרש בפנינו במסגרת שמיעת הראיות בתיק זה, שבו ביצע הנאשם שורה של מעשים קשים, מזעזעים ומצמררים לכל המנסה לדמיין את שהתרחש – מחזה אימה עם מספר אפיזודות וזירות.",דיון והכרעה
180,ME-17-05-55639-212,"בפתח אותו בוקר שהחל כבוקר אביבי רגיל, בשעה מוקדמת הגיע הנאשם לביתה של ל' – גרושתו ואם בנותיו, כשהוא מחופש כאדם דתי, צלצל בפעמון, אך ל' הורתה לבנותיה לא לפתוח את הדלת.",דיון והכרעה
181,ME-17-05-55639-212,"לאחר שלא עלה בידו להיכנס לביתה של ל', המשיך הנאשם באותו מסע נקמה רצחני; ואיתרע מזלו של המנוח, כי אליו התקשר הנאשם והזמין אותו לביתו באמתלה שברצונו לשחק עמו בקלפים.",דיון והכרעה
182,ME-17-05-55639-212,"המנוח - אדם חף מפשע, אותו הנאשם הכיר שנים רבות ואשר אף ניסה לסייע לנאשם לחדש את הקשר עם בנותיו ולראותן ללא ליווי של גורם מפקח, סבר בתום לב שמדובר במפגש חברי ונכנס שלא בטובתו אל תוך זירת תופת.",דיון והכרעה
183,ME-17-05-55639-212,"בדירתו של הנאשם הוכנו מראש סוגים שונים של כלי משחית, אשר נועדו לפגיעה באחרים שבהם רצה לנקום.",דיון והכרעה
184,ME-17-05-55639-212,"הנאשם לא בחל באמצעים והמית את המנוח באכזריות, בין היתר באמצעות חץ ברזל שירה מרובה קשת שהכין מבעוד מועד בביתו.",דיון והכרעה
185,ME-17-05-55639-212,"הנאשם לא הסתפק בפגיעה במנוח באמצעות החץ והמשיך לתוקפו, היכה את ראשו באלה וגם דקר אותו בעכוזו, ולבסוף אף שפך עליו חומצה.",דיון והכרעה
186,ME-17-05-55639-212,"בדירתו של הנאשם נמצאו הוראות הפעלה לרובה הקשת, וחומרים נוספים שניתן לעשות בהם שימוש לפגיעה באחרים ואף לקטילה, כגון: חומרים דליקים, חומצה, אלה טלסקופית, ומקלות עליהן קשורות פיסות בד, וכן רשימות שערך הנאשם ובהן פירוט מצמרר של תוכניותיו.",דיון והכרעה
187,ME-17-05-55639-212,"כל אלו מלמדים, כפי שציינו בהכרעת הדין, כי לנאשם היה תכנון מראש וכוונה ברורה לפגוע במנוח.",דיון והכרעה
188,ME-17-05-55639-212,"הנאשם הותיר את המנוח בדירתו מתבוסס בדמו, כשהוא נועל את הדירה אחריו ונוטל מהמנוח את האקדח שהיה עליו, אותו החזיק המנוח ברישיון.",דיון והכרעה
189,ME-17-05-55639-212,"עוד יוער, כי כפי שציינו בהכרעת הדין קיימת אפשרות שהנאשם דקר את המנוח עם החץ בידיו, ולא ירה את החץ מהרובה כפי שטען, זאת בשים לב לכך שרובה החיצים נמצא כשהוא דרוך ומוכן לירי עם חץ ללא כל דם עליו, ואילו החץ עם דמו של המנוח נמצא על הרצפה בפינת האוכל.",דיון והכרעה
190,ME-17-05-55639-212,חומרת מעשיו של הנאשם והזוועה המגולמת בהם מתעצמות בכך שהנאשם לא עצר לרגע.,דיון והכרעה
191,ME-17-05-55639-212,"גם אחרי שהיה לו ברור שנטל את חייו של המנוח, אותו הותיר כאמור מדמם על הרצפה בדירה, הוא לא התעשת ולא הראה כל חרטה על מעשיו, אלא פעל בקור רוח ונעל את הדירה כדי שהמנוח ייוותר בתוך דירה נעולה ולא יצליח בשום דרך לצאת ממנה, ומיד המשיך ליעד הבא.",דיון והכרעה
192,ME-17-05-55639-212,"זאת לא לפני שהחליף את בגדיו שהוכתמו בדם המנוח ולבש שוב את הבגדים שלבש בבוקר כשהתחזה לאדם דתי; ויצא מן הבית כשהוא מצויד באביזרים שונים אשר מיועדים לסייע לו להוציא לפועל את תוכניתו לפגוע בגרושתו, וכשהוא לוקח מהמנוח את האקדח כדי להשתמש אף בו בהמשך למסע הנקמה האלים.",דיון והכרעה
193,ME-17-05-55639-212,"הנאשם המשיך במסעו הרצחני וחזר ל""יעד הראשון"" ממנו החל המסע – ביתה של ל' גרושתו.",דיון והכרעה
194,ME-17-05-55639-212,הפעם למרבה הצער הצליח להיכנס אל ביתה.,דיון והכרעה
195,ME-17-05-55639-212,"מיד לאחר כניסתו הצמיד את האקדח למצחה, זרק מידיה את הטלפון הנייד ממנו ניסתה להזעיק עזרה, בהמשך גרר אותה לעבר הדלת, ובשלב מסוים ניסה להכניס מחסנית לאקדח, והטיח את ראשה בקיר עד שדיממה מאפה ונגרם לו שבר.",דיון והכרעה
196,ME-17-05-55639-212,"הנאשם לא בחל בשום אמצעי כדי לממש את זממו, ולאחר שניסיונותיו לפגוע בל' לא צלחו, הוא שפך חומר דליק על גופה של ל', אך היא הצליחה לברוח מן הדירה, כשבדירה נותרו בנותיה והנאשם.",דיון והכרעה
197,ME-17-05-55639-212,"בשלב זה ולמרות הימצאותן של בנותיו במקום, ולאחר שהן חזו במעמד המצמית והקשה במהלכו הנאשם אביהן ניסה לפגוע ולהרוג את אימן, הוא המשיך באותו פרץ של אלימות וזריעת הרס ואימה, כאשר שפך חומר דליק על רצפת הדירה והצית בה אש.",דיון והכרעה
198,ME-17-05-55639-212,"הנאשם הוסיף חטא על פשע כאשר עזב את הדירה הבוערת, והותיר שם את בנותיו, אשר בסופו של דבר הצליחו לצאת בכוחות עצמן מן הדירה.",דיון והכרעה
199,ME-17-05-55639-212,"נדגיש כי דחינו את טענות הנאשם כי שפך רק מעט חומר דליק ולא התכוון כלל להצית את הדירה וקבענו, כפי שעלה מהדוחות שהוגשו לנו, כי האש ניצתה וגרמה לנזקים משמעותיים.",דיון והכרעה
200,ME-17-05-55639-212,"לאחר כל אלו הנאשם נמלט מהמקום ונסע ברכב אותו שכר לירושלים, ואף העלה סרטונים ביוטיוב בהם אמר כי הוא יציג את הדברים מהצד שלו והסביר שהחליט לנקום בפושעים על הפשע שעשו בו ובבנותיו.",דיון והכרעה
201,ME-17-05-55639-212,"בהמשך הגיע הנאשם לכניסה לחניון בית המשפט העליון והצית את הרכב עם נוזל הדליק בעודו יושב בתוך הרכב, והאש התלקחה ואחזה גם בנאשם.",דיון והכרעה
202,ME-17-05-55639-212,"בטרם ייקבע מתחם העונש ההולם, יש לבחון האם שלושת האישומים בהם הורשע הנאשם מהווים אירוע אחד כפי שטען הסנגור בגינו יש לקבוע מתחם עונש אחד כולל, או מספר אירועים אשר בגינם יש לקבוע מתחם נפרד לכל אחד, זאת בהתאם לסעיף 40יג לחוק.",אירוע אחד או כמה אירועים
203,ME-17-05-55639-212,"בשלב השני, לאחר שבית המשפט קבע האם התרחיש העובדתי שלפניו מורכב מ""אירוע אחד"" או מ""כמה אירועים"", עובר בית המשפט לשלב המהותי של מלאכת הענישה, במסגרתו עליו לקבוע את מתחם הענישה ההולם ביחס לכל אירוע ולגזור את העונש הראוי בנסיבות הקונקרטיות של כל אירוע.",אירוע אחד או כמה אירועים
204,ME-17-05-55639-212,"בשלב זה יש חשיבות גדולה לשאלות שבמהות – מספר הקורבנות, הנזק שהסבה התנהגות העבריין, האינטרסים החברתיים שנפגעו כתוצאה מהתנהגותו.",אירוע אחד או כמה אירועים
205,ME-17-05-55639-212,"לפיכך בשלב זה ראוי לשוב ולבחון כל אירוע בהתאם למבחן המהותי-מוסרי שפותח והשתרש בפסיקת בית משפט זה, ולקבוע האם יש לפצל כל אירוע למספר מעשים, על כל הנובע מקביעה זו במישור העונשי (לרבות הוראת סעיף 186 לחוק סדר הדין הפלילי).",אירוע אחד או כמה אירועים
206,ME-17-05-55639-212,"במקרה זה לאחר שבחנו את טענות הצדדים ואת קביעותינו בהכרעת הדין, באנו לכלל  מסקנה כי הגם שהאישומים קשורים במידה כזו או אחרת זה לזה, והעבירות שבוצעו במסגרתם בוצעו בזו אחר זו באותו יום, הרי שכל אחד מהתרחישים המתואר בכל אחד מהאישומים הינו תרחיש נפרד ויש לראותו כאירוע נפרד.",אירוע אחד או כמה אירועים
207,ME-17-05-55639-212,"באישומים הראשון והשני גרם הנאשם לנזק חמור וקשה לקורבנות שונים, כאשר במסגרת האישום הראשון נגרם מותו של המנוח, ובמקרה השני הוא ניסה לרצוח את גרושתו, והצית את הבית תוך שהוא גורם לפחד וחרדה בקרב גרושתו ובנותיו.",אירוע אחד או כמה אירועים
208,ME-17-05-55639-212,על כן ישנה הצדקה מהבחינה המהותית-מוסרית לסווג כל אישום כאירוע נפרד.,אירוע אחד או כמה אירועים
209,ME-17-05-55639-212,"בנוסף המדובר באירועים מובחנים מבחינת מיקום וזמן, בעלי מטרות מובחנות, אשר בוצעו בזירות שונות.",אירוע אחד או כמה אירועים
210,ME-17-05-55639-212,"ההבחנה בין האירועים מתבקשת אף מבחינה מהותית, זאת נוכח הפגיעה באינטרסים החברתיים השונים במסגרתו של כל אחד מן האישומים.",אירוע אחד או כמה אירועים
211,ME-17-05-55639-212,"שכן לא ניתן להלום תוצאה לפיה מותו של המנוח ייכרך יחד עם המעשים הקשים שביצע הנאשם כלפי המתלוננת בזירה אחרת, תוצאה שיש בה משום זילות בערך המוגן של קדושת החיים.",אירוע אחד או כמה אירועים
212,ME-17-05-55639-212,"אשר לאישום השלישי הרי אף הוא מהווה אירוע העומד בפני עצמו, הן מבחינת המקום והזמן בהם בוצע, והן נוכח מטרתו של הנאשם והסימבוליות אשר ראה בעצם ביצוע המעשה אל מול בית המשפט העליון.",אירוע אחד או כמה אירועים
213,ME-17-05-55639-212,"לאור האמור, יש לקבוע  מתחם עונש הולם נפרד לכל אחד מהאישומים שכן כל אחד מהם מהווה אירוע העומד בפני עצמו כאמור.",אירוע אחד או כמה אירועים
214,ME-17-05-55639-212,מתחם העונש ההולם בגין האישום הראשון – המתת המנוח אבי אלתר,אירוע אחד או כמה אירועים
215,ME-17-05-55639-212,"בהתאם לתיקון 113 לחוק העונשין, על בית המשפט לקבוע מתחם עונש הולם תוך התחשבות בערך החברתי אשר נפגע מביצוע העבירה ומידת הפגיעה בו, מדיניות הענישה הנהוגה ובהתחשב בנסיבות הקשורות בביצוע העבירה (סעיף 40ג לחוק העונשין).",אירוע אחד או כמה אירועים
216,ME-17-05-55639-212,"באישום זה הורשע הנאשם כאמור בעבירה של המתה באחריות מופחתת לפי סעיף 301ב(ב)(2) לחוק העונשין, אשר העונש הקבוע בצידה הינו 20 שנות מאסר.",אירוע אחד או כמה אירועים
217,ME-17-05-55639-212,"אשר לערכים החברתיים אשר נפגעו כתוצאה מביצוע העבירה, הרי שהנאשם במעשיו גרם למותו של המנוח באכזריות רבה ולאחר תכנון והכנה.",אירוע אחד או כמה אירועים
218,ME-17-05-55639-212,"על כן, במעשיו של הנאשם מגולמת פגיעה חמורה וקשה בערך החשוב ביותר של קדושת החיים.",אירוע אחד או כמה אירועים
219,ME-17-05-55639-212,"נטילת חיי אדם חף מפשע בכוונה הינה מבין העבירות החמורות בספר החוקים, אשר פוגעת פגיעה אנושה בערך של ההגנה על בטחונו של אדם ועל זכותו לביטחון אישי וההגנה על שלום הציבור, וביתר שאת  כאשר הפגיעה מבוצעת לאחר תכנון מדוקדק ומתוך כוונה לפגוע ולקטול את המנוח, וכאשר המעשה נעשה תוך עורמה ובאכזריות, מתוך כוונה לחסל את המנוח, גם כדי ליטול ממנו את אקדחו.",אירוע אחד או כמה אירועים
220,ME-17-05-55639-212,"נוכח הפגיעות הרבות שנגרמו למנוח על ידי הנאשם כעולה מדו""ח נתיחת הגופה, הנאשם אף פגע בזכותו של המנוח לשלמות גופו.",אירוע אחד או כמה אירועים
221,ME-17-05-55639-212,"בתי המשפט ציינו פעמים רבות את החומרה שבנטילת חיי אדם, ואת הענישה המחמירה אשר יש לנקוט בגין לקיחת חיי אדם:",אירוע אחד או כמה אירועים
222,ME-17-05-55639-212,"מבחינת נסיבות ביצוע העבירה המנויות בסעיף 40ט לחוק העונשין, הרי מרבית הנסיבות לחומרא המנויות בסעיף זה מתקיימות בענייננו בעוצמה רבה.",אירוע אחד או כמה אירועים
223,ME-17-05-55639-212,מבחינת חלקו היחסי של הנאשם בביצוע העבירות (סעיף 40ט(א)2) לחוק העונשין) הרי שהנאשם הוא מבצע העבירה היחיד והוא עומד לבדו מאחורי התוכנית שרקם.,אירוע אחד או כמה אירועים
224,ME-17-05-55639-212,"אשר לתכנון שקדם לביצוע העבירה (סעיף 40ט(א)(1) לחוק העונשין), כפי שקבענו בהכרעת הדין הנאשם תכנן את מעשיו ונקמתו במשך זמן רב.",אירוע אחד או כמה אירועים
225,ME-17-05-55639-212,"הדבר עולה מן העובדה שהנאשם הזמין את המנוח אל דירתו, בה ארגן כלי משחית רבים לתקיפת המנוח: חיצים, רובה חיצים, אלה טלסקופית חומצה, אזיקונים, ומכלים ובהם דלק (ראו עמ' 38 להכרעת הדין, ת/15).",אירוע אחד או כמה אירועים
226,ME-17-05-55639-212,"התכנון של הנאשם עולה אף מן הרישומים שערך לעצמו שבהם ציין בכתב ידו ""אבי אלתר – לחטוף לו (את האקדח) ולחסל אותו.",אירוע אחד או כמה אירועים
227,ME-17-05-55639-212,"האפשרות קיימת אבל לא כדאית"" (ראו עמ' 35 להכרעת הדין).",אירוע אחד או כמה אירועים
228,ME-17-05-55639-212,"ואכן כפי שציין הנאשם ברישומיו, תוכנית זו הוצאה על ידו לפועל, שעה ש""חיסל"" את המנוח ולקח את אקדחו.",אירוע אחד או כמה אירועים
229,ME-17-05-55639-212,"בענייננו, כפי שעולה גם מדו""ח הנתיחה של גופת המנוח (ת/14), הנאשם פגע במנוח את הפגיעה הקטלנית באמצעות חץ בבטנו אך לא הסתפק בכך והמשיך להכות את המנוח בראשו באלה, דקר אותו בעכוזו ואף שפך עליו חומצה.",אירוע אחד או כמה אירועים
230,ME-17-05-55639-212,"כאמור, מדובר היה בתקיפה ממושכת וקשה, אשר החלה בפינת האוכל ונמשכה לחדר אחר, וחלק מהתקיפה בוצעה כאשר המנוח שכב על הרצפה, ובסיום התקיפה, הנאשם הותיר את המנוח מתבוסס בדמו בביתו, ונעל את הדלת אחריו.",אירוע אחד או כמה אירועים
231,ME-17-05-55639-212,מכל האמור ניתן ללמוד על האכזריות הרבה אותה נקט הנאשם כלפי המנוח.,אירוע אחד או כמה אירועים
232,ME-17-05-55639-212,"בענייננו, והגם שמצאנו בסופו של יום שיש להרשיע את הנאשם בעבירה של המתה באחריות מופחתת, עדיין יש משקל בעת קביעת המתחם לעובדה שהנסיבות שבהן בוצע המעשה הינן נסיבות חמורות, בדומה לנסיבות המחמירות הקבועות בעבירת הרצח לאחר הרפורמה בדיני ההמתה, זאת בשל התכנון והאכזריות שבמעשיו של הנאשם.",אירוע אחד או כמה אירועים
233,ME-17-05-55639-212,"נראה כי יפים לעניין זה הדברים שנאמרו במאמרם של כב' השופט בדימוס אורי שהם ולי-אור שחרור ""ענישה מופחתת או אחריות  מופחתת בעבירת הרצח"": ""על פי דברי ההסבר לחוק, עונש זה מבטא, מצד אחד, את הגמול הראוי בגין נטילת חיי אדם בכוונה או באדישות, אגב הוקעת המעשה והרתעה ראויה, לרבות במקרים של המתה בשל קנטור או בשל הפרעה נפשית חמורה; מצד אחר, הוא מבטא הקלה לעומת העונש של מאסר עולם כעונש מרבי, עקב הנסיבות המיוחדות המפורטות בסעיף זה.",אירוע אחד או כמה אירועים
234,ME-17-05-55639-212,"עוד נקבע כי העונש המרבי בצד עבירת ההמתה במצב של אחריות מופחתת לא ישתנה, גם אם מתקיימות נסיבות אשר הופכות את המעשה לרצח בנסיבות מחמירות.",אירוע אחד או כמה אירועים
235,ME-17-05-55639-212,"במילים אחרות גם אם מעשה ההמתה על רקע של הפרעה נפשית חמורה היה אכזרי במיוחד, עדיין יורשע העושה ב""המתה בנסיבות של אחריות מופחתת"", הגם שיינתן, כך יש להניח, ביטוי לנסיבות המחמירות במסגרת העונש המרבי של אותה עבירה"" [ספר מנחם פינקלשטיין - משפט, ביטחון וספר (נבו, 2020) עמ' 476].",אירוע אחד או כמה אירועים
236,ME-17-05-55639-212,"נסיבה נוספת לחומרה נוגעת לניצול לרעה של הנאשם את יחסיו עם המנוח, לאחר שהמנוח הכיר את הנאשם לאורך שנים, ואף ניסה לסייע לו בענייניו מול ל' ולהעביר לה את רצונו של הנאשם לראות את בנותיו, והוא לא העלה בדעתו כי מחכה לו מלכודת מוות בהגיעו לביתו לפי הזמנת הנאשם.",אירוע אחד או כמה אירועים
237,ME-17-05-55639-212,"אשר לנזק אשר נגרם כתוצאה מביצוע העבירה (סעיף 40ט(א))(3) לחוק העונשין), הרי שמדובר בנזק הקשה מכל, מותו של אדם, איש משפחה שהיה דמות משמעותית לכל בני משפחתו.",אירוע אחד או כמה אירועים
238,ME-17-05-55639-212,"מתסקיר נפגעי העבירה ביחס למשפחתו של המנוח עולה תמונה קשה וכואבת של אובדן גדול הקשה להכלה עם הירצחו של המנוח, אשר היה בן זוג, אבא וסבא כה משמעותי ואהוב; כאשר כל התא המשפחתי עבר טלטלה קשה.",אירוע אחד או כמה אירועים
239,ME-17-05-55639-212,הנזק במקרה זה קשה במיוחד כאשר האובדן של המנוח הגיע באופן כה מפתיע ומכאן ההלם שעודו מכה בהם ולא מרפה.,אירוע אחד או כמה אירועים
