text,PUNISHMENT,GENERAL_CIRCUM,CIRCUM_OFFENSE,CIR_STATUS_WEP,CIR_HELD_WAY_WEP,CIR_PURPOSE,CIR_AMMU_AMOUNT_WEP,CIR_OBTAIN_WAY_WEP,CIR_TYPE_WEP,CIR_USE,CIR_PLANNING,RESPO,REGRET,CONFESSION
"ומתוקף כך, המסוכנות הגבוהה הנשקפת ממנו לביצוע עבירות בעתיד ולנוכח כך, הצורך בענישה מוחשית.",9.617569e-06,0.99997807,9.516941e-06,3.9290844e-05,4.2916813e-06,4.434881e-05,8.8774395e-06,2.2539169e-05,1.8186825e-05,1.6745216e-05,0.00028835726,0.000503801,0.008421933,3.2689559e-06
"לצד זאת, יש לקחת בחשבון הודאת הנאשם בהזדמנות הראשונה הן במשטרה והן בבית המשפט והזמן השיפוטי שנחסך עקב כך.",8.779682e-06,0.99997866,9.437623e-06,3.665331e-05,4.3882796e-06,1.4528603e-05,9.556687e-06,2.724362e-05,1.8598692e-05,1.782031e-05,0.001076067,0.009393056,0.08632938,0.9999976
"כמו כן, לקחתי בחשבון, אם כי במידה מוגבלת, את נסיבותיו האישיות של הנאשם והנסיבות המיוחדות של משפחתו, ובפרט זו של אמו, כמו גם, התרומה שלו לחברה ולקהילה בה הוא חי.",1.2783976e-05,0.99997866,9.476766e-06,5.526085e-05,5.8313644e-06,2.5173753e-05,1.4055811e-05,9.471282e-05,1.9096293e-05,2.656938e-05,0.0015197521,0.0060074637,0.991161,3.710277e-06
"ציינתי כי נסיבותיו האישיות של הנאשם נשקלו באופן מוגבל משום שברור כי השיקול האישי נסוג מפני השיקול הציבורי, כפי שצויין מקודם.",6.9349285e-06,5.3493472e-06,9.372023e-06,4.288094e-05,4.645372e-06,3.292978e-05,8.642964e-06,2.0945728e-05,1.8509973e-05,1.7157881e-05,0.0007259685,0.00025070872,0.019212883,3.3162914e-06
"כמו כן, לקחתי בחשבון את גילו הצעיר של הנאשם והעובדה שלחובתו הרשעה אחת בלבד בעבירה שקשורה לנשק קר.",9.629601e-06,0.99997866,9.417277e-06,0.0038849874,4.290994e-06,0.0016432279,1.9643101e-05,0.007513496,2.244905e-05,0.99856997,0.00032744004,0.00013682457,0.005596922,0.15329759
"על יסוד כל המפורט לעיל, אני מוצאת כי העונש במתאים במקרה דנן נופל בתוך מתחם העונש הראוי ונוטה במידה מסויימת לעבר הרף העליון שלו.",1.1334927e-05,5.1687452e-06,9.508114e-06,4.9371632e-05,4.107516e-06,1.489248e-05,9.307324e-06,1.743695e-05,1.747034e-05,1.5901021e-05,0.00024873734,0.00016799774,0.0002649586,3.1639115e-06
"סיכומו של דבר, אני גוזרת על הנאשם את העונשים הבאים :",0.0001098043,5.2290793e-06,9.519719e-06,3.7062793e-05,4.9663377e-06,5.837752e-06,5.3541953e-06,1.406037e-05,1.8885377e-05,1.4497863e-05,0.00028921268,7.0341885e-05,0.0005864735,2.6590938e-06
מאסר בפועל של 14 חודשים מיום מעצרו בתאריך 3.3.14.,0.99999034,5.1508837e-06,9.478871e-06,4.062765e-05,6.5279864e-06,5.3026592e-06,9.320666e-06,1.9895617e-05,1.8885736e-05,1.2764605e-05,0.00035892683,5.267181e-05,0.00016082684,2.6718699e-06
מאסר על תנאי של 7 חודשים במשך שלוש שנים והתנאי הוא כי הנאשם לא יבצע בתקופה זו עבירת נשק ויורשע בגינה.,0.9999919,5.122725e-06,9.334507e-06,3.9722298e-05,4.754e-06,9.01317e-06,8.966644e-06,2.265394e-05,1.8659966e-05,2.2106751e-05,0.0002873002,5.5225402e-05,0.0002999087,5.2887453e-06
"קנס בסכום של 5,000 ש""ח  או 50 ימי מאסר תמורתו.",0.99998975,5.2055047e-06,9.550746e-06,5.2099167e-05,5.3478066e-06,8.381462e-06,9.710385e-06,2.6052088e-05,1.9868048e-05,1.5324164e-05,0.00045482986,7.692294e-05,0.00023141441,2.831697e-06
"הקנס ישולם ב- 10 תשלומים שווים ורצופים החל מיום 1.6.2015 ובכל 1 לחודש עוקב, אי עמידה באחד התשלומים תביא לפרעון מיידי של יתרת הקנס.",0.9998789,5.124166e-06,9.226338e-06,5.3419913e-05,4.571368e-06,9.750611e-06,1.8647033e-05,5.260651e-05,1.6797421e-05,1.5705536e-05,0.0005447691,0.0001425082,0.00031728335,3.1398592e-06
"אני מורה על חילוט המוצגים התפוסים בגין התיק דנן לטובת המדינה או לפי כל החלטה שתינתן ע""י קצין משטרה.",0.43734902,5.2079977e-06,9.349929e-06,4.3598408e-05,4.1950652e-06,8.404138e-06,1.1272435e-05,2.6337642e-05,1.7490744e-05,1.7100447e-05,0.00022635906,5.7552883e-05,0.00014696733,3.4465133e-06
"5129371ניתנה והודעה היום ה' תמוז תשע""ד, 03/07/2014 במעמד הנוכחים.",0.0006305748,5.0748868e-06,9.410141e-06,6.1001814e-05,4.5286147e-06,6.2730696e-06,7.18061e-06,2.1969703e-05,1.7114196e-05,1.4247204e-05,0.0011401995,5.4859287e-05,0.00046123686,3.1490415e-06
