text,PUNISHMENT,GENERAL_CIRCUM,CIRCUM_OFFENSE,CIR_STATUS_WEP,CIR_HELD_WAY_WEP,CIR_PURPOSE,CIR_AMMU_AMOUNT_WEP,CIR_OBTAIN_WAY_WEP,CIR_TYPE_WEP,CIR_USE,CIR_PLANNING,RESPO,REGRET,CONFESSION
"ב""כ המאשימה עו""ד גל ירדן
הנאשם הובא
בא כוח נאשם עו""ד סעיד סמור",9.256938e-06,5.1839897e-06,9.3190665e-06,3.1058695e-05,5.7518255e-06,3.6479857e-06,6.0724083e-06,1.9823685e-05,2.2066753e-05,1.50578835e-05,0.00025462257,5.061256e-05,0.00041748642,2.8203076e-06
"חוק העונשין, תשל""ז-1977: סע'  40ג(א), 40ט, 144, 144(א)",1.9968875e-05,4.998682e-06,9.482117e-06,6.0863982e-05,6.5808804e-06,6.4684514e-06,6.348516e-06,5.0980903e-05,1.9829831e-05,1.8730461e-05,0.0001656722,7.284885e-05,0.00034327625,2.7027022e-06
"ביום 12.3.2014 הורשע הנאשם על פי הודאתו באחזקת נשק שלא כדין, עבירה לפי סעיף 144(א) לחוק העונשין, וכן באחזקת חלק של נשק או תחמושת, עבירה לפי סעיף 144(א) סיפא לחוק.",1.04338405e-05,5.111276e-06,0.99999607,0.9997781,6.0024186e-06,0.00010038398,0.95196456,0.9964882,2.1592332e-05,0.000109888824,0.00020279968,9.293202e-05,0.00024168495,0.99999785
"עלפי הנטען בעובדות כתב האישום, הנאשם החזיק בחלקי נשק ותחמושת במחסן הצמוד לביתו של אחר, כאשר הנאשם החזיק במפתח המחסן הנ""ל ונהג בו מנהג הבעלים.",6.5167715e-06,5.201525e-06,0.9999962,0.9999423,0.99998784,0.8728334,0.99982065,0.99996233,0.00037129055,0.014160247,0.14618951,0.00014731385,0.00040498306,1.465089e-05
מכלול הנשק וחלקי התחמושת בהם החזיק הנאשם הם כמפורט להלן:,7.012727e-06,5.247873e-06,0.9999962,0.9999839,0.70355386,0.00040559543,0.999828,0.99988353,0.036337018,0.9999479,0.00022861434,7.3784235e-05,0.00012849773,3.046688e-06
"שירות המבחן הגיש תסקיר בעניינו של הנאשם, וממנו עולים הפרטים הבאים: הנאשם הינו רווק בן 24 שנים כיום, בעל תעודת בגרות חלקית ושירת בצה""ל שירות לא.",1.0478814e-05,0.9999788,9.324116e-06,5.7213012e-05,5.6878675e-06,9.058714e-06,3.2691478e-05,5.4795182e-05,1.743958e-05,1.8915442e-05,0.00062922464,0.00019836571,0.0066098543,3.6297668e-06
"הנאשם מתגורר בבית הוריו, עסק בעבודות מזדמנות ועובר למעצרו לא עבד בעבודה כלשהי.",7.3228343e-06,0.9999788,9.585009e-06,4.3860175e-05,5.305491e-06,1.4108819e-05,1.5546893e-05,0.0001243766,1.9880898e-05,1.7445867e-05,0.0009476245,6.966073e-05,0.0017444795,3.2906628e-06
"בהיותו בן 16 שנים אביו של הנאשם נפטר בשל מחלה קשה, ובעקבות כך התקשה להתרכז בלימודיו ולסיים את לימודי התיכון.",6.594872e-06,0.9999788,9.436291e-06,4.7700887e-05,5.3729373e-06,2.862666e-05,4.806495e-05,0.0029984757,1.9803167e-05,6.411207e-05,0.00092617783,9.212162e-05,0.015616987,2.99377e-06
"אמו לעומת זאת, נקלעה למצוקה נפשית והנאשם תמך בה משך כל התקופה.",7.529857e-06,0.99997866,9.560871e-06,4.5974874e-05,4.8336287e-06,1.8969145e-05,1.4653741e-05,0.002546587,1.977516e-05,1.794812e-05,0.0016073029,0.0001032627,0.050581545,3.1631937e-06
"במהלך שירותו הצבאי הוא התגלה על ידי מפקדיו כאדם חרוץ, מסודר, אמין ובעל מזג נוח.",1.04361e-05,0.99997866,9.551913e-06,5.1758914e-05,7.5511207e-06,1.9528698e-05,0.00014193103,0.30556354,2.1388252e-05,5.095272e-05,0.015179566,0.00033223318,0.101153664,3.142912e-06
"אשר לרקע לביצוע העבירות נשוא התיק, שירות המבחן ציין כי לנוכח קשיי תקשורת עם הנאשם הוא לא הצליח לעמוד על הסיבות אשר הביאו את הנאשם לבצע עבירות אלו, האם היו אלה סיבות רגשיות הקשורות לפטירת האב, או שמא סיבות הקשורות בהזדהות הנאשם עם תכנים וערכים עברייניים.",8.196134e-06,0.99997866,9.425615e-06,7.982389e-05,7.630897e-06,0.9994622,1.9813744e-05,0.899535,1.9998586e-05,2.9213868e-05,0.86774224,0.9999343,0.9909189,3.7731575e-06
"הגם שהנאשם הביע חרטה על מעשיו, ועל אף ששירות המבחן התרשם מכנות החרטה, הרושם הכללי שנותר היה שחרטה זו אינה נובעת מהתחברות הנאשם לחומרת מעשיו, אלא חרטה הקשורה למחיר האישי שהוא נאלץ לשלם עקב כך.",9.788774e-06,0.9999783,9.380053e-06,6.274357e-05,5.6317663e-06,0.99756706,1.4603629e-05,0.017031405,1.8375986e-05,2.3969502e-05,0.98419327,0.999992,0.9999449,4.4869234e-06
"כמו כן, וחרף התרשמות שירות המבחן מנזקקות טיפולית גבוהה אצל הנאשם, התסקיר אינו כולל המלצה טיפולית או שיקומית, וזאת לנוכח החשדנות שגילה הנאשם כלפי גורמי טיפול ולנוכח הכחשתו לצורך טיפולי כלשהו.",8.588809e-06,0.99997866,9.313398e-06,5.3801963e-05,4.888391e-06,0.00010213045,1.3939342e-05,4.5351746e-05,1.7337628e-05,1.7497183e-05,0.0021596772,0.999476,0.9451957,3.6054064e-06
"לאור האמור, ובשל הסיכון הגבוה להישנות התנהגות פורצת חוק בעתיד, שירות המבחן נמנע ממתן המלצה טיפולית והמליץ על השתת ענישה מוחשית.",7.4126515e-06,5.174694e-06,9.458293e-06,3.8734725e-05,3.7425311e-06,1.5987373e-05,8.2907545e-06,2.9447958e-05,1.7475571e-05,1.4111538e-05,0.00028748685,0.016639484,0.002436684,3.3508197e-06
"ב""כ המאשימה הגיש תמונות מתיק החקירה להמחשת התחמושת וחלקי הנשק שנתפסו אצל הנאשם, חוות דעת בדבר סוג רימוני היד, והמרשם הפלילי של הנאשם שכולל הרשעה אחת בעבר.",7.954058e-06,0.99997866,0.99999607,0.999948,0.013195953,0.00062058587,0.9986646,0.2468335,0.9999962,0.9990959,0.00052417954,0.00012179701,0.0003766941,1.570371e-05
"גם הנאשם ביקש להביא ראיות לעונש ובמסגרת זו העידו מספר עדים אשר הכירו את הנאשם מקרוב, בין במסגרת בית הספר ובין בחוג המשפחה.",8.689395e-06,0.99997866,9.521008e-06,3.7291473e-05,5.2292985e-06,1.712734e-05,1.2764921e-05,9.505739e-05,1.848404e-05,1.990148e-05,0.005748224,8.648298e-05,0.0058028563,0.000102328064
"העדים תיארו את הקשיים בהם נאלצה משפחת הנאשם להתמודד בתקופה בה היה האב חולה ומאושפז לתקופה ארוכה, לרבות החלל הרגשי והחינוכי שנותר בקרב הנאשם עקב מות אביו.",6.9393204e-06,0.99997866,9.319875e-06,5.3378208e-05,6.179945e-06,0.0002802022,3.062e-05,0.004160922,2.013674e-05,9.035084e-05,0.002004408,0.010601544,0.9056109,3.581517e-06
"לצד זאת, העדים ביקשו להדגיש את העשייה והתרומה של הנאשם לחברה שהתבטאה בדרך של סיוע לנזקקים במערך ההתנדבות הקהילתית.",6.7504066e-06,0.9999784,9.628417e-06,4.538869e-05,5.339968e-06,7.8883975e-05,1.6300326e-05,0.2623596,1.8974863e-05,2.3316088e-05,0.3774663,0.0036836874,0.789162,3.4536363e-06
"בפתח טיעוניו ציין ב""כ המאשימה, כי על מנת לקבוע את מתחם העניש יש צורך להתחשב בערך החברתי המוגן, בנסיבות ביצוע העבירה, מידת אשמתו של הנאשם והפסיקה הנוהגת.",9.881847e-06,5.3409763e-06,9.406731e-06,5.5789184e-05,5.2251708e-06,2.472371e-05,1.0736736e-05,2.0142003e-05,1.790755e-05,1.5995714e-05,0.0008385485,0.0023535597,0.030789888,0.99996674
"אשר לנסיבות ביצוע העבירה, ב""כ המאשימה טען שמדובר בעבירות חמורות מאוד וזאת משום שהנאשם החזיק בנשק ובכמות גדולה מאוד של מגוון סוגי תחמושת, באופן שאינו מתיישב עם החזקה מקרית בדומה להחזקת תחמושת מועטה או נשק אחד.",7.4708173e-06,5.1278425e-06,0.9999962,0.99999535,2.874473e-05,0.99637944,0.9996762,0.9998018,3.5749577e-05,0.24739338,0.10017385,0.0010378358,0.0009373852,6.3378748e-06
"עוד הוסיף ב""כ המאשימה כי אף אם הנשק אינו מוחזק לצורך ביצוע עבירות אחרות, אין לומר כי לא נשקפת מהנאשם סכנה לציבור, ועל בית המשפט לתן את דעתו לסוג הנשק המוחזק שלא כדין, לכמות התחמושת ולסכנה שנובעת ממנו.",8.5475685e-06,5.226267e-06,0.99999607,0.99999094,6.732265e-06,0.9997509,0.896689,0.4190749,7.740846e-05,0.9993445,0.00048938254,0.00040091254,0.0017740221,3.337476e-06
"בנוסף לאמור ציין ב""כ המאשימה, כי יש לתת את הדעת לנזק שצפוי היה להיגרם כתוצאה מהעבירות המיוחסות לנאשם, שבניגוד לעבירות אחרות מדובר בעבירה מתמשכת המלווה בתכנון ובהסלקה.",6.9208027e-06,5.2718156e-06,0.99999607,3.791788e-05,4.3111254e-06,8.656846e-05,8.580859e-06,0.00012411631,1.766896e-05,0.849361,0.998602,0.99890685,0.29564393,0.68118316
"על כל אלה, יש לתת את הדעת גם למאמצים המודיעיניים בהם נוקטת המשטרה על מנת לחשוף עבירות של אמל""ח, ולשקף את היקף המאמצים בענישה הולמת.",9.337321e-06,5.244631e-06,9.383131e-06,0.00025791395,5.268724e-06,3.8695962e-05,0.00012346884,0.00072059425,2.047154e-05,7.718224e-05,0.001739983,0.00040989986,0.0059336335,3.5210983e-06
"ב""כ המאשימה הוסיף וטען, כי לנאשם הרשעה קודמת בהחזקת נשק קר שבגינה ריצה עונש מאסר בעבודות שירות, ולכן ברור שלא מדובר במעידה ראשונה של הנאשם.",1.0937423e-05,0.99997866,0.99999607,6.533678e-05,4.552752e-06,0.00017167612,1.641082e-05,2.5342071e-05,1.940191e-05,0.9894248,0.96921295,0.00020944628,0.034329828,0.9999658
"אשר לתסקיר, ב""כ המאשימה ביקש לציין כי תסקיר שירות המבחן מלמד כי הנאשם חש חרטה אם כי לא חרטה כנה ואמתית.",7.53375e-06,5.477592e-06,9.359947e-06,3.5808673e-05,4.012664e-06,6.202991e-05,8.26338e-06,1.6413356e-05,1.827689e-05,1.3402121e-05,0.007900823,0.9211857,0.9978235,3.224561e-06
הנאשם שלל כל צורך בשיקום.,8.929871e-06,0.99997866,9.91621e-06,4.160281e-05,4.642493e-06,1.5341184e-05,1.4932342e-05,2.974e-05,1.9582352e-05,1.8012113e-05,0.0007672647,9.39271e-05,0.049546093,2.4876324e-06
משכך המליץ שירות המבחן על הטלת ענישה מוחשית שתחדד עבורו את משמעות מעשיו – וכך יש לנהוג.,8.912634e-06,5.2350015e-06,9.441008e-06,4.1867e-05,4.066932e-06,1.7759168e-05,9.130648e-06,2.2759872e-05,1.839892e-05,1.4866185e-05,0.0006246968,0.98481226,0.22256933,3.0755896e-06
"על כן, ועל בסיס פסיקה שונה שהוגשה על ידו, ביקש ב""כ המאשימה לקבוע מתחם ענישה שנע בין 16 חודשי מאסר בפועל ל-28 חודשי מאסר בפועל, ובנוסף לו מאסר על תנאי וקנס.",0.9999578,5.1391075e-06,9.364339e-06,4.221427e-05,4.0036007e-06,7.32104e-06,9.759887e-06,1.4836798e-05,1.7322902e-05,1.4748711e-05,0.0007277937,5.917366e-05,0.0001764562,2.7004735e-06
"במסגרת טיעוניו לעונש ביקש הסנגור להקל עם הנאשם ולהעדיף, חרף המלצת שירות המבחן, את הפן השיקומי שלו.",8.028767e-06,5.4102356e-06,9.495491e-06,3.8752572e-05,4.0558275e-06,8.847891e-06,9.967921e-06,1.6426256e-05,1.8756147e-05,1.4768557e-05,0.004488168,0.00043136373,0.33048588,3.5205946e-06
"לטענתו, במקרה דנן לא היה תכנון מוקדם לביצוע העבירה והנאשם נקלע באקראי לתחמושת אותה מצא והחזיק במחסן מתוך טעות בהפעלת שיקול הדעת.",5.22877e-06,5.1853594e-06,0.9999962,0.9999466,0.99606764,0.99995756,0.8674151,0.9999604,0.0004799247,0.99998736,0.9998171,0.14936385,0.55778825,3.405087e-06
"מכל מקום, לא נגרם כל נזק מוחשי כתוצאה מביצוע העבירה, והנאשם לא השתמש ולא הפיץ את הנשק והתחמושת.",9.698104e-06,5.1793895e-06,0.9999962,0.99999416,0.9545481,0.9996573,0.99626774,0.99953675,1.9263909e-05,0.9999893,0.0066062864,0.00018169508,0.056422543,3.2340927e-06
"הסנגור הוסיף, כי הנאשם הבין את חומרת מעשיו, הביע חרטה אמתית וכנה, והודה בהזדמנות הראשונה, הן במשטרה והן בבית המשפט.",7.962278e-06,0.99997866,9.430083e-06,3.3435e-05,5.2803243e-06,0.0036567978,9.789325e-06,0.00030903233,1.8179264e-05,2.2077613e-05,0.7739489,0.8087424,0.99990106,0.99999774
"הסנגור ביקש להדגיש את נסיבותיו האישיות של הנאשם הקשורות במות אביו בהיותו עדיין נער, באופן שפגע ביכולתו להתמודד עם מצבי לחץ ולהפעיל שיקול דעת נכון ובריא.",6.3045136e-06,0.99997866,9.408597e-06,4.6656467e-05,5.2596674e-06,0.97463256,1.0728843e-05,0.712754,1.8674742e-05,8.3915176e-05,0.0038479813,0.98990715,0.99941695,3.7272755e-06
"הסנגור המשיך וטען, כי מדובר בנאשם צעיר ודתי, המשתייך למשפחה נורמטיבית תומכת ואוהדת.",7.565804e-06,0.99997866,9.6202375e-06,3.40926e-05,4.186229e-06,1.1757017e-05,1.1131498e-05,2.72834e-05,1.8795216e-05,1.7934983e-05,0.0016769712,0.00042491517,0.79558843,5.1944558e-06
"לפיכך הטלת עונש מאסר עלולה לפגוע בו לאין שיעור ולפגוע במשפחתו ובמיוחד באמו, בה הוא תומך לאחר שנקלעה למצוקה נפשית מאז מות אביו – מצוקה שממילא התעצמה עקב מעצרו.",8.911062e-06,0.99997866,9.317698e-06,5.8418478e-05,4.7828407e-06,0.049603555,1.5849047e-05,0.00070927286,1.9015766e-05,4.2019074e-05,0.00044411232,0.0007094848,0.62056077,3.4745979e-06
"על יסוד כל אלה ביקש הסנגור להקל עם הנאשם, להימנע מהטלת מאסר בפועל ולהעדיף שיקולי השיקום שלו לנוכח גילו הצעיר ונסיבותיו, כמתואר לעיל.",8.026165e-06,0.99997854,9.430614e-06,4.0778723e-05,4.0437076e-06,1.3054849e-05,7.591664e-06,1.4993972e-05,1.7822722e-05,1.4962633e-05,0.0016982283,0.00041096171,0.90739197,1.2432346e-05
"לסיום, הסנגור ביקש לחלוק על מתחם העונש הראוי לו טען ב""כ המאשימה והגיש מגוון פסיקה המלמדת על הטלת עונשים בדמות עבודות שירות ואפילו מאסר צופה פני עתיד, גם כשמדובר היה בעבירות נשק חמורות יותר.",9.592773e-06,5.1436086e-06,9.271091e-06,4.6103865e-05,4.5767993e-06,2.1800399e-05,1.1037175e-05,2.2185635e-05,1.7039885e-05,1.7541226e-05,0.0041153217,0.00018508644,0.0009473063,4.0749255e-06
"כפי שמורה לנו סעיף 40ג(א) לחוק העונשין, מתחם הענישה נדרש להלום את מעשה העבירה שביצע הנאשם, ובקביעתו יתחשב בית המשפט בנסיבות הקשורות בביצוע העבירה כמפורט בסעיף 40ט לחוק, בערך החברתי שנפגע מביצוע העבירה וממידת הפגיעה בו, וכן במדיניות הענישה הנוהגת.",9.374508e-06,5.2080372e-06,9.32159e-06,6.400163e-05,5.1019692e-06,0.0007722571,1.0745022e-05,5.914083e-05,1.8002464e-05,3.6118985e-05,0.0010308104,0.0017844746,0.003670552,3.6746935e-06
אין צורך להכביר במלים אודות הסכנה הטמונה בביצוע עבירות בנשק לביטחון הציבור והפרט.,9.2241835e-06,5.3125286e-06,9.685081e-06,6.1193736e-05,4.3688215e-06,0.8716067,1.5349204e-05,0.00087121245,1.954146e-05,0.99774253,0.0003633881,0.00017165107,0.00077702355,3.5277465e-06
"לצערנו, אנו עדים לאלימות גואה מדי יום תוך שימוש בנשק חם באופן שפוגע בשלום גופם ושלוות נפשם של הציבור, ולצערנו אף לקיפוח חיי אדם.",8.060637e-06,5.2882056e-06,9.426415e-06,0.0018184114,9.803994e-06,0.9998895,0.00017110282,0.9947436,2.120235e-05,0.9999887,0.0006377204,0.00022214487,0.013784139,3.5840796e-06
"בהיות הזכות לביטחון הגוף והנפש ערך בסיסי לקיומנו כבני אדם בחברה אנושית מתוקנת, ברי כי שיקולי ההלימה מחייבים העדפה ברורה של האינטרס הציבורי על פני האינטרס האישי של הנאשם.",7.297117e-06,5.218418e-06,9.141112e-06,6.8369576e-05,5.2435357e-06,0.0013325557,1.1663845e-05,8.44379e-05,1.9168327e-05,3.1411553e-05,0.0025543773,0.0013187238,0.02615073,3.5120336e-06
"אשר לנסיבות ביצוע העבירה, אקדים לומר כי במקרה דנן העבירה המיוחסת לנאשם בדבר החזקת נשק, חלקי נשק ותחמושת שלא כדין, היא במדרג התחתון של עבירות הנשק שבסעיף 144 לחוק העונשין, כאשר מעליה ניתן למצוא הובלה או נשיאה של נשק, ומעל כל אלה ייצור או סחר בנשק.",9.3133085e-06,5.232701e-06,0.9999962,0.9999865,4.959597e-05,0.6618087,0.61160463,0.9997514,2.063932e-05,0.0015436875,0.00032433253,0.00043166397,0.00030912543,5.0090344e-05
"כמו כן יש לציין, כי מרבית הפריטים אשר נתפסו אצל הנאשם הם בגדר תחמושת ולא בנשק ממש, כאשר רק 6 רימוני הלם הם בגדר נשק.",7.4792e-06,5.242991e-06,0.9999962,0.99999,0.99981993,0.9933448,0.9998196,0.99964845,0.9999957,0.99998415,0.0003195117,0.00010877113,0.00022500276,3.2652697e-06
"חרף זאת אני מוצאת, כי ההיקף הגדול של התחמושת בה החזיק הנאשם מקפיץ חזרה כלפי מעלה את רף החומרה של העבירות והמסוכנות הנשקפת ממנו, הגם שמדובר בעבירת 'החזקה' בלבד.",1.3145649e-05,5.204591e-06,0.9999962,0.005441721,4.920266e-06,2.2667597e-05,2.0220641e-05,0.0018446697,1.945531e-05,0.9023527,0.0022634906,0.99793744,0.04923567,0.00017020314
"כפי שצוין מקודם, מלבד לששה רימוני הלם ומספר מחסניות הנאשם נמצא מחזיק גם בכדורים 'חיים' במגוון סוגים וגדלים בהיקף של כאלף כדורים, לא פחות!",1.3006954e-05,5.217194e-06,0.9999962,0.9999838,0.9999386,4.1657757e-05,0.9999658,0.99994516,0.99999666,0.9999863,0.00028971746,9.7002856e-05,0.0002670122,3.4410941e-06
"כידוע, ללא התחמושת לא ניתן לעשות שימוש בנשק ולבצע באמצעותו עבירות אלימות.",9.076613e-06,5.2811097e-06,0.99999607,0.99795365,5.2432406e-06,0.99973065,0.016486853,0.99934393,0.00014090192,0.99998426,0.00022690292,8.0612095e-05,0.00031411796,3.2752814e-06
"לפיכך ענישה מחמירה גם באשר למרכיב זה, תביא לפגיעה בחוליה משמעותית בשרשרת העבריינית ותביא להורדת רמת האלימות בחברה.",8.430555e-06,5.4507914e-06,9.478428e-06,6.265622e-05,4.1287863e-06,5.0813942e-05,1.1507638e-05,9.102659e-05,1.7805394e-05,2.7948987e-05,0.0006200682,0.00040529438,0.0010725714,3.446444e-06
"לכל אלה יש להוסיף, כי גם בהחזקת נשק עסקינן, וזאת לנוכח החזקת הנאשם בששה רימוני הלם.",1.0283118e-05,5.300424e-06,0.9999962,0.2774039,0.0017461958,0.013437089,0.7863726,0.98043895,0.99999523,0.99995995,0.00027239523,0.000100059624,0.00043665332,3.3257772e-06
"בהקשר זה אבקש להבהיר, כי לנוכח האמור בחוות הדעת של מעבדת החבלה, בדבר פוטנציאל הפגיעה הגופנית הטמון ברימונים מהסוג המדובר, אין להמעיט מחומרתם כפי שהסנגור ניסה לצייר בטיעוניו, ודאי וודאי שאין מקום שלא להתייחס אליהם כאל נשק לכל דבר ועניין.",8.857837e-06,5.2358955e-06,0.99999607,0.67053795,7.2555995e-06,0.22518694,3.2588512e-05,0.026759414,0.00010326024,0.99994373,0.0025777991,0.010264954,0.008596793,3.4228276e-06
"למעלה מכך, אין לי אלא לתהות אודות המניעים אשר הביאו את הנאשם להחזיק בכמות כה גדולה של תחמושת ונשק.",8.576875e-06,5.2524692e-06,0.99999607,0.9999821,7.843845e-06,0.99815553,0.9993044,0.9973514,2.4411405e-05,0.00016623268,0.24388082,0.0010141709,0.06962167,3.3769136e-06
"ויודגש, לפי גרסת הנאשם, הוא מצא את הנשק, חלקי הנשק והתחמושת בזמן שליקט עצים להסקה בשטח פתוח, הוא אסף אותם והחביא אותם במחסן ששייך לאחר אך נמצא בשליטתו והחזקתו.",7.3387946e-06,5.1724587e-06,0.9999962,0.9999951,0.99998844,0.9999485,0.99993694,0.99996686,2.4530493e-05,0.99997497,0.99943405,0.00038476184,0.001859185,6.424672e-06
"לגרסתו, הוא חשש לדווח למשטרה אודות האמל""ח שמצא פן יחשדו בו כמי שמעורב בביצוע מעשה אסור.",6.9707007e-06,5.3431827e-06,9.681868e-06,0.00014169683,7.956812e-06,0.99993455,0.00019561128,0.99993694,2.0205585e-05,0.99994445,0.046170603,0.0073872986,0.21998878,3.3472902e-06
"הגם שבכתב האישום המאשימה אינה מייחסת לנאשם כוונה לעשות שימוש באמל""ח שנתגלה אצלו, ועל אף שהמאשימה אינה מפרטת את המניעים אשר הביאו אותו לעשות מה שעשה, ברם אין לי אלא לתהות, האם כוונות תמימות עומדות ביסוד מעשה מסוג זה?",8.3864115e-06,5.2179507e-06,0.99999607,9.831423e-05,6.6327475e-06,0.9997801,2.5110812e-05,0.962508,2.1115462e-05,0.99907434,0.9983796,0.91295296,0.8531617,4.6684927e-06
"האם אדם נורמטיבי שיודע להבדיל בין טוב ורע, היה טורח לשאת את כל כמויות האמל""ח שמצא באופן מקרי לחלוטין במקום מסוים, להעביר אותם למקום ולהסתיר אותם במקום מסתור כך לשם שמיים וללא סיבה?",1.0554042e-05,0.99997854,1.0076536e-05,0.04064541,0.9998859,0.98622,0.9951846,0.99992156,3.9847953e-05,0.99992275,0.90260774,0.0008491575,0.014557289,4.3090213e-06
דומני כי התשובה גלומה בעצם התהייה העולה מהשאלה.,1.2601537e-05,5.5086307e-06,9.590467e-06,4.649018e-05,4.844751e-06,2.0265235e-05,2.0990483e-05,0.00016082852,2.3515095e-05,3.8770057e-05,0.005121345,0.00017114134,0.006940567,2.544571e-06
"אשר לרמת הענישה הנוהגת בעבירה מסוג זה, אבקש לציין, כי שני הצדדים הגישו לעיוני פסיקה שונה המגלה לא מעט פערים בנוגע למדיניות הנוהגת בעבירות כגון אלו.",8.536717e-06,5.2367345e-06,9.281318e-06,3.836746e-05,4.1520475e-06,9.431127e-06,9.860553e-06,2.2594519e-05,1.731347e-05,1.5922735e-05,0.00070904446,0.00011802946,0.00036767454,3.382796e-06
"כך למשל, ניתן להצביע על מספר מקרים בהם הוטלו על נאשמים מאסר בדרך של עבודות שירות, גם כאשר מדובר היה בהחזקת אקדח.",1.6031969e-05,5.2873233e-06,0.9999962,0.9999274,1.3039595e-05,2.5561932e-05,0.19504993,0.009422377,0.9999963,0.99992514,0.0010875138,8.928673e-05,0.00018852636,3.4222041e-06
מנגד ניתן להצביע על מקרים אחרים בהם הוטל מאסר לתקופה שנעה בין 10-12 חודשים .,0.99995685,5.288922e-06,9.638403e-06,4.4642187e-05,4.831458e-06,8.1150765e-06,1.2275419e-05,2.7902834e-05,1.9984514e-05,1.9158255e-05,0.00029653357,6.2646955e-05,0.00015309807,2.8757138e-06
"בתיק פלילי 5576-05-12 (שלום חדרה) מדינת ישראל נ' מברצקי, מדובר היה בנאשם שהורשע בהחזקת אקדח מסוג ברטה לאחר שרכש אותו מאחר כמו כן נמצא הנאשם מחזיק שתי מחסניות תואמות המכילות בתוכן 8 כדורים תואמים בכל אחת מהמחסניות, וקופסאות שהכילו עשרות כדורים ותרמילים מסוגים שונים, בית המשפט גזר על הנאשם 16 חודשי מאסר בפועלו 8 חודשי מאסר על תנאי .",0.99051976,5.0749936e-06,0.9999962,0.9999938,0.9999603,0.0010240416,0.9999392,0.98367405,0.99999607,0.999113,0.0038891176,0.00017320013,0.0003209393,0.3498778
"בשים לב למכלול הנתונים, אני קובעת שמתחם העונש הראוי נע בין 8 חודשים ל- 18 חודשים.",0.0019419166,5.230755e-06,9.490439e-06,4.5227574e-05,4.040531e-06,6.8561344e-06,9.3411945e-06,1.6549311e-05,1.7552438e-05,1.5097785e-05,0.00035541202,7.3349984e-05,0.00020878171,2.9100363e-06
"בהינתן הדעת לנסיבותיו של הנאשם אין להתעלם ממסקנות שרות המבחן ביחס לצורך הטיפולי, ומנגד להעדר נכונות אמיתית של הנאשם לקבל טיפול.",6.6623656e-06,0.99997866,9.458076e-06,3.8522616e-05,4.27672e-06,5.1522537e-05,1.11507925e-05,2.43135e-05,1.8099552e-05,1.659304e-05,0.004383933,0.99993765,0.995,3.0073825e-06
