text,CIR_PUNISHMENT,GENERAL_CIRCUM,CIRCUM_OFFENSE,reject,CIR_TYPE,CIR_AMOUNT,CIR_ROLE,CIR_EQ,REGRET,RESPO,CONFESSION
שי עמוס ת.ז. 305544967,0.000206224,3.1587468e-05,2.7264983e-05,0.9999876,0.00061847555,0.0012900714,0.0011367655,0.1240753,0.009796209,0.00016634936,0.00049671397
"ב""כ המאשימה עו""ד – ליפז סימני",0.00019974381,3.147891e-05,1.8026516e-05,0.99998784,0.00041831128,0.00070744404,0.00090382394,0.12426666,0.008839941,0.0001236741,0.0003057489
"הנאשם -   בעצמו                    ובא כוחו עו""ד – תאמר אסדי",0.00018056521,3.202976e-05,2.1014417e-05,0.9999782,0.00046213422,0.0010196227,0.0006988737,0.040616322,0.009773459,0.00015330607,0.00084672176
"פקודת הסמים המסוכנים [נוסח חדש], תשל""ג-1973",9.998855e-05,2.9010977e-05,1.9999901e-05,0.99998724,0.00038593775,0.0007255531,0.0003956714,0.03231924,0.044468615,0.00012570496,0.00078072416
"הנאשם הודה והורשע במסגרת הסדר טיעון שכלל תיקון מהותי בכתב האישום והסכמה עונשית, בכך שבתאריך 8.10.13, לקראת ערב, סוכן משטרתי יצר קשר טלפוני עם אחר קובי, וביקש לרכוש ממנו סוליה וחצי חשיש.",0.00015480793,3.0612206e-05,0.9999584,9.198944e-06,0.9987581,0.99733317,0.98813033,0.005156156,0.031899296,0.00020197821,0.99977833
"בהמשך בעקבות שיחות טלפון נוספות תיאמו להיפגש בביצוע עסקת סמים, הסוכן הגיע למכולת , המתין להגעת קובי, בשלב הזה פגש בו הנאשם.",0.00015140936,3.1437386e-05,0.9999411,0.9999875,0.0054564634,0.052472692,0.9990251,0.013985887,0.0076333694,0.0002193772,0.0003822604
"הסוכן ביקש שיצור קשר עם קובי והנאשם אמר לו שבעוד דקה הוא פה, ואכן כעבור דקות ספורות הגיע קובי למקום ובוצעה עסקה, במהלכה רכש הסוכן שתי פלטות סם מסוכן מסוג חשיש.",0.00013023023,3.1442964e-05,0.9999608,9.256787e-06,0.9995739,0.99977857,0.999503,0.01000499,0.007124076,0.00022563073,0.00073712185
"לאחר מכן אמר להם הנאשם לסוכן: ""אם אני צועק תברח"", קובי חצה את פלטה לשניים ולשני רבעים.",0.0002357082,3.1826523e-05,0.00075918174,0.99998736,0.00073988806,0.0026415545,0.15038402,0.06415824,0.017222991,0.0002407342,0.00036047745
"הסוכן מסר לקובי 6,600 ₪ במזומן ו קיבל פלטה וחצי – עבירה של סיוע לביצוע עסקת סמים.",0.00041375586,3.1114403e-05,0.99995947,9.276079e-06,0.009187458,0.9990144,0.99950874,0.002334846,0.008071554,0.00018582224,0.00026638567
"על פי ההסדר אם שירות המבחן ימליצו על כך לאחר שהנאשם ישולב בהליך טיפולי, תסתפק התביעה ב- 6 חודשי מאסר בעבודות שירות כולל הפעלה של מאסר מותנה של 3 חודשים בחופף ובאי כח הצדדים לא התיחסו לרכיבים נלווים וגם בעתירה שלה לעונש לא ביקשה התובעת פסילה ופסילה מותנית אלא רק לאחר שבית משפט העיר לה.",0.37427372,3.1180552e-05,3.518367e-05,0.9999877,0.0007851577,0.0013604253,0.00042616867,0.0025881995,0.009462891,0.00018504285,0.99659795
"הסניגור טוען שהרכיבים נלוים לא היו חלק מההסדר, אך גם הוסיף כי ברור שיהיה מאסר מותנה וקנס.",0.00015541716,3.26407e-05,0.004287593,0.9999871,0.00082844537,0.0012235601,0.0024880522,0.0030776453,0.016183965,0.00018393183,0.0010920906
"והואיל ועל פי פקודת הסמים יש להטיל פסילה בפועל וכן לא יעלה על הדעת שאדם שעדיין בדיקות השתן מעידות על שימוש ימשיך וינהג, מצאתי להוסיף כך רכיב של פסילה.",0.00025881155,3.258062e-05,9.1157744e-05,0.99774027,0.0008915904,0.0012402702,0.000631743,0.013611466,0.009427527,0.00016693411,0.00071959634
"נתקבלו בהתאם להסדר תסקירים וחוות דעת ממונה, מהם עולה שהנאשם כבן 23, רווק, לפני כ- 9 ימים נישא, הוא עובד היום בשתי עבודות במקביל בתיווך ושיפוצים.",0.00017411033,0.9999964,0.00012774467,8.933671e-06,0.00090945885,0.0013386059,0.0023384998,0.06689028,0.008128514,0.0003456092,0.0011017884
"כפי הנראה הוא בן למשפחה נורמטיבית, השלים 12 שנות לימוד, אך לא השלים תעודת בגרות.",0.00014245792,0.9999963,1.9760831e-05,8.964147e-06,0.0004484637,0.0010104429,0.0006185639,0.13038509,0.008431718,0.00024916956,0.0005396661
כעבור 10 שנים למעשה נפלט על רקע בעיות קשב וריכוז ועבר אבחון פסיכודידקטי.,9.168851e-05,0.99999607,2.014865e-05,9.033754e-06,0.00036857065,0.00090526533,0.00045790002,0.108009584,0.0064433813,0.00014485755,0.00018849867
"התגייס לצה""ל.",0.00036184987,0.99999464,3.7924678e-05,1.0245773e-05,0.00059654197,0.001597672,0.0004517725,0.012683406,0.009938201,0.00033161388,0.0006799307
הנאשם לא תופס עצמו כאדם בעל התנהגות עבריינית ושלל תחילה כל בעייתיות בתחום הסמים וטען שיכול להפסיק לבדו.,0.000109065266,0.9999958,2.068888e-05,9.035486e-06,0.0005083604,0.0008405869,0.0014484986,0.0037424718,0.27044728,0.03322214,0.00079903106
"שירות מבחן שלחו אותו לבדיקות מעקב ולמרות דבריו שהתנקה מסמים, מצאו לכאורה כי משמש בסמים.",0.000105975676,0.99997675,0.99961287,9.054256e-06,0.00084979116,0.00095380883,0.0049165073,0.014574379,0.0086948555,0.00025505092,0.00046982846
הדיון נדחה למעשה כדי לבחון זאת וגם בתסקיר שהוגש היום צוין כי נמצאו מספר דגימות שתן עם שרידי סם.,0.00011128658,3.152301e-05,0.9998714,9.431145e-06,0.6387213,0.90847605,0.0045657214,0.030301565,0.005548816,0.00015628293,0.00015476337
הסניגור טוען כי בבדיקה הקודמת שצוינה בתסקיר נמצאה טעות ומבדיקת מעבדה  עלה שלא נמצאו שרידי סם.,8.536221e-05,3.7823764e-05,0.99982786,0.19918947,0.34248114,0.12245837,0.011279184,0.6704765,0.013635854,0.0002173516,0.00026945808
הוא סבור שגם בשלושה מקרים הנוספים עליהם מדווחים היום קיימת אפשרות דומה.,0.00014335688,3.2603057e-05,2.7625012e-05,0.9999871,0.0007004196,0.00090692856,0.0016856646,0.10913753,0.010290312,0.0001570686,0.00034075472
"בנסיבות אלה, התובעת ביקשה שהדיון שוב ידחה כדי להמתין ולקבל את תוצאות הבדיקות, אך קצין המבחן סבור שאין בכך צורך ואף בית משפט סבור שאם אכן משתמש בסמים הממונה לא יכשירו לבצע עבודות שירות ויהיה עליו לשאת המאסר בכלא.",0.00017451488,3.1605035e-05,3.2252687e-05,9.291857e-06,0.000970104,0.0009541043,0.00052436267,0.0067658816,0.006774713,0.00016777874,0.00061059085
"אין ספק, כי מדובר במי שקיימת נזקקות טיפולית גבוהה בעניינו.",0.00013603232,3.2082004e-05,1.8525407e-05,0.99998736,0.00052610156,0.0008987251,0.00038794975,0.006279402,0.010018989,0.00014032268,0.00029524718
מהתסקיר המשלים שהוגש עולה שהוא הקפיד להגיע באופן סדיר לבדיקות ולטפול הקבוצתי ומבטא נכונות לעבוד על התכנים ולערוך שינוי.,0.00010469722,0.9999962,2.5883866e-05,8.945436e-06,0.00055424264,0.0009655425,0.0008628166,0.31444564,0.020148424,0.024382465,0.00023472926
הוא שיתף אותם בקשיים עמם מתמודד.,0.00019847562,0.99999464,2.3884642e-05,9.164366e-06,0.00047933857,0.001132204,0.0012393491,0.13699372,0.05122104,0.00027329323,0.00028495284
אף ביקש לקבל סיוע במצבו הנפשי.,0.00017364147,0.9999945,2.116425e-05,0.00049295096,0.00046931347,0.0007842092,0.00066070777,0.032201808,0.01739276,0.00015625359,0.00017415301
"בנסיבות אלה, שירות המבחן ממליצים להסתפק בעבודות שירות יחד עם צו מבחן ברוח הסדר הטיעון.",0.00022247044,3.0417701e-05,1.6951715e-05,0.99998724,0.0004864515,0.000991984,0.00038176402,0.0014216143,0.0053624287,9.909186e-05,0.00067897653
"לאור האמור, הסדר הטיעון יכובד.",0.0004703913,3.151459e-05,2.2256665e-05,0.99998677,0.0005850301,0.0009345137,0.00047443644,0.003343752,0.018230613,0.00016038836,0.00029471368
אני גוזרת על הנאשם לעונשים כדלקמן:,0.9993563,3.0816533e-05,2.0907633e-05,0.99998665,0.00039386237,0.0011452847,0.00046179048,0.0016180112,0.46376744,0.00010527336,0.00029432253
מאסר לתקופה של 6  חודשים.,0.99992645,3.188752e-05,2.3102762e-05,9.301343e-06,0.00047647953,0.0012646791,0.0004628217,0.0034805653,0.0051710093,0.00012799952,0.00030215076
הנני מורה על הפעלת עונש של מאסר מותנה למשך  3 חודשים  כפי שנפסק על,0.9999529,2.984202e-05,1.6093472e-05,9.088089e-06,0.00029408187,0.0006998431,0.00026411974,0.0013388443,0.0060944073,7.285087e-05,0.0001805339
תנאי  בבית משפט  קרית גת   ביום 9.6.14   בתיק מס'   35180-12-13 לריצוי באופן חופף.,0.169199,3.0184163e-05,2.2229537e-05,0.99998796,0.0006219981,0.0010227497,0.00071933726,0.009949209,0.005199303,0.0001333975,0.00047004235
"את המאסר ישא בעבודות שירות במתנ""ס נווה אילן, אשקלון,  וזאת 5 ימים בשבוע, 8.5 שעות יומיות, בעבודות אחזקה וסיוע, מנהלה ושירותים בפיקוח ישראלי שרון.",0.99993527,3.142144e-05,2.6867723e-05,9.275522e-06,0.00074154016,0.0010751667,0.00043525986,0.2388432,0.007646674,0.0002319729,0.0037842493
"תחילת המאסר מיום  23.6.15  ועליו להתייצב בשעה 08:00 במועד זה בפני המפקח על עבודות השירות לצורך קליטה והצבה במפקדת גוש דרום ב""ש, ליד כלא ב""ש,  (אוטובוס אגד מתחנה מרכזית בב""ש קו 46).",0.0001634513,3.067369e-05,3.8630627e-05,0.9999876,0.0006782674,0.001253076,0.00035676992,0.351327,0.005357063,0.00021656243,0.00056003244
"על הנאשם לדווח לממונה על עבודות השירות בשב""ס אודות כל שינוי בכתובתו ובפרטיו.",0.0001422139,3.099656e-05,2.8588845e-05,0.99990845,0.0005476168,0.0008790449,0.000747225,0.025340537,0.008983536,0.00017184054,0.00016688972
"כמו כן, מוסבר לו כי עליו לעמוד בתנאי הפיקוח וביקורות הפתע וכי כל הפרה תביא להפסקה מנהלית של העבודות ולנשיאה בעונש בין כותלי הכלא.",0.00015803004,3.134118e-05,2.6844185e-05,0.99995434,0.0006749501,0.0009921892,0.0006433431,0.3511839,0.023013243,0.00023438642,0.0007582187
"אני מתירה לממונה לערוך בדיקות שתן לגילוי שרידי סם לאור המצוין לעיל, ומוסבר לנאשם כי אם ימצא משתמש בסמים, בסמכותו של הממונה להורות כי את המאסר ישא בכלא.",0.029281504,3.1988126e-05,0.0005941412,9.116276e-06,0.0019259865,0.001697387,0.0008698294,0.014754911,0.010008136,0.00015011485,0.0008725625
אני מטילה על הנאשם  10 חודשי מאסר על תנאי למשך    3שנים והתנאי הוא שלא יעבור עבירה מסוג פשע לפקודת הסמים המסוכנים.,0.9999578,2.9465824e-05,1.9369521e-05,9.011752e-06,0.00048438023,0.0010594114,0.0004240407,0.0011924038,0.02632065,0.00011053273,0.015945386
הנני פוסלת את הנאשם/ת מלקבל או מלהחזיק רשיון נהיגה לתקופה של 3 חודש/ים.,0.99994886,2.9800613e-05,2.0235168e-05,9.065152e-06,0.0005520413,0.0010233101,0.00048770045,0.003191013,0.008894696,0.000111343266,0.0018770143
לצורך זאת יפקיד רשיונו במזכירות בית המשפט ומוסברת לו חומרת העבירה.,0.1232075,3.215956e-05,2.6662123e-05,1.0595662e-05,0.00049845513,0.00096504955,0.00053718116,0.010259437,0.07998214,0.00014113479,0.00033083235
"קנס בסך  1000 ₪,  שיקוזז מהפקדון והיתרה תושב לנאשם או מי מטעמו על פרטי חשבון בנק שימציא.",0.99995625,3.0085992e-05,0.053144313,9.070349e-06,0.000804414,0.0011350526,0.26363373,0.007853267,0.005180831,0.00016306274,0.00031885624
הנאשם יחתום על התחייבות בסך 6000  ₪ להימנע מביצוע עבירה מסוג פשע לפקודת הסמים המסוכנים.,0.9999436,3.0550265e-05,2.5463245e-05,9.051278e-06,0.00049621065,0.00084539846,0.0066085467,0.001627604,0.03217295,9.6628035e-05,0.017147383
במשך 3    שנים מהיום.,0.9997563,3.2120886e-05,2.7398984e-05,9.334988e-06,0.00047658378,0.0011714892,0.00070042996,0.3015533,0.0063882605,0.00019376664,0.0004101516
"אם לא יחתום על ההתחייבות, יאסר למשך 90  ימים.",0.9998672,3.1706135e-05,2.7409882e-05,9.572083e-06,0.00049892336,0.0012933236,0.0006650108,0.18309738,0.0062062163,0.00020072858,0.0003664344
הנאשם ימצא בפיקוח שירות המבחן למשך שנה מהיום.,0.99990535,3.0571133e-05,1.8414334e-05,9.33157e-06,0.00046770507,0.0009112135,0.0004582572,0.0024257333,0.003933324,0.000112763504,0.000501261
לצורך זאת עליו לחתום על צו מבחן.,0.00014846667,3.2297314e-05,1.873566e-05,0.99998605,0.0004366346,0.0011469115,0.0004640635,0.011352136,0.0046963217,0.00014194241,0.0002897111
"מוסבר לנאשם כי אם לא יעמוד בתנאי הצו, ניתן יהיה להפקיעו ולגזור דינו לרכיבי ענישה נוספים.",0.00012323278,3.1484135e-05,2.402195e-05,0.999987,0.00054093497,0.0010336082,0.00051326933,0.0027819646,0.013088488,0.00020044301,0.0005687333
זכות ערעור תוך 45 יום מהיום.,0.99985397,3.137988e-05,2.4384599e-05,0.9999875,0.00043225547,0.0013007022,0.00053444825,0.036096368,0.005042985,0.00019135831,0.00043140055
"ניתנה והודעה היום ט' סיוון תשע""ה, 27/05/2015 במעמד הנוכחים.",0.9945651,3.083532e-05,2.7631651e-05,0.99998724,0.000508105,0.0013491734,0.00077820616,0.08396088,0.017065382,0.00021042529,0.0021506483
