feature_key,text,extraction
GENERAL_CIRCUM,"ביום 13/4/23 התקבל מטעם שירות המבחן התסקיר בעניינו של הנאשם ממנו עולה כי מדובר בנאשם בן 22 שנים, רווק, אשר עצור עד תום ההליכים, מיום 3/1/23.","['1 : לא', '2 : לא', '3 : לא', '4 : לא', '5 : לא', '6 : לא', '7 : לא', '8 : לא', '9 : לא', '10 : כן', '11 : לא']"
GENERAL_CIRCUM,"כעולה מהתסקיר, הנאשם לקח אחריות חלקית למעשיו, וציין כי הנשק שנמצא בבית המשפחה הוא שלו, וזאת לאחר שרכש אותו מצד ג'.","['1 : לא', '2 : לא', '3 : לא', '4 : לא', '5 : לא', '6 : לא', '7 : לא', '8 : לא', '9 : לא', '10 : לא', '11 : לא']"
GENERAL_CIRCUM,"שירות המבחן אף שוחח עם אביו של הנאשם ובמסגרת אותה שיחה, לדברי שירות המבחן, בלטה מצוקת האב סביב מעצרו הממושך של הנאשם, גישתו הייתה מגוננת מחד, ומאידך ביטא האב עמדות שומרות חוק ומכבדות ממסד.","['1 : לא', '2 : כן', '3 : לא', '4 : לא', '5 : לא', '6 : לא', '7 : לא', '8 : כן', '9 : לא', '10 : לא', '11 : לא']"
GENERAL_CIRCUM,"הנאשם נעדר עבר פלילי וזו מעורבותו הראשונה והיחידה בעבירות פליליות, התנהגותו אינה מעידה על דפוסי התנהגות עברייניים מושרשים.","['1 : לא', '2 : לא', '3 : לא', '4 : לא', '5 : לא', '6 : לא', '7 : כן', '8 : לא', '9 : לא', '10 : לא', '11 : כן']"
GENERAL_CIRCUM,"המאשימה הדגישה במסגרת טיעוניה את נסיבות ביצוע העבירות, את הפגיעה בערך החברתי המוגן, וכן את נסיבותיו האישיות של הנאשם  בהן העובדה כי מדובר בנאשם נטול הרשעות קודמות.","['1 : לא', '2 : לא', '3 : לא', '4 : לא', '5 : לא', '6 : לא', '7 : לא', '8 : כן', '9 : לא', '10 : לא', '11 : לא']"
GENERAL_CIRCUM,"מנגד, ב""כ הנאשם הפנה במסגרת טיעוניו לגילו הצעיר של מרשו, לעובדה כי מדובר בנאשם נטול הרשעות קודמות אשר הודה בעבירות המיוחסות לו בכתב האישום לקח אחריות על מעשיו חסך זמן שיפוטי יקר ושוהה במעצר עד תום ההליכים מיום 3/1/23.","['1 : כן', '2 : לא', '3 : לא', '4 : כן', '5 : לא', '6 : לא', '7 : כן', '8 : לא', '9 : לא', '10 : לא', '11 : לא']"
GENERAL_CIRCUM,"ב""כ הנאשם טען כי העבירות בהן הורשע מרשו לא בוצעו תוך תכנון מוקדם או תחכום, עסקינן בנאשם נורמטיבי בעל יציבות תעסוקתית אשר גדל במשפחה נורמטיבית ותומכת.","['1 : לא', '2 : לא', '3 : לא', '4 : לא', '5 : לא', '6 : לא', '7 : כן', '8 : לא', '9 : לא', '10 : לא', '11 : לא']"
GENERAL_CIRCUM,"רובד נוסף הוא התעצמות הפעילות העבריינית, פועלה ושאיפתה לשלוט בתחומים רחבים ושונים...","['1 : לא', '2 : לא', '3 : לא', '4 : לא', '5 : לא', '6 : לא', '7 : לא', '8 : לא', '9 : לא', '10 : לא', '11 : לא']"
GENERAL_CIRCUM,"אין כל חולק כי עונש מאסר בפועל יפגע בנאשם, שזוהי הסתבכותו הראשונה ומעולם לא נשא בעונש מאסר כך גם עמדה עונשית זו כלומר מאסר מאחורי סורג ובריח אף תואמת את עמדת שירות המבחן.","['1 : כן', '2 : לא', '3 : לא', '4 : לא', '5 : לא', '6 : לא', '7 : לא', '8 : לא', '9 : לא', '10 : לא', '11 : לא']"
GENERAL_CIRCUM,"עם זאת, לקחתי בחשבון את העובדה כי הנאשם נעדר עבר פלילי, זוהי אכן הסתבכותו הראשונה, הנאשם לקח אחריות על מעשיו, הודה בהזדמנות הראשונה וחסך זמן שיפוטי יקר.","['1 : לא', '2 : לא', '3 : לא', '4 : כן', '5 : כן', '6 : לא', '7 : כן', '8 : לא', '9 : לא', '10 : לא', '11 : לא']"
CIR_HELD_WAY_WEP,"כעולה מעובדות כתב האישום החל ממועד שאינו בידיעת המאשימה במדויק ועד ליום 3/1/23, בשעות הבוקר, במהלך חיפוש שנעשה על פי צו בבית הנאשם באום אל פאחם, החזיק הנאשם בתוך חדר בקומה הראשונה, בתוך ארון אחסון בו סירים, באקדח חצי אוטומט מסוג FN  מספר סידורי","['בבית', 'מוסלק - מוסתר']"
CIR_HELD_WAY_WEP,"הנאשם כאמור, החזיק בתוך חדר בקומה הראשונה בביתו, מוסלק בארון אחסון ובו סירים, אקדח חצי אוטומטי המצויד במחסנית ריקה.","['בבית', 'מוסלק - מוסתר']"
CIR_OBTAIN_WAY_WEP,במעשיו האמורים החזיק הנאשם שלא כדין באביזר נשק ובנשק שמסוגל לירות כדור ולהמית אדם.,['מאחר']
CIR_TYPE_WEP,"כעולה מעובדות כתב האישום החל ממועד שאינו בידיעת המאשימה במדויק ועד ליום 3/1/23, בשעות הבוקר, במהלך חיפוש שנעשה על פי צו בבית הנאשם באום אל פאחם, החזיק הנאשם בתוך חדר בקומה הראשונה, בתוך ארון אחסון בו סירים, באקדח חצי אוטומט מסוג FN  מספר סידורי",['אקדח סוג הנשק שהחזיק הנאשם הוא אקדח חצי אוטומט מסוג FN עם מספר סידורי']
CIR_TYPE_WEP,"L 30192, קליבר 9 מ""מ כשבתוך הנשק מחסנית ריקה התואמת את סוג הנשק.","['אקדח סוג הנשק המוזכר בחומר הוא אקדח, כיוון ש""L 30192"" הוא מספר סידורי של אקדח, ""קליבר 9 מ""']"
CIR_TYPE_WEP,"אקדח שיורה ""במערכה השלישית"" גורם כמובן לנזק רב, אך גם אקדח שמונח על השולחן ""במערכה הראשונה"" – אף אם לא נעשה בו כל שימוש אחר בהמשך – עלול לפגוע בשלום הציבור באופן ממשי.",['אקדח']
CIR_TYPE_WEP,"אין להפריז במשקל שיש לתת לנתונים כגון סוג האקדח, ולקבוע מעין ""מדרגה עונשית"" שמתמקדת אך ורק בנתון זה ובתוצאה, ולא בסיכון שנוצר.",['אקדח']
CIR_TYPE_WEP,"הנאשם כאמור, החזיק בתוך חדר בקומה הראשונה בביתו, מוסלק בארון אחסון ובו סירים, אקדח חצי אוטומטי המצויד במחסנית ריקה.",['אקדח']
CONFESSION,"הנאשם הורשע על פי הודאתו בעבירות המיוחסות לו בכתב האישום - החזקת נשק שלא כדין – עבירה לפי סעיף 144(א) רישא לחוק העונשין, תשל""ז – 1977 והחזקת חלק של נשק – עבירה לפי סעיף 144(א) סיפא לחוק העונשין, תשל""ז – 1977.",['כן']
CONFESSION,"מנגד, ב""כ הנאשם הפנה במסגרת טיעוניו לגילו הצעיר של מרשו, לעובדה כי מדובר בנאשם נטול הרשעות קודמות אשר הודה בעבירות המיוחסות לו בכתב האישום לקח אחריות על מעשיו חסך זמן שיפוטי יקר ושוהה במעצר עד תום ההליכים מיום 3/1/23.",['כן']
CONFESSION,"עם זאת, לקחתי בחשבון את העובדה כי הנאשם נעדר עבר פלילי, זוהי אכן הסתבכותו הראשונה, הנאשם לקח אחריות על מעשיו, הודה בהזדמנות הראשונה וחסך זמן שיפוטי יקר.",['כן']
CONFESSION,"משנאמר כל זאת, בהתחשב בחומרת המעשים, בנסיבותיהם, במידת הפגיעה בערך החברתי ובמדיניות הענישה הנוהגת, בהודאתו של הנאשם ובנסיבות חייו, תוך עריכת איזון בין רכיבי הענישה השונים, אני מטיל על הנאשם את העונשים הבאים:",['כן']
PUNISHMENT_ACTUAL,מאסר בפועל למשך 15 חודשים אשר יחושב מיום מעצרו 3/1/23.,['15 חודשים']
PUNISHMENT_SUSPENDED,"מאסר על תנאי לתקופה של 10 חודשים למשך 3 שנים  והתנאי הוא שהנאשם לא יעבור בפרק זמן זה, לאחר שחרורו מריצוי תום מאסרו בגין תיק זה, על אחת העבירות בהן הורשע או כל עבירת נשק מסוג פשע.",['הנאשם קיבל 10 חודשי מאסר על תנאי']
