text,PUNISHMENT,GENERAL_CIRCUM,CIRCUM_OFFENSE,CIR_STATUS_WEP,CIR_HELD_WAY_WEP,CIR_PURPOSE,CIR_AMMU_AMOUNT_WEP,CIR_OBTAIN_WAY_WEP,CIR_TYPE_WEP,CIR_USE,CIR_PLANNING,RESPO,REGRET,CONFESSION
"דא עקא שתסקירי שרות המבחן, ובעיקר שני התסקירים האחרונים, אינם מלמדים כי הנאשם השתקם או כי יש סיכוי של ממש שישתקם.",1.1768459e-05,0.9999783,9.399557e-06,4.098277e-05,4.744109e-06,1.4139663e-05,1.0200127e-05,2.574836e-05,1.7554012e-05,1.4432215e-05,0.008516999,0.0044226595,0.034895442,3.306057e-06
"ודוק, מהתסקיר מיום 4/1/22 עולה כי הקבוצה הטיפולית אינה מהווה מענה מספק לצרכיו של הנאשם, ומהתסקיר האחרון והעדכני מיום  13/1/22 עולה כי שרות המבחן נמנע מהמלצה טיפולית נוכח הערכה ואבחון שנערכו לנאשם, חומרת העבירה ובהינתן התרשמות מרמת סיכון גבוהה של הנאשם.",8.402695e-06,5.227015e-06,9.279433e-06,5.8223657e-05,5.6390054e-06,1.2162934e-05,1.9699024e-05,5.571449e-05,1.808599e-05,2.0164105e-05,0.0012221658,0.9959418,0.48512927,3.6174506e-06
"לפיכך, בהינתן התמונה המצטיירת ממקרא התסקירים האחרונים, ברי כי לא ניתן לקבוע שהנאשם השתקם ואף לא כי יש סיכוי של ממש שישתקם.",1.1977417e-05,0.43717566,9.360072e-06,3.9842824e-05,4.4937497e-06,2.0291693e-05,8.869849e-06,1.9847444e-05,1.7474023e-05,1.6843056e-05,0.0025951478,0.01649127,0.08755935,3.3679244e-06
"אי לכך, אינני מוצאת לנכון לסטות בתיק זה לקולה ממתחם העונש ההולם מטעמי שיקום.",9.208986e-06,5.265017e-06,9.568743e-06,3.630328e-05,3.9288093e-06,8.552958e-06,7.4978257e-06,1.5611015e-05,1.784541e-05,1.3572816e-05,0.00037645714,6.465408e-05,0.00061970484,1.741714e-05
"עם זאת, יש מקום לדידי להשית על הנאשם מאסר בפועל ברף התחתון של מתחם העונש ההולם, וזאת לאור עברו הנקי ללא רבב של הנאשם לצד העובדה, כי לא נפתחו נגדו תיקים נוספים במשטרת ישראל ובהינתן הודאתו בעובדות כתב האישום המתוקן והבעת החרטה על-ידו ובהתחשב בהשפעת המעצר בתיק זה עליו ובהיותו נתון במעצר באיזוק אלקטרוני במשך כארבעה חודשים, וכן בהתחשב בנסיבותיו האישיות שתוארו, כאמור, מפי הסנגור וע""י שרות המבחן.",1.24910175e-05,0.99997854,9.355611e-06,4.7164198e-05,5.244451e-06,1.1192129e-05,1.4999236e-05,3.39956e-05,1.7154838e-05,1.6620359e-05,0.004385721,0.998156,0.98958313,0.999998
"בסיכומו של דבר, אני דנה את הנאשם, כדלקמן:",1.5240915e-05,5.307976e-06,9.741475e-06,3.7104313e-05,4.354861e-06,5.622246e-06,6.212664e-06,1.5613188e-05,1.9238612e-05,1.6291484e-05,0.00025342492,6.890636e-05,0.00052195485,2.4508736e-06
"למאסר בפועל לתקופה של 12 חודשים, בניכוי ימי מעצרו (מיום 17/8/20 עד ליום 7/10/20).",0.9999919,5.157357e-06,9.304076e-06,5.2077758e-05,6.9336124e-06,6.1781006e-06,8.0621285e-06,2.2441152e-05,1.806465e-05,1.3341395e-05,0.00047061057,6.268491e-05,0.00029334126,2.6583864e-06
"למאסר על תנאי לתקופה של 12 חודשים למשך 3 שנים, והתנאי הוא כי הנאשם לא יעבור עבירה מסוג פשע לפי סעיף 144 לחוק העונשין, התשל""ז – 1977.",0.99999166,5.159959e-06,9.305177e-06,4.4714197e-05,5.2756527e-06,7.45954e-06,7.151006e-06,1.88659e-05,1.802968e-05,1.7692766e-05,0.00023097047,5.3893214e-05,0.00022577384,4.3527184e-06
"למאסר על תנאי לתקופה של 6 חודשים למשך 3 שנים, והתנאי הוא כי הנאשם לא יעבור עבירה מסוג עוון לפי סעיף 144 לחוק העונשין, התשל""ז – 1977.",0.99999166,5.159979e-06,9.322657e-06,4.424481e-05,5.3769613e-06,6.9496655e-06,7.1818836e-06,1.7760285e-05,1.8019296e-05,1.4672941e-05,0.00022366167,5.424957e-05,0.00020924407,3.95803e-06
"בהינתן מצבו הכלכלי הקשה של הנאשם והעובדה שהושת עליו מאסר בפועל משמעותי בתיק זה, אני מבכרת שלא להשית עליו קנס.",1.0822997e-05,0.99997866,9.4215975e-06,3.20202e-05,3.7655436e-06,8.830677e-06,8.868335e-06,1.4834591e-05,1.7712517e-05,1.36259905e-05,0.0012136174,0.00016622903,0.012049704,2.881213e-05
זכות ערעור לבית המשפט העליון תוך 45 יום.,9.495455e-06,5.4292923e-06,9.380429e-06,4.6507565e-05,4.4479284e-06,1.0422783e-05,1.0300314e-05,2.0398596e-05,1.8726692e-05,2.0438905e-05,0.00032286163,5.7387926e-05,0.00019188762,2.5230358e-06
המזכירות תמציא העתק גזר הדין לשרות המבחן.,4.9687755e-05,5.4702937e-06,9.601394e-06,4.0489067e-05,4.2680617e-06,9.119579e-06,1.4294621e-05,2.5146206e-05,1.8619563e-05,1.699276e-05,0.0009477102,6.353164e-05,0.0002532283,2.851904e-06
"ניתן היום,  ה' ניסן תשפ""ב, 06 אפריל 2022, במעמד ב""כ המאשימה עו""ד אדם סרי, ב""כ הנאשם, עו""ד מוחמד מסרי והנאשם בעצמו.",0.00017829645,5.106711e-06,9.43711e-06,4.3310367e-05,4.8747647e-06,7.337801e-06,7.822584e-06,1.4923815e-05,1.7664106e-05,1.5632439e-05,0.0009041297,8.188472e-05,0.0005268066,3.0007445e-06
