text,CIR_PUNISHMENT,GENERAL_CIRCUM,CIRCUM_OFFENSE,reject,CIR_TYPE,CIR_AMOUNT,CIR_ROLE,CIR_EQ,REGRET,RESPO,CONFESSION
בעניין:		מדינת ישראל – פרקליטות מחוז מרכז (פלילי)		המאשימה,0.00017128844,3.0254765e-05,1.8967103e-05,0.9999883,0.00038422414,0.0007485621,0.00040559427,0.0150908455,0.013348761,0.000113037284,0.0002580458
"ע""י ב""כ עו""ד דניאל איקן",0.00019816532,3.234182e-05,2.2754446e-05,0.9999871,0.0003204244,0.00077489915,0.000543921,0.52823794,0.01011422,0.0001594813,0.0002789443
"ע""י ב""כ עו""ד יזהר קונפורטי",0.0001716653,3.225441e-05,2.30523e-05,0.99998724,0.00034915106,0.00084188196,0.0006013514,0.66635686,0.010468039,0.00017855063,0.0002680245
"פקודת הסמים המסוכנים [נוסח חדש], תשל""ג-1973: סע'  7(א), (ג)",0.000110676156,2.8627372e-05,2.254966e-05,0.9999876,0.00039063982,0.0008649151,0.000492432,0.030679613,0.038896676,0.00012290491,0.0012852444
"פקודת התעבורה [נוסח חדש]: סע'  2, 10א', 67",0.00012773932,2.9047296e-05,2.1533931e-05,9.404084e-06,0.00040462843,0.0008899044,0.0005379702,0.01431687,0.035463605,0.000116530224,0.00051676884
"פקודת ביטוח רכב מנועי [נוסח חדש], תש""ל-1970: סע'  2א'",9.314567e-05,2.959373e-05,2.2143653e-05,0.99998796,0.00044570674,0.00077821437,0.0003884692,0.23514387,0.03807449,0.0001117302,0.0004311838
"תקנות התעבורה, תשכ""א-1961 - לא מרובדות: סע'  28(ב)(1)(א)",0.00013276414,2.9885136e-05,2.5449994e-05,9.247337e-06,0.00035007828,0.0011931469,0.0005714875,0.03218725,0.025612427,0.00014996449,0.00058825064
"לאחר שנשמעו שישה עדי תביעה, ביום 26.1.20, הודה הנאשם במיוחס לו בכתב האישום בתיק העיקרי, במסגרת הסדר טיעון, והורשע בעבירה של החזקת סם שלא לצריכה עצמית, בניגוד לסעיף 7(א) ו-(ג) רישא לפקודת הסמים המסוכנים.",0.00015576565,3.054246e-05,0.9996493,9.01293e-06,0.12650588,0.05301535,0.32847995,0.0018494556,0.041814726,0.00017252844,0.99986243
"על פי עובדות כתב האישום, ביום 10.2.17 בשעה 18:30, החזיק הנאשם בביתו שבכפר קאסם סמים מסוכנים ללא היתר, כדלקמן – סם מסוכן מסוג הרואין במשקל 31.6386 גרם נטו; 31 אריזות מפלסטיק סגורות בחום ובתוכן סם מסוכן מסוג הרואין במשקל כולל של 18.414 גרם נטו; סם מסוכן מסוג fub-amb במשקל 0.6461 גרם נטו; וסם מסוכן מסוג חשיש במשקל 22.25 גרם נטו.",0.0001325754,3.0743537e-05,0.99996054,8.97294e-06,0.9996419,0.99986625,0.99926466,0.0689489,0.009215228,0.00024079734,0.0624822
במסגרת הסדר הטיעון הוסכם כי הנאשם יישלח לשירות המבחן לצורך קבלת תסקיר בעניינו.,0.00013373194,3.0679428e-05,1.7596212e-05,0.9999871,0.00045402895,0.00084791397,0.00040026754,0.0016194052,0.0052921013,9.0490095e-05,0.0054643517
"הוסכם שבמידה והתסקיר ילמד על לקיחת אחריות על ביצוע העבירה, הירתמות להליך טיפולי, נקיון מסמים, היעדר פתיחת תיקים חדשים, ושבסופו תהיה המלצה שיקומית הכוללת צו מבחן למשך שנה – יעתרו הצדדים במשותף לעונש של 6 חודשי מאסר בפועל שירוצו בעבודות שירות, בכפוף לחוות דעת הממונה על עבודות השירות, מאסר על תנאי, קנס כספי וצו מבחן למשך שנה.",0.9996737,3.140437e-05,0.00049118086,9.025789e-06,0.0010712577,0.0013290484,0.00068928103,0.0031583526,0.27677405,0.9559609,0.99461913
"ככל שהתסקיר לא ילמד כאמור, ולא תהיה בו המלצה שיקומית, הצדדים יטענו באופן חופשי לעונש, כאשר מובהר שעמדת המאשימה תהיה למאסר בפועל ולענישה נלווית.",0.00022486401,3.1855034e-05,2.3140823e-05,0.9999871,0.00078010844,0.0010911657,0.00070979557,0.0023773797,0.009476637,0.00014548711,0.89240617
"ביום 14.9.20 התקבלה הודעה מטעם שירות המבחן בה נאמר שהנאשם נעצר ביום 5.8.20 בגין העבירות המיוחסות לו בתיק הצירוף, פ""ל 1292-08-20, עבירות של נהיגה בזמן פסילה, בניגוד לסעיף 67 לפקודת התעבורה [נוסח חדש], תשכ""א-1961; רשיון נהיגה פקע יותר מ-12 חודשים, בניגוד לסעיף 10א' לפקודת התעבורה; נהיגה ברכב ללא ביטוח, בניגוד לסעיף 2א' לפקודת ביטוח רכב מנועי [נוסח חדש], תש""ל-1970; שימוש בטלפון בעת שהרכב נע שלא באמצעות דיבורית, בניגוד תקנה 28(ב)(1)(א) לתקנות התעבורה, תשכ""א-1961; ורשיון הרכב פקע יותר מ-4 חודשים ועד שנה, בניגוד לסעיף 2 לפקודת התעבורה.",0.00019943914,3.1977386e-05,0.0026783491,9.013367e-06,0.0012809413,0.0061488845,0.0011289956,0.03030306,0.037194442,0.0002689509,0.9982476
"על פי עובדות כתב האישום בתיק הצירוף, ביום 31.12.17 נדון הנאשם, בין היתר, ל-24 חודשי פסילה בפועל שמניינה מיום שחרורו ממאסר.",0.0003811796,3.0391257e-05,2.4069832e-05,1.0100279e-05,0.00061190984,0.0009219795,0.0008711059,0.0016950503,0.008166072,0.0001389833,0.9277889
הנאשם השתחרר ממאסר ביום 3.5.19.,0.00018241549,0.99999535,1.8543999e-05,0.99998665,0.00043139068,0.0010043723,0.00049520587,0.008928877,0.009569554,0.00016694017,0.0006300597
"ביום 5.8.20 בשעה 11:43 נהג הנאשם ברכב בכפר קאסם, ביודעו שהוא פסול לנהיגה.",0.000113827635,0.99999547,0.00051061553,9.459592e-06,0.0006362961,0.003120541,0.29280663,0.021192921,0.008045277,0.00018080125,0.0009525257
"הנאשם נהג ללא רשיון נהיגה תקף, אשר פקע ביום 10.9.00.",0.00014179225,0.99999607,2.6070953e-05,9.007937e-06,0.00052347645,0.0011884216,0.0023141266,0.017856397,0.008428074,0.00019717957,0.00026531098
"הנאשם נהג ללא רשיון רכב תקף, אשר פקע ביום 24.1.20.",0.00013507169,0.99999595,3.5246165e-05,9.0117355e-06,0.0005943394,0.0023634355,0.007995593,0.029045742,0.008560261,0.00020369036,0.00026032515
"כמו כן, לרכב לא היתה פוליסת ביטוח בת תוקף.",0.00013532012,3.7289905e-05,3.496582e-05,9.333493e-06,0.00060065143,0.0017035219,0.0014362207,0.53812265,0.015227242,0.00014217987,0.00020068952
הנאשם השתמש בטלפון נייד בעת שהרכב היה בתנועה שלא באמצעות דיבורית.,0.00011631152,3.2156953e-05,0.8096645,0.9999875,0.000763241,0.002720628,0.78707564,0.17578094,0.005860558,0.0001388649,0.00020787338
"נוכח העובדה שהנאשם נעצר בתיק הצירוף, התבקשו דחיות על מנת לבחון צירוף התיק לתיק העיקרי שנדון לפניי, ואכן, ביום 9.3.21 הורשע הנאשם על פי הודאתו בתיק הצירוף.",0.00015653393,0.0002571192,3.0772488e-05,9.163204e-06,0.0006595897,0.0010270479,0.0017380168,0.0020481474,0.008457911,0.00012189182,0.9997222
בעניינו של הנאשם התקבלו שני תסקירים – האחד בתיק התעבורה והשני בתיק העיקרי.,0.00019288535,3.1377996e-05,1.7495282e-05,0.99998736,0.0005344121,0.0010667741,0.0005781185,0.0012919965,0.0065883514,8.3295316e-05,0.00069179933
"מתסקיר מיום 16.12.20, אשר הוגש ביחס לתיק הסמים העיקרי, עלה שהנאשם כבן 44, נשוי ואב ל-3 בנות, עובד בתחום הרתכות.",0.00015178013,0.99999654,0.032251947,8.942417e-06,0.00074898236,0.0013011476,0.0027959466,0.033080287,0.0091655515,0.000344173,0.13830462
"במהלך חייו לא התמיד במסגרות תעסוקתיות, התנהל באופן שולי, חזר והסתבך עם החוק וריצה עונשי מאסר.",0.00012905449,0.9999962,1.848404e-05,9.012508e-06,0.00046192342,0.0009891584,0.00048377624,0.0098077515,0.056219894,0.00019989946,0.0009177326
מגיל 23 החל להשתמש בסמים מסוג חשיש ואקסטזי באופן שבועי.,9.591253e-05,0.99999607,0.9999131,8.995242e-06,0.99843496,0.9986986,0.32441387,0.010302347,0.00837091,0.00012059661,0.00031809416
בשנת 2011 הפסיק שימוש בסם באופן עצמאי.,0.00012246364,0.9999957,2.0773936e-05,9.108975e-06,0.0006784866,0.00080580567,0.0022903353,0.0065186108,0.00868491,0.00012981243,0.00022453409
"יחד עם זאת, טרם מעצרו השתמש בסמים מסוג קנאביס ואקסטזי והביע עמדות מקלות סביב השימוש בסמים.",9.9090255e-05,0.999995,0.9998622,9.223365e-06,0.9951113,0.42940927,0.13113815,0.005273787,0.027435184,0.000120427576,0.00061292603
הוא שלל כי רואה בעייתיות באופי שימושו בסמים.,0.00012582225,3.3971548e-05,2.256375e-05,1.2225289e-05,0.0004787762,0.00094481127,0.0018542768,0.0051396675,0.023522045,0.00013918409,0.00021291172
"לחובת הנאשם 7 הרשעות קודמות מהשנים 2013-1995 בגין עבירות סמים, רכוש ואלימות בגינן נדון, בין היתר, ל-4 עונשי מאסר ולפסילת רשיון נהיגה.",0.00018616841,0.9999964,2.8682569e-05,8.9623345e-06,0.00072040985,0.0009840177,0.0014017086,0.0022985395,0.019137824,0.00014623789,0.44495314
לחובתו של הנאשם 21 הרשעות תעבורה קודמות בגין עבירות של נהיגה בזמן פסילה ונהיגה ללא רשיון נהיגה (מעולם לא הוצא).,0.00015418009,0.9999964,1.9055977e-05,8.950308e-06,0.00046682337,0.000867656,0.00033667346,0.0030652585,0.011874324,0.00015698116,0.003937238
"בשנת 2015, עת הופנה לשירות המבחן במסגרת תיק קודם, אובחן כמחזיק בדפוסים שוליים, תוקפניים והתמכרותיים.",0.00012310428,0.9999963,8.376295e-05,8.943175e-06,0.00068819575,0.0010613408,0.0008756713,0.0044758404,0.0069207344,0.0001696673,0.00045866563
אז העריך השירות שקיימת נזקקות טיפולית והנאשם ביטא מוטיבציה ראשונית להשתלב בטיפול.,0.00010997405,0.9999957,2.3474093e-05,9.07819e-06,0.00046678403,0.0008347613,0.0005705087,0.009344605,0.012559118,0.00013624273,0.0001308922
"לכששולב בקבוצה טיפולית, התנהל באופן מניפולטיבי, ניהל אורח חיים שולי והתמכרותי וההתרשמות שהוא נעדר כוחות להיגמל מסמים ולנהל אורח חיים תקין.",0.00011359927,0.9999964,0.021269495,8.898493e-06,0.00060992053,0.0011090501,0.0025582828,0.053566948,0.020750977,0.00030338299,0.0007426279
הוא נדון לעונש מאסר ממנו השתחרר בחודש מאי 2019.,0.00025759227,0.9999957,2.001509e-05,9.163046e-06,0.0004334158,0.0010667162,0.00044643684,0.004268881,0.008377681,0.00010758505,0.00029054677
במסגרת הפגישה עמו התרשם שירות המבחן מגורמי סיכון רבים להישנות התנהגות עוברת חוק בתחום התעבורה וכן סיכון להישנות התנהגות עוברת חוק בכלל.,0.0001202738,3.2187698e-05,1.9760004e-05,0.99998665,0.00043496478,0.0007791578,0.00045970827,0.0026267725,0.016078575,0.0001681431,0.00022667478
"הנאשם שלל נזקקות טיפולית בתחום ההתמכרויות ולפיכך, לא בא השירות בהמלצה טיפולית בעניינו.",0.00013273352,0.00038064874,1.7260485e-05,0.9999869,0.00044961518,0.0009161972,0.00048329573,0.0013475778,0.004832803,0.0001399843,0.00134171
"בהתייחסותו לעבירת הסמים, טען שהתנהל מרדף משטרתי אחרי אחרים שהכיר, הם נכנסו לביתו השליכו את הסמים שנשאו עמם והמשיכו במרדף, הוצא צו חיפוש ונמצאו הסמים בביתו.",0.000118292766,3.1800035e-05,0.9999318,0.99971896,0.26690966,0.34247738,0.9601784,0.116516836,0.013656747,0.0002537789,0.0006591669
"הנאשם שלל כל קשר לביצוע העבירה, טען שהסמים לא שייכים לו, שלל תכנון לסחור בהם ואף לא התכוון להשתמש בהם לצריכתו העצמית.",0.00014142551,3.2820175e-05,0.999961,8.9428595e-06,0.7906772,0.085004404,0.9997881,0.70194054,0.08527037,0.0011598705,0.043659173
"לדבריו, במאסרו האחרון השתתף בטיפול בתחום ההתמכרויות בכלא.",0.00012364157,0.9999956,1.9080582e-05,9.033927e-06,0.00038553326,0.00081405824,0.00061080337,0.019645216,0.0138488645,0.00010906006,0.00039788635
"במסגרת מעצרו הנוכחי ביקש להשתלב כחונך בפרויקט טיפולי, אך טרם שולב.",0.00014680203,0.99999607,1.799323e-05,9.052944e-06,0.00050213374,0.0008754364,0.00035761116,0.03200942,0.005813355,0.00012417787,0.00028391476
הנאשם שלל צורך טיפולי בתחום ההתמכרויות.,0.00011420348,0.99999464,1.7426311e-05,9.433016e-06,0.0004369977,0.0008262537,0.001011802,0.0034081875,0.008780122,0.00010795615,0.00019112199
"לאחר ששקלל גורמי סיכון וסיכוי בעניינו של הנאשם, הגיע שירות המבחן למסקנה כי עלו גורמי סיכון רבים להישנות התנהגות עוברת חוק בתחום התעבורה וכן סיכון להישנות התנהגות עוברת חוק בכלל.",0.00011279222,3.3424352e-05,2.2529583e-05,0.9999871,0.0006393416,0.0008990659,0.0006158251,0.0019242485,0.019870913,0.00016204378,0.0009088845
"נוכח גורמי הסיכון, ובהיעדר תכנית טיפולית, נמנע שירות המבחן מהמלצה שיקומית בעניינו.",0.00015617942,3.0799234e-05,1.5544254e-05,0.9999871,0.00049457676,0.0009448815,0.00037417945,0.0046243686,0.007837836,0.0001328979,0.0002595222
"מתסקיר מיום 6.12.20, אשר הוגש ביחס לתיק התעבורה, עלה שהנאשם מזער מחלקו בביצוע העבירות, טען שלאחר שחרורו ממאסר בשנת 2019 נהג ברכבו בעיקר מהחניה אל פתח הבית והתקשה לראות בעייתיות בהתנהלותו.",0.00012060236,0.9999962,0.3857128,9.07973e-06,0.0014262857,0.0014327037,0.03503208,0.0067571485,0.020287514,0.0008786656,0.9973724
הוא לא זכר שהשתמש בטלפון בעת הנהיגה.,0.00015051487,0.9999949,6.478418e-05,1.0032754e-05,0.0005242144,0.0010743077,0.016337195,0.14888576,0.010360996,0.00024464438,0.00046297678
לאור חזרתיות בביצוע עבירות תעבורה הסיק שירות המבחן שהנאשם מתנהל באופן מקל ראש בכל הקשור לחוקי התעבורה וחוזר ונוהג כשהוא פסול לנהיגה.,9.840521e-05,0.99999607,2.0624288e-05,9.176102e-06,0.00050317775,0.0009922714,0.002781052,0.0017917594,0.031828858,0.00077971857,0.0013253147
"גם כאן, לאחר שקלול גורמי סיכון וסיכוי במצבו, ולאור חזרתיות בביצוע עבירות תעבורה תוך הקלת ראש בחוקי התעבורה, נמנע שירות המבחן מהמלצה שיקומית טיפולית בעניינו.",0.00012682928,3.1345124e-05,1.8510607e-05,0.9999869,0.0005538054,0.00096963736,0.0004539291,0.0024666581,0.01866885,0.00015816001,0.002524081
"מהבהרה מיום 27.12.20 אשר הוגשה מטעם מחלקת חינוך, טיפול ושיקום בשירות בתי הסוהר, נאמר שהנאשם נמצא בבית מעצר ""הדרים"" מיום 5.5.20.",0.00013267758,3.0757907e-05,2.4863277e-05,0.99998736,0.0006700382,0.00093325647,0.00041564787,0.04160555,0.008882683,0.00017921276,0.0004991312
בתחילת מעצרו דיווח על נקיון מסמים לאחר שעבר טיפול גמילה במאסרו הקודם.,0.000121588375,0.99999595,1.6540253e-05,8.960762e-06,0.00039610764,0.0007038427,0.0005404292,0.011879186,0.013202685,0.00014093549,0.00030079985
לפני כחודש שינה דבריו ודיווח כי השתמש בסמים בכלא ובאותו המעמד ביקש להשתלב בתכנית הכנה לטיפול גמילה אולם עוד טרם נבדקה התאמתו דיווח כי לא השתמש בסמים.,0.00010108222,0.9999958,5.1231505e-05,8.956661e-06,0.0005644778,0.00079183106,0.0011648051,0.03039987,0.0103587285,0.00023062498,0.00050462876
למרות הדיווחים הסותרים מדווח שעדיין ברצונו להשתלב בתכנית.,0.0001412797,0.99999356,2.7355358e-05,1.0574212e-05,0.00054766063,0.0010711787,0.000889351,0.34328774,0.011513385,0.00018136828,0.00026019363
השתלבותו בתכנית תיבחן בהמשך בכפוף למקום פנוי ולשיתוף פעולה מצדו.,0.00015167145,2.8747745e-05,2.0648416e-05,0.00010757326,0.00044322986,0.00096549786,0.0005754796,0.64073074,0.004674997,0.00021853107,0.00018542718
"ב""כ המאשימה הפנה לערכים החברתיים המוגנים בעבירות העיקריות בהן הורשע הנאשם שעניינם שמירה על שלומו ובטחונו של הציבור מפני פגיעתם הרעה של הסמים המסוכנים ושמירה על שלומם ובטחונם של המשתמשים בדרך מפני מי שנוטלים את ההגה לידיהם ונוהגים ברכב מנועי כשהם נתונים בפסילה או כשרשיון הנהיגה שלהם פקע לפני שנים רבות.",0.00013780882,0.9868413,0.20468006,9.792266e-06,0.0011230551,0.0016856181,0.0017432127,0.07856181,0.13918467,0.00032108006,0.36623922
"התובע הפנה לנסיבות המחמירות בכל תיק – בתיק הסמים טען שהנאשם החזיק בסמים מסוכנים, מסוגים שונים, בכמויות גדולות, כאשר מדובר, בין היתר, בסמים ""קשים"" מסוג הרואין, בכמות שהיא בערך פי 166 מהכמות שמוגדרת לצריכה עצמית.",0.00014765772,3.0179788e-05,0.9999553,9.164427e-06,0.9995334,0.9998307,0.9994678,0.008768186,0.009744945,0.0001866209,0.003898828
"כמו כן, הפנה לכך שהסמים היו מחולקים לאריזות; בתיק התעבורה טען שהנאשם נהג בזמן פסילה, זו הפעם השלישית, נהג כשרשיון הנהיגה שלו פקע, זו הפעם העשירית, וכשרשיון הרכב פקע, זו הפעם הרביעית – כל זאת כאשר תלויים ועומדים נגדו שני מאסרים על תנאי בני הפעלה – האחד לתקופה של 12 חודשים והשני לתקופה של 6 חודשים.",0.00070199784,0.9999958,0.99897826,8.984636e-06,0.16241911,0.0023552128,0.093577065,0.005536861,0.010352541,0.0001959757,0.919043
"לאור התנהלות חזרתית זו, טען התובע שהנאשם בנהיגתו מסכן חיים ממש.",0.00013413937,3.282528e-05,2.0858204e-05,0.99998546,0.00050546956,0.0008666051,0.012158987,0.031925615,0.0678132,0.0002005264,0.0002669147
"בנסיבות אלה, טען התובע למתחם עונש הולם, בעבירת הסמים, הנע בין 24 ל-48 חודשי מאסר, לצד מאסר על תנאי וקנס; בגין עבירות התעבורה ביקש התובע לגזור על הנאשם עונש מאסר שלא יפחת מ-24 חודשים, הכולל בתוכו את הפעלת שני המאסרים המותנים התלויים ועומדים נגד הנאשם, לצד פסילה בפועל שתיקבע ברף עליון במתחם שבין 6 ל-60 חודשים.",0.13189834,2.9611772e-05,2.901272e-05,0.9999807,0.0007929592,0.0014338306,0.0004863611,0.0011454811,0.008075166,0.00011569958,0.9717389
"נוכח נסיבות שאינן קשורות בביצוע העבירות, וביניהן, נטילת אחריות חלקית, עבר פלילי הכולל ריצוי מאסרים בפועל, עבר תעבורתי הכולל עבירות זהות לאלה שביצע בתיק התעבורה ותסקירים שליליים של שירות המבחן, ביקש התובע לגזור על הנאשם עונש כולל של 66 חודשי מאסר (5.5 שנות מאסר), הכולל את הפעלת המאסרים על תנאי, לצד מאסר על תנאי, קנס כספי, פסילה בפועל ופסילה על תנאי.",0.9486048,0.9999951,4.24778e-05,8.9538e-06,0.00083944184,0.0015358602,0.0014055964,0.0012556167,0.2459132,0.03644176,0.99957746
התובע הפנה לפסיקה התומכת בעמדתו.,0.00019153867,3.4039e-05,2.9695477e-05,0.9999875,0.00047745343,0.0012145125,0.0016001763,0.10171415,0.025164722,0.0001789464,0.00022613557
"נטען שההסדר בתיק העיקרי גובש לאור קושי ראייתי, ועל כן, הסכימה המאשימה להתקשר בהסדר מתון המסתפק בענישה מקלה, יחסית, של 6 חודשי מאסר לריצוי בעבודות שירות, בכפוף לתסקיר חיובי.",0.00018394447,3.0963412e-05,2.564886e-05,0.9999875,0.0006582826,0.0011683227,0.00055255817,0.001177201,0.0066241976,0.000117293326,0.99298453
"נטען שקיימת סתירה חזיתית בין האמור בתסקירי שירות המבחן לפיו הנאשם שלל כל נזקקות טיפולית בתחום הסמים וההתמכרויות, בעוד שבהודעת ההבהרה משב""ס נאמר שהנאשם נכון להשתלב בטיפול כזה.",0.00011198821,4.291412e-05,3.2649543e-05,0.9999871,0.0007334264,0.0009935001,0.0007406242,0.004281633,0.009412723,0.00019366728,0.000938792
"נטען שלו היה הנאשם מצרף את תיק הסמים לתיק האחרון שהתנהל בעניינו, אשר פסק הדין בו ניתן בבית המשפט המחוזי בתל-אביב ביום 4.6.18, הרי שהיה זוכה להתחשבות מצד בית המשפט שם באופן שלא היה מכביד בעונשו.",0.00014988583,3.246642e-05,8.359236e-05,0.9999765,0.0008864213,0.0015292912,0.0010654173,0.0026368932,0.0078557655,0.00019266349,0.7745447
"לענין עבירת הסמים – נטען שהנאשם אמנם עומד בהודאתו, אך טוען ש""פלוני אלמוני הטמין במקום כזה והוא מצא אותם ולקח"", ושלל כוונה לסחור בהם.",0.00012525507,3.1532596e-05,0.9999529,9.01164e-06,0.9490871,0.020441668,0.9996774,0.048012517,0.04809511,0.00027840628,0.99496824
"ב""כ הנאשם לא חלק על כך שבתי המשפט גוזרים עונשי מאסר בפועל לתקופה של 24 חודשים בגין החזקת סמים שלא לצריכה עצמית בכמויות דומות (עמ' 55, ש' 30-26), אך ביקש לקחת בחשבון את המניעים שעמדו מאחורי הסדר הטיעון המקורי ככאלה שראוי להטיל בגינם ענישה מקלה יותר.",0.00012898535,3.3342534e-05,0.99130756,9.053549e-06,0.16926797,0.0022953225,0.0042140232,0.0028763888,0.05862271,0.00018704953,0.9824012
"באשר לתיק התעבורה – טען הסניגור שאמנם נגזרו על הנאשם עונשי פסילה, אך נהיגתו במקרה הנוכחי לא סיכנה חיים.",0.00014257629,3.3320248e-05,2.1448099e-05,9.135971e-06,0.00053867704,0.0009789001,0.00048980664,0.0024597603,0.03583365,0.0001871994,0.001110496
"בנסיבות אלה, טען ב""כ הנאשם כי ראוי לגזור על הנאשם מספר מצומצם של חודשי מאסר.",0.000106063024,3.1026317e-05,1.6990783e-05,0.999987,0.000409109,0.0009298822,0.00028815662,0.0011699093,0.029669756,9.350619e-05,0.0011114172
"הוא לא התעלם משני המאסרים על תנאי התלויים ועומדים נגד הנאשם, האחד למשך 12 חודשים והשני למשך 6 חודשים, אך ביקש ש""בית המשפט יפעל כחוכמתו"" (עמ' 56, ש' 25).",0.00028298647,3.1616728e-05,2.49155e-05,1.0954272e-05,0.000607369,0.0012210708,0.0007699993,0.003222861,0.011494553,0.00016958837,0.022085045
הוא הציע להטיל תקופת מאסר ולהפעיל את עונשי המאסר על תנאי בחופף לה.,0.72085917,3.0499059e-05,1.8409206e-05,0.9999658,0.00043546653,0.001068831,0.0005272701,0.0012256785,0.021114537,0.00010679495,0.0022773682
"הסניגור הפנה לנסיבותיו האישיות של הנאשם, להיותו אב ל-3 בנות ולעובדה שההתמכרות לסמים הרסה לו את החיים.",9.8376324e-05,0.9999963,2.2222268e-05,8.986248e-06,0.00039396164,0.0010352521,0.00066108635,0.029667152,0.503459,0.0007914502,0.0048196116
עוד ציין שהנאשם הודה בשני התיקים וחסך מזמנו היקר של בית המשפט.,0.00014863185,3.11446e-05,2.2182969e-05,9.1173015e-06,0.00046607794,0.0009100314,0.03370379,0.0015749856,0.86771214,0.8786689,0.9993548
"לאור האמור, ביקש ב""כ הנאשם להקל בענישה עד כמה שניתן.",0.00011560705,3.0840878e-05,1.8598781e-05,0.99998677,0.0004157136,0.0009152606,0.00052345457,0.0019887432,0.03268358,0.0001325548,0.0009899376
"העבירות שביצע הנאשם, בשני התיקים, חמורות מאוד.",0.00024931287,3.3358756e-05,2.3589551e-05,0.99998724,0.00057428074,0.0010393442,0.20424524,0.0014652886,0.29735926,0.00021573622,0.00052495074
