text,CIR_PUNISHMENT,GENERAL_CIRCUM,CIRCUM_OFFENSE,reject,CIR_TYPE,CIR_AMOUNT,CIR_ROLE,CIR_EQ,REGRET,RESPO,CONFESSION,PUNISHMENT_ACTUAL,PUNISHMENT_SUSPENDED,PUNISHMENT_FINE
"הנאשם הורשע, על פי הודאתו בעבירה של סיוע להחזקת סם שלא לצריכה עצמית, עבירה לפי סעיף 7(א) + (ג) רישא בפקודת הסמים המסוכנים [נוסח חדש], תשל""ג-1973 ביחס עם סעיף 31 בחוק העונשין, תשל""ז – 1977.",,,,,,,,,,,['כן'],,,
"נסיבות המקרה הן שביום 22.2.2017 סייע הנאשם לאחר להחזיק כמעט 4 ק""ג של חשיש ולהסתירם ברכב.",,,,,"['[קנביס], [חשיש]']",,,,,,,,,
"הנאשם כבן 25, אין לו עבר פלילי.",,"['1 : לא', '2 : לא', '3 : לא', '4 : לא', '5 : לא', '6 : לא', '7 : לא', '8 : לא', '9 : לא', '10 : לא', '11 : לא']",,,,,,,,,,,,
"6 חודשי מאסר, אשר ירוצו בדרך של עבודות שירות באצטדיון טרנר בב""ש, במסגרת חברת ""כיוונים"", במשך חמישה ימים בשבוע, 6.5 שעות ביום או לפי קביעה אחרת של הממונה על עבודות השירות.",,,,,,,,,,,,['6 חודשי מאסר'],[],[]
"12 חודשי מאסר על תנאי, לתקופה של שלוש שנים מהיום שלא יעבור עבירת סמים מסוג פשע.",,,,,,,,,,,,[],['12 חודשי מאסר על תנאי'],[]
"6 חודשי מאסר על תנאי, לתקופה של שלוש שנים מהיום שלא יעבור עבירת סמים מסוג עוון.",,,,,,,,,,,,[],['6 חודשי מאסר על תנאי'],[]
"קנס כספי בסך 15,000 ₪ או 150 ימי מאסר תמורתו.",,,,,,,,,,,,[],[],"['15,000 ₪']"
"אני פוסל את הנאשם מלהחזיק או לקבל רישיון נהיגה, וזאת למשך 2 חודשים מהיום.",,,,,,,,,,,,[],[],[]
"בנוסף, אני דן את הנאשם לפסילת רישיון או קבלת רישיון נהיגה למשך 6 חודשים אולם עונש זה יהיה על תנאי והתנאי הוא שבמשך 36 חודשים מהיום לא יעבור עבירת סמים כלשהי.",,,,,,,,,,,,[],[],[]
